百色梦居装饰工程责任有限公司 ,百色市右江区那毕大道龙景苑c区1栋7单元3...,13877684360,2800606,
鲁班大宅装饰集团 ,百色市右江区龙景东路龙景名都S1-103号...,13397766966,2871666,
百色市鹏程装饰工程有限责任公司 ,百色市右江区闽盛家居建材广场一区B栋4楼,17777606088,2220098,
广西中匠装饰工程有限公司百色分公司 ,百色市右江区那毕大道百色大厦西塔楼1单元2...,17777602877,2988881,
北京龙发装饰集团            ,阳明东路71号金涛国际a座,4008-659-600,,
百色锦鑫装饰有限公司            ,百色市右江区,4008-659-600,,
惠州市新居缘装饰设计有限公司            ,惠州市麦地东路7号麦景新苑B栋1层2号,4008-659-600,,
百色市欧艺装饰工程有限责任公司            ,城东站前大道市总工会办公楼四楼（欧艺九龙大...,4008-659-600,,
广西百色市欧尚家居装饰有限公司            ,百色市右江区-南大建材市场,4008-659-600,,
百色市华达装修公司            , 百色市中山二路,4008-659-600,,
三星装饰有限公司            ,百色市龙景区龙景路127号,4008-659-600,,
广州市英泰装饰设计有限公司            ,天河区体育中心体育东路财富广场东塔九楼90...,4008-659-600,,
广西御居建筑装饰设计工程有限公司            ,百色市右江区-城东二路河东区商业步行街C5...,4008-659-600,,
中山市铭轩装饰工程有限公司百色分公司            ,鼎盛中央公园一期商铺,4008-659-600,,
广东星艺装饰集团股份有限公司百色分公司            ,百色市右江区新兴路体育馆左侧二楼,4008-659-600,,
广西上古装饰有限工程有限公司            ,百色那毕大道新环球1208,4008-659-600,,
伟杰装饰            , 百色市右江区福州街D66号,4008-659-600,,
南昌三帝装饰设计有限公司            ,南昌市青山湖区洪都北道299号高能金域名都...,4008-659-600,,
南昌林涵设计            ,林涵设计,4008-659-600,,
 ,,4008-659-600,,
金芒果装饰集团            ,江西省吉安市吉州区广场北路1号(新世界广场...,4008-659-600,,
南昌三帝装饰设计有限公司            ,南昌市青山湖区洪都北道299号高能金域名都...,4008-659-600,,
田阳帝豪装饰公司            ,,4008-659-600,,
公司名称广西吉祥阁装饰工程有限公司            ,亿家龙景名都S1-107商铺,4008-659-600,,
华浔品味装饰公司            ,环岛一路富邦广场4楼,4008-659-600,,
广西中百建设工程有限公司            ,分部 金晨星河湾第30栋109-209商铺,4008-659-600,,
广东星艺装饰百色分公司            ,,4008-659-600,,
百色华浔品味装饰            ,,4008-659-600,,
广西丽隆装饰工程有限公司            ,,4008-659-600,,
晶升装饰工程有限公司            ,百色市那毕新村B73号,4008-659-600,,
广东星艺装饰百色分公司            ,,4008-659-600,,
广东帝豪装饰工程有限公司            ,百色市右江区江滨二路金湾42号帝豪装饰,4008-659-600,,
广西匠心装饰公司百色分公司            ,百色市那毕大道新环球左塔11楼,4008-659-600,,
广西品匠家居装饰工程集团有限公司百色分公司            ,广西百色市右江区江滨二路幸福港湾.幸福商业...,4008-659-600,,
百色紫名都装饰工程有限公司            ,百色市右江区江滨二路滨江国际1栋101号,4008-659-600,,
百色市龙万家装饰有限公司            ,百色市右江区鼎盛中央公园10栋126号,4008-659-600,,
惠州市新居缘装饰设计有限公司百色分公司            ,百色市右江区鼎盛中央花园小区7幢115号,4008-659-600,,
百色市御天装饰            ,江滨二路恒升水岸花园D9栋,4008-659-600,,
百色欧坊装饰工程有限公司            ,右江区龙景西路486号,4008-659-600,,
广东鹏锦装饰有限公司            ,体育广场二楼星艺装饰,4008-659-600,,
广西百色卓艺装饰工程有限公司            ,德保县东蒙桃园路都市名苑4幢2单元301,4008-659-600,,
阔达建筑装饰工程有限责任公司            ,北京市海淀区西三环北路87号国际财经中心c...,4008-659-600,,
广西尚雅装饰设计工程有限公司            ,百色市右江区城东大道平安,4008-659-600,,
百色锦辉装饰工程有限公司            ,百色市东合路嘉和商厦二楼,4008-659-600,,
嘉祺装饰设计工程有限公司            ,,4008-659-600,,
星艺装饰有限公司            ,南昌市北京东路·恒茂国际都会...,4008-659-600,,
波涛装饰公司            ,高新区南二环西段财富中心,4008-659-600,,
南国风装饰工程有限工司            ,青山湖南大道墅溪园,4008-659-600,,
广州市华宁装饰工程有限公司南昌分公司            ,江西省南昌市西湖区广润门三区37栋1号,4008-659-600,,
南昌市思晨装饰工程有限公司            ,江西省南昌市红谷滩新区万达广场A1-310,4008-659-600,,
南昌道艺装饰有限公司            ,南昌市红谷滩万达中心写字楼B2-814,4008-659-600,,
华浔品味装饰            ,东路鹿鼎家居4楼b馆,4008-659-600,,
