广州市艺雕装饰设计工程限公司三水分公司 ,佛山市三水区西南街道南丰大道1号九座三楼,18688876265,87804088,
市南海东鹏装饰设计工程有限公司            ,桂城南海大道北31号首层（南海农村信用社新...,4008-659-600,,
市佳艺雅装饰工程有限公司            ,佛山市禅城区碧桂园城市花园南区一座1204...,4008-659-600,,
市龙光装饰设计工程有限公司            ,佛山市港口路16号沿海馨庭南门9座首层P5...,4008-659-600,,
居众装饰            ,佛山市禅城区绿景三路雅居乐花园6号2区P1...,4008-659-600,,
广州域丰装饰分公司            ,佛山南海区桂城季华东路31号天安中心3座1...,4008-659-600,,
市三星装饰西樵分公司            ,佛山市南海区西樵镇新城广场三星装饰C5-6...,4008-659-600,,
市时代凤凰尚筑设计有限公司            ,佛山市禅城区港口路11号国家高新科技开发区...,4008-659-600,,
广东星艺装饰集团有限公司平洲分公司            ,佛山市南海区平洲东信南路与六村交界处1-4...,4008-659-600,,
瑞翔装饰设计工程有限公司            ,佛山禅城区文华北路157/188号二楼,4008-659-600,,
市喜居装饰工程有限公司            ,禅城区绿景西路美居国际建材中心3座4楼37...,4008-659-600,,
广州隆和装饰公司            ,佛山市顺德区陈村镇白陈路189号悦峰天誉1...,4008-659-600,,
家装e站            ,佛山市禅城区石湾雾岗路与绿景西路交汇处（美...,4008-659-600,,
市东成至盛装饰公司            ,佛平三路御景城市花园,4008-659-600,,
广州市华寓装饰工程有限公司            ,广州市番禺区宏信装饰城D201-202,4008-659-600,,
喜安居室装饰设计有限公司            ,佛山-南海-大沥 岭南路广佛智城8号楼70...,4008-659-600,,
市菲絮装修有限公司            ,广东省佛山市南海区,4008-659-600,,
名林装饰            ,佛山市南海区 文府街8号,4008-659-600,,
名欣装饰有限公司            ,佛山市桂城平洲富丰新城,4008-659-600,,
广州市晴星装饰设计工程有限公司            ,广州市白云区石槎路32号锦东家居饰品广场b...,4008-659-600,,
市东成至盛装饰有限公司            ,佛山市禅城区石湾街道绿景西路北侧美居建材城...,4008-659-600,,
广州集弈装饰南海分公司            ,佛山市南海区城市广场A509(桂城桂澜中路...,4008-659-600,,
市尚无界装饰设计工程有限公司            ,佛山市顺德区大良街道府又南国东路238号首...,4008-659-600,,
市东鹏装饰设计工程有限公司            ,佛山市禅城区文华北路南村一号楼首层（岭南明...,4008-659-600,,
佛山市顺德区唐韵汉风装饰设计有限公司            ,,4008-659-600,,
佛山三水星奕装饰有限公司            ,,4008-659-600,,
佛上星梦家居科技有限公司            ,,4008-659-600,,
三禾装饰三水公司            ,佛山市三水区广海大道中51号109铺(西南...,4008-659-600,,
佛山市梵居装饰设计工程有限公司            ,佛山市三水区云东海街道万达华府首层1094...,4008-659-600,,
三水华宁装饰            ,佛山市三水区广海大道61号7天酒店首层（1...,4008-659-600,,
广东泰禾装饰设计有限公司            ,佛山市禅城区金澜北路3号A座8楼整层(流行...,4008-659-600,,
市晶鼎装饰有限公司            ,佛山市南海区桂城街道平洲夏南路创越时代文化...,4008-659-600,,
老班匠装饰设计工程有限公司            ,广东省佛山市南海区南海大道北55号（南海广...,4008-659-600,,
市汉堂装饰设计有限公司            ,顺德区大良桂峰路明日华府71号,4008-659-600,,
广东南都装饰工程有限公司            ,佛山市南海区南海大道北20号金安大厦523...,4008-659-600,,
市顺德区尚筑装饰设计工程有限公司            ,佛山市顺德区大良新桂南路16号,4008-659-600,,
广东大汉锦江工程装饰有限公司            ,广东省佛山市南海区大沥镇广佛智城7座3楼,4008-659-600,,
