临汾市居联峰尚建筑装饰工程有限公司 ,秦蜀路尧丰市场北口往南50米,18103570681,3115333,
城市人家装饰有限公司            ,临汾市尧都区滨河东路南端御景水城双子写字楼...,4008-659-600,,
简尚装饰            ,山西省 临汾市 尧都区 尧都区南外环车管所...,4008-659-600,,
鲁班装饰设计有限公司            ,临汾,4008-659-600,,
百变空间装饰            ,南坪会展中心9玺国际8栋,4008-659-600,,
北京索美装饰工程有限公司临汾分公司            ,临汾市尧都区平阳南街益民路北二巷东赵村,4008-659-600,,
博洛尼整体家装            ,临汾市尧都区河汾路国贸大厦B座3层,4008-659-600,,
北京业之峰诺华装饰股份有限公司            ,山西省临汾市尧都区神州装饰城家装区1号,4008-659-600,,
北京龙发装饰集团            ,阳明东路71号金涛国际a座,4008-659-600,,
天韵宅配            ,山西省 临汾市 尧都区 临汾南外环天和装饰...,4008-659-600,,
亿路达装饰            ,青云谱洪都洪城路6号国贸广场13层,4008-659-600,,
丽饰装饰            ,,4008-659-600,,
南昌市轩仝宇装饰工程有限公司            ,江西省南昌市西湖区子安路89号1602,4008-659-600,,
江西苹果装饰设计工程有限公司            ,,4008-659-600,,
金芒果装饰集团            ,江西省吉安市吉州区广场北路1号(新世界广场...,4008-659-600,,
南昌三帝装饰设计有限公司            ,南昌市青山湖区洪都北道299号高能金域名都...,4008-659-600,,
南昌林涵设计            ,林涵设计,4008-659-600,,
 ,,4008-659-600,,
山西顺臻贸易            ,山西省,临汾市,尧都区,河汾路中段,4008-659-600,,
侯马开发区建民装饰材料有限公司            ,侯马经济开发区中天建材市场一层6-110-...,4008-659-600,,
临汾市尧都区城市人家装饰有限公司            ,临汾市尧都区滨河南路3号新能源大厦B1层,4008-659-600,,
龙发装饰临汾直营公司            ,山西省临汾市尧都区平阳南街104号裕祥花园...,4008-659-600,,
北京紫名都装饰有限公司临汾分公司            ,临汾市开发区源宏世纪花园第六组团0004幢...,4008-659-600,,
临汾市鲁公大宅装饰工程公司            ,临汾市恒大华府旁98号,4008-659-600,,
临汾市欧坊装饰工程有限公司            ,临汾市滨河南路中国建设银行旁,4008-659-600,,
百信装饰            ,山西省 临汾市 尧都区 临汾市尧都区,4008-659-600,,
临汾市易尚装饰            ,临汾市中大街南路22号,4008-659-600,,
阔达建筑装饰工程有限责任公司            ,北京市海淀区西三环北路87号国际财经中心c...,4008-659-600,,
南昌道艺装饰有限公司临汾分公司            ,临汾市迎宾大道92号,4008-659-600,,
嘉祺装饰设计工程有限公司            ,,4008-659-600,,
临汾星艺装饰有限公司            ,临汾市万达影城旁,4008-659-600,,
波涛装饰公司            ,高新区南二环西段财富中心,4008-659-600,,
临汾市尚品创意装饰工程有限公司            , 临汾市尧都区科委巷解放二小2号楼103号,4008-659-600,,
广州市华宁装饰工程有限公司临汾分公司            ,临汾市新能源大厦5楼501-502,4008-659-600,,
临汾阔达            ,临汾市 尧都区 临汾市平阳南街123号(五...,4008-659-600,,
华浔品味装饰            ,东路鹿鼎家居4楼b馆,4008-659-600,,
