温州豪品装饰工程有限公司 ,乐清市银来大厦A-1703,13695891100,61662528,
温州云鸿装饰工程有限公司            ,温州车站大道1号宏泰店面101(宏泰大楼一...,4008-659-600,,
温州腾业装饰设计工程有限公司            ,温州市吴桥大厦A幢1801室（温三中对面）,4008-659-600,,
温州珂居网络科技有限公司            ,乐清城南街道千帆西路188号,4008-659-600,,
温州独艺建筑装饰工程有限公司            ,乐清市乐成镇城东街道环城东路1号,4008-659-600,,
九鼎装饰乐清公司            ,清远路261号欣业大厦1单元603室,4008-659-600,,
乐清市尚艺装饰工程有限公司            ,乐清市城南街道丹霞路555号银来大厦A栋7...,4008-659-600,,
温州庆源装饰设计工程有限公司            ,温州市鹿城区车站大道交行广场11a,4008-659-600,,
温州源艺装饰有限公司            ,温州万源路华泰大厦1幢404室(新城站旁),4008-659-600,,
中观国际装饰公司            ,温州市东游大厦2504室,4008-659-600,,
温州今古建筑装饰工程有限公司            ,温州大道730号4楼,4008-659-600,,
温州市金棕榈建筑装饰工程有限公司            ,锦绣路南国大厦3-1801,4008-659-600,,
温州伟业装饰有限公司            ,温州市车站大道金河大厦B幢6楼,4008-659-600,,
温州市平安饰居装饰工程有限公司            ,温州市鹿城区 南浦路 上吕浦锦园 10栋3...,4008-659-600,,
温州铭和装饰工程有限公司            ,温州市强强锦园1栋2单元1106室,4008-659-600,,
上海三箭装饰有限公司温州分公司            ,温州黎明西路110号5幢三楼,4008-659-600,,
温州开美装饰工程有限公司            ,温州雁荡西路100号和乐律师楼一楼,4008-659-600,,
温州立方装饰有限公司            ,江滨西路金讯达大厦a幢701室,4008-659-600,,
温州庆源装饰设计工程有限公司            ,温州黎富大厦2003室（黎明立交桥边）,4008-659-600,,
温州市室界装饰设计工程有限公司            ,温州市鹿城区新城物华大厦6B,4008-659-600,,
温州新一方装饰有限公司            ,浙江省乐清柳市柳青北路柳丰大厦1单元501...,4008-659-600,,
温州雅泰装饰有限公司            ,温州市鹿城区会展路滨江花苑51幢,4008-659-600,,
臻鼎国际创意设计机构            ,温州经济技术开发区雁荡西路2号402室,4008-659-600,,
温州宝乐装饰有限公司            ,鹿城区宏嘉大厦2--1501,4008-659-600,,
温州天玛装饰有限公司            ,温州望江西路木材市场E幢215-218,4008-659-600,,
臻域装饰工程有限公司            ,宏都小区29幢1单元501室,4008-659-600,,
温州小象装饰工程有限公司            ,温州十七中路丰台小区3幢103室,4008-659-600,,
温州上品装潢建筑有限公司            ,温州市欧洲城中心大楼704,4008-659-600,,
温州昕逸装饰工程有限公司            ,温州市鹿城区南塘四组团1幢2501室,4008-659-600,,
浙江视野环境艺术装饰工程有限公司            ,温州市黎明工业区花源路29号,4008-659-600,,
温州罗浮名家装饰工程有限公司            ,温州市平阳县鳌江区,4008-659-600,,
温州家艺装饰工程有限公司            ,温州市瓯海区梧田街道南堡村东方北路84号4...,4008-659-600,,
温州易百装饰工程有限公司            ,浙江温州学院路 7号 LOFT浙江创意园 ...,4008-659-600,,
温州百仕邸装饰有限公司            ,温州市鹿城区南塘4组团,4008-659-600,,
温州豪品装饰            ,乐清市银来大厦A-1703,4008-659-600,,
