市平安区小太阳装饰工程有限公司            ,海东市平安区新平大道239#（华金小区东门...,4008-659-600,,
倾世皓天装饰设计工程有限公司            ,西宁市五四大街商业巷交电大楼4楼,4008-659-600,,
青海旭腾装饰工程有限公司            ,青海省西宁市城北区海湖新区金座B区北,4008-659-600,,
北京龙发装饰集团            ,阳明东路71号金涛国际a座,4008-659-600,,
西宁馨阁装饰设计有限公司            ,青海省西宁市城西区,4008-659-600,,
青海炫禾装饰工程有限公司            ,西宁市城西区昆仑西路居然之家西200米路南,4008-659-600,,
西宁美嘉装饰装潢有限公司            ,西宁市城中区南关街45号,4008-659-600,,
北京业之峰诺华装饰股份有限公司            ,八一大道357号 财富广场b座22层,4008-659-600,,
青海盛世思维装饰工程设计有限公司            ,西宁市城西区五四大街万通中心45号,4008-659-600,,
青海惠佳信装饰工程设计有限公司            ,青海省西宁市城西区金座a区2号楼3单元31...,4008-659-600,,
龙辰装饰工程有限公司            ,青海省西宁市城西南川西路,4008-659-600,,
 ,,4008-659-600,,
金芒果装饰集团            ,江西省吉安市吉州区广场北路1号(新世界广场...,4008-659-600,,
南昌三帝装饰设计有限公司            ,南昌市青山湖区洪都北道299号高能金域名都...,4008-659-600,,
南昌林涵设计            ,林涵设计,4008-659-600,,
南昌欧坊装饰工程有限公司            ,南昌西湖区洪城路576号天使商务广场t层,4008-659-600,,
南昌鲁公大宅装饰工程公司            ,南昌市八一广场丽华购物广场6楼,4008-659-600,,
西宁绿色空间装饰设计有限公司            ,青海省西宁市海湖新区万达广场斜对面（金座B...,4008-659-600,,
西宁信鼎装饰设计工程有限公司            ,西宁市城东区八一西路32号民航家属院2号楼...,4008-659-600,,
南昌道艺装饰有限公司            ,南昌市红谷滩万达中心写字楼B2-814,4008-659-600,,
阔达建筑装饰工程有限责任公司            ,北京市海淀区西三环北路87号国际财经中心c...,4008-659-600,,
华浔品味装饰            ,东路鹿鼎家居4楼b馆,4008-659-600,,
嘉祺装饰设计工程有限公司            ,,4008-659-600,,
西宁启辰建筑装饰工程有限公司            ,西宁市五四大街力盟步行街2号楼21楼121...,4008-659-600,,
星艺装饰有限公司            ,南昌市北京东路·恒茂国际都会...,4008-659-600,,
波涛装饰公司            ,高新区南二环西段财富中心,4008-659-600,,
南国风装饰工程有限工司            ,青山湖南大道墅溪园,4008-659-600,,
广州市华宁装饰工程有限公司南昌分公司            ,江西省南昌市西湖区广润门三区37栋1号,4008-659-600,,
西宁方舟佳居装饰有限公司            ,城中区西大街省政府旁世贸大厦10楼,4008-659-600,,
西宁完美装饰工程有限公司            ,青海省海东市平安县海东建材市场,4008-659-600,,
