美家帮装饰设计工程有限公司 ,伊宁市西部建材城北区B1栋,15559280175,8066777,
水墨丹青装饰            ,天津路气象卫星地面站高层1号楼1单元140...,4008-659-600,,
海坤装饰有限责任公司            ,伊宁  - 开发区河北路1299号福安国际...,4008-659-600,,
酷居装饰设计有限公司            ,伊宁,4008-659-600,,
名鼎装饰设计有限公司            ,伊宁  - 伊宁市开发区新世界国际建材家居...,4008-659-600,,
润亨装饰            ,伊宁  - 伊犁伊宁市滨河家园北门,4008-659-600,,
交换空间装饰有限公司            ,南坪会展中心9玺国际8栋,4008-659-600,,
天佑兴业装饰设机构工程有限公司            ,乌鲁木齐新市区昆明路518号阳光天和综合楼...,4008-659-600,,
创想饰界建筑装饰工程有限公司            ,乌鲁木齐新市区长春南路美林花源南区1号楼4...,4008-659-600,,
纳美装饰限公司            ,伊宁  - 伊犁伊宁市开发区西部建材市场,4008-659-600,,
爱家家居装饰工程有限公司            ,乌鲁木齐市新市区鲤鱼山路1166号鸿祥雅轩...,4008-659-600,,
新疆疆工国际装饰工程有限公司            ,乌鲁木齐市新市区天津南路银苑商务楼18层,4008-659-600,,
好易家装饰            ,新疆乌鲁木齐高新技术产业开发区(新市区)长...,4008-659-600,,
轻舟装饰            ,伊宁,4008-659-600,,
新疆海智装饰工程有限公司伊犁分公司            ,开发区解放西路744号海智装饰(交警队对面...,4008-659-600,,
新疆美艺雅装饰工程有限公司伊宁市分公司            ,,4008-659-600,,
新疆美艺雅装饰工程有限公司伊宁市分公司            ,新疆伊犁州伊宁市经济合作区天津北路中国西部...,4008-659-600,,
新疆铭诚艺鼎装饰有限公司            ,伊宁,4008-659-600,,
 ,,4008-659-600,,
新疆继伟彩诗建筑装饰工程有限公司            ,伊宁,4008-659-600,,
新疆六度空间装饰设计有限公司            ,伊宁,4008-659-600,,
新疆精典伟业装饰设计有限公司            ,新疆乌鲁木齐新市区河北东路966号康城果岭...,4008-659-600,,
南昌道艺装饰有限公司            ,南昌市红谷滩万达中心写字楼B2-814,4008-659-600,,
嘉祺装饰设计工程有限公司            ,,4008-659-600,,
创艺时代装饰有限公司            ,乌鲁木齐市长沙路158号绿苑雅筑7号楼1单...,4008-659-600,,
惠巢装饰有限公司            ,伊宁,4008-659-600,,
新疆快捷龙盟装饰有限公司            ,新疆乌鲁木齐北京路二宫新华联大厦B座13层,4008-659-600,,
新疆黎源建筑装饰设计有限公司            ,小西沟肿瘤医院旁边阳光天和1305和230...,4008-659-600,,
新疆惠盛天祥家装设计有限公司            ,伊宁,4008-659-600,,
