杭州铭鸿装饰工程有限公司余姚分公司 ,余姚是望湖路244号(东城名苑南大门),13655845048,62771100,
余姚世纪鼎天装饰设计工程有限公司 ,余姚市凤山街道金型路533号,13685855632,62727515,
余姚市杰昇装饰工程有限公司 ,浙江省余姚市世南西路1000-1004号,18395994898,5994898,
余姚欧诺装饰设计有限公司 ,余姚市,15381370303,1370908,
余姚业星装饰有限公司 ,余姚市长元路152-162号,13486057311,62824198,
余姚易尚装饰工程有限公司 ,余姚市长安西路300号,13777931115,400-886-1832,
余姚市尚美装饰工程有限公司 ,浙江省宁波市余姚市四明东路418号,13248502258,8888888,
余姚星艺装饰            ,余姚市丰山路248号(浙东家居往东100米...,4008-659-600,,
余姚华宁装饰            ,余姚市四明西路713号(名仕花园建行旁),4008-659-600,,
余姚九鼎装饰            ,四明西路799号,4008-659-600,,
余姚法勒尔装饰            ,余姚市文山路466-468号,4008-659-600,,
余姚天宏装饰有限公司            ,余姚万年桥路217-219号,4008-659-600,,
宁波市唯倡装饰工程有限公司            ,余姚市天德商都D-11号,4008-659-600,,
香港和景国际室内设计顾问有限公司            ,浙江省余姚市新建北路110号,4008-659-600,,
风中装饰            ,余姚市,4008-659-600,,
风中装饰            ,余姚市,4008-659-600,,
宁波九极建筑装饰工程有限公司            ,海曙区民通街100号（11-1）室,4008-659-600,,
宁波市江东博翔装饰工程有限公司            ,宁波市江东区百丈东路815号22楼B座,4008-659-600,,
宁波吉美建筑装饰有限公司            ,宁波市钱湖北路101号404室（麦德龙斜对...,4008-659-600,,
宁波海曙志佳装饰工程有限公司            ,宁波海曙段塘东路636号泛亚国际22号81...,4008-659-600,,
宁波市乔华建筑装饰有限公司            ,宁波市江东南路341号日月银座二楼B11,4008-659-600,,
天骏装饰            ,,4008-659-600,,
宁波荣豪装饰工程有限公司            ,,4008-659-600,,
宁波九极建筑装饰工程有限公司            ,海曙区民通街100号（11-1）室,4008-659-600,,
宁波市江东博翔装饰工程有限公司            ,宁波市江东区百丈东路815号22楼B座,4008-659-600,,
宁波吉美建筑装饰有限公司            ,宁波市钱湖北路101号404室（麦德龙斜对...,4008-659-600,,
宁波海曙志佳装饰工程有限公司            ,宁波海曙段塘东路636号泛亚国际22号81...,4008-659-600,,
宁波代唯装饰有限公司            ,余姚市梨州街道万年桥路282号,4008-659-600,,
余姚天宏装饰有限公司            ,余姚万年桥路217-219号,4008-659-600,,
余姚市华浔品味装饰设计工程有限公司            ,余姚市开丰路322号万达广场写字楼701室,4008-659-600,,
苏州俏居装饰工程设计有限公司余姚分公司            ,兰馨路85号（哈罗贝贝幼儿园斜对面）,4008-659-600,,
余姚市青苔居装饰有限公司            ,余姚城东望湖路236-240号,4008-659-600,,
宁波悦安装饰工程有限公司            ,余姚市金型路638号,4008-659-600,,
余姚家年华装饰工程有限公司            ,余姚 市丰山西路33号,4008-659-600,,
余姚市雅尚装饰工程有限公司            ,浙江省余姚市万年桥路201号,4008-659-600,,
余姚十杰装饰            , 余姚四明西路761号（名士花园北门）,4008-659-600,,
余姚市高点装饰工程有限公司            ,余姚市文山路521号,4008-659-600,,
余姚江南春装饰设计有限公司            ,浙江省余姚市南滨江路168号国际大厦130...,4008-659-600,,
