业之峰装饰工程有限公司            ,,4008-659-600,,
徽派装饰工程有限公司            ,,4008-659-600,,
西安都市经典分公司            ,咸阳市世纪大道海泉湾斜对面帝都温泉花园21...,4008-659-600,,
豪迈装饰工程有限公司            ,,4008-659-600,,
紫藤装饰工程有限公司            ,,4008-659-600,,
轻舟装饰工程有限公司            ,,4008-659-600,,
万家装饰工程有限公司            ,,4008-659-600,,
陕西峰光无限装饰公司分公司            ,世纪大道中段,4008-659-600,,
北京阔达装饰分公司            ,陈阳寨转盘向东500米华宇蓝郡商铺三楼,4008-659-600,,
陕西龙亭装饰工程有限公司            ,世纪大道南海家缘龙亭装饰,4008-659-600,,
荣欣装饰工程有限公司            ,,4008-659-600,,
东晔装饰工程有限公司            ,,4008-659-600,,
九鼎装饰工程有限公司            ,,4008-659-600,,
逸家装饰工程有限公司            ,人民西路正大国际西侧雅典建材二楼,4008-659-600,,
华浔品味装饰工程有限公司            ,,4008-659-600,,
陕西伍蚁联筑装饰工程有限公司            ,陕西西咸新区沣东新城后卫寨地铁口启航时代广...,4008-659-600,,
陕西艺尚名品建筑装饰工程有限公司            ,秦都区世纪大道中段 铁投V领郡,4008-659-600,,
城市人家装饰有限公司            ,世纪大道中段启迪国际2层,4008-659-600,,
中瀛装饰工程有限公司            ,,4008-659-600,,
逸家装饰工程有限公司            ,咸阳市人民西路亚典建材商厦临街二楼,4008-659-600,,
北京金兰朵装饰西安分公司            ,西安市未央区三桥后卫寨地铁站D出口向东18...,4008-659-600,,
西咸新区精度人生匠心装饰工程有限公司            ,咸阳市秦都区世纪大道中段铁投V领郡前排写字...,4008-659-600,,
陕西兄弟装饰工程有限公司            ,咸阳市秦都区世纪大道海泉湾西南面帝都花园2...,4008-659-600,,
精度人生装饰            ,咸阳市渭城区东风路东风大厦三层,4008-659-600,,
陕西爱尚美居装饰工程有限公司            ,咸阳秦都区体育场十字西北角财苑大厦15层,4008-659-600,,
尚巢装饰有限公司            ,咸阳市秦都区彩虹二路798艺术区,4008-659-600,,
鲁班装饰有限公司            ,咸阳世界大道二号桥转盘,4008-659-600,,
怡馨装饰工程有限公司            ,人民路北门口双峰大厦A座东单元402,4008-659-600,,
装修            ,0,4008-659-600,,
精度人生装饰工程有限公司            ,陕西省咸阳市渭城区东风路东风大厦三楼南,4008-659-600,,
