家装e站            ,宜宾市下江北轻工博览城,4008-659-600,,
北京交换空间装饰公司            ,四川省宜宾市大地坡丽雅龙城商铺7-2,4008-659-600,,
康蓉装饰有限公司            ,宜宾市南溪区正信路三段164号,4008-659-600,,
德峰装饰责任有限公司            ,宜宾市南溪区正信路三段164号,4008-659-600,,
四川巅峰装饰有限公司            ,宜宾市南溪区正信路三段164号,4008-659-600,,
市品设计专业设计表现机构            ,四川省宜宾市翠屏区南岸西区鑫领寓3栋,4008-659-600,,
众信装修工程有限责任公司            ,宜宾市下江北青年城1期22号,4008-659-600,,
四川钟诚装饰工程有限公司            ,宜宾上江北尚城家居4楼[江北建材城对面],4008-659-600,,
美饰家装饰工程有限公司            ,宜宾翠柏大道锦丝路火车站口,4008-659-600,,
云上装饰工程有限责任公司            ,宜宾市翠屏区鲁能生活广场(速八酒店对面),4008-659-600,,
腾祥集团装饰公司            ,宜宾市南溪区正信路三段164号,4008-659-600,,
广州华浔品味装饰分公司            ,宜宾市翠屏区南岸酒都剧场11号门楼,4008-659-600,,
名匠装饰            ,宜宾市南溪区正信路三段164号,4008-659-600,,
钟诚装饰公司·            ,,4008-659-600,,
飞翔装饰有限责任公司            ,,4008-659-600,,
宜宾市南溪区匠人手法装饰有限公司            ,宜宾市南溪区正信路三段164号,4008-659-600,,
