温州超凡工程设计院台州分院 ,台州椒江颐景名苑南门东侧753号,18815203221,12545656,
浙江鼎丰装饰工程有限公司 ,台州市椒江区广场南路226号,15968610217,88820666,
台州天雅装饰有限公司 ,台州市鑫泰广场E幢六层9号,15306865232,1111111,
台州圣都家居装饰有限公司 ,椒江市府大道535号第一时间生活广场5楼,13666877915,66877915,
浙江台州楚鑫装饰工程有限公司 ,台州市路桥区露背赵王村腾达路818号620...,18605860607,89236376,
浙江华景装饰工程有限公司 ,台州椒江区康平路168号中建花园4楼,13968658777,88838333,
台州九鼎装饰公司            ,,4008-659-600,,
台州鼎典装饰            ,,4008-659-600,,
台州易家装饰工程有限公司            ,浙江台州市椒江东海大道865号（整体家居体...,4008-659-600,,
台州丽园装饰            ,台州市椒江区白云山南路181号(深澜概念酒...,4008-659-600,,
台州工元装饰公司            ,台州市椒江区广场南路66-70号(鑫泰广场...,4008-659-600,,
台州良友3d720度数码家装            ,台州路桥南官大道73号,4008-659-600,,
台州国圣装饰工程有限公司            ,台州市椒江区东海大道797号，东方罗马对面,4008-659-600,,
台州市豪盛装饰有限公司            ,东海大道627至633号,4008-659-600,,
台州市路桥区无印良品装饰设计事务所            ,台州市路桥区数码城A区10楼,4008-659-600,,
台州唐庭装饰工程有限公司            ,台州城市港湾白云山路号,4008-659-600,,
台州国圣            ,,4008-659-600,,
台州鼎典装饰设计工程有限公司            ,台州市椒江区东海大道,4008-659-600,,
台州欧丽都装饰设计工程有限公司            ,温岭市大溪镇方山大道339号豪景花苑 2幢...,4008-659-600,,
台州同济建筑装潢有限公司            ,台州市椒江区东海大道446-15(欧尚超市...,4008-659-600,,
台州华浔品味装饰工程有限公怀            ,台州市椒江东海大道(欧尚超市对面),4008-659-600,,
台州恒诺装饰工程有限公司            ,,4008-659-600,,
广东星艺装饰集团临海分公司            ,临海市临海大道（中）23号，云水山庄,4008-659-600,,
台州帝荣装饰工程有限公司            ,台州市椒江区云西路211号一楼,4008-659-600,,
浙江张管家装饰工程有限公司            ,浙江省台州市椒江区巨鼎国际406室,4008-659-600,,
台州华人装饰            ,温岭市箬横镇横滨大道红绿灯旁,4008-659-600,,
东易日盛家居装饰集团股份有限公司台州分公司            ,洪家装饰城红星美凯龙6F,4008-659-600,,
台州星艺装饰工程有限公司            ,,4008-659-600,,
台州路桥杰力装饰材料有限公司            ,路桥腾达路325-327号,4008-659-600,,
台州众信装饰工程有限公司            ,浙江台州椒江区市府大道方远商务大厦1617,4008-659-600,,
朗诚装饰设计工程有限公司            ,水云南路39号,4008-659-600,,
以勒装饰            ,路桥区老机关幼儿园对面.,4008-659-600,,
甲骨文装饰设计有限公司            ,台州黄岩天元路414,4008-659-600,,
温岭宏宇装修设计有限公司            ,温岭市兴兴公寓兴光中路333号,4008-659-600,,
房向标装饰设计有限公司            ,浙江台州市温岭市万昌中路476号(西门子体...,4008-659-600,,
黄岩世家装饰工程有限公司            ,黄岩洞天路159号,4008-659-600,,
温岭市鼎典装饰工程有限公司            ,温岭总商会大楼2603室,4008-659-600,,
台州汉铭装饰设计有限公司            ,临海柏叶中路168-2,4008-659-600,,
台州聚通装饰工程有限公司             ,浙江省台州市,4008-659-600,,
台州市品一装饰设计有限公司            ,句容县,4008-659-600,,
真诚华算装饰            ,浙江省玉环县,4008-659-600,,
台州新典建筑装饰工程有限公司            ,三门海游镇,4008-659-600,,
台州市古彩建筑装饰工程有限公司            ,台州市路桥区发达大厦301室,4008-659-600,,
美星装饰公司            ,,4008-659-600,,
台州墨点装饰设计            ,台州市黄岩区迎薰路27号,4008-659-600,,
台州市观诺建筑装饰工程有限公司            ,台州市市府大道299号市政大厦7F,4008-659-600,,
天台县琼升装饰设计工程有限公司            ,,4008-659-600,,
台州艺腾空间装饰设计工程有限公司            ,台州市君悦大厦B幢1137室,4008-659-600,,
台州市翔之业新型建材有限公司            ,浙江省台州市临海市沿江镇马头山化工园区（1...,4008-659-600,,
佛山南国鼎峰工程有限公司临海分公司            ,,4008-659-600,,
台州良友数码家装            ,路桥南官大道71-73号,4008-659-600,,
真诚 华算装饰            ,玉环县,4008-659-600,,
浙伟装饰            ,,4008-659-600,,
台州一米装饰工程设计有限公司            ,碧海明珠小区北区34幢,4008-659-600,,
易百装饰台州分公司            ,浙江省台州市路桥区腾达路1099-6,7号...,4008-659-600,,
宁波鼎天装饰            ,天台县始丰新城天元西街72号,4008-659-600,,
台州金鼎装饰有限公司            ,纬二路49 号,4008-659-600,,
台州新宇装潢有限公司            ,仙居县建设西路56号,4008-659-600,,
台州市登煌装饰有限公司            ,椒江,4008-659-600,,
晨宇私人装修            ,,4008-659-600,,
DB装饰工程有限公司            ,椒江区新明半岛富强路200号,4008-659-600,,
台州图南装饰工程有限公司            ,椒江后徐老31号,4008-659-600,,
台州路桥圣航装饰店            ,蓬街镇新光村光华北路75号,4008-659-600,,
盛唐装饰设计工作室            ,椒江区悦景花园,4008-659-600,,
东海油漆装潢            ,路桥,4008-659-600,,
以勒装饰设计室            ,路桥新东方理想学校对面,4008-659-600,,
台州荣佳建筑装饰有限公司            ,三门县海游街道三六罗巷青蟹市场二楼(赛格特...,4008-659-600,,
台州市登煌装饰有限公司            ,白云山南路296,4008-659-600,,
老柯装修有限公司            ,浙江温岭,4008-659-600,,
超新油漆装潢            ,台州市椒江区洪家街道,4008-659-600,,
DB装饰工程有限公司            ,椒江区新明半岛富强路200号,4008-659-600,,
台州图南装饰工程有限公司            ,椒江后徐老31号,4008-659-600,,
台州路桥圣航装饰店            ,蓬街镇新光村光华北路75号,4008-659-600,,
盛唐装饰设计工作室            ,椒江区悦景花园,4008-659-600,,
东海油漆装潢            ,路桥,4008-659-600,,
以勒装饰设计室            ,路桥新东方理想学校对面,4008-659-600,,
台州荣佳建筑装饰有限公司            ,三门县海游街道三六罗巷青蟹市场二楼(赛格特...,4008-659-600,,
台州市登煌装饰有限公司            ,白云山南路296,4008-659-600,,
老柯装修有限公司            ,浙江温岭,4008-659-600,,
超新油漆装潢            ,台州市椒江区洪家街道,4008-659-600,,
老柯装修有限公司            ,浙江温岭,4008-659-600,,
超新油漆装潢            ,台州市椒江区洪家街道,4008-659-600,,
台州叶佳装饰有限公司            ,,4008-659-600,,
台州市南宏装饰工程有限公司            ,浙江省台州市天台县和合北路176号工商局对...,4008-659-600,,
一塑设计工作室            ,黄岩,4008-659-600,,
金臣装饰            ,台州市黄岩区西城街道委羽街394号,4008-659-600,,
台州金诺装饰设计有限公司            ,台州市开发区学院路铂金国际花园向南200米,4008-659-600,,
台州青青装饰有限公司            ,台州市椒江区,4008-659-600,,
台州大视野装饰工程有限公司            ,,4008-659-600,,
品东装饰            ,,4008-659-600,,
一塑设计工作室            ,黄岩,4008-659-600,,
金臣装饰            ,台州市黄岩区西城街道委羽街394号,4008-659-600,,
台州金诺装饰设计有限公司            ,台州市开发区学院路铂金国际花园向南200米,4008-659-600,,
台州青青装饰有限公司            ,台州市椒江区,4008-659-600,,
台州大视野装饰工程有限公司            ,,4008-659-600,,
品东装饰            ,,4008-659-600,,
浙江张管家装饰工程有限公司            ,浙江省台州市椒江区亿嘉路190号巨鼎国际4...,4008-659-600,,
台州天绘装饰工程有限公司            ,台州市临海市双林南路389号,4008-659-600,,
台州非语装饰设计有限公司            ,,4008-659-600,,
台州麒典装饰            ,,4008-659-600,,
台州瓦良装饰工程有限公司            ,台州市椒江区、东平路505号、瓦良装饰,4008-659-600,,
台州宏佳装饰            ,洪家城市港湾小区商铺1028号,椒江太平洋...,4008-659-600,,
台州大视野装饰            ,台州经济开发区亿嘉路巨鼎国际商务大厦4楼,4008-659-600,,
台州聚通装饰            ,台州市椒江区亿嘉路华中大厦一单元二楼（聚通...,4008-659-600,,
台州市甲骨文装饰工程设计有限公司            ,台州黄岩天元路414号,4008-659-600,,
台州博大装饰有限公司            ,台州市白云山南路海湾浪琴50-53号 ,4008-659-600,,
台州市椒江筑家装饰工程有限公司            ,椒江红星美凯龙全球家居生活馆5F,4008-659-600,,
台州立方装饰工程有限公司            ,椒江君悦大厦B幢10楼1033室,4008-659-600,,
广东华浔品味装饰集团台州有限公司            ,椒江东海大道欧尚超市北门对面,4008-659-600,,
临海市星艺装饰有限公司路桥分公司            ,浙江省台州市路桥区商海北街1号,4008-659-600,,
樸源室内建筑設計            ,台州市路桥区妙智街86-88号,4008-659-600,,
台州市三禾德泰装饰工程有限公司            ,浙江省台州市椒江区东环大道128-148号...,4008-659-600,,
台州登煌装饰有限公司            ,台州椒江区白云山南路296号2楼,4008-659-600,,
台州市鼎舜装饰工程有限公司            ,台州市路桥区灵山街1131－1133号,4008-659-600,,
易百装饰(新加坡)国际有限公司台州分公司            ,台州市路桥区腾达路水天一色商铺号,4008-659-600,,
台州中创建筑装饰工程有限公司            ,路桥区腾达路987号(台州市路桥区第二中学...,4008-659-600,,
台州划时代装饰设计            ,台州市路桥区世贸中心b1511-1513室,4008-659-600,,
台州恒诺装饰工程有限公司            ,台州市椒江区金辉佳苑广场南路764号,4008-659-600,,
台州聚通装饰设计工程有限公司            ,台州椒江区亿嘉路华中大厦一单元二楼(中心医...,4008-659-600,,
台州极米装饰工程有限公司            ,椒江,4008-659-600,,
佛山南国鼎峰装饰临海分公司            ,临海市柏叶中路219号,4008-659-600,,
台州市华尚装饰工程有限公司            ,椒江区东环大道405号,4008-659-600,,
