重庆市全正装饰设计工程有限公司 ,合川义乌大道16号2-2-62-66（工商...,13389631313,42838813,
广东华浔品味装饰集团重庆有限公司合川分公司 ,希尔安大道，金科世界城联合一百三楼,13650556885,42740288,
重庆市合川区景珑装饰设计工作室 ,合川区钓鱼城办事处花漫里37-2-24,17323992630,42887166,
欧坊装饰合川公司            ,重庆·合川汽摩交易中心3号馆2楼,4008-659-600,,
生活家装饰有限公司            ,重庆市永川区人民东路16号,4008-659-600,,
重庆鹏茂建筑装饰工程有限公司            ,重庆永川区南大街38号一单元2-1（原南大...,4008-659-600,,
华浔品味装饰            ,江北区北滨一路368号灯巢国际灯饰博览中心...,4008-659-600,,
四川华绘格调建筑装饰有限公司            ,德阳市岷江西路256号汇通大厦B栋1楼1号...,4008-659-600,,
城市人家装饰有限公司            ,四川省德阳市旌阳区岷江西路一段256号汇通...,4008-659-600,,
北京业之峰诺华装饰股份有限公司            , 重庆市渝北区人和金开大道两江天地（迪卡侬...,4008-659-600,,
北京龙发装饰集团            ,渝北区红黄路439号(近大众4S店) ,4008-659-600,,
星艺装饰有限公司            ,合川南津街道体育馆1-1,4008-659-600,,
重庆欧也装饰工程有限公司            ,渝北新牌坊转盘附近,4008-659-600,,
重庆一号家居网            ,重庆市 重庆市 江北区 五里店明日城市广场...,4008-659-600,,
名匠装饰有限公司            ,合川瑞山西路电力公司斜对面,4008-659-600,,
三星装饰有限公司            ,重庆 重庆渝北 两路农贸市场,4008-659-600,,
宜美家装饰            ,德阳千山街一段122号3楼 （新钟鼓楼广场...,4008-659-600,,
鲁公大宅装饰            ,合川上什字茂田国际建博城1期二栋3楼6-8...,4008-659-600,,
美星装饰集团            ,南昌,4008-659-600,,
鲁班装饰设计有限公司            ,南昌,4008-659-600,,
交换空间装饰有限公司            ,南坪会展中心9玺国际8栋,4008-659-600,,
实创家居装饰集团有限公司            ,青云谱洪都洪城路6号国贸广场13层,4008-659-600,,
重庆市鲁家匠装饰有限公司            ,合川区花滩国际新城花漫里3号楼二楼,4008-659-600,,
重庆唐卡装饰工程有限公司            ,合川区嘉滨路385、386号（东海滨江城3...,4008-659-600,,
江西苹果装饰公司            ,南昌市抚生丽都广场,4008-659-600,,
北京实创家居装饰集团(江西)有限公司            ,南昌市洪城路6号国贸国贸广场新华都1-3层,4008-659-600,,
江西苹果装饰设计工程有限公司            ,西湖区洪城路987号丽都广场a栋五楼（）,4008-659-600,,
香港云裳软装配饰南昌分公司            ,南昌市西湖区省府西二路,4008-659-600,,
南昌市轩仝宇装饰工程有限公司            ,江西省南昌市西湖区子安路89号1602,4008-659-600,,
迪赞设计空间            ,南昌市井冈山大道名爵公馆,4008-659-600,,
金芒果装饰集团            ,江西省吉安市吉州区广场北路1号(新世界广场...,4008-659-600,,
南昌满艺装饰工程有限公司            ,江西省南昌市西湖区朝阳洲中大云锦A102商...,4008-659-600,,
江西苹果装饰工程有限公司            ,江西省南昌市洪城路987号丽都广场a栋5楼,4008-659-600,,
重庆红升装饰工程有限公司            ,,4008-659-600,,
星辰装饰工作室            ,,4008-659-600,,
重庆红升装饰工程有限公司            ,,4008-659-600,,
重庆乐风装饰设计工程有限公司            , 重庆合川义乌建材城3栋2楼74号,4008-659-600,,
家装e站lclc00001            ,,4008-659-600,,
苹果装饰            ,,4008-659-600,,
甲壳虫整体装饰            ,合川区公交上中心3楼,4008-659-600,,
重庆公司            ,重庆市,4008-659-600,,
宏兴精艺装饰            ,重庆市合川区宝龙城市广场34幢102,4008-659-600,,
合川装修公司qzw            ,,4008-659-600,,
重庆红升装饰工程有限公司            ,,4008-659-600,,
家装e站璧山站            ,璧山区泉山路8号附20号金科中央公园城3号...,4008-659-600,,
合川新未来装饰工程有限公司            ,重庆合川区南津街南屏路270-4号（南津街...,4008-659-600,,
生色印象装饰设计工作室            ,合川区行政大厅对面中南路285号,4008-659-600,,
阔达建筑装饰工程有限责任公司            ,北京市海淀区西三环北路87号国际财经中心c...,4008-659-600,,
南昌道艺装饰有限公司            ,南昌市红谷滩万达中心写字楼B2-814,4008-659-600,,
