唐山市沃尔芬装饰工程有限公司 ,唐山市龙泽北路566号龙盛大厦,15231525131,8992650,
唐山景鑫装饰工程有限公司 ,河北省唐山市路北区唐百时代家居建材博览中心...,13930556860,5912932,
实创(唐山)装饰工程有限公司 ,唐山市路北区建设北路与龙华道交叉口北行10...,18903384212,5068127,
唐山市金诚建筑装饰工程有限公司 ,唐山市路北区玫瑰庄园底商东1号,13933442355,9010315,
唐山塞纳春天装饰工程有限公司 ,唐山市路北高新区龙华道与开三路交叉口金色河...,13011518588,400-684-6599,
唐山元洲装饰            ,河北 唐山 北新道丽景琴园1-21,4008-659-600,,
唐山梵高装饰设计有限公司            ,河北 唐山 唐山市路北区,4008-659-600,,
唐山云艺装饰有限公司            ,国盛商贸城一期9-18号,4008-659-600,,
唐山市格典装饰有限公司            ,唐山路南区南东道269号东方家园2楼d-1...,4008-659-600,,
唐山战友装饰有限公司            ,河北省唐山市路南区万博源建材城商业街69号,4008-659-600,,
唐山市昊昱装饰工程有限公司            ,河北省唐山市路北区光明路与翔云道交叉口北行...,4008-659-600,,
唐山舍一装饰设计有限公司            ,路北区北新道学院路口西南侧100米凯源花苑,4008-659-600,,
唐山卡洛斯奇建筑装饰工程有限公司            ,路北区景泰翰林412楼3号底商,4008-659-600,,
唐山战友装饰有限公司            ,河北省唐山市路南区万博源建材城商业街69号,4008-659-600,,
唐山开源装饰工程有限公司            ,唐山市丰润区君瑞国际商业楼1单元1门516...,4008-659-600,,
唐山市福佳装饰工程有限公司            ,唐山市路北区建设北路南北家园六层,4008-659-600,,
唐山高度国际装饰设计            ,河北省唐山市路北区唐城壹零壹底商806,4008-659-600,,
意图装饰公司            ,唐山市路南区新华贸8层,4008-659-600,,
唐山意图建筑装饰有限公司            ,唐山市路南区新华贸8层,4008-659-600,,
唐山铭筑装饰设计有限公司            ,河北省唐山市路北区凤城国贸爱琴海写字楼8层,4008-659-600,,
唐山青墨装饰设计有限公司            ,建设路与龙华道交口东200米时代家居五层,4008-659-600,,
唐山龙发装饰公司            ,万达,4008-659-600,,
实创装饰            ,唐山市路北区建设路与龙华道交叉口北行500...,4008-659-600,,
唐山新传奇装饰工程有限公司            ,唐山市路南区,4008-659-600,,
唐山东恒装饰工程有限公司            ,唐山市路北区学院路68号,4008-659-600,,
唐山创艺装饰工程有限公司            ,唐山乐亭县,4008-659-600,,
北京弘艺装饰唐山分公司            ,长宁道与卫国路交叉口北行200米路西(景泰...,4008-659-600,,
唐山市鸿基伟业装饰工程有限公司            ,唐山市丰润区,4008-659-600,,
唐山市丽庭装饰工程有限公司            ,唐山市迁安市,4008-659-600,,
曾洋装饰设计有限公司            ,九江永修县白莲南路1幢1002号,4008-659-600,,
唐山青墨装饰设计有限公司            ,建设路龙华道交口东200米唐百时代家居五层,4008-659-600,,
中木装饰            ,学院路与仁通道16-7底商,4008-659-600,,
香港嘉祺装饰设计工程有限公司(唐山分公司)            ,,4008-659-600,,
鲁班装饰设计有限公司            ,唐山乐亭县,4008-659-600,,
南昌网吧装修-南昌眼镜店装修-写字楼办公室装修-厂房装修            ,怡园路888号,4008-659-600,,
城艺装饰            ,8号小区,4008-659-600,,
南昌宅美装饰            ,南昌抚生路口丽都大厦B座7楼,4008-659-600,,
 ,,4008-659-600,,
唐山市枫鸣装饰设计工程有限公司            ,唐山市丰润区端明路富丽商贸西楼3号,4008-659-600,,
万上装饰有限公司            ,,4008-659-600,,
业之峰装饰唐山分公司            ,唐山市路北区兴源道与友谊路交叉口,4008-659-600,,
尚诚装饰            , 迁安尚诚装饰地址：永顺街西段路南（金客隆...,4008-659-600,,
新传奇装饰有限公司            ,唐山市曹妃甸区,4008-659-600,,
城艺装饰            ,8号小区,4008-659-600,,
南昌宅美装饰            ,南昌抚生路口丽都大厦B座7楼,4008-659-600,,
 ,,4008-659-600,,
唐山市枫鸣装饰设计工程有限公司            ,唐山市丰润区端明路富丽商贸西楼3号,4008-659-600,,
万上装饰有限公司            ,,4008-659-600,,
雅迪布艺            , 路北区学院路17-18号,4008-659-600,,
浩元装饰设计工作室            ,路北区建设路与龙富南道交叉口会展中心地下灯...,4008-659-600,,
唐山市枫鸣装饰设计工程有限公司            ,唐山市丰润区端明路富丽商贸西楼3号,4008-659-600,,
万上装饰有限公司            ,,4008-659-600,,
雅迪布艺            , 路北区学院路17-18号,4008-659-600,,
意图装饰有限公司            ,,4008-659-600,,
北京艺品鼎盛装饰设计有限公司唐山分公司            ,河北省唐山市路南区南新西道100-1号,4008-659-600,,
御峰轩装饰公司            ,,4008-659-600,,
建龙装饰            ,,4008-659-600,,
北京龙轩装饰设计有限公司唐山路北分公司            ,翔云道与友谊路交叉口,4008-659-600,,
欧品家居装饰有限公司            ,路北区卫国北路与长宁道交叉口北行300米景...,4008-659-600,,
唐山金诚装饰            ,唐山市路北区玫瑰庄园底商东1号金诚装饰,4008-659-600,,
唐山市路南乐修装饰有限公司            ,唐山市路南新华联花园12楼c座2504,4008-659-600,,
唐山博彩广告装饰有限公司            ,,4008-659-600,,
木牌橱柜            ,唐山市丰润区,4008-659-600,,
唐山实创装饰公司            ,建设北路111号,4008-659-600,,
家派装饰工程有限公司            ,唐山市高新区大学道11号轻工学院大学生*活...,4008-659-600,,
意图装饰有限公司            ,,4008-659-600,,
北京艺品鼎盛装饰设计有限公司唐山分公司            ,河北省唐山市路南区南新西道100-1号,4008-659-600,,
御峰轩装饰公司            ,,4008-659-600,,
建龙装饰            ,,4008-659-600,,
实创（唐山）装饰有限公司            ,唐山市高新区元龙大厦4层,4008-659-600,,
唐山中洲装饰工程有限公司            ,唐山市路北区光明路与祥云道交叉口北行300...,4008-659-600,,
唐山今朝装饰设计有限公司            ,建设北路居然之家六层,4008-659-600,,
唐山风尚装饰设计有限公司            ,建设路与龙华道交叉口东行200米路南侧宏杨...,4008-659-600,,
苹果装饰设计工程有限公司            ,河北省唐山市路南区万达广场A座606,4008-659-600,,
唐山水木南山装饰有限公司            ,曹妃甸区唐海镇建设大街140号,4008-659-600,,
北京御峰轩装饰唐山分公司            ,唐山市路北区长宁道与卫国北路交叉口北行50...,4008-659-600,,
波涛装饰公司            ,河北唐山唐山路北区大里北路蓝天家园商品,4008-659-600,,
唐山市浩元装饰设计工作室            ,唐山市路北区建设路与龙福南道交叉口会展中心...,4008-659-600,,
实创(唐山)装饰工程有限公司            ,唐山市高新区建设北路与龙华道交叉口元龙大厦...,4008-659-600,,
广东华浔品味装饰唐山公司            ,唐山市北新道与友谊路交叉口乐购对面红梅公寓...,4008-659-600,,
 唐山中辉装饰工程有限公司            ,唐山-路北区-百货大楼 新天地一条街F3-...,4008-659-600,,
唐山金典装饰            ,唐山-丰润区-丰润 美景花园底商一号（中铁...,4008-659-600,,
城市人家装饰有限公司            ,唐山市路北区新华西道世博大厦1205室 ,4008-659-600,,
唐山中辉装饰工程有限公司            ,唐山-路北区-百货大楼 新天地一条街F3-...,4008-659-600,,
嘉祺装饰设计工程有限公司            ,,4008-659-600,,
美星装饰集团            ,唐山市丰南区,4008-659-600,,
鲁班装饰设计有限公司            ,唐山路北区 军创凯旋城底商3号,4008-659-600,,
交换空间装饰有限公司            ,唐山海港开发区港欣街与海港路交口,4008-659-600,,
星艺装饰有限公司            ,唐山市 路北区北新西道71号（圣典茶楼东3...,4008-659-600,,
佳鑫装饰            ,唐山-开平区 东城路201,4008-659-600,,
三星装饰有限公司            ,河北省唐山市 路北区 唐丰路２８号,4008-659-600,,
名匠装饰有限公司            ,唐山市路北区兴源道155号,4008-659-600,,
唐山易宸装饰            ,唐山-路北区 路北区远洋城,4008-659-600,,
唐山开源装饰工程有限公司            ,唐山市古治区,4008-659-600,,
