嘉兴市力之帆装饰工程有限公司 ,嘉兴市凌公塘路1473-1485号(康桥花...,18368365952,83950005,
嘉兴禾派装饰工程有限公司 ,嘉兴市南湖区纺工路1108号(凌公塘路与纺...,13356005880,82821990,
上海庆节设计装饰嘉兴分公司 ,万达广场写字楼春江中心4号楼 4F 408,18969315875,82725433,
嘉兴齐家居美科技精装 ,嘉兴市南湖区庆丰南路875号信源大厦9楼,13732579698,89995589,
嘉兴荣思装饰工程有限公司 ,嘉兴市信诚路嘉兴总部商务花园61号楼,18367304680,89998099,
嘉兴荃居装饰工程有限公司 ,嘉兴市南湖区南湖商会A座1005室,13456389895,82862286,
嘉兴誉家装饰工程有限公司 ,嘉兴市南湖区徽商大厦2002室,18042235596,82832519,
上海波涛装饰(嘉兴分公司) ,颐高广场中环西路486号,18058638658,83806703,
嘉兴市鼎铖装饰工程有限公司 ,嘉兴市长水路116号百瑞大厦9楼,13305839188,82667991,
嘉兴樾尚装饰工程有限公司 ,嘉兴颐高广场办公区901室,15167377858,82238937,
嘉兴博饰装饰工程有限公司 ,嘉兴市秀洲区秀园路382号,18157372368,82617113,
广田过家家装饰嘉兴分公司 ,嘉兴市南湖区新领域广场3号楼2F,17862933244,83888818,
浙江汇金装饰股份有限公司 ,嘉兴市桐乡大道1235号海德饰博汇A区,18057337688,1658881,
大众装饰工程有限公司            ,海宁市旺吴路1号,4008-659-600,,
嘉兴龙兴装饰工程有限公司            ,,4008-659-600,,
嘉兴品诺装饰有限公司            ,嘉兴南湖区文昌路1406号晨凯大厦1302...,4008-659-600,,
嘉兴尚院建筑装饰工程有限公司            ,浙江嘉兴南湖区凌公塘1271号(南湖区政府...,4008-659-600,,
嘉兴合一装饰工程有限公司            ,由拳路2527号文锦苑一幢东2楼（紫景艺境...,4008-659-600,,
嘉兴艺国装饰工程有限公司            ,嘉兴万好家居A幢8楼,4008-659-600,,
嘉兴市东大装饰工程有限公司            ,嘉兴市中山西路京润大厦1201室,4008-659-600,,
绮园装饰            ,海盐县海滨东路46号,4008-659-600,,
柒宇室内设计工作室            ,嘉兴市南湖区南溪西路同方燕语林苑14栋2单...,4008-659-600,,
嘉兴市禾辰装饰工程有限公司            ,嘉兴市秀洲区兴港商贸中心3F,4008-659-600,,
嘉兴装饰有限公司            ,嘉兴市嘉善县,4008-659-600,,
大境室内设计有限公司            ,中山东路392号世纪高尔夫南门,4008-659-600,,
嘉兴圣元装饰装饰工程有限公司            ,嘉兴市秀洲区 周安路中安商贸园D区33幢2...,4008-659-600,,
嘉兴合一装饰工程有限公司            ,嘉兴市南湖区商务大道由拳路交汇处,4008-659-600,,
嘉善工匠装饰设计工作室            ,嘉善县体育南路413号,4008-659-600,,
嘉兴管家婆装饰工程有限公司            ,嘉兴市洪兴路置地大厦B幢405,4008-659-600,,
嘉兴怡家装饰有限公司            ,,4008-659-600,,
禾辰国际装饰工程有限公司            ,嘉兴市王江泾镇闻川路744号,4008-659-600,,
嘉兴市伟鸿装饰工程有限公司            ,中环南路福地广场405室,4008-659-600,,
桐乡市雅安居装饰            ,桐乡市梧桐街道振东新区和平东路400-40...,4008-659-600,,
嘉兴顶尚软膜天花装饰材料有限公司            ,嘉兴市南湖区凌塘路36号,4008-659-600,,
嘉兴城市人家装饰公司            ,嘉兴城市人家装饰位于嘉兴市中环西路486号...,4008-659-600,,
吴仞装饰有限公司            ,查无,4008-659-600,,
嘉兴建材市场立壕PU精致线条            ,嘉兴市建材市场东大门C2区140--141...,4008-659-600,,
个人装修施工队            ,嘉兴市友谊街,4008-659-600,,
嘉兴视界装饰工程有限公司            ,嘉兴市景宜路澳洲花园东门1号商铺(二楼),4008-659-600,,
嘉兴利民装饰            ,嘉兴嘉城绿都春兰苑,4008-659-600,,
浙江麦斯特姆（嘉兴）壁纸工厂            ,嘉兴工业园区江南路99号,4008-659-600,,
海宁装修公司            ,海宁公园,4008-659-600,,
嘉兴简装饰公司            ,凌公塘路巴黎都市961号,4008-659-600,,
嘉兴市杭君装饰有限公司            ,中港城新世纪公寓3-1603,4008-659-600,,
海宁金美佳电梯装饰有限公司            ,海宁市海洲街道,4008-659-600,,
嘉兴品诺装饰有限公司            ,嘉兴市南湖区文昌路1406号晨凯大厦130...,4008-659-600,,
嘉兴嘉家乐装饰工程有限公司            ,中山西路2017京润大厦,4008-659-600,,
精诚装修施工队            ,嘉兴秀洲区,4008-659-600,,
嘉兴安福居装饰公司            ,嘉兴市南湖区望湖路787号,4008-659-600,,
嘉兴市居庭装饰工程有限公司            ,嘉兴南湖区南溪西路2165hao,4008-659-600,,
嘉兴简装饰公司            ,凌公塘路巴黎都市961号,4008-659-600,,
嘉兴叶佳装饰有限公司            ,嘉兴市王店镇,4008-659-600,,
天启装饰工程有限公司            ,嘉兴市南湖区广益路万好家居A栋301,4008-659-600,,
嘉兴德志装饰工程有限公司            ,嘉兴中环北路732号环北商贸大厦507,4008-659-600,,
雄都科技责任有限公司            ,南京浦口盘城丁解工业园6号,4008-659-600,,
KS快速装潢            ,嘉兴秀洲区,4008-659-600,,
 ,,4008-659-600,,
嘉兴安福居装饰工程有限公司            ,嘉兴市南湖区望湖路787号,4008-659-600,,
嘉兴盘铭装饰工程有限公司            ,嘉兴市南湖区景宜路952号,4008-659-600,,
瑞嘉装饰有限公司            ,嘉兴市秀洲区加创路1155号,4008-659-600,,
嘉兴吉豪装饰有限公司            ,嘉善大道518号乔克国贸中心1510室,4008-659-600,,
广州美星装饰            ,海宁市文苑路9-11号,4008-659-600,,
嘉兴市鸿腾木业商店装饰部            ,嘉兴市洪兴路376号,4008-659-600,,
嘉兴昱丰装饰            ,嘉兴市南湖区双溪路1151号,4008-659-600,,
嘉兴上房装饰有限公司            ,嘉兴富悦大酒店写字楼602,4008-659-600,,
嘉兴市御造装饰工程有限公司            ,乔克国贸一号楼601,4008-659-600,,
嘉兴市零点装饰设计有限公司            ,嘉兴市东升西路咖尔花园,4008-659-600,,
嘉兴市金福装饰工程有限公司            ,嘉兴市永泰广场14幢2楼,4008-659-600,,
嘉善优典装饰            ,,4008-659-600,,
凤缘饰家            ,嘉兴市 南湖区,4008-659-600,,
嘉兴德志装饰            ,,4008-659-600,,
嘉兴装修工程公司            ,桐乡市世纪大道号,4008-659-600,,
嘉兴惠美装饰            ,,4008-659-600,,
嘉兴名匠装饰有限公司            ,,4008-659-600,,
嘉兴尚嘉装饰有限公司            ,中环南路2608号福地广场403室,4008-659-600,,
精诚装修施工队            ,嘉兴秀洲区,4008-659-600,,
嘉兴安福居装饰公司            ,嘉兴市南湖区望湖路787号,4008-659-600,,
嘉兴市居庭装饰工程有限公司            ,嘉兴南湖区南溪西路2165hao,4008-659-600,,
嘉兴简装饰公司            ,凌公塘路巴黎都市961号,4008-659-600,,
嘉兴叶佳装饰有限公司            ,嘉兴市王店镇,4008-659-600,,
天启装饰工程有限公司            ,嘉兴市南湖区广益路万好家居A栋301,4008-659-600,,
嘉兴德志装饰工程有限公司            ,嘉兴中环北路732号环北商贸大厦507,4008-659-600,,
雄都科技责任有限公司            ,南京浦口盘城丁解工业园6号,4008-659-600,,
KS快速装潢            ,嘉兴秀洲区,4008-659-600,,
 ,,4008-659-600,,
嘉兴涵帅装饰工程有限公司            ,嘉兴南湖区望湖路787号,4008-659-600,,
平湖市兆艺装饰有限公司            ,平湖市祥中路25号（世纪名苑一期门口）,4008-659-600,,
嘉兴个人装修施工队            ,嘉兴市秀洲区王江泾,4008-659-600,,
嘉兴金福装饰工程有限公司            ,嘉兴市秀洲区新城街道永泰广场,4008-659-600,,
上海岩朗建材有限公司            ,嘉兴市中安市场12幢109,4008-659-600,,
嘉兴中冠建筑装饰工程有限公司            ,,4008-659-600,,
浙江紫金世家            ,嘉兴市中山东路世纪广场,4008-659-600,,
嘉兴市老木匠人居环境建筑装饰有限公司            ,嘉兴市南湖区凌公塘路743号(汇龙苑大门西...,4008-659-600,,
嘉兴市金福装饰工程有限公司            ,嘉兴市永泰广场14幢2楼,4008-659-600,,
嘉善优典装饰            ,,4008-659-600,,
凤缘饰家            ,嘉兴市 南湖区,4008-659-600,,
晟田工艺品            ,,4008-659-600,,
嘉兴万泓装饰工程有限公司城西分公司            ,,4008-659-600,,
嘉兴铭品装饰工程有限公司            ,嘉兴市经济开发区桐乡大道1235号 海德饰...,4008-659-600,,
嘉兴市良程景观工程有限公司            ,,4008-659-600,,
嘉兴云木环保科技有限公司            ,浙江省嘉兴市海盐县盐东村精工路5号云木科技,4008-659-600,,
上海米萝装饰平湖分公司            ,,4008-659-600,,
禾善装饰            ,嘉善乔克国贸中心,4008-659-600,,
嘉兴宏元装饰工程有限公司            ,浙江省嘉兴市双溪路1008号,4008-659-600,,
嘉兴闪光点装饰有限公司            ,海宁塘南东路731号（硖石小学斜对面）,4008-659-600,,
大禾装饰            ,,4008-659-600,,
嘉兴福仕得装饰材料有限公司            ,嘉兴市秀洲区王店镇南塘工业园区,4008-659-600,,
嘉兴千嘉装饰工程有限公司            ,,4008-659-600,,
PINGO国际禾善装饰            ,嘉善乔克国贸中心(写字楼22层),4008-659-600,,
麦瓷瓷家装            ,,4008-659-600,,
美家装饰            ,嘉兴汽车北站,4008-659-600,,
嘉兴市德志装饰工程有限公司            ,嘉兴市华隆广场1号楼1507,4008-659-600,,
嘉兴锦尚装饰工程有限公司            ,,4008-659-600,,
嘉兴德志装饰工程有限公司            ,嘉兴华隆广场1号楼1507,4008-659-600,,
上海帆聿装饰工程有限公司            ,嘉善乔克国贸中心写字楼1209室,4008-659-600,,
嘉兴万泓装饰工程有限公司城西分公司            ,,4008-659-600,,
嘉兴铭品装饰工程有限公司            ,嘉兴市经济开发区桐乡大道1235号 海德饰...,4008-659-600,,
sanguo            ,,4008-659-600,,
上海芈悦装饰设计有限公司            ,嘉善县嘉善大道518号乔克商务中心二号楼2...,4008-659-600,,
江苏金螳螂有限公司            ,,4008-659-600,,
全嘉装饰设计工程有限公司            ,,4008-659-600,,
创壹装饰有限公司            ,浙江省嘉兴市南湖区嘉兴市嘉兴总部商务花园7...,4008-659-600,,
军艺装饰工程有限公司            ,,4008-659-600,,
嘉兴洛森装饰材料有限公司            ,,4008-659-600,,
上海帆聿装饰工程有限公司            ,嘉善乔克国贸中心写字楼1209室,4008-659-600,,
浙江菲恩装饰有限公司            ,嘉兴市南湖区花园路1734号,4008-659-600,,
普清装修            ,海宁市袁花镇彭墩工业园188号,4008-659-600,,
巢品顶墙集成装饰有限公司            ,浙江省嘉兴市王店镇南塘工业园中元1号,4008-659-600,,
嘉兴豪来屋装饰工程有限公司            ,嘉兴市南湖区广益路南湖商会805室,4008-659-600,,
嘉兴全嘉装饰工程有限公司            ,,4008-659-600,,
嘉兴市德志装饰有限公司            ,嘉兴市华隆广场1号楼1507,4008-659-600,,
上海米萝装饰平湖分公司            ,,4008-659-600,,
浙江森怡建筑设计有限公司            ,浙江省嘉兴市嘉善县路555号A1幢6楼,4008-659-600,,
嘉祥装饰            ,,4008-659-600,,
嘉兴旭凯装饰工程有限公司            ,,4008-659-600,,
嘉兴闪光点装饰有限公司            ,海宁塘南东路731号（硖石小学斜对面）,4008-659-600,,
泰雅装饰工程有限公司            ,嘉兴市南湖区三元路东升苑商铺2橦24号,4008-659-600,,
浙江菲恩装饰有限公司            ,嘉兴市南湖区花园路1734号,4008-659-600,,
普清装修            ,海宁市袁花镇彭墩工业园188号,4008-659-600,,
益彩装饰材料有限公司            ,,4008-659-600,,
嘉兴创美网络科技有限公司            ,海盐县天宁寺西路38号,4008-659-600,,
嘉兴曼居国际装饰工程有限公司            ,,4008-659-600,,
麦瓷瓷家装            ,,4008-659-600,,
嘉兴千嘉装饰工程有限公司            ,,4008-659-600,,
PINGO国际禾善装饰            ,嘉善乔克国贸中心(写字楼22层),4008-659-600,,
美家装饰            ,嘉兴汽车北站,4008-659-600,,
嘉兴市德志装饰工程有限公司            ,嘉兴市华隆广场1号楼1507,4008-659-600,,
sanguo            ,,4008-659-600,,
上海芈悦装饰设计有限公司            ,嘉善县嘉善大道518号乔克商务中心二号楼2...,4008-659-600,,
江苏金螳螂有限公司            ,,4008-659-600,,
嘉兴中冠装饰工程有限公司            ,嘉兴秀洲区昌盛南路现代广场2号楼1703室,4008-659-600,,
嘉兴缘海装饰工程有限公司            ,嘉兴庆丰路1120号（格兰英郡朝西店面）,4008-659-600,,
浙江森屿装饰设计有限公司            ,嘉兴市南湖区南溪西路2423号,4008-659-600,,
锦尚装饰有限公司            ,武义南溪西路2189号,4008-659-600,,
嘉兴放心装饰工程有限公司            ,嘉兴市远洋大厦b棟9c室,4008-659-600,,
嘉兴市言诚装饰有限公司            ,嘉兴市南湖区南溪西路2559号（罗马都市商...,4008-659-600,,
嘉兴市典匠装饰工程有限公司            ,嘉兴市中山大厦807室,4008-659-600,,
嘉兴洛曼装饰工程有限公司            ,凌公塘路号,4008-659-600,,
嘉兴市中正装饰工程有限公司            ,嘉兴南溪西路2084号,4008-659-600,,
嘉兴简美装饰工程有限公司            ,嘉兴南湖区双溪路1108号,4008-659-600,,
嘉兴市嘉禹装饰设计有限公司            ,浙江省 嘉兴市 南湖区 南湖商会大厦B座8...,4008-659-600,,
嘉兴市鸿志装饰工程有限公司            ,嘉兴市南湖区亚欧路214号,4008-659-600,,
嘉兴市龙鑫装饰工程有限公司            ,嘉兴市南湖区当代华府云东路194—196号...,4008-659-600,,
嘉兴鸿艺装饰工程有限公司            ,嘉兴友谊街国际丝贸中心1609,4008-659-600,,
上海付杰室内装饰有限公司嘉兴分公司            ,嘉兴市南湖区农翔路625号,4008-659-600,,
嘉兴九木堂装饰工程有限公司            , 嘉兴南湖双溪路1213号,4008-659-600,,
嘉兴欧申装饰有限公司            ,嘉兴市南湖区双溪路1131号,4008-659-600,,
嘉兴龍铭装饰工程有限公司            ,嘉兴市南湖区望湖路811号,4008-659-600,,
嘉兴东源装饰工程有限公司            ,嘉兴市南湖区广益路1319号中创电气商贸园...,4008-659-600,,
嘉兴市博尚装饰工程有限公司            ,嘉兴市南湖区双溪路1152号,4008-659-600,,
嘉兴拜占庭装饰工程有限公司            ,嘉兴市秀洲区现代广场2号楼4楼,4008-659-600,,
嘉兴梦家装饰有限公司            ,嘉兴市南湖区云东路439号（罗马都市东大门...,4008-659-600,,
嘉兴泰美装饰工程有限公司            ,嘉兴市南湖区凌公塘路1799号,4008-659-600,,
嘉兴筑巢装饰工程有限公司            ,嘉兴市文昌西路新文化广场1号楼16楼,4008-659-600,,
嘉兴正弘装饰有限公司            ,嘉兴市南湖区紫竹路225号2楼,4008-659-600,,
嘉兴艾格轩装饰有限公司            ,嘉兴市云东路426号(郁金香花园西面商铺),4008-659-600,,
嘉兴洛曼装饰有限公司            ,嘉兴市南湖区凌公塘路2119号,4008-659-600,,
嘉兴市易安装饰工程有限公司            ,嘉兴市南湖区望湖路838号,4008-659-600,,
广州华宁装饰工程有限公司嘉兴分公司            ,嘉兴市南湖区中港城双溪路1453号（康桥花...,4008-659-600,,
嘉兴尚宏装饰工程有限公司            ,嘉兴秀洲区现代广场2号楼1005室(元一柏...,4008-659-600,,
嘉兴上房装饰有限公司            ,嘉兴市中环南路2608号福地广场1008,4008-659-600,,
嘉兴拜占庭装饰工程有限公司            ,,4008-659-600,,
上海悟升装饰公司嘉兴分公司            ,嘉兴秀洲区昌盛南路1629号现代广场A12...,4008-659-600,,
浙江意罗尼装饰工程有限公司            ,嘉兴市南湖区广益路732号(万达广场春江中...,4008-659-600,,
上海储涵建筑装饰工程设计（嘉兴）有限公司            ,中国嘉兴市望湖路615号（翡翠花园商铺）,4008-659-600,,
嘉兴巨佳装饰工程有限公司            ,嘉兴市南湖区中环南路1980号中核大厦5F,4008-659-600,,
嘉兴壹品装饰工程有限公司            ,嘉兴市望湖路633号,4008-659-600,,
嘉兴当家苹果装饰设计工程有限公司            ,嘉兴市南湖区中山东路中山名都6栋1401,4008-659-600,,
嘉兴中正装饰工程有限公司            ,,4008-659-600,,
嘉兴九渝装饰工程有限公司            ,嘉兴市南湖区华隆广场2幢1004-1006,4008-659-600,,
嘉兴尚东视觉装饰工程有限公司            ,嘉兴南湖区南江路211号-221号（南江路...,4008-659-600,,
嘉兴福鑫装饰有限公司            ,嘉兴市昌盛南路1261号,4008-659-600,,
嘉兴市贝格装饰设计有限公司            ,嘉兴市南湖区望湖路975号,4008-659-600,,
嘉兴典尚装饰工程有限公司            ,,4008-659-600,,
嘉兴市禾家装饰工程有限公司            ,嘉兴瑞安广场1701室,4008-659-600,,
嘉兴印象中国工程有限公司            ,,4008-659-600,,
嘉兴东鸿装饰工程有限公司            ,嘉兴市凌公塘路811号,4008-659-600,,
嘉兴星艺装饰工程有限公司            ,,4008-659-600,,
嘉兴时代装饰工程有限公司            ,,4008-659-600,,
嘉兴龙禾装饰有限公司            ,嘉兴南湖区,4008-659-600,,
浙江天元十杰装饰工程有限公司            ,嘉兴南湖新区双溪路1181号(御溪花园东门...,4008-659-600,,
龙发装饰集团嘉兴分公司            ,嘉兴市南湖区中山路耀城广场1542,4008-659-600,,
嘉兴星艺装饰公司            ,嘉兴市中环南路与花园路交叉口体育中心南区一...,4008-659-600,,
嘉兴九创装饰工程有限公司            ,嘉兴市秀州区京润大厦24楼2412-241...,4008-659-600,,
