天津优佳装饰工程有限公司 ,天津市塘沽区杭州道2250号兴海装饰城对面...,15022109789,60905978,
广东星艺装饰集团天津有限公司            ,天津市开发区第三大街与洞庭路交口盛泰公寓底...,4008-659-600,,
慕尚艺流(天津)装饰工程有限公司            ,开发区第二大街与洞庭路交口中建大厦,4008-659-600,,
天津腾虹装饰工程有限公司            ,塘沽区上海道和福建西路交口,4008-659-600,,
东易日盛装饰            ,滨海新区泰达第二大街泰达MSD C3-10...,4008-659-600,,
天津阳光德成装饰工程有限公司            ,塘沽外滩八方园明2门301,4008-659-600,,
天津独秀佳美装饰设计工程公司            ,天津市滨海新区大港新基业家居装饰中心四层,4008-659-600,,
天津开发区唐之杰装饰有限公司            ,天津开发区第三大街森泰小区12门101室,4008-659-600,,
天津滨海万通装饰工程有限公司            ,天津塘沽响螺湾中惠熙元广场1号楼e区9层,4008-659-600,,
天津阳光德成装饰工程有限公司            ,天津开发区第二大街与洞庭路交口(融创洞庭路...,4008-659-600,,
天津思奥装饰工程有限公司            ,天津市滨海新区福州道滨海名都13栋106-...,4008-659-600,,
天津市淼瑞森装饰工程有限公司            ,塘沽胡家园高新区旭辉澜郡3栋1-1102室,4008-659-600,,
天津华亿世景装饰工程有限公司            ,工农村宝山道首创国际城28-602,4008-659-600,,
天津思奥装饰工程有限公司            ,,4008-659-600,,
天津龙居装饰有限公司            ,塘沽火车站附近四季风情小区内,4008-659-600,,
佛山市楼兰陶瓷            ,,4008-659-600,,
天津世纪光明装饰工程有限公司            ,天津市塘沽区向阳街跃进里,4008-659-600,,
天津福泽致远装饰工程有限公司            ,,4008-659-600,,
天津金凯润装饰工程有限公司            ,塘沽华北陶瓷市场K3馆101室,4008-659-600,,
天津华耐美家装饰有限公司            ,河西区环渤海建材473号（华耐美家整体家装...,4008-659-600,,
天津市恒鑫伟业装饰工程有限公司            ,天津市滨海高新区华北陶瓷对面远洋城(分公司...,4008-659-600,,
天津市滨海新区美艺空间装饰工程有限公司            ,天津市滨海新区宏达公寓14号,4008-659-600,,
天津金凯利装饰工程有限公司            ,天津市滨海新区胡家园街华北陶瓷市场内D1馆,4008-659-600,,
天津滨海新区永华盛世建筑装饰公司            ,天津塘沽新港二号路朝阳公寓2门1201室,4008-659-600,,
天津斯图曼装饰工程有限公司            ,天津大港区港东新城福泽园44号商业楼斯图曼...,4008-659-600,,
天津美居天成装饰工程有限公司            ,天津市塘沽区宝山道688号(梅林浩商贸发展...,4008-659-600,,
天津滨海凌大装饰设计公司            ,天津市河北区红星路与幸福道交口,4008-659-600,,
