广东九木堂装饰重庆大足分公司 ,重庆市大足区棠香街道二环南路蓝湖星宇100...,18725635918,43776868,
永川区宏鑫亿装饰工程有限公司大足分公司 ,大足区新城十二区公交站旁二楼,13368274600,61161598,
重庆市德壹装饰设计有限公司 ,重庆市大足区圣迹南路68号,18883750039,43355385,
重庆明道装饰工程有限公司 ,重庆市大足区观棠晓月二期大门口二楼转角门市,15608319778,43796315,
天怡美装饰工程有限公司            ,重庆市渝北区天宫大道华宇北城中央A区,4008-659-600,,
居之家装饰            ,重庆市大足区北环路与宏声东路交叉口东北10...,4008-659-600,,
德品装饰工程有限公司            ,重庆市江北区红旗河沟东和银都大厦5楼,4008-659-600,,
一号家居网            ,重庆市大足区棠香街道办事处五星大道226附...,4008-659-600,,
居众装饰            ,重庆市大足区宏声东路与宏声南路交叉口东北1...,4008-659-600,,
生活家装饰工程有限公司            ,重庆市大足区夏碧路158-附1号附近,4008-659-600,,
好时嘉装饰工程有限公司            ,重庆市南岸区亚太路玖玺国际1栋6楼,4008-659-600,,
西港装饰工程有限公司            ,重庆市大足区香山美地1号楼19号,4008-659-600,,
象田装饰设计工程有限公司            ,重庆市大足区人和路135号,4008-659-600,,
古兰建筑装饰设计工程有限公司            ,重庆市大足区龙中路214号,4008-659-600,,
天古装饰艺术设计有限公司            ,重庆市渝中区中山一路169号和信大厦裙楼三...,4008-659-600,,
幸运猫装饰工程有限公司            ,重庆市渝北区新溉路231号附2号天工太阳岛...,4008-659-600,,
成都居之家装饰工程有限公司分公司            ,重庆市大足区迎宾大道附近,4008-659-600,,
天色装饰设计有限公司            ,江北观音桥朗晴广场B幢38楼,4008-659-600,,
鹏泰家好佳装饰工程有限公司            ,重庆市大足区宏声广场4号,4008-659-600,,
视觉色纯简易家装饰            ,重庆市大足区宏声广场4号,4008-659-600,,
美的家装饰工程有限公司            ,主城.区县都有店面(江北.南坪.沙坪坝.渝...,4008-659-600,,
亨元装饰设计工程有限公司            ,重庆市江北区南桥寺永辉大厦5楼,4008-659-600,,
华浔品味装饰            ,重庆市江北区北滨路灯巢406室,4008-659-600,,
 装饰设计工程有限公司分公司            ,重庆市大足区建新路39号附13号,4008-659-600,,
优乐装饰集团-江北整装体验馆            ,重庆市江北区红旗河沟红黄路10号华创大厦3...,4008-659-600,,
臻上装饰设计工程有限公司            ,重庆市江北区观音桥郎晴广场A塔9-1,4008-659-600,,
炬木装饰设计工程有限公司            ,南坪金台大厦12-1,17-7,4008-659-600,,
乐尚装饰工程有限公司            ,江北店：观音桥泰兴e世界7层整层，南岸区店...,4008-659-600,,
汉德装饰工程有限公司            ,重庆市南坪区南坪西路27号福天大厦A座3楼,4008-659-600,,
诗情装饰设计工程有限公司            ,重庆市大足区幸光大道与朝阳街交叉口西南50...,4008-659-600,,
欧也装饰工程有限公司            ,重庆市大足区体育馆3号门市,4008-659-600,,
鼎轩装饰工程有限公司            ,重庆市江北区 红旗河沟转盘 北部尚座23楼...,4008-659-600,,
美的家装饰工程有限公司            ,重庆市江北区北滨路灯巢TEL:,4008-659-600,,
