苏州沙米宁装饰工程有限公司 ,太仓市城厢镇郑和中路423-2号,18962651088,53356999,
上海廉丰装饰设计有限公司太仓恩妹分公司 ,太仓市城厢镇太平路4-9号,15000366798,53985598,
太仓金凯装饰工程有限公司 ,太仓市郑和西路23-7-8号,15862454999,53718388,
太仓市归居装饰工程设计有限公司 ,太仓市之江国际13栋B2-1室,18013782250,8659600,
太仓美星装饰设计有限公司 ,太仓市城厢镇东仓北路2号1幢110室(东仓...,13812914771,53122979,
苏州壹只鼎装饰工程有限公司 ,江苏省太仓市万达广场银街5-014号,15950996367,33060570,
太仓好饰家装饰工程有限公司            ,,4008-659-600,,
太仓顶鼎装饰工程设计有限公司            ,华侨花园17-105,4008-659-600,,
太仓典尚装饰工程有限公司            ,,4008-659-600,,
太仓市亚光亚装饰工程有限公司            ,太仓人民北路30-25,4008-659-600,,
上海鸿境建筑装饰工程有限公司            ,滨河路86-11（近娄江南路口）,4008-659-600,,
上海申欣装饰工程有限公司太仓分公司            ,太平新路1号,4008-659-600,,
太仓市源创建筑装饰工程有限公司            ,太仓市太平北路66号(太平路与弇山路路口向...,4008-659-600,,
太仓意品佳装饰工程有限公司            ,,4008-659-600,,
太仓安得装饰工程有限公司            ,,4008-659-600,,
太仓阔达装饰            ,太仓郑和西路23-4号鸿鑫汽贸城对面阔达装...,4008-659-600,,
太仓华浔品味装饰工程有限公司            ,,4008-659-600,,
深圳市欧陆风装饰太仓分公司            ,太仓市城厢镇郑和中路403(东仓路与郑和路...,4008-659-600,,
太仓全筑装饰工程有限公司            ,,4008-659-600,,
广东名匠装饰太仓分公司            ,太平南路2号,4008-659-600,,
太仓上源建筑装饰工程有限公司            ,太仓市城厢镇南园西路58号（南洋1号公馆对...,4008-659-600,,
太仓基磊装饰工程有限公司            ,,4008-659-600,,
江苏筑锦装饰工程有限公司            ,上海东路5号华侨大厦,4008-659-600,,
太仓典卫装饰工程有限公司            ,太仓市城厢镇南郊西埠桥南150米,4008-659-600,,
苏州三宅装饰            ,太仓市城厢镇县府东街61-8,4008-659-600,,
苏州同唐装饰设计工程有限公司            ,郑和西路25-4号(住房公积金东200米）,4008-659-600,,
九岳装饰            ,太仓市上海东路199号102室,4008-659-600,,
香港嘉祺装饰太仓公司            ,太仓市县府西街94-96号(马家地）,4008-659-600,,
太仓索美装饰工程有限公司            ,南园西路140号（果园二村门口）,4008-659-600,,
太仓装修施工工程队            ,苏州太仓,4008-659-600,,
苏州红蝴蝶建筑装潢工程有限公司            ,太仓市朝阳东路3号香塘大厦7楼,4008-659-600,,
沙米宁装饰工程有限公司            ,上海东路77号五洋国际商务大厦1#901,4008-659-600,,
上海唐琪建筑装饰工程有限公司太仓分公司            ,江苏省苏州市太仓市城厢镇郑和中路65号奥森...,4008-659-600,,
太仓金阳装饰工程有限公司            ,太仓宝龙广场宝龙酒店北侧A-1123号,4008-659-600,,
太仓市城厢镇博雅装饰设计工作室            ,太仓市朝阳西路201号 起浩大厦1501室,4008-659-600,,
广东华宁装饰            ,太平北路56号,4008-659-600,,
江苏海滨装饰工程有限公司            ,江苏省太仓市城厢镇,4008-659-600,,
江苏太仓好家居装饰有限公司            ,江苏太仓,4008-659-600,,
太仓广州华宁装饰            ,江苏苏州太仓市城厢镇太平北路56号1栋22...,4008-659-600,,
太仓市爱家智能化工程有限公司            ,江苏省太仓市宝龙城市广场39-106,4008-659-600,,
上海善友建筑装饰设计有限公司            ,太仓市岳阳路59号,4008-659-600,,
上海御统装饰设计有限公司            ,太仓市盛园小区,4008-659-600,,
江苏红蚂蚁装饰集团            ,太仓郑和中路376号塞纳丽舍20幢3号商铺,4008-659-600,,
深圳欧陆风装饰            ,郑和东路11号3-4室,4008-659-600,,
金品装饰设计室            ,太仓万达广场12棟716,4008-659-600,,
江苏红蚂蚁装饰集团            ,郑和中路376号塞纳丽舍20幢3号商铺,4008-659-600,,
名帆装饰设计工程有限公司            ,太仓市发展大厦2幢511,4008-659-600,,
太仓市艺邦装饰工程有限公司            ,太仓市郑和中路65号,4008-659-600,,
五点五八建筑装饰公司            ,,4008-659-600,,
利民室内装璜【装饰】有限公司            ,江苏省太仓市东仓北路1118号,4008-659-600,,
太仓红蚂蚁装饰集团            ,太仓郑和中路376号塞纳丽舍底楼商铺,4008-659-600,,
上海凯丰装饰设计有限公司            ,太仓市县府西街君悦豪庭19号,4008-659-600,,
明相装饰钱龙            ,板桥四通路57号,4008-659-600,,
太仓筑巢装饰设计有限公司            ,太仓世纪广场财富大厦1103,4008-659-600,,
明相装潢公司            ,板桥四通路57号,4008-659-600,,
苏州柏饰家3D墙艺装饰            ,浮桥镇康居花园,4008-659-600,,
上海沪利装饰太仓分公司            ,太仓市县府西街君悦豪庭20号商铺（近204...,4008-659-600,,
上海同技联合建设发展有限公司            ,上海东路东盛广场(宝龙酒店正对面)农商行隔...,4008-659-600,,
太仓市全筑装饰工程有限公司            ,郑和中路423号,4008-659-600,,
上海基磊装饰太仓分公司            ,太仓市郑和东路11-1号,4008-659-600,,
太仓名家建筑装饰设计有限公司            ,太仓长胜南路宝龙广场二楼名家装饰,4008-659-600,,
上海邦特装潢设计有限公司            ,江苏太仓朝阳东路158-2号,4008-659-600,,
上海路锦装饰工程有限公司            ,上海市中江路,4008-659-600,,
金丝雀装饰设计有限公司            ,郑和东路2号（海事局东侧）,4008-659-600,,
凯博橱柜衣柜            ,,4008-659-600,,
苏州文都装饰工程有限公司            ,太仓市双凤镇风中路1号,4008-659-600,,
苏州明相装潢公司            ,太仓市开发区四通路57号,4008-659-600,,
南通金阳装饰工程有限公司太仓分公司            ,太仓市上海东路95号(LOFT工业设计园Q...,4008-659-600,,
太仓市浏河镇尚凯家装设计工作室            ,太仓市浏河镇望海路267-5号,4008-659-600,,
造梦空间墙纸软包            ,太仓市沙溪镇,4008-659-600,,
RRRRRwwwww            ,,4008-659-600,,
太仓铭匠装饰有限公司            ,郑和西路19号,4008-659-600,,
太仓一手装饰公司            ,滨河路168-9号,4008-659-600,,
上海申怡建筑装饰工程有限公司            ,太仓市朝阳西路201号莱茵帝景101室,4008-659-600,,
苏州金钥匙建筑装饰设计工程有限公司            ,城厢镇郑和中路7-2,4008-659-600,,
爱尚名家装饰有限公司            ,太仓市上海东路288号宝龙城市商业街（20...,4008-659-600,,
太仓波涛装饰工程有限公司            ,太仓市滨河东路92-4(华源上海城南门),4008-659-600,,
蚁族装饰设计有限公司            ,郑和路 塞纳丽舍13-01-03商铺,4008-659-600,,
南京水木清华装饰公司            ,太仓市柳州路37号社保局对面,4008-659-600,,
江苏旭日装饰工程有限公司            ,县府西路78号,4008-659-600,,
苏州诺玛特装饰设计工程有限公司            ,,4008-659-600,,
广东星艺装饰有限公司太仓分公司            ,太仓市郑和东路29号,4008-659-600,,
筑梦家装饰工程有限公司            ,太仓市城厢镇小北门街人杰景典3幢筑梦家装饰,4008-659-600,,
太仓沙米宁工程有限公司            ,上海东路五洋国际商务大厦1#901,4008-659-600,,
太仓蓬仙阁装饰工程有限公司            ,太仓万达广场12-716,4008-659-600,,
太仓市全筑装饰工程有限公司            ,郑和中路423号,4008-659-600,,
上海基磊装饰太仓分公司            ,太仓市郑和东路11-1号,4008-659-600,,
太仓名家建筑装饰设计有限公司            ,太仓长胜南路宝龙广场二楼名家装饰,4008-659-600,,
太仓沙米宁工程有限公司            ,上海东路五洋国际商务大厦1#901,4008-659-600,,
太仓蓬仙阁装饰工程有限公司            ,太仓万达广场12-716,4008-659-600,,
太仓市全筑装饰工程有限公司            ,郑和中路423号,4008-659-600,,
上海基磊装饰太仓分公司            ,太仓市郑和东路11-1号,4008-659-600,,
太仓名家建筑装饰设计有限公司            ,太仓长胜南路宝龙广场二楼名家装饰,4008-659-600,,
上海邦特装潢设计有限公司            ,江苏太仓朝阳东路158-2号,4008-659-600,,
上海路锦装饰工程有限公司            ,上海市中江路,4008-659-600,,
金丝雀装饰设计有限公司            ,郑和东路2号（海事局东侧）,4008-659-600,,
凯博橱柜衣柜            ,,4008-659-600,,
苏州文都装饰工程有限公司            ,太仓市双凤镇风中路1号,4008-659-600,,
苏州明相装潢公司            ,太仓市开发区四通路57号,4008-659-600,,
南通金阳装饰工程有限公司太仓分公司            ,太仓市上海东路95号(LOFT工业设计园Q...,4008-659-600,,
太仓上源建筑装饰工程有限公司            ,,4008-659-600,,
上海善友建筑装饰设计有限公司            ,太仓市岳阳路59号,4008-659-600,,
上海申欣装饰工程有限公司            ,上海浦东浦三路1515号同福易家；丽3-3...,4008-659-600,,
太仓三星品高装饰设计工程有限公司            ,太仓市东仓北路2号1幢109室,4008-659-600,,
上海棠颂装饰设计有限公司            ,太仓市太平南路57号,4008-659-600,,
太仓东筑空间设计有限公司            ,太仓市人民南路华旭大夏a909,4008-659-600,,
苏州诚艺之星智能装饰工程有限公司            ,太仓科教新城健雄路20号,4008-659-600,,
太仓市明相装饰有限公司            ,太仓市板桥镇四通路57号,4008-659-600,,
上海邦特装潢设计有限公司            ,江苏太仓朝阳东路158-2号,4008-659-600,,
心诚装修/个人装修包工            ,太仓市陆渡镇,4008-659-600,,
上海凯丰装饰设计有限公司            ,太仓市县府西街君悦豪庭19号,4008-659-600,,
明相装饰钱龙            ,板桥四通路57号,4008-659-600,,
太仓筑巢装饰设计有限公司            ,太仓世纪广场财富大厦1103,4008-659-600,,
明相装潢公司            ,板桥四通路57号,4008-659-600,,
上海沪利装饰太仓分公司            ,太仓市县府西街君悦豪庭20号商铺（近204...,4008-659-600,,
上海同技联合建设发展有限公司            ,上海东路东盛广场(宝龙酒店正对面)农商行隔...,4008-659-600,,
苏州红阳装饰设计工程有限公司            ,,4008-659-600,,
苏州典尚建筑装饰设计有限公司            ,东盛商业广场4栋2楼,4008-659-600,,
家天下建筑装饰工程有限公司            ,太仓市庆阳路19号,4008-659-600,,
南京旺家丰装饰太仓分公司            ,南京红太阳装饰城,4008-659-600,,
江苏梦居装饰公司            ,太仓市长春北路城北停车场对面,4008-659-600,,
艺博名轩建筑装饰工程有限公司            ,太仓人民南路华旭财富中心A808,4008-659-600,,
太仓壹只鼎装饰            ,,4008-659-600,,
广东星艺装饰            ,郑和东路亲水半岛29-10,11,4008-659-600,,
太仓安心装饰设计工程有限公司            ,太仓郑和西路通洋花园10-12,4008-659-600,,
太仓市艺堂美家建筑装饰工程有限公司            ,太仓市郑河路360号世家英伦06商铺 ,4008-659-600,,
苏州金丝雀装饰设计工程有限公司            ,太仓市郑和东路2号(海事局东侧),4008-659-600,,
苏州柏饰家3D墙艺装饰            ,太仓浮桥康居花园,4008-659-600,,
太仓品为九万装饰工程有限公司            ,太仓市上海东路188号万达广场银街5幢16...,4008-659-600,,
太仓明慧美装饰装潢有限公司            ,太仓宝龙广场商业街C-180,4008-659-600,,
新钰澜门业            ,太仓市城厢镇板桥区兴业路16号南门,4008-659-600,,
太仓市帝豪空间设计工程有限公司            ,郑和中路453号（友谊医院往西300米左右...,4008-659-600,,
太仓安心装饰设计工程有限公司            ,太仓郑和西路通洋花园10-12,4008-659-600,,
太仓市艺堂美家建筑装饰工程有限公司            ,太仓市郑河路360号世家英伦06商铺 ,4008-659-600,,
苏州金丝雀装饰设计工程有限公司            ,太仓市郑和东路2号(海事局东侧),4008-659-600,,
苏州柏饰家3D墙艺装饰            ,太仓浮桥康居花园,4008-659-600,,
太仓宝屋建筑装饰工程有限公司            ,太仓市城厢镇南阳路2-2号 （ 锦江国际往...,4008-659-600,,
太仓居然装饰工程有限公司            ,太仓市太平南路3-24号,4008-659-600,,
广东星艺装饰集团太仓分公司            ,太仓市郑和东路亲水半岛旁29-10.11号,4008-659-600,,
苏州尊艺装饰工程有限公司            ,太仓郑和中路发展大厦11楼1108室,4008-659-600,,
太仓立人装饰工程有限公司            ,,4008-659-600,,
太仓名匠装饰            ,太平南路2号,4008-659-600,,
上海九万建筑装饰工程有限公司太仓分公司            ,太仓市上海东路188号万达广场银街5-16...,4008-659-600,,
上海祥筑建设工程有限公司            ,朝阳东路21号科而雅大厦8楼祥筑建设,4008-659-600,,
太仓波涛装饰工程有限公司            ,太仓市滨河东路92-4(华源上海城南门),4008-659-600,,
上海杰友装饰设计太仓分公司            ,江苏省太仓市太平南路36-1号,4008-659-600,,
太仓嘉源装饰工程有限公司            ,,4008-659-600,,
苏州赫邦装饰设计工程有限公司            ,太仓市科教新城大学科技园,4008-659-600,,
上海沪利装饰太仓分公司            ,太仓市县府西街君悦豪庭20号商铺（近204...,4008-659-600,,
太仓市喜洋洋装饰工程有限公司            ,太仓市沙南东路8号,4008-659-600,,
苏州元昇装饰工程有限公司            ,太仓市城厢镇太平北路66号,4008-659-600,,
