山西今朝英迈装饰设计有限公司 ,太原市五一广场,18735127122,8234606,
山西紫苹果装饰工程有限公司 ,太原市小店区,13643453293,7220807,
太原城市人家装饰 ,千峰北路瓦窑街口西北角城市人家装饰,13453446641,2736618,
太原生活家装饰工程有限公司 ,晋祠路9号(迎泽桥西往南300米),18603477783,8728999,
山西华浔品味装饰有限公司 ,晋源区长风商务区长兴南街阳光城环球金融中心...,18406589133,6855789,
山西华创晋美装饰工程有限公司 ,山西省太原市小店区长风街长风画卷B座505,18334710612,7099309,
独特壹家整装生活馆 ,南内环千峰路口鸿峰商务大厦,13653651075,2167800,
太原天地筑和装饰有限公司            ,太原市平阳路186号飞云国际公寓7层717...,4008-659-600,,
太原业之峰装饰有限公司            ,太原市南中环街与体育路口企联大厦18层,4008-659-600,,
太原星艺装饰有限公司            ,太原市小店区长治南路180号(居然之家斜对...,4008-659-600,,
东易日盛阳光居然装饰有限公司            ,太原市长治路199号华辰大厦一、二、三层(...,4008-659-600,,
上海波涛装饰集团太原公司            ,太原市小店区长风街千禧大厦805,4008-659-600,,
太原城市人家装饰有限公司            ,太原市千峰北路瓦窑街口西北角,4008-659-600,,
太原尚层装饰有限公司            ,男中环街国际大都会七号名车公馆楼上,4008-659-600,,
太原风尚共和装饰有限公司            ,小店区体育路16号(近体育场),4008-659-600,,
太原鲁班装饰有限公司            ,山西省 太原市小店区太原市学府街124号,4008-659-600,,
山西保利绿洲装饰设计有限公司            ,太原市小店区亲贤街佳地花园B座18层210...,4008-659-600,,
山西夏之阳装饰设计工程有限公司            ,小店区亲贤北街58号怡和广场1228室,4008-659-600,,
太原市东唐装饰设计有限公司            ,太原市小店区平阳路万狮京华大酒店北侧,4008-659-600,,
太原业之峰诺华装饰有限公司            ,太原市长风街北方君威财富中心16层,4008-659-600,,
山西星尚装饰工程有限公司            ,太原市晋阳街平阳路口东500米纳达大厦东座...,4008-659-600,,
太原东易日盛            ,太原市晋阳街88号兴业大厦西裙楼1-4层东...,4008-659-600,,
小邦主整装服务平台            ,太原市建设南路亲贤北街口邦荟网线下体验店四...,4008-659-600,,
山西欧美金辉装饰工程有限公司            ,小店区电子街 康馨苑B2座2-1301室,4008-659-600,,
太原金拇指装饰设计工程有限公司            ,小店区电子街恒大绿洲西南角二层,4008-659-600,,
百思图建筑装饰工程有限公司            ,吴家堡D3-2-201,4008-659-600,,
太原品界国际装饰            ,太原市长风街北方君威7层,4008-659-600,,
苏人装饰工程有限公司            ,山西省太原市杏花岭区赛马场,4008-659-600,,
山西汉亚装饰设计工作室            ,山西省太原市小店区太榆路君怡大厦,4008-659-600,,
金山建筑装饰工程有限公司            ,小店区电子街恒大绿洲36幢C座,4008-659-600,,
太原东唐装饰设计有限公司            ,①⑧①零③⑤①⑤⑧⑦⑥,4008-659-600,,
实创装饰太原分公司            ,太原市杏花岭区北大街新建路口173号,4008-659-600,,
北京品界装饰有限公司太原分公司            ,太原市小店区长风街北方君威7层,4008-659-600,,
北京宜美家园建筑装修工程有限公司            ,迎泽西大街德馨花园A座2单元19A,4008-659-600,,
山西晟坤装饰有限公司            ,小店长治路奥林花园悉尼座5层,4008-659-600,,
北京元洲装饰太原直营分公司            ,长风街建设路交叉口往东500米路北(国控大...,4008-659-600,,
山西省太原市C创装饰有限公司            ,,4008-659-600,,
太原布瑞可室内设计有限公司            ,太原市长风西街万国MOMA城2号楼801室,4008-659-600,,
山西格林艾尔环境工程技术有限公司            ,山西省太原市小店区人民北路颐源街中世汇源b...,4008-659-600,,
北京交换空间装饰太原公司            ,太原市长风街长治路口,4008-659-600,,
东唐装饰设计有限公司            ,太原市长风街长治路口东方家缘,4008-659-600,,
胜多负少机会            ,山西省太原市,4008-659-600,,
山西惬意家居装饰有限公司            ,山西太原万柏林区万水装饰城,4008-659-600,,
山西今朝英迈装饰设计有限公司            ,山西省太原市迎泽区并州东街62号(卷烟厂东...,4008-659-600,,
太原市万柏林区锦福木门经销部            ,旧晋祠路万水装饰城灯饰门业馆212号,4008-659-600,,
深圳市华亿天成设计有限公司(太原分公司)            ,山西省太原市小店区长风街华德中心广场a座1...,4008-659-600,,
蓝泥儿硅藻泥            ,山西省太原市长治路大唐龙庭,4008-659-600,,
山西微艺空间装饰设计有限公司            ,太原市万柏林区前进路下元花鸟鱼市旁布衣茶客...,4008-659-600,,
山西蕉友装饰设计工程有限公司            ,高新区创业街时代广场,4008-659-600,,
太原市金山装饰有限公司            ,太原市小店区电子街恒大绿洲北门36幢c座,4008-659-600,,
鑫艺德装饰有限公司            ,北美新天地2号搂1811室,4008-659-600,,
太原名联装饰有限公司            ,山西太原小店区长风东大街高速口领秀长风小区...,4008-659-600,,
山西北国明珠装饰设计有限公司            ,太原市晋阳街体育路口文创园,4008-659-600,,
山西金视野装饰有限公司            ,山西省太原市晋阳街与太榆路交叉口西南,4008-659-600,,
山西三晋之家装饰公司            ,sxsjzj,4008-659-600,,
山西千众装饰工程有限公司            ,体育南路晋阳街北美金棕榈8号楼2单元290...,4008-659-600,,
山西东大创合装饰设计工程有限公司            ,,4008-659-600,,
北京顶尚恒明装饰有限公司            ,北京市朝阳区十里河工程区,4008-659-600,,
山西鲲鹏智能科技有限公司            ,太原市高新区创业街27号时代广场1403,4008-659-600,,
山西贵族风尚建筑装饰工程有限公司            ,,4008-659-600,,
我爱我家家居装饰            ,山西省太原市、山西省忻州市、山西省晋中市,4008-659-600,,
丰诚百泰装饰工程有限公司            ,长风画卷a座3单元2101室,4008-659-600,,
太原东旭装饰工程有限公司            ,平阳路267号,4008-659-600,,
君安专业装修            ,太原市,4008-659-600,,
山西美创装饰工程有限公司            ,,4008-659-600,,
蕉友装饰设计工程有限公司            ,高新区创业街时代广场,4008-659-600,,
山西皇冠明珠装饰设计有限公司            ,南中环街 景观360 1-503,4008-659-600,,
金德易装饰工程有限公司            ,太原市万柏林区大王路美林湾小区,4008-659-600,,
太原市佳爱装饰有限公司            ,太原市坞城南路99号山西工商学院6幢-1层,4008-659-600,,
太原东唐装饰有限公司            ,平阳路万狮京华大酒店北侧100米,4008-659-600,,
山西精艺俍工装饰工程有限公司            ,,4008-659-600,,
广东华浔品味装饰集团山西分公司            ,太原市万柏林区长风桥西万国城MOMOA商住...,4008-659-600,,
太原市皓东装饰工程有限公司            ,,4008-659-600,,
东易日盛·阳光居然装饰            ,太原市长治路199号华辰大厦1-3层,4008-659-600,,
山西华誉装饰设计有限公司            ,太原市小店区体育路学府街口往南300米华誉...,4008-659-600,,
太原装修太原装修太原装修            ,876,4008-659-600,,
汇峰装饰工程有限公司            ,太原市长风街泰华城市广场a座2单元1502...,4008-659-600,,
太原鸿利佳源装饰工程有限公司            ,,4008-659-600,,
山西汇盛装饰有限公司            ,山西省太原市杏花岭区解放路,4008-659-600,,
山西领誉装饰工程有限公司            ,太原市长风桥东华德中心广场C座1单元120...,4008-659-600,,
山西广腾装饰工程有限公司            ,太原市长风街123号君威财富中心1604,4008-659-600,,
山西保利绿洲装饰设计有限公司            ,,4008-659-600,,
山西保利绿洲装饰设计有限公司            ,太原市亲贤街佳地花园b座18层,4008-659-600,,
太原皖南一精艺装饰            ,,4008-659-600,,
太原市龙泉装饰广告有限公司            ,太原市南内环西街9号,4008-659-600,,
山西一品美居装饰            ,,4008-659-600,,
 ,,4008-659-600,,
广东华浔品味装饰集团太原有限公司            ,太原市万柏林区万国城moma-2号楼-29...,4008-659-600,,
山西亚鑫港装饰工程有限公司            ,太原市长风西街万柏林区街道办事处A座,4008-659-600,,
山西一品美居装饰            ,,4008-659-600,,
山西保利绿洲装饰设计有限公司            ,,4008-659-600,,
山西保利绿洲装饰设计有限公司            ,太原市亲贤街佳地花园b座18层,4008-659-600,,
晋美装修公司            ,,4008-659-600,,
山西哥弟诺一装饰工程有限公司            ,,4008-659-600,,
 ,,4008-659-600,,
广东华浔品味装饰集团太原有限公司            ,太原市万柏林区万国城moma-2号楼-29...,4008-659-600,,
山西亚鑫港装饰工程有限公司            ,太原市长风西街万柏林区街道办事处A座,4008-659-600,,
爱设计装饰开发有限公司            ,山西省太原市小店区学府西街,4008-659-600,,
太原市聚信通装饰工程有限公司            ,,4008-659-600,,
北京居然之家装饰工程有限公司太原分公司            ,太原市万柏林区迎泽西大街332号居然之家装...,4008-659-600,,
山西奥凯建筑工程有限公司            ,山西省太原市小店区南中环街大都会西区,4008-659-600,,
华浔品味装饰            ,,4008-659-600,,
 ,,4008-659-600,,
北京都市时空装饰太原直营分公司            ,南内环街平阳路口东南角赛格数码商务楼20层,4008-659-600,,
 ,,4008-659-600,,
山西万豪美诚装饰有限公司            ,山西太原小店新天地,4008-659-600,,
山西鸿祥昇装饰工程有限公司            ,南中环街北张小区A,4008-659-600,,
太原元洲装饰            ,山西省太原市高新开发区五峰国际1010,4008-659-600,,
山西交换空间装饰设计工程有限公司            ,山西太原小店区长风街千禧大厦13层,4008-659-600,,
山西凯帝莱橱柜            ,,4008-659-600,,
实创家居装饰太原有限公司            ,,4008-659-600,,
太原装饰公司            ,,4008-659-600,,
太原米乐装饰有限公司            ,,4008-659-600,,
晋美装修公司            ,,4008-659-600,,
山西哥弟诺一装饰工程有限公司            ,,4008-659-600,,
晋美装饰            ,,4008-659-600,,
北京装家乐装饰有限公司太原店            ,小店区学府街于平阳路交叉口路东100米紫檀...,4008-659-600,,
 ,,4008-659-600,,
山西一品美居装饰            ,,4008-659-600,,
山西保利绿洲装饰设计有限公司            ,,4008-659-600,,
山西保利绿洲装饰设计有限公司            ,太原市亲贤街佳地花园b座18层,4008-659-600,,
 ,,4008-659-600,,
广东华浔品味装饰集团太原有限公司            ,太原市万柏林区万国城moma-2号楼-29...,4008-659-600,,
山西亚鑫港装饰工程有限公司            ,太原市长风西街万柏林区街道办事处A座,4008-659-600,,
山西鸿祥昇装饰工程有限公司            ,南中环街北张小区A,4008-659-600,,
太原元洲装饰            ,山西省太原市高新开发区五峰国际1010,4008-659-600,,
 ,,4008-659-600,,
太原专业美缝剂施工            ,,4008-659-600,,
 ,,4008-659-600,,
山西千众装饰工程有限公司            ,体育路晋阳街北美金棕榈小区2单元2901室,4008-659-600,,
山西朗艺建筑装饰有限公司            ,,4008-659-600,,
山西辰亮涂料有限公司            ,太原市小店区,4008-659-600,,
太原索美建筑装饰有限公司            ,长风画卷A座1单元1002,4008-659-600,,
太原市聚信通装饰工程有限公司            ,,4008-659-600,,
北京居然之家装饰工程有限公司太原分公司            ,太原市万柏林区迎泽西大街332号居然之家装...,4008-659-600,,
太原东唐装饰            ,,4008-659-600,,
名仕家居一站式装修            ,居然之家春天店3层,4008-659-600,,
山西奥凯建筑工程有限公司            ,山西省太原市小店区南中环街大都会西区,4008-659-600,,
 ,,4008-659-600,,
太原业之峰装饰有限公司            ,长风街长治路北方君威大厦,4008-659-600,,
山西奥凯建筑工程有限公司            ,山西省太原市小店区南中环街大都会西区,4008-659-600,,
广东华浔品味装饰集团山西分公司            ,太原市万柏林区长风桥西万国城MOMO商住楼...,4008-659-600,,
太原鸣寰装饰            ,太原市小店区龙城北街滨江花园(山西大医院后...,4008-659-600,,
山西鸿祥昇装饰工程有限公司            ,南中环街北张小区A,4008-659-600,,
太原元洲装饰            ,山西省太原市高新开发区五峰国际1010,4008-659-600,,
山西凯帝莱橱柜            ,,4008-659-600,,
 ,,4008-659-600,,
山西辰亮涂料有限公司            ,太原市小店区,4008-659-600,,
太原业之峰诺华装饰            ,山西省太原市小店区长风街北方君威16层精品...,4008-659-600,,
 ,,4008-659-600,,
北京如图装饰工程有限公司            ,,4008-659-600,,
山西茂盛家园建筑装饰工程有限公司            ,太原市小店区茂盛装饰城东排2-1,4008-659-600,,
飞黄腾达装饰有限公司            ,太原市晋原区和平装饰家园,4008-659-600,,
太原红蜘蛛装饰设计有限公司            ,聚宝盆斜对面,4008-659-600,,
太原东旭装饰工程有限公司            ,平阳路267号,4008-659-600,,
君安专业装修            ,太原市,4008-659-600,,
山西美创装饰工程有限公司            ,,4008-659-600,,
专业个人团队            ,太原晋源区,4008-659-600,,
山西格林艾尔环境工程技术有限公司            ,山西省太原市小店区人民北路颐源街中世汇源b...,4008-659-600,,
 ,,4008-659-600,,
格调生活灯饰壁纸            ,,4008-659-600,,
金德易装饰工程有限公司            ,太原市万柏林区大王路美林湾小区,4008-659-600,,
太原市佳爱装饰有限公司            ,太原市坞城南路99号山西工商学院6幢-1层,4008-659-600,,
太原市晋源区聚美佳装饰有限公司            ,太原市晋源区贤富宛小区商铺(龙山大街)D东...,4008-659-600,,
实创装饰集团太原分公司            ,新建路北大街口往南两百米，宏艺珠宝旁,4008-659-600,,
山西千众装饰工程有限公司            ,体育路晋阳街北美金棕榈小区2单元2901室,4008-659-600,,
山西朗艺建筑装饰有限公司            ,,4008-659-600,,
太原市聚信通装饰工程有限公司            ,,4008-659-600,,
山西奥凯建筑工程有限公司            ,山西省太原市小店区南中环街大都会西区,4008-659-600,,
丰诚百泰装饰工程有限公司            ,长风画卷a座3单元2101室,4008-659-600,,
太原元洲装饰            ,山西省太原市高新开发区五峰国际1010,4008-659-600,,
蕉友装饰设计工程有限公司            ,高新区创业街时代广场,4008-659-600,,
山西皇冠明珠装饰设计有限公司            ,南中环街 景观360 1-503,4008-659-600,,
山西鸿祥昇装饰工程有限公司            ,南中环街北张小区A,4008-659-600,,
华浔品味装饰            ,,4008-659-600,,
 ,,4008-659-600,,
北京都市时空装饰太原直营分公司            ,南内环街平阳路口东南角赛格数码商务楼20层,4008-659-600,,
山西凯帝莱橱柜            ,,4008-659-600,,
 ,,4008-659-600,,
百事通专业装饰团队            ,太原市,4008-659-600,,
太原市正扬装饰有限公司            ,迎泽西大街奥林匹克花园14楼1单元106号,4008-659-600,,
佳晨博雅建筑装饰工程有限公司            ,山西长治市清华园,4008-659-600,,
山西阳光世纪装饰工程有限公司            ,山西省太原市长风桥东华德中心广场B座907...,4008-659-600,,
 ,,4008-659-600,,
山西晟峰达装饰工程有限公司            ,山西太原尖草坪区北宫龙城8-1-402,4008-659-600,,
金点子金点子            ,,4008-659-600,,
山西鑫厚工贸有限公司            ,山西太原长风街,4008-659-600,,
山西百尚德装饰有限公司            ,,4008-659-600,,
山西华誉装饰设计有限公司            ,体育南路学府街书香苑3楼华誉装饰,4008-659-600,,
太原苹果装饰设计工程有限公司            ,,4008-659-600,,
太原源艺百汇装饰            ,,4008-659-600,,
太原一家一装饰工程有限公司            ,太原市小店区学府街120号,4008-659-600,,
太原鹏威门窗装饰            ,太原,4008-659-600,,
山西满堂红装饰            ,,4008-659-600,,
山西金锋伟业装饰工程有限公司            ,真武路万马仕广场2705,4008-659-600,,
 ,,4008-659-600,,
山西田上装饰设计工程有限公司            ,,4008-659-600,,
 亿家豪庭装饰工程有限公司            ,,4008-659-600,,
 亿家豪庭装饰工程有限公司            ,,4008-659-600,,
太原东唐装饰设计有限公司            ,,4008-659-600,,
山西新豪联装饰有限公司            ,,4008-659-600,,
御龙飞翔装饰            ,,4008-659-600,,
山西艺沁源装饰设计            ,太原市小店区电子街,4008-659-600,,
山西贵舍尚宅建筑装饰工程有限公司            ,太原市尖草坪区兴华北街11号C幢2层1-3...,4008-659-600,,
 ,,4008-659-600,,
太原一家一装饰工程有限公司            ,太原市小店区学府街120号,4008-659-600,,
太原鹏威门窗装饰            ,,4008-659-600,,
太原市居函装饰工程有限公司            ,太原市小店区215号,4008-659-600,,
金富贵室内设计装饰工程有限公司            ,,4008-659-600,,
山西精诚龙鼎装饰建筑工程有限公司            ,,4008-659-600,,
山西格丽特装饰工程有限公司            ,太原双塔寺街闻汇大厦,4008-659-600,,
太原业之峰诺华装饰有限公司            ,长风街长治路口,4008-659-600,,
太原东唐装饰设计有限公司            ,,4008-659-600,,
山西华誉装饰设计有限公司            ,体育南路学府街书香苑3楼华誉装饰,4008-659-600,,
太原苹果装饰设计工程有限公司            ,,4008-659-600,,
御龙飞翔装饰            ,,4008-659-600,,
太原一家一装饰工程有限公司            ,太原市小店区学府街120号,4008-659-600,,
太原鹏威门窗装饰            ,太原,4008-659-600,,
 ,,4008-659-600,,
山西金锋伟业装饰工程有限公司            ,真武路万马仕广场2705,4008-659-600,,
 ,,4008-659-600,,
山西田上装饰设计工程有限公司            ,,4008-659-600,,
 亿家豪庭装饰工程有限公司            ,,4008-659-600,,
山西新豪联装饰有限公司            ,,4008-659-600,,
山西艺沁源装饰设计            ,太原市小店区电子街,4008-659-600,,
太原源艺百汇装饰            ,,4008-659-600,,
山西贵舍尚宅建筑装饰工程有限公司            ,太原市尖草坪区兴华北街11号C幢2层1-3...,4008-659-600,,
独特壹家整装生活馆            ,,4008-659-600,,
阳光膜业有限公司            ,,4008-659-600,,
山西广嘉同工贸有限公司            ,太原市南内环西街万水澜庭5-2-102,4008-659-600,,
山西火麒麟建筑装饰工程有限公司            ,太原市万柏林区千峰南路长风西街口海盛科技大...,4008-659-600,,
晋中鸿德装饰工程有限公司            ,山西省晋中市榆次区汇通路汇森美家装饰城20...,4008-659-600,,
佐丹诗装饰            ,,4008-659-600,,
太原靓尚伊家家居有限公司            ,,4008-659-600,,
汉唐阁装饰            ,,4008-659-600,,
太原整装体验馆            ,长风街和平南路交叉口北侧500米路东,4008-659-600,,
太原御龙飞翔装饰工程有限公司            ,建设南路南内环街口西南角200米东城一品,4008-659-600,,
山西鱼水荷装饰工程有限公司            ,山西省太原市小店区滨河东路晋阳街口东悦广场...,4008-659-600,,
太原东唐装饰设计有限公司            ,太原市小店区许坦东街美特好对面 锦东国际商...,4008-659-600,,
山西都市时空装饰工程有限公司            ,太原市长风街与千峰南路交叉口往北800米路...,4008-659-600,,
实创家居装饰集团太原有限公司            ,北大街新建路口173号,4008-659-600,,
太原九创装饰            ,长治路与南中环交叉口火炬大厦C座11层,4008-659-600,,
山西景鸿整体家居装饰设计工程有限公司            ,太原市长风桥西万国城moma15号楼2单元...,4008-659-600,,
山西新艺堂建筑装饰工程有限责任公司            ,高新区创业街时代广场8层,4008-659-600,,
山西白金汉宫整体家居装饰设计有限公司            ,太原市小店区体育南路千禧学府苑北门6号商铺,4008-659-600,,
山西众森盛业装饰设计工程有限公司            ,万柏林区旧晋祠路南屯往南100米华彩国际6...,4008-659-600,,
山西力昌盛装饰工程有限公司            ,太原市杏花岭区胜利街金刚堰路交叉口西北角,4008-659-600,,
优多装饰公司            ,太原市高新区晋阳街联合大厦a座2单元17层,4008-659-600,,
太原市巨丰装饰有限公司            ,山西太原北中环街千峰北路口,4008-659-600,,
太原一家一装饰工程有限公司            ,太原市小店区学府街120号,4008-659-600,,
太原大唐一品装饰            ,太原市高新区时代广场2层西侧0214大唐一...,4008-659-600,,
山西九艺装饰工程有限公司            ,太原千峰南路长风街口向北500米,4008-659-600,,
山西皖南精艺建筑装饰工程有限公司            ,太原市长风街领秀长风2-3-301,4008-659-600,,
山西火麒麟装饰建筑工程有限公司            ,万柏林区长风街千峰南路口海盛科技大厦3层,4008-659-600,,
山西信宅装饰工程设计有限公司            ,太原市小店区南中环与太榆路交口西北角瑞吉财...,4008-659-600,,
潮巢装饰设计工程太原有限公司            ,太原市亲贤北街茂业天地3#2403室,4008-659-600,,
山西源艺百汇装饰设计有限公司            ,太原市小店平阳路高新区创业街时代广场201...,4008-659-600,,
山西诺言装饰工程有限公司            ,小店区南内环街与平阳路交叉口东南方向赛格商...,4008-659-600,,
山西锦顺善德装饰工程有限公司            ,平阳南路晋阳街口君怡创新城3层,4008-659-600,,
太原靓尚伊家家居有限公司            ,山西省太原市长风桥西万国城MOMA19号楼...,4008-659-600,,
山西新愿景装饰工程有限公司            ,太原市亲贤街双喜城10栋1单元803,4008-659-600,,
太原九创装饰工程有限公司            ,太原市小店区长治路南中环街口火炬创业大厦c...,4008-659-600,,
山西九艺装饰工程设计有限公司            ,长风西街千峰南路新庄北街口万象城商铺四层,4008-659-600,,
太原天盛嘉森装饰工程有限公司            ,太原市万柏林区千峰南路万象城A座底商4层,4008-659-600,,
山西臻爱柒玖捌装饰工程有限公司            ,太原市万柏林区新晋祠路甲40号雅阁瑞普家居...,4008-659-600,,
山西正中和装饰设计有限公司            ,山西省太原市小店区许坦东街锦东国际A座20...,4008-659-600,,
太原市创艺佳装饰设计工程有限公司            ,长风街长治路北美新天地南200米创艺佳大厦...,4008-659-600,,
美丽万家装饰            ,晋阳街平阳路口东200米纳达大厦2楼207,4008-659-600,,
山西爱众装饰工程有限公司            ,太原市小店区平阳路65号平阳景苑6号楼13...,4008-659-600,,
山西优然居家工程有限公司            ,太原市万柏林区西中环路西矿街口科大世纪花园...,4008-659-600,,
山西源艺百汇装饰工程有限公司            ,和平南路长风西街交叉口北500米,4008-659-600,,
太原宜家家居装饰工程有限公司            ,太原市小店区晋阳街滨河东路口东悦广场三层,4008-659-600,,
山西易家装饰设计有限公司            ,山西省太原市迎泽大街万邦国际10楼1002...,4008-659-600,,
太原贵舍装饰设计工程有限公司            ,尖草坪兴华北街11号滨丰园别墅区,4008-659-600,,
山西阔达巢艺建筑装饰工程有限公司            ,小店区长治路八一街口紫晨大厦四层,4008-659-600,,
太原新洲装饰公司            ,亲贤街体育路交叉口佳地花园对面盛立大厦五楼,4008-659-600,,
山西栋星装饰工程有限公司            ,太原市高新区时代广场西区11层,4008-659-600,,
山西华浔品味装饰有限公司            ,万柏林区长风西街万国城MOMA2号楼290...,4008-659-600,,
山西朗艺建筑装饰公司            ,山西省太原市小店区平阳路平阳景苑6号楼20...,4008-659-600,,
山西朗华装饰工程有限公司            ,亲贤街体育西路茂业天地 7幢9层,4008-659-600,,
山西以诺建筑装饰工程有限公司            ,太原南内环平阳路口赛格科技广场22,23层,4008-659-600,,
