山西梵古装饰工程有限公司            ,许坦东街锦东国际A座16层,4008-659-600,,
太原市胜威诺装饰工程有限公司            ,小店区电子街恒大绿洲西区西门1012底商S...,4008-659-600,,
太原苹果装饰源设计工程有限公司            ,太原市亲贤街和体育路的交叉路口阳光大厦16...,4008-659-600,,
山西柏德装饰设计有限公司            ,太原小店区长风街体育西路口长风画卷C座二单...,4008-659-600,,
山西佰创装饰设计有限公司            ,小店区康宁东街万马仕西侧康宁大卖场a座22...,4008-659-600,,
济南金尚装饰工程有限公司太原分公司            ,小店区晋阳街滨河东路口，东悦广场西座8层金...,4008-659-600,,
山西荣盛伟业建筑装饰工程有限公司            ,太原市小店区长风街长风画卷b座二单元270...,4008-659-600,,
山西唯萨整体家居设计有限公司            ,太原市小店区康宁街康宁大厦A座902/90...,4008-659-600,,
太原市意念名流装饰工程有限公司            ,太原市旧晋祠路万水装饰城A区303室,4008-659-600,,
太原居众装饰            ,体育路学府街口,4008-659-600,,
山西力昌盛装饰工程有限公司            ,杏花岭区胜利西街和大同路交叉口西北角,4008-659-600,,
山西盛鼎装饰工程有限公司            ,太原市小店区平阳路与长风街交汇处平阳景苑,4008-659-600,,
山西省太原市红峰鑫装饰            ,太原市学府街西口127号新太原公寓,4008-659-600,,
太原丹凤白鹭装饰公司            ,太原市迎泽区新建南路双塔西街口丹凤白鹭大酒...,4008-659-600,,
山西美创装饰工程有限公司            ,山西省太原市新建南路81号汾东商务七层,4008-659-600,,
山西红枫叶装饰工程有限公司            ,南中环北张住宅小区,4008-659-600,,
山西德日新装饰            ,太原市滨河西路三给街交叉口宏星滨西建材市场...,4008-659-600,,
馨创世家装饰设计有限公司            ,小店区恒大绿洲,4008-659-600,,
山西毅锴装饰工程有限公司            ,太原市小店区平阳路八一街口天鑫花园105号,4008-659-600,,
太原易嘉乐装饰公司            ,太原市尖草坪区现代装饰城地板门业管二层44...,4008-659-600,,
山西鼎鑫枫尚装饰工程有限公司            ,太原市小店区许东长风上院1号楼5单元501,4008-659-600,,
北京欧亚世纪装饰工程有限公司            ,万柏林区千峰南路西岸南区底商205,4008-659-600,,
太原哥特装饰有限公司            ,山西省太原市迎泽西大街普国路龙鑫苑装饰广场...,4008-659-600,,
山西太原恒和装饰设计有限公司            ,太原市小店区平阳路万狮京华北侧大和昌业22...,4008-659-600,,
北京今朝装饰太原分公司            ,并州东街62号(3000平米的家居展馆),4008-659-600,,
山西独特装饰工程有限公司            ,千峰南路西岸南区底商206,4008-659-600,,
山西锦顺善德装饰工程有限公司            ,山西省太原市小店区平阳南路32号君怡创新城...,4008-659-600,,
太原市简约空间装饰设计有限公司            ,山西省太原市小店区许坦西街109号开元北小...,4008-659-600,,
山西易家装饰设计有限公司            ,太原火车站万邦国际1002室,4008-659-600,,
