孝义市壹品装饰部 ,吕梁市孝义市文昌街(第四中学),13663585543,400-215-4321,
山西信宅装饰工程设计有限公司            ,太原市小店区南中环与太榆路交口西北角瑞吉财...,4008-659-600,,
业勤装饰有些公司            ,孝义市离石区宝宏国际公馆C座405B,4008-659-600,,
山西火麒麟装饰建筑工程有限公司            ,万柏林区长风街千峰南路口海盛科技大厦3层,4008-659-600,,
吕梁市太昊装饰工程设计有限公司            ,吕梁市离石区金鼎大厦17A-1814号,4008-659-600,,
山西众森盛业装饰设计工程有限公司            ,万柏林区旧晋祠路南屯往南100米华彩国际6...,4008-659-600,,
山西青赛时代装饰设计有限公司            ,山西省吕梁市离石区泰和商城28楼 ,4008-659-600,,
山西都市时空装饰工程有限公司            ,太原市长风街与千峰南路交叉口往北800米路...,4008-659-600,,
山西正中和装饰设计有限公司            ,山西省太原市小店区许坦东街锦东国际A座20...,4008-659-600,,
靓尚伊家家居有限公司            ,山西省太原市长风桥西万国城MOMA19号楼...,4008-659-600,,
山西源艺百汇装饰工程有限公司            ,吕梁市离石区八一街今音大厦12层,4008-659-600,,
山西星曜装饰工程有限公司            ,吕梁市离石区凤山路袁家庄七巷 ,4008-659-600,,
装饰设计工程有限公司            ,太原市亲贤街和体育路的交叉路口阳光大厦16...,4008-659-600,,
山西朗华装饰工程有限公司            ,亲贤街体育西路茂业天地 7幢9层,4008-659-600,,
山西以诺建筑装饰工程有限公司            ,太原南内环平阳路口赛格科技广场22、23层,4008-659-600,,
名典装饰设计有限公司            ,吕梁市孝义市青年路700号,4008-659-600,,
吕梁市交城县神雕侠建材有限公司            ,吕梁市交城县洪相乡成村工业区5栋1楼,4008-659-600,,
山西建磊装饰工程有限公司吕梁分公司            ,山西省吕梁市离石区美丽家园装饰城往南100...,4008-659-600,,
北京城市人家装饰孝义分公司            ,吕梁市离石区金晖盛世风情27号商铺,4008-659-600,,
东易日盛阳光居然装饰有限公司            ,太原市长治路199号华辰大厦一、二、三层(...,4008-659-600,,
孝义金岛装饰有限公司            ,山西省吕梁孝义市永泰花园东门永安路小学正对...,4008-659-600,,
忆居轩装饰工程有限公司            ,山西省吕梁市离石区泰化物质城8排24号 ,4008-659-600,,
尚层装饰有限公司            ,男中环街国际大都会七号名车公馆楼上,4008-659-600,,
北京汉唐装饰有限公司            ,吕梁市离石区泰化物资城12排16号 ,4008-659-600,,
吕梁市新鼎间设计装饰有限责任公司            ,吕梁市离石区泰化物资城12 -7号 ,4008-659-600,,
孝义恋家装饰            ,西关世纪广场b6,4008-659-600,,
山西省孝义市大唐一品装饰有限公司            ,孝义市时代广场2层西侧0214大唐一品装饰,4008-659-600,,
美丽万家装饰            ,晋阳街平阳路口东200米纳达大厦2楼207,4008-659-600,,
山西易家装饰设计有限公司            ,山西省太原市迎泽大街万邦国际10楼1002...,4008-659-600,,
山西华浔品味装饰有限公司            ,中阳楼街道万国城MOMA2号楼1楼,4008-659-600,,
山西朗艺建筑装饰公司            ,山西省太原市小店区平阳路平阳景苑6号楼20...,4008-659-600,,
乐平市居众装饰设计有限公司            ,体育路学府街口260号,4008-659-600,,
