江南美装饰集团孝感分公司 ,孝感市孝南区天仙路松达丽水湾一楼(城铁站斜...,13971500257,59208137,
孝感吉诚装饰工程有限公司 ,北京路桂桥家居北侧京御苑一楼61号,13720375905,2085901,
湖北溢致装饰工程设计有限公司 ,孝感市董永路88号宇济大酒店写字楼11楼,15172143044,2345000,
孝感市景派装饰工程有限公司            ,湖北 孝感 孝感市孝南区,4008-659-600,,
湖北红珊瑚装饰设计工程有限公司            ,湖北省孝感市孝南区北京路34-8号,4008-659-600,,
孝感天力装饰工程有限公司            ,湖北省孝感市孝南区天仙路乾坤阳光4栋116...,4008-659-600,,
孝感正文装饰设计有限公司            ,孝感市孝南区南卧路11号,4008-659-600,,
孝感壹零玖装饰设计工程有限公司            ,湖北省孝感市孝南区孝感市航空南路锦绣后湖三...,4008-659-600,,
吉吉            ,........................,4008-659-600,,
湖北君庭装饰工程有限公司            ,湖北省孝感市孝南区槐荫大道与玉泉路交汇处(...,4008-659-600,,
孝感市一品装饰有限公司            ,湖北省孝感市孝南区天仙路68号,4008-659-600,,
湖北欣美装饰工程有限公司            ,云梦白云建材城C5栋二楼,4008-659-600,,
孝感城际环境艺术设计有限公司            ,孝感市孝武大道565号香港城中央广场A栋一...,4008-659-600,,
武汉小刘美嘉装饰有限公司孝感分公司            ,孝感市孝南区分丝路兵工花园特1号,4008-659-600,,
汉川市天晓装饰设计工程有限公司            ,汉川市体育馆路,4008-659-600,,
孝感市雨山装饰            ,即可更换,4008-659-600,,
孝感汇锦装饰公司            ,孝感市天仙路福星城三期大门口,4008-659-600,,
孝感澳华装饰设计工程有限公司            ,孝感市天仙路西湖明珠门面(天仙路与北京一路...,4008-659-600,,
孝感丁尚装饰设计公司            ,北京路铜锣湾广场三单元1610室(凯瑞祥酒...,4008-659-600,,
湖北致远家装饰工程有限公司            ,应城市王桥路海山门店C8栋107-110号,4008-659-600,,
孝感微盛家博装饰设计有限公司            ,湖北省孝感市开发区董永路湾流汇宜家小区1-...,4008-659-600,,
湖北品格建筑装饰工程设计有限公司            ,孝感市孝南区宝成路中段巴黎印象2季4栋一层...,4008-659-600,,
湖北合纵装饰设计工程有限公司            ,孝感市星河天街C1栋二单元1227室,4008-659-600,,
奥百装饰            ,湖北云梦睡虎路1号,4008-659-600,,
孝感致诚装饰设计有限公司            ,南方国际商城建材区B7栋318室,4008-659-600,,
湖北筑心装饰工程有限公司            ,应城市大兴建材育才南路111号,4008-659-600,,
星诚装饰工程有限公司            ,孝感-孝南 交通路孝棉商住楼7-301,4008-659-600,,
应城市致远装饰有限公司            ,应城市大兴建材育才南路111号,4008-659-600,,
云梦诚信装饰            ,云梦梦泽大道221号,4008-659-600,,
孝感市华雅装饰装潢            ,孝感市乾坤大道馨都上层2单元906,4008-659-600,,
aaaaaaaaaaaaaaaaaaaaaaaaaaaaa            ,湖北省-安6市-金秋大道金榜大酒店正对面,4008-659-600,,
孝感市壹家壹装饰设计有限公司            ,天仙南路福星城一期门面115号(橘子洲头旁...,4008-659-600,,
新思维睿泓装饰设计工程有限公司孝感分公司            ,孝武大道星河天街C1栋2单元525室,4008-659-600,,
孝感市御家装饰有限公司            ,孝感市毛陈镇107国道以东,4008-659-600,,
麦禾空间设计            ,云梦白云世纪城2期18栋西行20米,4008-659-600,,
湖北乐巢装饰设计工程有限公司            ,交通东路26号,4008-659-600,,
孝感美成装饰工程有限公司            ,孝感市 孝南区孝感市董永路湾流汇2-110...,4008-659-600,,
安陆帝卡斯墙艺环保材料有限公司            ,安陆市316国道泰和乐园斜对面,4008-659-600,,
孝感美成装饰工程有限公司            ,孝感市董永路湾流汇2栋110号商铺,4008-659-600,,
北京阔达装饰（孝感分公司）            ,湖北省孝感市孝南区南方国际建材城B区19栋...,4008-659-600,,
孝感简艺汇装饰公司            ,,4008-659-600,,
湖北新次元装饰设计工程有限公司            ,应城市长荆大道北美城市花园南门3051商铺,4008-659-600,,
孝感市一品装饰有限责任公司            ,孝南区天仙路68号,4008-659-600,,
湖北臻饰建筑工程有限公司            ,湖北省汉川市霍城大道99号新汉都2D-3F,4008-659-600,,
应城赛尚装饰            ,湖北应城北美建行东侧50米,4008-659-600,,
孝感城际装饰环境艺术设计有限公司            ,孝感南大香港城 a栋一单元24楼,4008-659-600,,
正和装饰装潢有限公司            ,孝感市孝南区孝汉大道南大香港城S2,4008-659-600,,
北京龙发装饰孝感分公司            ,孝感市北京路6号(保丽建材市场对面),4008-659-600,,
孝感力唯装饰设计工程有限公司            ,,4008-659-600,,
宜帮公司            ,星河天街c3-106,4008-659-600,,
安陆市鑫诚装饰有限责任公司            ,安陆市太白大道丰达国际城西门11-121号,4008-659-600,,
湖北乐巢装饰设计工程有限公司            ,交通东路26号,4008-659-600,,
孝感美成装饰工程有限公司            ,孝感市 孝南区孝感市董永路湾流汇2-110...,4008-659-600,,
安陆帝卡斯墙艺环保材料有限公司            ,安陆市316国道泰和乐园斜对面,4008-659-600,,
孝感美成装饰工程有限公司            ,孝感市董永路湾流汇2栋110号商铺,4008-659-600,,
北京阔达装饰（孝感分公司）            ,湖北省孝感市孝南区南方国际建材城B区19栋...,4008-659-600,,
孝感简艺汇装饰公司            ,,4008-659-600,,
江南美装饰             ,,4008-659-600,,
孝感精诚装饰有限公司            ,董永路.滨湖天地菊苑小区5-102门面(滨...,4008-659-600,,
孝感家装e站            ,董永路民邦槐荫东岸E座三楼,4008-659-600,,
北京海天环艺家居装饰有限公司孝感分公司            ,横三路民邦槐荫东岸二期S1栋 华耀天城轻轨...,4008-659-600,,
江南美装饰             ,,4008-659-600,,
孝感零壹空间设计工程有限责任公司            ,文化东路汇金国际大厦801（航天中学对面）,4008-659-600,,
小刘美嘉装饰            ,湖北省孝感市孝南区分丝路兵工花园特1号,4008-659-600,,
上海百安居装饰工程有限公司孝感分公司            ,,4008-659-600,,
湖北华伟时尚装饰工程有限公司            ,湖北省孝感市孝南区孝武大道555号翰林学府,4008-659-600,,
钥家装饰            ,,4008-659-600,,
武汉雨山装饰有限公司            ,董永路温哥华1栋西单元2801室,4008-659-600,,
孝感零壹空间设计工程有限责任公司            ,文化东路汇金国际大厦801（航天中学对面）,4008-659-600,,
小刘美嘉装饰            ,湖北省孝感市孝南区分丝路兵工花园特1号,4008-659-600,,
上海百安居装饰工程有限公司孝感分公司            ,,4008-659-600,,
湖北华伟时尚装饰工程有限公司            ,湖北省孝感市孝南区孝武大道555号翰林学府,4008-659-600,,
钥家装饰            ,,4008-659-600,,
武汉雨山装饰有限公司            ,董永路温哥华1栋西单元2801室,4008-659-600,,
孝感精雕衣柜门橱柜门加工厂            ,孝感新华立交桥南大管委会旁,4008-659-600,,
孝感分公司            ,湖北省孝感市孝武大道英才外国语,4008-659-600,,
孝感市紫名都装饰工程有限公司            ,孝感市乾坤大道与天仙路交汇处（蔚蓝新都门面...,4008-659-600,,
北京海天环艺装饰工程有限公司孝感分公司            ,湖北省孝感市孝南区天仙路西湖明珠,4008-659-600,,
湖北极地装饰工程有限公司            ,孝感市航空路金一华府特一号,4008-659-600,,
广东星艺装饰孝感有限公司            ,湖北省孝感市天仙路乾坤阳光东门,4008-659-600,,
孝感力唯装饰设计有限公司            ,孝感市孝感区天仙路中段西湖明珠北侧丁字路口,4008-659-600,,
孝感爱家装饰有限公司            ,孝感福星城文化旅游街G6（111—112）,4008-659-600,,
孝感迈高装饰设计工程有限公司            ,孝感市孝南区南大香港城一期A栋二单元100...,4008-659-600,,
孝感市居易装饰有限公司            ,孝感市天仙路福星城一期门面110-111,4008-659-600,,
