北京百度装饰安庆馆 ,湖心北路19号（香樟里大门往北50米）,15922381300,5534288,
安庆宏达装饰有限公司 ,安徽省安庆市菱北西路左岸名居7-1号,13955683080,5681928,
安庆诚仁装饰设计工程有限公司 ,安庆市迎江区吾悦广场西门S1-1001,18010706032,400-865-9600,
安庆市安心建筑装饰工程有限公司 ,安庆市开发区同安路239号1号楼东二层10...,15605564899,400-865-9600,
安庆交换空间装饰有限公司 ,安庆市迎江区皖江大道16号林语棠小区2号楼...,18956960288,5201618,
北京深度空间装饰工程有限公司安庆分公司 ,安庆市书香一品小区门口3-4号门面9栋30...,13866004956,5282199,
湖北鲁公大宅装饰工程有限公司安庆分公司            ,安庆市,4008-659-600,,
安庆弘艺装饰工程公司            ,安徽-安庆-安庆市宜秀区-安庆市中兴大道金...,4008-659-600,,
安徽安庆365宜居装饰            ,安徽省安庆市迎江区棋盘山路宏杰景泰南苑11...,4008-659-600,,
安徽正好建筑装饰有限公司            ,安庆市市府路汇峰广场5栋二单元1102室,4008-659-600,,
安庆市雅美居装饰工程有限公司            ,安徽 安庆 安庆市迎江区,4008-659-600,,
美星装饰集团            ,南昌,4008-659-600,,
安庆轻舟装饰有限公司            ,安徽省安庆市菱湖南路110号*业公司大楼三...,4008-659-600,,
安徽点今装饰有限公司            ,安徽 安庆 安庆市迎江区 街道：湖心南路1...,4008-659-600,,
胜锦装饰设计有限公司            ,安徽省桐城市同安路75号,4008-659-600,,
安庆九万建筑装饰工程有限公司            ,安庆市天柱山路9-1号（光彩7路车终点站对...,4008-659-600,,
安庆托美尔装饰有限公司            ,安庆市迎江区绿地LOFT 1-506,4008-659-600,,
安庆馨福家装饰有限公司            ,安庆市宜秀区迎宾东路神墩家居一楼,4008-659-600,,
安庆森筑设计有限公司            ,安徽省安庆市宜秀区光彩四期烩街,4008-659-600,,
南昌新传奇装饰工程有限公司            ,南昌市青山湖区高新大道1755号新传奇装饰...,4008-659-600,,
实创家居装饰集团(江西)有限公司            ,南昌市洪城路6号国贸广场新华都3楼,4008-659-600,,
南昌创艺装饰工程有限公司            ,青云谱区解放西路坛子口明珠广场h座23楼整...,4008-659-600,,
南昌市鸿基伟业装饰工程有限公司            ,江西省南昌市南京西路555号永溪 大厦11...,4008-659-600,,
南昌市丽庭装饰工程有限公司            ,南昌市南京东路鹿鼎国际988号四楼8080...,4008-659-600,,
曾洋装饰设计有限公司            ,九江永修县白莲南路1幢1002号,4008-659-600,,
清风网络公司            ,,4008-659-600,,
安庆市格尚装饰工程有限公司            ,安庆市碧桂园迎江御墅小区8-4,4008-659-600,,
嘟嘟装饰公司            ,,4008-659-600,,
安庆市易邻装饰工程有限公司            ,安庆市绿地启航社1栋605室,4008-659-600,,
鲁班装饰设计有限公司            ,四川南昌,4008-659-600,,
鲁班装饰设计有限公司            ,四川南昌,4008-659-600,,
南昌网吧装修-南昌眼镜店装修-写字楼办公室装修-厂房装修            ,怡园路888号,4008-659-600,,
新传奇装饰有限公司            ,南昌市高新大道1755号,4008-659-600,,
安庆辉腾装饰            ,横埠镇周庄村221号,4008-659-600,,
进贤家装有限公司            ,南昌进贤,4008-659-600,,
南昌至尚装饰工程有限公司            ,解放西路116号1单元602,4008-659-600,,
安庆平乐装饰工程有限公司            ,,4008-659-600,,
新传奇装饰工程有限公司            ,南昌市高新大道1755号,4008-659-600,,
luifghbl            ,,4008-659-600,,
南昌市金佳园装饰有限公司            ,南昌市红谷滩新区凤凰北大道景岗佳园店面89...,4008-659-600,,
万上装饰有限公司            ,,4008-659-600,,
唐朝装修公司            ,解放大道23号,4008-659-600,,
南昌宅美装饰            ,南昌抚生路口丽都大厦B座7楼,4008-659-600,,
新传奇装饰有限公司            ,南昌市高新大道1755号,4008-659-600,,
汪氏装饰            ,,4008-659-600,,
弘扬装饰设计公司            ,安庆市湖心北路6号,4008-659-600,,
潜山中桥装饰工程有限公司            ,潜山县梅城镇潜阳路0299号富城大厦一楼,4008-659-600,,
安徽百盈建筑装饰工程有限公司            ,皖江大道绿地启航社1栋1811,4008-659-600,,
安庆市春天装饰工程有限责任公司              ,,4008-659-600,,
道科环保装饰有限公司            ,安徽省安庆市潜山县梅城镇皖潜大道427号（...,4008-659-600,,
喋血孤城            ,,4008-659-600,,
皇朝装饰有限公司            ,,4008-659-600,,
安庆市惠民装饰有限公司            ,菱湖南路110号正奇家居三楼,4008-659-600,,
安庆诚仁装饰有限公司            ,,4008-659-600,,
安庆圣煌装饰有限公司            ,碧桂园山水云间3号楼7号门面房,4008-659-600,,
发V根本就那个            ,,4008-659-600,,
华庭装饰            ,,4008-659-600,,
唯爱公司            ,,4008-659-600,,
安庆圣煌装饰有限公司            ,碧桂园山水云间3号楼7号门面房,4008-659-600,,
发V根本就那个            ,,4008-659-600,,
华庭装饰            ,,4008-659-600,,
唯爱公司            ,,4008-659-600,,
安庆市惠民装饰有限公司            ,安庆市菱湖南路110号正奇家居三楼,4008-659-600,,
want  kek zhuangx            ,,4008-659-600,,
安庆迎江区宜居装饰            ,安庆市迎江区绿地紫峰大厦B座1615室,4008-659-600,,
汪氏室内装饰设计有限公司            ,,4008-659-600,,
安庆一号家居网【面对面装饰公司】            ,安徽省安庆市开发区中兴大道14号（晶海花园...,4008-659-600,,
北京德创时代装饰设计有限公司安庆分公司            ,安庆大观区华茂1958c区2栋522,4008-659-600,,
安庆市乙久装饰有限责任公司            ,安庆市大观区左岸名居,4008-659-600,,
大连福星装饰设计工程有限公司安庆分公司            ,皖江大道世纪城启航社1幢四层14室,4008-659-600,,
安庆九佳建筑装饰工程有限公司            ,安庆远达写字楼405室,4008-659-600,,
安庆华丽之家装饰有限公司            ,迎江区西湖绿洲城3期5栋一层3室,4008-659-600,,
安庆云兰建筑装饰工程有限公司            ,安庆中兴大道与天柱山路交叉口联富大楼601...,4008-659-600,,
合肥大维装饰工程有限公司安庆分公司            ,安徽省安庆市菱湖南路168号正奇家居楼二楼...,4008-659-600,,
安庆市同博装饰有限公司            ,安庆市皖江大道香水百合西大门17-3号,4008-659-600,,
安庆市迎江区宜居装饰            ,绿地紫峰大厦B座1615室,4008-659-600,,
香港嘉祺装饰设计工程有限公司            ,,4008-659-600,,
交换空间装饰有限公司南昌分公司            ,南坪会展中心9玺国际8栋,4008-659-600,,
潜山县庆坤建筑装饰工程有限公司            ,安徽 安庆 潜山县 街道：潜山县蓝鼎中央城...,4008-659-600,,
上海波涛装饰公司南昌分公司            ,高新区南二环西段财富中心,4008-659-600,,
安庆市泓邺装饰工程有限公司            ,安庆市迎江区渡江路14号大桥装饰城8幢一层...,4008-659-600,,
安庆市瑞馨建筑装饰工程有限公司            ,安徽省安庆市迎江区棋牌,4008-659-600,,
实创家居装饰集团(江西)有限公司            ,安庆市迎江区绿地迎江世纪城二号写字楼,4008-659-600,,
安庆金居佳装饰设计有限公司            ,安庆市迎江区碧桂园迎江御墅15-09号,4008-659-600,,
安庆市迎江区时克装饰            ,湖心南路百年家居,4008-659-600,,
