平潭综合实验区三星装饰有限公司 ,平潭县万中宝路建设银行斜对面(台亚岚南门口...,13705980571,23103018,
怡杰装饰工程有限公司            ,平潭综合实验区世界城3期c区19号楼,4008-659-600,,
平潭综合实验区鼎艺装饰装修有限公司            ,平潭县潭城镇万宝路和进城路交叉处凯源花园1...,4008-659-600,,
艺之峰装饰工程有限公司            ,平潭翠园北路荷花街71号（龙翔大地斜对面）,4008-659-600,,
广东星艺装饰集团平潭分公司            ,平潭西航路海滨城E区5号楼,4008-659-600,,
春满人间装饰平潭分公司            ,平潭县西航路七天酒店对面,4008-659-600,,
平潭综合实验区名匠装饰设计工程有限公司            ,福州 平潭县 潭城镇万宝路金洋小区宝城A座...,4008-659-600,,
福建仕宇道室内设计有限公司            ,福建省福州市平潭综合实验区潭城镇东林庄10...,4008-659-600,,
华浔品味装饰平潭公司            ,平潭谭城镇万宝路（第三教堂对面）,4008-659-600,,
晟宇装饰设计工程有限公司            ,平潭中海华侨城15#25a27(浦发银行楼...,4008-659-600,,
北京实创家居装饰集团有限公司            ,平潭,4008-659-600,,
 ,,4008-659-600,,
 ,,4008-659-600,,
翔海装饰工程有限公司            ,平潭,4008-659-600,,
实创家居装饰            ,平潭,4008-659-600,,
 ,,4008-659-600,,
 ,,4008-659-600,,
欧坊装饰            ,平潭,4008-659-600,,
高鸿装饰工程有限公司            ,平潭,4008-659-600,,
21312312            ,,4008-659-600,,
广东三星装饰·余工设计师楼平潭分公司            ,平潭县潭城镇西航路西泰园（坡顶红绿灯附近）,4008-659-600,,
品格装饰工程有限公司            ,平潭综合实验区西航路国税局对面二楼,4008-659-600,,
平潭壹品装饰设计工程有限公司            ,平潭县潭城镇南门庄154号（康德路口）,4008-659-600,,
福建泉州嘉禾装饰工程有限公司平潭分公司            ,福州-平潭 福建省平潭综合实验区海坛东路豪...,4008-659-600,,
福建江南环艺装饰设计工程有限公司            ,潭县潭城镇万宝路中段北侧（康德别墅）CE座...,4008-659-600,,
平潭巧匠装饰工程有限公司            ,福建福州平潭县西航南路（凯宾商务酒店对面）,4008-659-600,,
平潭创典装饰工程有限公司            ,平潭西航路A区8号三层,4008-659-600,,
福建丰阁装饰设计工程有限公司            ,平潭翠园南路一号公馆2号楼502,4008-659-600,,
福建省汇景苑装饰设计工程有限公司            ,福州-平潭 福建平潭综合实验区西航路凯宾酒...,4008-659-600,,
福建浩辉建筑装饰工程有限公司平潭分公司            ,福建福州平潭县西航路南段康德别墅区（第三教...,4008-659-600,,
美星装饰集团            ,平潭,4008-659-600,,
鲁班装饰设计有限公司            ,平潭,4008-659-600,,
三星装饰有限公司            ,平潭,4008-659-600,,
好设计找平潭            ,平潭平潭,4008-659-600,,
实创家居装饰集团有限公司            ,平潭,4008-659-600,,
