城市人家装饰有限公司            ,庆阳经济开发区4号街区力宝广场c座12层,4008-659-600,,
美星装饰集团            ,南昌,4008-659-600,,
鲁班装饰设计有限公司            ,南昌,4008-659-600,,
交换空间装饰有限公司            ,南坪会展中心9玺国际8栋,4008-659-600,,
尚书美业装饰有限责任公司            ,庆阳八一大道436号,4008-659-600,,
名匠装饰有限公司            ,南昌市洪都中大道隆鑫广场a4栋103铺,4008-659-600,,
庆阳雅绿装饰工程有限责任公司            ,八一大道357号 财富广场b座22层,4008-659-600,,
北京龙发装饰集团            ,阳明东路71号金涛国际a座,4008-659-600,,
庆阳苹果装饰(旗舰店)            ,庆阳洪城路丽都广场a栋苹果装饰5楼,4008-659-600,,
实创家居装饰集团有限公司            ,青云谱洪都洪城路6号国贸广场13层,4008-659-600,,
甘肃品尚装饰工程有限公司            ,长庆南路东庄花园1号,4008-659-600,,
向日葵装饰工程有限公司            ,,4008-659-600,,
 ,,4008-659-600,,
南昌市轩仝宇装饰工程有限公司            ,江西省南昌市西湖区子安路89号1602,4008-659-600,,
金芒果装饰集团            ,江西省吉安市吉州区广场北路1号(新世界广场...,4008-659-600,,
南昌三帝装饰设计有限公司            ,南昌市青山湖区洪都北道299号高能金域名都...,4008-659-600,,
南昌林涵设计            ,林涵设计,4008-659-600,,
 庆阳城市人家装饰有限责任公司            ,,4008-659-600,,
庆阳十三月设计装饰工程有限公司            ,,4008-659-600,,
保山星艺装饰有限责任公司            ,,4008-659-600,,
庆阳火星人装饰工程有限公司            ,,4008-659-600,,
庆阳鲁工坊装饰设计有限公司            ,,4008-659-600,,
云南创艺装饰工程集团保山有限公司            ,,4008-659-600,,
庆阳火星人装饰工程有限公司            ,西峰区华语名称北侧路口向内10米,4008-659-600,,
庆阳爱蜂巢施工安装有限公司            ,,4008-659-600,,
庆阳生活家装饰有限责任公司            ,,4008-659-600,,
庆阳天元装饰有限公司            ,,4008-659-600,,
西安顾家装饰设计工程有限公司庆阳分公司            ,,4008-659-600,,
保山市雅居装饰工程有限公司            ,,4008-659-600,,
庆阳铭典装饰工程有限公司            ,,4008-659-600,,
庆阳余业之峰装饰工程有限公司            ,,4008-659-600,,
广州市华宁装饰工程有限公司保山分公司            ,,4008-659-600,,
庆阳阔达建筑装饰有限公司            ,,4008-659-600,,
庆阳阔达建筑装饰有限公司            ,甘肃省庆阳市西峰区北京大道御景城东门南邻5...,4008-659-600,,
庆阳波涛装饰设计工程有限公司            ,甘肃省庆阳市西峰区岐黄大道东侧(庆阳卫生监...,4008-659-600,,
庆阳皇朝雨涵装饰有限公司            ,庆阳市西湖区抚生南路博富大厦二楼,4008-659-600,,
庆阳欧易装饰设计有限公司            ,庆阳西湖区洪城路576号天使商务广场t层,4008-659-600,,
易尚装饰            ,南昌市青山湖大道333号天香园8号创意园二...,4008-659-600,,
北京实创家居装饰集团有限公司            ,庆阳洪城路6号国贸新华都广场1-3层,4008-659-600,,
阔达建筑装饰工程有限责任公司            ,北京市海淀区西三环北路87号国际财经中心c...,4008-659-600,,
庆阳大音装饰工程有限公司            ,庆阳市八一广场丽华购物广场6楼,4008-659-600,,
南苑装饰工程有限公司            ,庆阳市西湖区站前西路289号三星大厦B座1...,4008-659-600,,
嘉祺装饰设计工程有限公司            ,,4008-659-600,,
星艺装饰有限公司            ,南昌市北京东路·恒茂国际都会...,4008-659-600,,
波涛装饰公司            ,高新区南二环西段财富中心,4008-659-600,,
南国风装饰工程有限工司            ,青山湖南大道墅溪园,4008-659-600,,
广州市华宁装饰工程有限公司南昌分公司            ,江西省南昌市西湖区广润门三区37栋1号,4008-659-600,,
庆阳盛世建筑装潢设计有限公司            ,庆阳市红谷滩新区万达广场A1-310,4008-659-600,,
南昌道艺装饰有限公司            ,南昌市红谷滩万达中心写字楼B2-814,4008-659-600,,
华浔品味装饰            ,东路鹿鼎家居4楼b馆,4008-659-600,,
