盐城润万家装饰 ,德容装饰城往东100米，冠华西路263号,18352082863,86110009,
艺嘉装饰工程有限公司            ,盐城市金鹰奥莱城k幢1049号,4008-659-600,,
中原世创装饰工程有限公司            ,,4008-659-600,,
广东三星品高装饰设计工程有限公司            ,紫薇广场c区10184-10185（人民南...,4008-659-600,,
林艺装饰工程有限公司            ,,4008-659-600,,
巨人装饰设计有限公司            ,盐城市亭湖区双元路与迎宾路交界处,4008-659-600,,
广东名匠装饰分公司            ,盐城市大庆中路49号芝林广场一楼(鸿基电脑...,4008-659-600,,
桢富莱装饰工程有限公司            ,盐城市城南新区人民南路与聚亨路口,4008-659-600,,
都市家人装饰工程有限公司            ,盐城市盐都华邦国际东厦b区1305,4008-659-600,,
蓝宝石装饰工程有限公司            ,盐城市东进国际商贸中心1#616室,4008-659-600,,
明祺装饰工程有限公司            ,,4008-659-600,,
居泰隆装饰有限公司            ,地址:盐城市人民南路1号(建军饭店北楼),4008-659-600,,
元洲装饰工程有限公司             ,,4008-659-600,,
后十年装饰工程有限公司            ,,4008-659-600,,
江苏东易日盛装饰公司            ,,4008-659-600,,
建湖县乐家装饰有限公司            ,建湖县城秀夫南路建业小区二号楼第9间,4008-659-600,,
好日子装饰工程有限公司             ,,4008-659-600,,
鼎盛商标事务所            ,盐城市人民南路1号华邦国际东厦7楼,4008-659-600,,
博诚家装服务            ,盐城市盐都区海润尊品3#1402,4008-659-600,,
锦宏装饰设计公司            ,阜宁金城时代广场16号楼3-4门市,4008-659-600,,
博诚家装服务            ,盐城市盐都区海润尊品3#1402,4008-659-600,,
锦宏装饰设计公司            ,阜宁金城时代广场16号楼3-4门市,4008-659-600,,
建湖祥云装饰有限公司            ,建湖县湖中南路459号,4008-659-600,,
建湖恒美装潢有限公司            ,,4008-659-600,,
建湖高度装饰设计有限公司            ,盐城市建湖县建宝路金港湾售楼部北20米,4008-659-600,,
建湖县恒美装饰            ,,4008-659-600,,
南京壹号家信息科技有限公司分公司            ,盐城市东进路与迎宾南路交界处向南50米（文...,4008-659-600,,
天拓装饰工程有限公司            ,盐城市东进国际装饰城2#7F（东进路与开放...,4008-659-600,,
天工装饰工程有限公司            ,东进国际装饰城2号楼608(东进路与开放大...,4008-659-600,,
皇巢装饰工程有限公司            ,盐城市建军东路68号交通银行大楼808,4008-659-600,,
轻舟装饰有限公司            ,盐城市迎宾路钱江方舟东门南区30#商铺10...,4008-659-600,,
好易居工程装饰有限公司            ,,4008-659-600,,
品筑建筑装饰工程有限公司            ,盐城市亭湖区建军中路177号汇金购物中心1...,4008-659-600,,
欧尚装饰工程有限公司            ,,4008-659-600,,
江苏省大丰金典装饰有限公司            ,大丰市黄海西路富贵园8号楼（兴隆装饰城东广...,4008-659-600,,
