怀宁高河镇一家装饰服务部 ,高河镇黄梅路(孔雀商贸城23栋17号),13671392467,400-865-9600,
北京百度装饰馆            ,安徽省安庆市怀宁县高河镇骑龙村五丰组,4008-659-600,,
湖北鲁公大宅装饰工程有限公司分公司            ,安庆市,4008-659-600,,
宏达装饰有限公司            ,安徽省安庆市菱北西路左岸名居7-1号,4008-659-600,,
轻舟装饰有限公司            ,安徽省安庆市菱湖南路110号*业公司大楼三...,4008-659-600,,
诚仁装饰设计工程有限公司            ,安庆市迎江区吾悦广场西门S1-1001,4008-659-600,,
弘艺装饰工程公司            ,安徽-安庆-安庆市宜秀区-安庆市中兴大道金...,4008-659-600,,
安徽365宜居装饰            ,安徽省安庆市迎江区棋盘山路宏杰景泰南苑11...,4008-659-600,,
安徽点今装饰有限公司            ,安徽省安庆市怀宁县高河镇新安路197号,4008-659-600,,
安徽正好建筑装饰有限公司            ,安徽省安庆市怀宁县石镜乡石镜街道736号,4008-659-600,,
市雅美居装饰工程有限公司            ,安徽省安庆市怀宁县茶岭镇茶岭村,4008-659-600,,
市安心建筑装饰工程有限公司            ,安徽省安庆市怀宁县马庙镇合一村瓦屋组,4008-659-600,,
北京深度空间装饰工程有限公司分公司            ,安庆市书香一品小区门口3-4号门面9栋30...,4008-659-600,,
交换空间装饰有限公司            ,安庆市迎江区皖江大道16号林语棠小区2号楼...,4008-659-600,,
香港嘉祺装饰设计工程有限公司            ,安徽省安庆市怀宁县高河镇经一路与纬六路交汇...,4008-659-600,,
金居佳装饰设计有限公司            ,安徽省安庆市怀宁县高河镇E区,4008-659-600,,
怀宁松鹤装饰工程有限公司            ,安徽省安庆市怀宁县石镜乡甘露居委会新屋组,4008-659-600,,
北京德创时代装饰设计有限公司分公司            ,安徽省安庆市怀宁县高河镇皖河路490号,4008-659-600,,
市乙久装饰有限责任公司            ,安徽省安庆市怀宁县高河镇政和路62号,4008-659-600,,
大连福星装饰设计工程有限公司分公司            ,怀宁县腊树镇腊树街道,4008-659-600,,
市泓邺装饰工程有限公司            ,安徽省安庆市怀宁县茶岭镇万福村双庙组007...,4008-659-600,,
怀宁县壹品居装修有限公司            ,安徽省安庆市怀宁县高河镇政和路62号,4008-659-600,,
九佳建筑装饰工程有限公司            ,安徽省安庆市怀宁县高河镇育儿路金色城堡1号...,4008-659-600,,
云兰建筑装饰工程有限公司            ,安徽省安庆市怀宁县高河镇黄梅路皖西南家具城...,4008-659-600,,
华丽之家装饰有限公司            ,安徽省安庆市怀宁县小市镇小市新街269号,4008-659-600,,
怀宁远航装饰工程有限公司            ,安徽省安庆市怀宁县马庙镇马庙街道,4008-659-600,,
市同博装饰有限公司            ,安徽省安庆市怀宁县高河镇龙山路和谐家园F1...,4008-659-600,,
怀宁万晨装饰工程有限公司            ,安徽省安庆市怀宁县高河镇经二路金色城堡18...,4008-659-600,,
