江西博发装饰有限公司 ,江西省抚州市赣东大道万象新城5F,15982180655,8505333,
抚州市鼎兴装饰工程有限公司            ,江西省 抚州市 市辖区 青云路凤凰城B栋二...,4008-659-600,,
丛一楼装饰抚州分公司            ,江西省 抚州市 临川区 玉茗大道丰源宜合1...,4008-659-600,,
美星装饰集团            ,南昌,4008-659-600,,
抚州黑苹果装饰工程有限公司            ,江西省 抚州市 市辖区 伍塘路瀚海龙蟠小区...,4008-659-600,,
星艺装饰有限公司抚州分公司            ,江西省 抚州市 临川区 抚州市南湖路延伸,4008-659-600,,
润泰装饰抚州分公司            ,江西省抚州市临川区凤凰城商业广场,4008-659-600,,
三星装饰有限公司            ,江西省抚州市临川区赣东大道,4008-659-600,,
广州市华宁装饰工程有限公司南昌分公司            ,江西省 抚州市 临川区 玉茗大道,4008-659-600,,
南昌欧坊装饰工程有限公司            ,南昌西湖区洪城路576号天使商务广场t层,4008-659-600,,
江西苹果装饰公司            ,南昌市抚生丽都广场,4008-659-600,,
北京实创家居装饰集团(江西)有限公司            ,南昌市洪城路6号国贸国贸广场新华都1-3层,4008-659-600,,
江西苹果装饰设计工程有限公司            ,西湖区洪城路987号丽都广场a栋五楼（）,4008-659-600,,
南昌道艺装饰有限公司            ,南昌市红谷滩万达中心写字楼B2-814,4008-659-600,,
一号家居网南昌站            ,江西省南昌市青山湖区上海路699文化创意园,4008-659-600,,
一号家居网            ,南昌市青山湖区上海路699文化创意园,4008-659-600,,
迪赞设计空间            ,南昌市井冈山大道名爵公馆,4008-659-600,,
抚州市新居源装饰设计有限公司            ,,4008-659-600,,
南昌实创家居装饰            ,南昌市洪城路6号新华都购物广场3楼,4008-659-600,,
江西翔海装饰工程有限公司            ,,4008-659-600,,
南昌实创家居装饰            ,南昌市洪城路6号新华都购物广场3楼,4008-659-600,,
江西翔海装饰工程有限公司            ,,4008-659-600,,
抚州新九度装饰公司            ,抚州市玉茗大道玉茗华城5栋,4008-659-600,,
江西省抚州市江枫装饰            ,江西省抚州市玉茗大道299号二楼(市移动公...,4008-659-600,,
抚州百安居装饰设计工程有限公司            ,,4008-659-600,,
广州托美尔装饰抚州分公司            ,抚州市凤凰城建材街18栋2楼11-12号店...,4008-659-600,,
聊城市东昌府区简尚装饰有限公司            ,,4008-659-600,,
江西特佳建筑装饰工程有限公司            ,,4008-659-600,,
上海波涛装饰集团抚州公司            ,,4008-659-600,,
抚州亿家美装饰有限公司            ,江西省抚州市钟岭大道未来城东郡3栋19-1,4008-659-600,,
抚州艺品装饰工程有限公司            ,,4008-659-600,,
抚州新九度装饰公司            ,抚州市玉茗大道玉茗华城5栋,4008-659-600,,
江西省抚州市江枫装饰            ,江西省抚州市玉茗大道299号二楼(市移动公...,4008-659-600,,
抚州百安居装饰设计工程有限公司            ,,4008-659-600,,
广州托美尔装饰抚州分公司            ,抚州市凤凰城建材街18栋2楼11-12号店...,4008-659-600,,
聊城市东昌府区简尚装饰有限公司            ,,4008-659-600,,
抚州市华宾装饰有限公司            ,江西省抚州市凤凰城建材街19栋2楼16号、...,4008-659-600,,
抚州星艺装饰有限公司            ,江西省抚州市玉茗大道延伸段华福公寓5-8号...,4008-659-600,,
江西嘉尚装饰有限公司            ,抚州华萃庭院东门16栋2层,4008-659-600,,
抚州仲言装饰设计工程有限公司            ,抚州市临川区玉茗大道翰城国际7栋二单元90...,4008-659-600,,
抚州波涛装饰设计工程有限公司             ,江西省抚州市玉茗大道延伸段丰源宜和10栋7...,4008-659-600,,
抚州市品典装饰工程            ,江西省抚州市玉茗大道丰源宜合82-87号青...,4008-659-600,,
江西省丛一楼装饰工程有限公司抚州分公司            ,抚州市,玉茗大道,延伸段,丰源宜合小区13...,4008-659-600,,
抚州鼎盛装饰设计工程有限公司            ,抚州市临川区玉茗大道974号,4008-659-600,,
江西特佳建筑装饰工程有限公司            ,江西省抚州市玉茗大道南湖路加油站农商银行隔...,4008-659-600,,
江西峰格装饰工程有限公司            ,江西省抚州市赣东大道68号钧天步步高百货四...,4008-659-600,,
抚州乐居装饰工程有限公司            ,江西省 抚州市 市辖区 玉茗大道延伸段74...,4008-659-600,,
嘉祺装饰设计工程有限公司            ,,4008-659-600,,
抚州扬子装饰工程有限公司            ,抚州市 临川区 贸易广场北二街43--45...,4008-659-600,,
抚州奥文建筑装饰有限公司            ,抚州市曾巩大道20号,4008-659-600,,
名匠装饰有限公司抚州分公司            ,抚州市玉茗大道中段（青青家园路口）,4008-659-600,,
抚州市水木装饰有限公司            ,抚州市南门路722号赣东大道交口处,4008-659-600,,
北京龙发装饰集团抚州分公司            ,江西省 抚州市 凤凰城建材街,4008-659-600,,
江西苹果装饰-江西苹果装饰(旗舰店)            ,江西省南昌市西湖区洪城路丽都广场a栋苹果装...,4008-659-600,,
抚州华浔品味装饰工程有限公司            ,抚州梦湖东路166号凤凰海域（即梦湖拱桥对...,4008-659-600,,
实创家居装饰集团有限公司            ,青云谱洪都洪城路6号国贸广场13层,4008-659-600,,
