无锡雅田装饰冷暖设备工程有限公            ,11111,4008-659-600,,
无锡轻舟世纪装饰工程有限公司            ,1,4008-659-600,,
嗡嗡嗡嗡嗡嗡            ,,4008-659-600,,
无锡市宝祥装饰装潢有限公司            ,1,4008-659-600,,
无锡市新区长旺软门装饰有限公司            ,兴源路喻松桥121号302厂房,4008-659-600,,
江苏中兴一品装饰股份有限公司            ,俱崇安,4008-659-600,,
无锡市昊天装饰            ,无锡市惠山大道明发商业广场,4008-659-600,,
无锡泽园装饰装潢有限公司            ,无锡市塘南路121号,4008-659-600,,
面对面装饰集团无锡公司司            ,1,4008-659-600,,
江阴市波涛装饰            ,江阴市波涛装饰,4008-659-600,,
无锡锡辉装饰            ,1,4008-659-600,,
无锡万家灯火装饰工程有限公司            ,1,4008-659-600,,
无锡市旭展装饰设计工程有限公司            ,1,4008-659-600,,
无锡乐饰装饰装潢有限公司            ,1,4008-659-600,,
无锡市创异空间装饰设计事务所            ,1,4008-659-600,,
无锡市安家装饰装潢总公司            ,1,4008-659-600,,
无锡聚财装饰有限公司            ,1,4008-659-600,,
无锡徐创装饰设计有限公司            ,3,4008-659-600,,
北京圣点世纪装饰            ,北京圣点世纪装饰,4008-659-600,,
无锡名典装饰设计工程有限公司            ,3,4008-659-600,,
江阴市申典装饰            ,887,4008-659-600,,
无锡雅田装饰冷暖设备工程有限公            ,11111,4008-659-600,,
嗡嗡嗡嗡嗡嗡            ,,4008-659-600,,
百姓装潢专业施工队            ,坊前,新丰苑二期88号,4008-659-600,,
江苏中兴一品装饰股份有限公司            ,俱崇安,4008-659-600,,
无锡市帝景智家装饰设计有限公司            ,广益哥伦布广场B座1320室,4008-659-600,,
江阴市乐巢装饰            ,江阴市乐巢装饰,4008-659-600,,
无锡金米兰装饰工程设计有限公司            ,1,4008-659-600,,
江阴市艺海装饰有限公司            ,1,4008-659-600,,
无锡风水装饰有限公司            ,3,4008-659-600,,
无锡欧鼎装饰材料公司            ,1,4008-659-600,,
无锡爱格派装饰设计有限公司            ,3,4008-659-600,,
无锡品蓝装饰有限公司            ,3,4008-659-600,,
无锡艺诚装饰            ,1,4008-659-600,,
无锡摩丹国际装饰设计工公司            ,3,4008-659-600,,
绿华装饰设计有限公司            ,1,4008-659-600,,
中蚁阁装饰装潢有限公司            ,1,4008-659-600,,
无锡市旺宅园装饰有限公司            ,无锡市崇安区工艺桥1号207室,4008-659-600,,
无锡美丽装饰            ,1,4008-659-600,,
上海元新建筑装潢有限公司            ,1111111,4008-659-600,,
无锡杰俊装饰装潢店            ,1,4008-659-600,,
无锡锦华装饰工程有限公司            ,1,4008-659-600,,
诚信门窗装潢            ,1,4008-659-600,,
无锡市圣诺装饰工程有限公司            ,锡沪路8号（名品城二期A1-1702）,4008-659-600,,
常州鼎创装饰设计工程有限公司            ,1,4008-659-600,,
江阴市超众装饰            ,江阴市超众装饰,4008-659-600,,
上海高尚建筑装饰工程有限公司无锡分公司            ,无锡市新区春合路国信世家57-18号,4008-659-600,,
无锡得亚装饰有限公司            ,1,4008-659-600,,
无锡旭日装饰装潢有限公司            ,1,4008-659-600,,
无锡金诚装饰            ,1,4008-659-600,,
无锡个人简约装饰装潢            ,1,4008-659-600,,
怡庭装饰有限公司            ,1,4008-659-600,,
无锡市创异空间装饰设计事务所            ,1,4008-659-600,,
中天装饰工程有限公司            ,无锡滨湖区建筑路新梁溪人家138号1016...,4008-659-600,,
无锡亮康装饰            ,无锡新区长江路信息产业园L栋210,4008-659-600,,
无锡绿怡装饰有限公司            ,3,4008-659-600,,
无锡市帝景智家装饰设计有限公司            ,3,4008-659-600,,
无锡金米兰装饰工程有限公司            ,3,4008-659-600,,
无锡金流源装饰装潢有限公司            ,3,4008-659-600,,
无锡万诺装饰设计            ,1,4008-659-600,,
无锡程度装饰设计工程有限公司            ,1,4008-659-600,,
无锡尚宝一品有限公司            ,东绛镇.锡南路134号,4008-659-600,,
无锡如家装饰设计有限公司            ,1,4008-659-600,,
上海欧丽诗装饰设计工程有限公司            ,1,4008-659-600,,
无锡市欧美装饰工程有限公司            ,1,4008-659-600,,
无锡德尚装饰装潢有限公司            ,1,4008-659-600,,
无锡百年好合装饰装潢设计有限公司            ,3,4008-659-600,,
无锡市龙飞装饰有限公司            ,3,4008-659-600,,
无锡市爱格装饰设计有限公司            ,1,4008-659-600,,
浙江中宇装饰无锡卓筑装饰设计有限公司            ,1,4008-659-600,,
无锡市品轩装饰设计有限公司            ,3,4008-659-600,,
80后装饰设计            ,无锡市，清扬路家乐福附近,4008-659-600,,
无锡晨曦装饰有限公司            ,1,4008-659-600,,
宁波市海曙简诚建筑装饰工程有限公司            ,1,4008-659-600,,
无锡深蓝装饰有限公司            ,无锡新区泰伯大道475号,4008-659-600,,
无锡丑石装饰装潢有限公司            ,1,4008-659-600,,
无锡鲁艺装饰            ,111,4008-659-600,,
无锡鑫业装饰设计有限公司            ,3,4008-659-600,,
无锡西西里装饰工程有限公司            ,3,4008-659-600,,
无锡三木饰家装饰            ,1,4008-659-600,,
OPPEIN欧派铂金装饰            ,俱崇安家居创意设计园205A,4008-659-600,,
尚层国际设计研究院（香港）无锡分公司            ,无锡滨湖区太湖西大道2168号中锐佳诚国际...,4008-659-600,,
无锡鼎天装潢装饰设计公司            ,1,4008-659-600,,
无锡柠檬环保无污染装饰            ,1,4008-659-600,,
上海乃兴装饰无锡分公司            ,1,4008-659-600,,
无锡三匹马装饰装潢有限公司            ,1,4008-659-600,,
无锡市如家装饰设计有限公司            ,3,4008-659-600,,
无锡市同心装饰装潢有限公司            ,1,4008-659-600,,
无锡琅艺琅家装修公司            ,3,4008-659-600,,
无锡360装饰装潢有限公司            ,3,4008-659-600,,
无锡市中琅装饰工程有限公司            ,1,4008-659-600,,
无锡绿草地装饰工程有限公司            ,3,4008-659-600,,
江苏七彩虹建筑装饰工程有限公司            ,1,4008-659-600,,
无锡市高博装饰装潢有限公司            ,3,4008-659-600,,
高工装饰装潢有限公司            ,1,4008-659-600,,
上海万庆装饰无锡分公司            ,33333333333333333,4008-659-600,,
无锡犀点设计工程有限公司            ,无锡市滨湖区五湖大道11号蠡湖科创中心南楼...,4008-659-600,,
无锡怡锦洪建筑装饰设计有限公司            ,3,4008-659-600,,
无锡万千建筑装饰工程有限公司            ,3,4008-659-600,,
无锡辉烨装饰设计工程有限公司            ,3,4008-659-600,,
无锡市东科装饰设计工程有限公司            ,3,4008-659-600,,
上海贤和装饰无锡分公司            ,3333333333333,4008-659-600,,
江海江丽            ,,4008-659-600,,
无锡顺桐装潢工程有限公司            ,3,4008-659-600,,
成俊装潢公司            ,无锡！春雷嘉苑,4008-659-600,,
德旺设计装饰工程有限公司            ,1,4008-659-600,,
无锡我爱阿你装饰            ,1,4008-659-600,,
尚古装饰            ,尚古装饰,4008-659-600,,
上海2018空间设计            ,1,4008-659-600,,
江阴市嘉禾装饰            ,江阴市嘉禾装饰,4008-659-600,,
无锡景澜装饰设计有限公司            ,1,4008-659-600,,
无锡盈动空间装饰设计            ,1,4008-659-600,,
上海庆阳建筑装潢            ,上海庆阳建筑装潢,4008-659-600,,
无锡品蓝装饰有限公司            ,1,4008-659-600,,
无锡上观装饰工程有限公司            ,3,4008-659-600,,
宫殿装饰工程有限公司            ,宜兴阳光花园东大门,4008-659-600,,
无锡市江大建筑装饰装潢有限公司            ,3,4008-659-600,,
盛唐恒逸（无锡）装饰服务联盟            ,1,4008-659-600,,
南国风装饰            ,宜北路237-239号,4008-659-600,,
无锡超群装饰总公司            ,1,4008-659-600,,
无锡得亚装饰有限公司            ,1,4008-659-600,,
无锡旭瑞装饰设计有限公司            ,3,4008-659-600,,
无锡居佳旺装饰            ,1,4008-659-600,,
博安居装饰公司            ,1,4008-659-600,,
无锡市创佳装饰工程有限公司            ,3,4008-659-600,,
长春市百合家装设计工程有限公司            ,西安大路与安达街交汇处（典石广场3楼）,4008-659-600,,
无锡茗軒雅阁装饰工程有限公司            ,1,4008-659-600,,
无锡典杰装饰装潢有限公司            ,1,4008-659-600,,
北京居泰隆装饰有限公司江阴分公司            ,11,4008-659-600,,
无锡市清逸设计工作室            ,3,4008-659-600,,
无锡得亚装饰有限公司            ,1,4008-659-600,,
无锡亿联润达装饰装装潢公司            ,1,4008-659-600,,
博安居装饰公司            ,1,4008-659-600,,
无锡家家乐装饰服务有限公司            ,3,4008-659-600,,
无锡欧景装饰设计工程有限公司            ,3,4008-659-600,,
无锡福满楼建筑装饰工程有限公司            ,1,4008-659-600,,
无锡新非凡装饰装潢有限公司            ,1,4008-659-600,,
无锡金米兰装饰设计工程有限公司            ,1,4008-659-600,,
无锡兴业装潢            ,1,4008-659-600,,
无锡家园装饰设计有限公司            ,3,4008-659-600,,
无锡吉祥鸟装饰有限公司            ,1,4008-659-600,,
无锡蒋氏装饰设计有限公司            ,3,4008-659-600,,
无锡百姓家装饰工程有限公司            ,1,4008-659-600,,
无锡桃花源装饰设计工程有限公司            ,3,4008-659-600,,
上海市欧丽诗装饰工程有限公司            ,1,4008-659-600,,
无锡市雅豪装饰设计有限公司            ,3,4008-659-600,,
无锡威帆装饰装潢设计有限公司            ,3,4008-659-600,,
无锡家家乐装饰服务有限公司            ,3,4008-659-600,,
江阴市欣萱建筑装潢            ,江阴市欣萱建筑装潢,4008-659-600,,
无锡欧景装饰设计工程有限公司            ,3,4008-659-600,,
宜兴市庆友装饰工程有限公司            ,宜兴九滨中路221号,4008-659-600,,
无锡盛宝泰装饰工程公司            ,3,4008-659-600,,
无锡冠晟装饰设计工程有限公司            ,无锡市东亭皮革城东3门,4008-659-600,,
无锡市春旺装饰装潢有限公司            ,1,4008-659-600,,
无锡房丽美装饰工程有限公司            ,3,4008-659-600,,
无锡鑫石装饰设计有限公司            ,3,4008-659-600,,
无锡伟复环保科技有限公司            ,无锡市锡山区锡沪中路123号嘉柏大厦703...,4008-659-600,,
无锡琅艺琅家装饰设计工程有限公司            ,3,4008-659-600,,
绿怡美淘家无锡运营中心            ,崇安区锡沪路嘉饰茂三楼,4008-659-600,,
江阴安隆达贸易有限公司            ,江阴通富路135号,4008-659-600,,
无锡礼邦装饰有限公司            ,3,4008-659-600,,
江阴市随意居装饰            ,江阴市随意居装饰,4008-659-600,,
无锡宇汇装饰装潢有限公司            ,11111111,4008-659-600,,
135791            ,135791,4008-659-600,,
无锡荣辰建筑装饰设计有限公司            ,3,4008-659-600,,
江苏利德装饰工程有限公司            ,无锡市崇安区摩天360,4008-659-600,,
无锡澎达装饰设计工程有限公司            ,3,4008-659-600,,
广东三星装饰无锡分公司            ,3,4008-659-600,,
新洲装饰装潢公司            ,无锡市坊前五洲国际五米阳光54栋813室,4008-659-600,,
无锡瑞华装饰设计公司            ,3,4008-659-600,,
无锡梦雅装饰装潢有限公司            ,3,4008-659-600,,
无锡百佳装饰设计公司            ,3,4008-659-600,,
无锡联塑管业有限公司            ,友谊北路300号万力装饰城B区7栋12号,4008-659-600,,
无锡观宇装饰设计公司            ,3,4008-659-600,,
无锡佳喜装饰装潢有限公司            ,3,4008-659-600,,
江阴市维佳诺装饰            ,江阴市维佳诺装饰,4008-659-600,,
江阴市美迅装饰            ,江阴市美迅装饰,4008-659-600,,
怡庭装饰有限公司            ,1,4008-659-600,,
无锡鼎峰设计装饰有限公司            ,3,4008-659-600,,
威兹帕克实木地板            ,无锡锡山区红星美凯龙2楼,4008-659-600,,
无锡市创异空间装饰设计事务所            ,1,4008-659-600,,
无锡鹏鑫装饰装潢有限公司            ,无锡锡沪东路488号,4008-659-600,,
 ,,4008-659-600,,
无锡市金久装饰装潢有限公司            ,3,4008-659-600,,
无锡万佳装饰工程有限公司            ,3,4008-659-600,,
无锡林祥装饰有限公司            ,无锡市中大诺卡花园214号202室,4008-659-600,,
无锡精筑装饰设计工程有限公司            ,3,4008-659-600,,
无锡艺品轩装饰工程有限公司            ,1,4008-659-600,,
宜兴轻舟装饰公司            ,1,4008-659-600,,
圣诺装饰工程有限公司            ,1,4008-659-600,,
无锡百姓家装饰工程有限公司            ,3,4008-659-600,,
无锡润天装饰工程有限公司            ,,4008-659-600,,
无锡市中天建筑装饰工程有限公司            ,3,4008-659-600,,
顾家工艺工艺装饰工程（无锡）有限公司            ,无锡滨湖区奥林花园,4008-659-600,,
无锡业之锋装饰有限公司            ,3,4008-659-600,,
宜兴三星装饰            ,1,4008-659-600,,
无锡易家居装饰公司            ,3,4008-659-600,,
无锡易家居装饰公司            ,3,4008-659-600,,
80后装饰设计            ,无锡市，清扬路家乐福附近,4008-659-600,,
无锡爱格派装饰            ,1,4008-659-600,,
无锡深蓝装饰有限公司            ,无锡新区泰伯大道475号,4008-659-600,,
无锡吉祥鸟装饰有限公司            ,1,4008-659-600,,
无锡伏尔加设计装饰工程有限公司            ,3,4008-659-600,,
无锡港艺装饰装潢有限公司            ,1,4008-659-600,,
景帝智家装饰            ,无锡,4008-659-600,,
无锡释内晶筑装饰设计公司            ,3,4008-659-600,,
无锡金美德装饰公司            ,3,4008-659-600,,
无锡欧源装饰有限公司            ,无锡-锡山-锡沪路 名品城2期，A2栋-2...,4008-659-600,,
无锡金城幕墙装饰工程有限公司            ,1,4008-659-600,,
无锡唯美装饰装潢有限公司            ,1,4008-659-600,,
无锡天惠装饰设计有限公司            ,1,4008-659-600,,
无锡合诚装饰设计有限公司            ,3,4008-659-600,,
无锡阳光海岸装饰装潢有限公司            ,1,4008-659-600,,
无锡苏鹤建筑装饰工程有限公司            ,3,4008-659-600,,
无锡市世家装饰工程有限公司            ,3,4008-659-600,,
无锡创景装饰工程有限公司            ,3,4008-659-600,,
无锡顶鼎装饰设计有限公司            ,3,4008-659-600,,
DAVID手绘壁画            ,,4008-659-600,,
无锡唐龙建筑装饰工程有限公司无锡唐龙建筑装饰工程有限公司            ,1,4008-659-600,,
无锡上宸逸展装饰装潢工程有限公司            ,无锡市锡山区锡东新城东兴路141号,4008-659-600,,
无锡思特颖装饰装潢有限公司            ,无锡市新区湘江北路2#,4008-659-600,,
千家瑞装饰装潢工程有限公司            ,北塘区民丰路278号,4008-659-600,,
江阴市事成装饰            ,江阴市事成装饰,4008-659-600,,
无锡火鸟空间设计有限公司            ,3,4008-659-600,,
江阴市百安居装饰            ,江阴市百安居装饰,4008-659-600,,
无锡旺海装饰设计有限公司            ,3,4008-659-600,,
江阴市道成装饰            ,江阴市道成装饰,4008-659-600,,
无锡源生态装饰有限公司            ,33333333333,4008-659-600,,
无锡 金舵装饰            ,1,4008-659-600,,
华康装饰装潢公司            ,1,4008-659-600,,
无锡荣胜装潢有限公司            ,3,4008-659-600,,
无锡轻舟世纪装饰工程有限公司            ,1,4008-659-600,,
无锡市捷旺装潢有限公司            ,3,4008-659-600,,
无锡市宝祥装饰装潢有限公司            ,1,4008-659-600,,
无锡怡锦洪建筑装饰设计有限公司            ,3,4008-659-600,,
无锡市东科装饰设计工程有限公司            ,3,4008-659-600,,
无锡聚财装饰有限公司            ,1,4008-659-600,,
无锡典杰装饰装潢有限公司            ,1,4008-659-600,,
无锡精筑装饰装潢工程有限公司            ,3,4008-659-600,,
无锡磐石建筑装饰工程有限公司            ,3,4008-659-600,,
无锡新视界装饰设计            ,,4008-659-600,,
无锡市金宇建筑装饰材料有限公司            ,无锡市北塘区科技创业园706室,4008-659-600,,
无锡盟莱适阁装饰设计有限公司            ,3,4008-659-600,,
无锡市春天装饰装潢有限公司            ,3,4008-659-600,,
北京亚光亚装饰宜兴分公司            ,3,4008-659-600,,
无锡金芒果装饰工程有限公司            ,1,4008-659-600,,
无锡方舟装饰装潢有限公司            ,3,4008-659-600,,
无锡市御匠世家装饰装潢有限公司            ,3,4008-659-600,,
七彩虹建筑装饰工程有限公司            ,1,4008-659-600,,
无锡美智庭装饰设计工程有限公司            ,3,4008-659-600,,
无锡金米兰装饰工程有限公司            ,1,4008-659-600,,
无锡市饕餮建筑装饰设计有限公司            ,3,4008-659-600,,
无锡雅鼎装饰工程设计有限公司            ,3,4008-659-600,,
无锡高工装饰装潢有限公司            ,3,4008-659-600,,
水木源空间装饰设计工程有限公司            ,梁清路693号,4008-659-600,,
无锡市宏圆和盛建筑装饰有限公司            ,3,4008-659-600,,
无锡格律空间家居设计工作室            ,3,4008-659-600,,
江阴市申典装饰            ,887,4008-659-600,,
无锡2018空间设计装饰有限公司            ,3,4008-659-600,,
上海美平建筑装潢有限公司            ,3,4008-659-600,,
无锡市盛成建筑装饰设计公司            ,3,4008-659-600,,
无锡金巢装饰公司            ,3,4008-659-600,,
宜兴三星装饰            ,1,4008-659-600,,
无锡晶彩科技有限公司            ,,4008-659-600,,
旭日装饰工程有限公司江阴公司            ,旭日装饰工程有限公司江阴公司,4008-659-600,,
庆阳建筑装潢设计            ,庆阳建筑装潢设计,4008-659-600,,
宜兴市佳艺装饰设计有限公司            ,1,4008-659-600,,
无锡优空间设计装饰有限公司            ,3,4008-659-600,,
无锡盛世华为装饰设计工程有限公司            ,锡沪东路6号1120,4008-659-600,,
无锡宇汇装饰装潢有限公司            ,11111111,4008-659-600,,
无锡市上瑞元筑设计制作有限公司            ,1,4008-659-600,,
无锡白岩装饰设计有限公司            ,3,4008-659-600,,
无锡市神州装饰装潢工程有限公司            ,江苏省无锡市南长区石子街75－1号,4008-659-600,,
无锡东辉装饰有限公司            ,1,4008-659-600,,
江阴市爱心装饰            ,江阴市爱心装饰,4008-659-600,,
无锡端点设计            ,1,4008-659-600,,
上海聚通装潢            ,1,4008-659-600,,
江阴市美迅装饰            ,江阴市美迅装饰,4008-659-600,,
无锡梦雅装饰装潢有限公司            ,3,4008-659-600,,
江阴佳品卓诚装饰            ,江阴佳品卓诚装饰,4008-659-600,,
无锡殿堂软装设计            ,3,4008-659-600,,
无锡观宇装饰设计公司            ,3,4008-659-600,,
江阴市星艺装饰            ,9,4008-659-600,,
无锡艺品清建筑装饰工程有限公司            ,3,4008-659-600,,
无锡中兴一品装饰股份有限公司            ,无锡市商业大厦20楼整层,4008-659-600,,
无锡全兴装饰装潢有限公司            ,3,4008-659-600,,
无锡乐之家家居装饰有限公司            ,无锡市建筑路1155号奥林花园B区,4008-659-600,,
无锡佳喜装饰装潢有限公司            ,3,4008-659-600,,
无锡建墅装饰            ,1,4008-659-600,,
上海市欧丽诗装饰工程有限公司            ,1,4008-659-600,,
无锡市达迅装饰装潢有限公司            ,无锡盛岸路256-3,4008-659-600,,
无锡佰瑞装饰设计工程有限公司            ,1,4008-659-600,,
无锡市安诺装修公司            ,无锡市北塘区宪丰路,4008-659-600,,
北京居泰隆实体家居            ,1,4008-659-600,,
博安居装饰有限公司            ,金石东路1号,4008-659-600,,
无锡睿景建筑装饰工程有限公司            ,3,4008-659-600,,
无锡程度装饰设计工程有限公司            ,1,4008-659-600,,
无锡设计工作室            ,11,4008-659-600,,
无锡鑫业装饰设计有限公司            ,3,4008-659-600,,
无锡西西里装饰工程有限公司            ,3,4008-659-600,,
无锡布拉格装饰工程有限公司            ,1,4008-659-600,,
无锡市兴锡装饰设计有限公司            ,无锡市湖滨路月秀东园19号,4008-659-600,,
无锡市兴建装饰设计有限公司            ,1,4008-659-600,,
江阴市宝钰装饰            ,江阴市宝钰装饰,4008-659-600,,
江阴邦亚室内设计装饰有限公司            ,3,4008-659-600,,
江阴邦亚室内设计装饰有限公司            ,1,4008-659-600,,
无锡博高装饰材料有限公司            ,3,4008-659-600,,
无锡国丰装饰工程有限公司            ,1,4008-659-600,,
无锡天惠装饰设计有限公司            ,1,4008-659-600,,
无锡文业装饰设计有限公司            ,3,4008-659-600,,
无锡深蓝装饰有限公司            ,1,4008-659-600,,
无锡市雅方装饰设计有限公司            ,3,4008-659-600,,
无锡美之家室内设计工作室            ,1,4008-659-600,,
无锡佰仟装饰工程有限公司            ,3,4008-659-600,,
无锡景澜装饰设计有限公司            ,1,4008-659-600,,
无锡市细节人生装饰工程有限公司            ,3,4008-659-600,,
无锡市世家装饰工程有限公司            ,1,4008-659-600,,
九鼎装饰股份有限公司无锡分公司            ,无锡锡沪中路162号（中储建材对面）,4008-659-600,,
优质完美装饰            ,无锡市,民丰家园一区13号,4008-659-600,,
无锡市世家装饰工程有限公司            ,1,4008-659-600,,
无锡山姆装饰艺术设计有限公司            ,1,4008-659-600,,
德旺设计装饰工程有限公司            ,1,4008-659-600,,
无锡市派克装潢设计有限公司            ,1,4008-659-600,,
无锡雅鼎装饰工程设计有限公司            ,3,4008-659-600,,
无锡粤风装饰设计有限公司            ,3,4008-659-600,,
无锡杰美装饰有限公司            ,1,4008-659-600,,
无锡典杰装饰装潢有限公司            ,1,4008-659-600,,
无锡正点装饰设计有限公司            ,1,4008-659-600,,
无锡华诚装饰装潢有限公司            ,1,4008-659-600,,
无锡连恩建筑装饰工程有限公司            ,3,4008-659-600,,
无锡市品筑装饰装潢有限公司            ,1,4008-659-600,,
无锡博高装饰材料有限公司            ,1,4008-659-600,,
无锡鼎天装潢装饰设计公司            ,3,4008-659-600,,
无锡一成天装饰工程有限公司            ,1,4008-659-600,,
无锡个人简约装饰装潢            ,1,4008-659-600,,
无锡福艺装饰设计工程有限公司            ,3,4008-659-600,,
无锡鑫东中锐装饰工程有限公司            ,1,4008-659-600,,
欧景装饰设计工程有限公司            ,1,4008-659-600,,
无锡市龙鼎装饰装潢有限公司            ,建筑西路656号,4008-659-600,,
江阴市天河装饰            ,江阴市天河装饰,4008-659-600,,
usadmins            ,,4008-659-600,,
江阴市南通雅兴装饰            ,江阴市南通雅兴装饰,4008-659-600,,
无锡盛宝泰装饰设计工程有限公司            ,1,4008-659-600,,
无锡韩非装饰工程有限公司            ,1,4008-659-600,,
无锡精筑装饰装潢工程有限公司            ,1,4008-659-600,,
无锡艺正恒业装饰设计有限责任公司            ,3,4008-659-600,,
无锡万家灯火装饰工程有限公司            ,1,4008-659-600,,
无锡市哲轩装饰装潢设计            ,1,4008-659-600,,
无锡金陵建筑装饰公司            ,3,4008-659-600,,
无锡隆居装饰装潢工程有限公司            ,1,4008-659-600,,
无锡凹凸装修有限公司            ,3,4008-659-600,,
北京居泰隆装饰有限公司江阴分公司            ,11,4008-659-600,,
无锡钱师傅装饰装潢            ,3,4008-659-600,,
无锡兔宝宝.乐邦装饰公司            ,3,4008-659-600,,
无锡市斯达尔装饰有限公司            ,3,4008-659-600,,
玲珑阁装饰设计有限公司            ,1,4008-659-600,,
无锡市艺海装修公司            ,3,4008-659-600,,
无锡杰美装饰有限公司            ,1,4008-659-600,,
无锡久天装饰设计室            ,1,4008-659-600,,
无锡市雅方装饰            ,1,4008-659-600,,
无锡市科达装饰设计工程有限公司            ,无锡市西郊装潢材料市场25号,4008-659-600,,
家家乐装饰服务有限公司            ,1,4008-659-600,,
无锡市景宜园装饰装潢有限公司            ,锡沪东路365号311室,4008-659-600,,
无锡市龙飞装饰有限公司            ,1111,4008-659-600,,
无锡百佳安建筑装饰工程有限公司            ,高浪路国际金泰装饰城1幢246号,4008-659-600,,
无锡中天建筑装饰工程有限公司            ,滨湖区建筑路新梁溪人家136号1016-1...,4008-659-600,,
