无锡市汉鼎装饰设计有限公司            ,无锡市滨湖区锦溪路100号,4008-659-600,,
高博装饰装潢有限公司城中分公司            ,1,4008-659-600,,
无锡奥美装饰装潢有限公司            ,3,4008-659-600,,
无锡市瑞国装饰装潢有限公司            ,1,4008-659-600,,
无锡市瑞国装饰装潢有限公司            ,3,4008-659-600,,
广东三星余工设计师楼            ,1,4008-659-600,,
无锡慢慢靠近装修            ,1,4008-659-600,,
华浔装饰公司            ,时代国际,4008-659-600,,
无锡啄木鸟装饰            ,,4008-659-600,,
江阴博格装饰            ,江阴博格装饰,4008-659-600,,
无锡百佳安建筑装饰工程有限公司            ,高浪路,4008-659-600,,
拓者装饰设计设计施工中心            ,1,4008-659-600,,
usadmins            ,,4008-659-600,,
无锡市派克装潢设计有限公司            ,3,4008-659-600,,
宜兴天成装饰            ,1,4008-659-600,,
惠居室内装饰设计            ,惠居室内装饰设计,4008-659-600,,
子小涧家居设计            ,子小涧家居设计,4008-659-600,,
中天装饰工程有限公司            ,无锡滨湖区建筑路新梁溪人家138号1016...,4008-659-600,,
广东春满人间装饰宜兴分公司            ,1,4008-659-600,,
无锡市锦创装饰装潢有限公司            ,1,4008-659-600,,
宏源装修            ,宜兴市  丁蜀镇,4008-659-600,,
江苏鑫业装饰有限公司            ,江苏无锡,4008-659-600,,
无锡清韵装饰工程有限公司            ,1,4008-659-600,,
乐邦装饰装潢有限公司            ,1,4008-659-600,,
鸿鹏装饰11`            ,1,4008-659-600,,
无锡金科装饰有限公司            ,1,4008-659-600,,
无锡远达装饰有限公司            ,1,4008-659-600,,
无锡市誉灵装饰装潢有限公司            ,1,4008-659-600,,
无锡恒信室内装饰设计有限公司            ,1,4008-659-600,,
无锡金科装饰设计工程有限公司            ,1,4008-659-600,,
无锡市盛成建筑装饰、设计公司            ,1,4008-659-600,,
雅家装饰设计有限公司            ,1,4008-659-600,,
无锡文业装饰设计有限公司            ,3,4008-659-600,,
无锡市雅方装饰设计有限公司            ,3,4008-659-600,,
无锡佰仟装饰工程有限公司            ,3,4008-659-600,,
无锡市细节人生装饰工程有限公司            ,3,4008-659-600,,
无锡百姓家装饰工程有限公司            ,3,4008-659-600,,
无锡佳饰家装饰公司            ,北塘区民丰北苑31栋202,4008-659-600,,
无锡市中天建筑装饰工程有限公司            ,3,4008-659-600,,
135791            ,135791,4008-659-600,,
无锡业之锋装饰有限公司            ,3,4008-659-600,,
好莱屋装饰设计有限公司            ,1,4008-659-600,,
无锡市景宜园装饰装潢有限公司            ,1,4008-659-600,,
无锡市丽景装饰装潢工程有限公司            ,1,4008-659-600,,
无锡艺峰装饰设计有限公司            ,3,4008-659-600,,
无锡福满楼建筑装饰工程有限公司            ,1,4008-659-600,,
无锡超群装饰设计总公司            ,3,4008-659-600,,
无锡尚品装饰设计有限公司            ,3,4008-659-600,,
无锡万庆装饰工程有限公司            ,3,4008-659-600,,
无锡联谊橱柜装饰有限公司            ,3,4008-659-600,,
上海茶亭装饰有限公司无锡分公司            ,3,4008-659-600,,
上海琢磨建筑装潢公司无锡分公司            ,3,4008-659-600,,
无锡啄木鸟装饰            ,,4008-659-600,,
无锡腾顺装饰装潢有限公司            ,1,4008-659-600,,
无锡艺峰装饰有限公司            ,3,4008-659-600,,
江阴市百姓装饰            ,江阴市百姓装饰,4008-659-600,,
无锡市汉鼎装饰设计有限公司            ,无锡市滨湖区锦溪路100号,4008-659-600,,
无锡金米兰装饰工程有限公司            ,1,4008-659-600,,
北京居安如意装饰无锡分公司            ,3333333333,4008-659-600,,
江阴市龙发装饰            ,江阴市龙发装饰,4008-659-600,,
无锡韩非装饰工程有限公司            ,11,4008-659-600,,
无锡金米兰装饰工程设计有限公司            ,3,4008-659-600,,
无锡市时代装饰有限公司            ,1,4008-659-600,,
无锡国丰装饰工程有限公司            ,3,4008-659-600,,
无锡铭府装饰            ,春联路12号(皇宴大酒店向西300米),4008-659-600,,
上海布空间装饰无锡站            ,1,4008-659-600,,
无锡旭雅装潢有限公司            ,3,4008-659-600,,
无锡壹空间装饰装潢            ,无锡市滨湖区经贸路100号,4008-659-600,,
无锡德俊装饰工程有限公司            ,3,4008-659-600,,
无锡风水装饰有限公司            ,3,4008-659-600,,
瀚风装饰工程有限公司            ,无锡西郊装饰市场5L,4008-659-600,,
无锡众想装饰设计有限公司            ,1,4008-659-600,,
江苏苏州金螳螂装饰工程有限公司            ,,4008-659-600,,
无锡卓筑装饰设计工程有限公司            ,1,4008-659-600,,
无锡乾鑫装饰有限公司            ,3,4008-659-600,,
无锡天禹装饰工程有限公司            ,1,4008-659-600,,
无锡欧丽诗装饰设计工程有限公司            ,3,4008-659-600,,
无锡市旭展装饰设计工程有限公司            ,1,4008-659-600,,
无锡市旭展装饰设计工程有限公司            ,1,4008-659-600,,
无锡市创异空间装饰设计事务所            ,1,4008-659-600,,
无锡聚财装饰有限公司            ,1,4008-659-600,,
无锡风水装饰有限公司            ,3,4008-659-600,,
无锡饰安居装饰装潢有限公司            ,万达,4008-659-600,,
无锡爱格派装饰设计有限公司            ,3,4008-659-600,,
无锡品蓝装饰有限公司            ,3,4008-659-600,,
无锡摩丹国际装饰设计工公司            ,3,4008-659-600,,
 ,,4008-659-600,,
无锡思盛装饰工程有限公司            ,无锡市北塘区江海西路990号909室,4008-659-600,,
上海金年华实业有限公司            ,上海市世界路135号,4008-659-600,,
无锡创达盛事装饰设计有限公司            ,3,4008-659-600,,
无锡居景天装饰工程有限公司            ,3,4008-659-600,,
无锡居景天装饰工程有限公司            ,3,4008-659-600,,
无锡正点装饰设计有限公司            ,3,4008-659-600,,
无锡宝诗龙装饰装潢有限公司            ,1,4008-659-600,,
无锡创成装饰装潢公司            ,3,4008-659-600,,
山姆设计装饰            ,春申路85号,4008-659-600,,
无锡犀点创意设计有限公司            ,1,4008-659-600,,
广东三星装饰无锡分公司            ,1,4008-659-600,,
无锡市宝辉装饰有限公司            ,1,4008-659-600,,
无锡合诚装饰            ,1,4008-659-600,,
无锡房丽美装饰工程有限公司            ,1,4008-659-600,,
无锡宏旺装饰装潢有限公司            ,1,4008-659-600,,
无锡典杰装饰装潢有限公司            ,3,4008-659-600,,
无锡某某装饰公司            ,,4008-659-600,,
无锡钱师傅装饰装潢            ,1,4008-659-600,,
无锡通楹工程设计有限公司            ,3,4008-659-600,,
无锡金匠装饰装潢有限公司            ,无锡南长区沁园新村579-1,4008-659-600,,
百安居无锡新区装潢设计中心            ,1,4008-659-600,,
无锡拓者室内设计工作室            ,3,4008-659-600,,
无锡市创苑装饰装潢有限公司大华分公司            ,阳光100,4008-659-600,,
无锡大森林装饰设计有限公司            ,1大森林装饰公司成立于2002年，在国家工...,4008-659-600,,
无锡兔宝宝乐邦装饰            ,1,4008-659-600,,
无锡索迪亚橱柜装饰            ,1,4008-659-600,,
上海伊超无锡建筑装饰工程有限公司            ,3,4008-659-600,,
无锡市亚乔装饰设计工程有限公司            ,锡沪西路999号现代之星大厦435,4008-659-600,,
江阴市艺尚装饰            ,江阴市艺尚装饰,4008-659-600,,
江阴市福瑞达装饰            ,江阴市福瑞达装饰,4008-659-600,,
无锡思盛装饰工程有限公司            ,无锡市北塘区江海西路990号909室,4008-659-600,,
上海金年华实业有限公司            ,上海市世界路135号,4008-659-600,,
江阴市事成装饰            ,江阴市事成装饰,4008-659-600,,
江阴市百安居装饰            ,江阴市百安居装饰,4008-659-600,,
江阴市道成装饰            ,江阴市道成装饰,4008-659-600,,
上海杰贤建筑工程有限公司            ,1,4008-659-600,,
无锡欧景装饰公司            ,3,4008-659-600,,
宜兴应菲装饰            ,1,4008-659-600,,
无锡创辉装饰工程有限公司            ,梁清路大润发旁,4008-659-600,,
无锡轻质砖隔墙            ,无锡市锡山区锡北镇八士席巷6号,4008-659-600,,
无锡致尚装饰有限公司            ,无锡滨湖区梁清路华邸国际大厦B座503,4008-659-600,,
无锡怡锦洪建筑装饰设计有限公司            ,人民中路123号摩天360大厦2909室,4008-659-600,,
无锡南西设计装饰有限公司            ,无锡新区坊前第一国际,4008-659-600,,
江阴市豪华装饰            ,江阴市豪华装饰,4008-659-600,,
无锡精筑装饰设计有限公司            ,3,4008-659-600,,
无锡正大阳光装饰有限公司            ,3,4008-659-600,,
中兴水电安装公司            ,江苏省江阴市利港镇,4008-659-600,,
无锡世纪龙腾装饰装潢有限公司            ,3,4008-659-600,,
无锡市春旺装饰装潢有限公司            ,1,4008-659-600,,
上海工程有限公司            ,阳山镇陆区陆育路3号,4008-659-600,,
无锡云臣装饰装潢设计有限公司            ,,4008-659-600,,
无锡阡陌空间设计有限公司            ,3,4008-659-600,,
无锡百佳装饰工程有限公司            ,1,4008-659-600,,
无锡绿园装饰有限公司            ,无锡市长江北路新光东路,4008-659-600,,
无锡市仙居装饰装潢有限公司            ,1,4008-659-600,,
无锡百佳安建筑装饰工程有限公司            ,高浪路,4008-659-600,,
无锡程度装饰设计工程有限公司            ,1,4008-659-600,,
无锡俄莱建筑装饰工程有限公司            ,滨湖区梁溪路118号,4008-659-600,,
满意装饰让你满意            ,,4008-659-600,,
无锡市综艺装饰装潢有限公司            ,2,4008-659-600,,
无锡华赛装饰有限公司            ,3,4008-659-600,,
无锡市锦创装饰装潢有限公司            ,3,4008-659-600,,
无锡雅琪装饰公司            ,11,4008-659-600,,
无锡七签名装饰设计工作室            ,3,4008-659-600,,
无锡韩非装饰工程有限公司            ,无锡滨湖区南泉方泉苑135-11,4008-659-600,,
江苏中兴一品装饰股份有限公司            ,1,4008-659-600,,
无锡博安居装饰公司            ,1,4008-659-600,,
无锡新梁溪人家            ,无锡新梁溪人家,4008-659-600,,
无锡丽轩装饰装潢有限公司            ,1,4008-659-600,,
江阴市弘佰年装饰            ,江阴市弘佰年装饰,4008-659-600,,
无锡市惠之峰装饰设计有限公司            ,1,4008-659-600,,
宜兴轻舟装饰公司            ,1,4008-659-600,,
江阴市涵艺装饰            ,江阴市涵艺装饰,4008-659-600,,
无锡市友嘉装饰工程有限公司            ,3,4008-659-600,,
无锡艺品清建筑装饰工程有限公司            ,3,4008-659-600,,
无锡东辉装饰有限公司            ,3,4008-659-600,,
北京业之峰诺华装饰工程有限公司无锡公司            ,无锡市南长区,4008-659-600,,
无锡晶彩科技有限公司            ,,4008-659-600,,
上海晨创装饰无锡分公司            ,3,4008-659-600,,
无锡A8装饰设计工作室            ,3,4008-659-600,,
玲珑阁装饰设计有限公司            ,1,4008-659-600,,
无锡市惠之峰装饰设计有限公司            ,1,4008-659-600,,
无锡市尚好家装饰装潢有限公司            ,1,4008-659-600,,
广东三星装饰无锡分公司            ,1,4008-659-600,,
无锡春秋装饰有限公司            ,3,4008-659-600,,
无锡火鸟空间设计有限公司            ,3,4008-659-600,,
无锡旺海装饰设计有限公司            ,3,4008-659-600,,
无锡市明阁装饰设计有限公司            ,3,4008-659-600,,
上海唐琪装饰有限公司无锡分公司            ,3,4008-659-600,,
无锡天禹装饰工程有限公司            ,3,4008-659-600,,
天成装饰装潢            ,1,4008-659-600,,
无锡忆江南装饰装潢有限公司            ,3,4008-659-600,,
宏锦建筑装饰有限公司            ,宏锦建筑装饰有限公司,4008-659-600,,
无锡深度装饰有限公司            ,3,4008-659-600,,
无锡振楠装饰设计有限公司            ,3,4008-659-600,,
无锡市金宇建筑装饰材料有限公司            ,无锡市北塘区科技创业园706室,4008-659-600,,
江阴市事成装饰            ,江阴市事成装饰,4008-659-600,,
江阴市百安居装饰            ,江阴市百安居装饰,4008-659-600,,
无锡金芒果装饰工程有限公司            ,1,4008-659-600,,
江阴市道成装饰            ,江阴市道成装饰,4008-659-600,,
无锡超艺装饰设计工程有限公司            ,1,4008-659-600,,
上海杰贤建筑工程有限公司            ,1,4008-659-600,,
江苏百思装饰建筑工程有限公司            ,江阴市人民东路585号,4008-659-600,,
无锡市中立建筑装饰工程有限公司            ,无锡崇安区上马墩路38号,4008-659-600,,
无锡千成金点子装潢设计有限公司            ,3,4008-659-600,,
无锡立邦装饰装潢责任有限公司            ,3,4008-659-600,,
无锡千成金点子装饰装潢有限公司            ,3,4008-659-600,,
无锡品尚装饰公司            ,3,4008-659-600,,
无锡市泰达建筑装饰工程有限公司            ,3,4008-659-600,,
无锡文业装饰设计工程有限公司            ,3,4008-659-600,,
佰瑞装饰设计工程有限公司            ,1,4008-659-600,,
上海春鹏装饰设计有限公司            ,1,4008-659-600,,
江苏利德装饰股份有限公司            ,33333333333333,4008-659-600,,
无锡中宏装潢装饰有限公司荣誉资质            ,3,4008-659-600,,
无锡好华装饰公司            ,3,4008-659-600,,
无锡优空间设计装饰有限公司            ,3,4008-659-600,,
上海元新装饰有限公司无锡分公司            ,3,4008-659-600,,
无锡陆天装饰有限公司            ,3,4008-659-600,,
无锡聚财装饰有限公司            ,1,4008-659-600,,
无锡万千建筑装饰工程有限公司            ,3,4008-659-600,,
无锡品尚装饰工程有限公司            ,3,4008-659-600,,
无锡市精工建筑装饰工程有限公司            ,无锡市景溪路100号,4008-659-600,,
无锡威帆装饰装潢设计有限公司            ,1,4008-659-600,,
上海贤和装饰无锡分公司            ,3333333333333,4008-659-600,,
无锡居泰隆实体家居装饰公司            ,3,4008-659-600,,
无锡市伟业装饰设计有限公司            ,3,4008-659-600,,
无锡市兴建装饰设计有限公司            ,3,4008-659-600,,
无锡苏彤装饰设计有限公司            ,3,4008-659-600,,
无锡市锡辉装饰装潢有限公司            ,1,4008-659-600,,
无锡索迪亚橱柜装饰            ,3,4008-659-600,,
广东三星装饰无锡分公司            ,1,4008-659-600,,
无锡品轩装饰有限公司            ,3,4008-659-600,,
无锡合诚装饰            ,1,4008-659-600,,
无锡普雅北欧风整体装饰设计公司            ,3,4008-659-600,,
无锡布空间设计装饰            ,1,4008-659-600,,
无锡苏彤装饰设计有限公司            ,3,4008-659-600,,
春秋装饰有限公司            ,1,4008-659-600,,
无锡市锡辉装饰装潢有限公司            ,1,4008-659-600,,
无锡新起点装饰设计工程有限公司            ,1,4008-659-600,,
无锡迪曼软膜科技有限公司            ,惠山区堰桥工业园区渡水桥东路8号,4008-659-600,,
无锡索迪亚橱柜装饰            ,3,4008-659-600,,
无锡威华装饰有限公司            ,1,4008-659-600,,
无锡无忧装饰            ,新区,4008-659-600,,
无锡玛益装饰工程有限公司            ,1,4008-659-600,,
无锡市兴建装饰设计有限公司            ,3,4008-659-600,,
无锡万千建筑装饰工程有限公司            ,3,4008-659-600,,
上海贤和装饰无锡分公司            ,3333333333333,4008-659-600,,
星艺装饰有限公司江阴分公司            ,星艺装饰有限公司江阴分公司,4008-659-600,,
无锡兴业装潢            ,1,4008-659-600,,
江阴市信德装饰            ,江阴市信德装饰,4008-659-600,,
无锡吉祥鸟装饰有限公司            ,1,4008-659-600,,
无锡尚亭品佳装饰设计有限公司            ,3,4008-659-600,,
无锡欧丽诗装饰工程有限公司            ,3,4008-659-600,,
无锡金美德装饰装潢有限公司            ,3,4008-659-600,,
无锡双益品味装饰有限公司            ,1,4008-659-600,,
无锡市爱格装饰设计有限公司            ,3,4008-659-600,,
大丰合装饰装潢有限公司            ,1,4008-659-600,,
无锡奥林装饰有限公司            ,3,4008-659-600,,
无锡创辉装饰工程有限公司            ,梁清路大润发旁,4008-659-600,,
无锡深蓝装饰有限公司            ,1,4008-659-600,,
无锡市中琅装饰工程有限公司            ,3,4008-659-600,,
无锡轻质砖隔墙            ,无锡市锡山区锡北镇八士席巷6号,4008-659-600,,
江苏利德装饰有限公司            ,1,4008-659-600,,
无锡诚信门窗装潢            ,3,4008-659-600,,
无锡大午装饰工程有限公司            ,3,4008-659-600,,
80后装饰设计            ,无锡市，清扬路家乐福附近,4008-659-600,,
无锡市春旺装饰装潢有限公司            ,1,4008-659-600,,
无锡唐朝装饰设计有限公司            ,3,4008-659-600,,
无锡深蓝装饰有限公司            ,无锡新区泰伯大道475号,4008-659-600,,
无锡百佳装饰工程有限公司            ,1,4008-659-600,,
无锡市斯达尔装饰有限公司            ,1,4008-659-600,,
无锡金科装饰设计工程有限公司            ,1,4008-659-600,,
宜兴天成装饰            ,1,4008-659-600,,
无锡雅琪装饰公司            ,11,4008-659-600,,
无锡鲁艺装饰设计有限公司            ,1,4008-659-600,,
无锡韩非装饰工程有限公司            ,3,4008-659-600,,
无锡明创装饰装潢            ,1,4008-659-600,,
无锡南西室内设计装饰公司            ,3,4008-659-600,,
滨湖区全兴装饰装潢部            ,1,4008-659-600,,
无锡蓝钻坊装饰有限公司            ,3,4008-659-600,,
宜兴逸品居装饰            ,1,4008-659-600,,
