江苏鸥鼎建筑装饰工程有限公司 ,五爱路78号德源大厦9D室,13665154948,82715925,
无锡市尚品空间装饰设计工程有限公司 ,无锡市梁溪区锡沪家艺中心6号1522室,18661000125,81083050,
无锡盛观装饰设计工程有限公司 ,无锡市崇安区中山路270号天安大厦11楼,15861462228,85812082,
江苏尚锦明堂装饰工程有限公司 ,锡沪东路名品城A2-1401,18262220844,68063885,
无锡申远空间装饰设计有限公司 ,锡沪西路999号现代之星大厦318室,13382888506,82404480,
无锡九墅装饰设计工程有限公司 ,人民东路560号2楼九墅装饰,18013418589,82326966,
江苏锡润建筑装饰工程有限公司 ,人民东路531号红豆万花城4楼,15190262348,88221658,
无锡市铂金装饰工程有限公司 ,无锡市崇安区月星国际15A07-15A10,15190318551,82436166,
无锡衡恒建筑工程有限公司 ,无锡市梁溪区广瑞路1288号(新联大厦)2...,18961824330,85765777,
上海久筑建筑装饰设计工程有限公司无锡分公司 ,无锡市滨湖区贡湖大道505号5楼,13061607166,85061099,
无锡乐窝装潢设计工程有限公司 ,无锡市滨湖区青祁路住友家园门面房24-1-...,13338762352,85808352,
无锡市尚强品盛装饰装潢有限公司 ,无锡市锡沪路与江海路交叉口广益名品城内,18800574629,82321668,
无锡睿筑铭墅装饰设计工程有限公司 ,梁溪区广益路313号五洲国际银河城A区4楼,15306182962,81808558,
江苏锦华建筑装饰设计工程股份有限公司            ,人民中路123号摩天360大厦37楼,4008-659-600,,
北京东易日盛家居装饰集团股份有限公司无锡分公司            ,苏州崇安区中山路,4008-659-600,,
江苏中兴一品装饰股份有限公司            ,锡沪路俱崇安家居创意园B座负一楼,4008-659-600,,
无锡茗轩雅阁装饰工程有限公司            ,无锡市崇安区广益路哥伦布广场A座1225室,4008-659-600,,
无锡怡锦洪建筑装饰设计有限公司            ,无锡市人民中路123号360大厦2909,4008-659-600,,
无锡中博装饰设计有限公司            ,惠山区洛城大道108号（麦德龙对面）,4008-659-600,,
无锡海翔装饰设计工程有限公司            ,无锡市广益路287号(哥伦布广场)B座LO...,4008-659-600,,
上海欧堡建筑装饰有限公司 无锡分公司            ,佳润装饰城西五号二楼（锡沪路光年南路口）,4008-659-600,,
无锡华阳建筑装饰工程有限公司            ,无锡市锡沪路东鹏国际365号604室,4008-659-600,,
无锡百家信建筑装饰工程有限公司            ,无锡北塘区锡澄路295号锦江之星一楼门面,4008-659-600,,
北京阔达装饰集团无锡分公司            ,无锡市中山路555号聚丰园大酒店,4008-659-600,,
无锡古上装饰设计有限公司            ,锡沪东路8号名品城二期A1-1103/11...,4008-659-600,,
无锡轻舟世纪建筑装饰工程有限公司            ,无锡市五爱路25号（工商银行对面）,4008-659-600,,
上海品清装饰无锡分公司            ,无锡昇平巷29号恒通国际大厦辅楼5楼（八佰...,4008-659-600,,
无锡市八斗装饰设计总公司            ,锡沪西路999号现代之星425-426（中...,4008-659-600,,
无锡亿联润达装饰设计有限公司            ,无锡市锡沪东路99-2嘉饰茂A幢706室,4008-659-600,,
滨湖区乾祥室内环境治理服务部            ,无锡市滨湖区湖滨街11-922,4008-659-600,,
无锡邻家装饰设计工程有限工公司            ,无锡市锡沪中路196—214（紫金门家居广...,4008-659-600,,
无锡康源装饰            ,无锡市梁溪区锡沪路家艺中心A4座1210,4008-659-600,,
无锡源千呈装饰工程有限公司            ,无锡滨湖区商业街11号蠡湖国际315-31...,4008-659-600,,
广州华浔品味装饰有限公司无锡分公司            ,江苏无锡市北塘区北大街47-49号,4008-659-600,,
无锡时光剪墙体彩绘            ,无锡市崇安区通江大道爱家金河湾3号门,4008-659-600,,
无锡面对面装饰公司            ,无锡市五爱路五爱人家2号写字楼11层,4008-659-600,,
无锡典艺大宅装修装潢工程有限公司            ,无锡市滨湖区国家工业设计院/锡沪路东鹏广场,4008-659-600,,
无锡尚品原筑装饰设计工程有限公司            ,无锡市梁溪区锡沪东路8号1818室,4008-659-600,,
居然元洲装饰            ,无锡新吴区金城东路18号一楼 居然.元洲装...,4008-659-600,,
广州美星装饰无锡分公司            ,无锡市滨湖区梁清路264号万达广场D区商铺...,4008-659-600,,
苏州金象香山工匠设计装饰股份有限公司            ,无锡市滨湖区梁清路荣巷历史街区5#301,4008-659-600,,
无锡南西设计装饰有限公司            ,无锡新区  联系电话：1325520712...,4008-659-600,,
上海熙拓装饰有限公司            ,无锡市安镇大道3534号,4008-659-600,,
无锡红蝴蝶装饰公司            ,无锡广益路291号哥伦布广场3号楼1632...,4008-659-600,,
上海聚通建筑装潢工程有限公司无锡分公司            ,无锡市畅舜苑46号-5A,4008-659-600,,
上海伊超装饰无锡分公司            ,崇安区大成巷8号明珠大厦1703,4008-659-600,,
无锡元筑装饰工程有限公司            ,崇安区月星国际广场1220室,4008-659-600,,
上海元新建筑装潢工程有限公司（无锡分公司）            ,无锡清扬路123号金阳大厦606室（茂业百...,4008-659-600,,
无锡紫苹果装饰工程有限公司            ,崇安区中山路531号红豆国际大厦48楼,4008-659-600,,
无锡市精工建筑装饰工程有限公司            ,无锡市五爱路18号化轻大厦12楼,4008-659-600,,
无锡居佳旺装饰装潢有限公司            ,无锡市北塘区广石路912-914号,4008-659-600,,
无锡东科装饰设计工程有限公司            ,无锡中山路359号东方广场B座G楼,4008-659-600,,
三星装饰·余工设计师楼            ,无锡市兴源北路,4008-659-600,,
无锡豪度冷暖设备工程有限公司            ,学前东路916号,4008-659-600,,
张木匠装饰装潢有限公司            ,无锡市滨湖区建筑路新梁溪人家鼎牌公寓136...,4008-659-600,,
无锡细节人生装饰工程有限公司            ,无锡市上马墩路160号靖海公园c座4层,4008-659-600,,
无锡观唐上院装饰有限公司            ,中国江苏省无锡市滨湖区太湖西大道2168号...,4008-659-600,,
无锡新区七七装饰装潢有限公司            ,无锡新区五洲国际博览城二期辽宁街D117栋...,4008-659-600,,
上海泽博装饰设计工程有限公司            ,无锡市锡陆路423-32号（美林湖店铺）,4008-659-600,,
居泰隆实体家居            ,无锡市胜利门永定巷18号,4008-659-600,,
无锡中博装饰设计有限公司            ,无锡市清扬路五爱综合大楼711,4008-659-600,,
无锡市利峦装饰设计有限公司            ,滨湖区荣巷街道勤新63-6,4008-659-600,,
无锡市细节人生装饰工程有限公司            ,无锡市上马墩路160号靖海公园内C座4层,4008-659-600,,
瑾晨装饰公司            ,宜兴丁蜀镇川埠中学岔路口,4008-659-600,,
无锡老周装潢            ,无锡市新区旺庄86号,4008-659-600,,
无锡源生态装饰有限公司            ,无锡北塘区民丰路民丰西苑196号,4008-659-600,,
无锡市腾涛装饰设计有限公司            ,滨湖市雪浪雪溪苑A区41#503,4008-659-600,,
无锡市腾涛装饰设计有限公司            ,滨湖市雪浪雪溪苑A区41#503,4008-659-600,,
恒盛装潢装饰            ,无锡市江海新村,4008-659-600,,
无锡市佳业装饰有限公司            ,惠山开发区惠源路559,4008-659-600,,
无锡三木饰家建筑装饰有限公司            ,锡沪东路8号名品城A02栋1218室,4008-659-600,,
无锡品轩装饰            ,3,4008-659-600,,
无锡恒茂建筑装饰工程有限公司            ,无锡市崇安区华东装饰城325号,4008-659-600,,
无锡万千装饰建筑装饰工程有限公司宜兴分公司            ,宜兴东山西路88号新港湾商务广场5楼（浦发...,4008-659-600,,
无锡市上观装饰装潢有限公司            ,无锡市北大街22号508（禾嘉大厦）,4008-659-600,,
江阴夏奇装饰设计工程有限公司            ,(江阴)环城北路27号凯悦国际7F,4008-659-600,,
无锡融合装饰工程有限公司            ,广益哥伦布b塔1509室,4008-659-600,,
藤川榻榻米和室材料公司            ,无锡市惠山区石塘湾,4008-659-600,,
无锡星杰国际装饰工程有限公司            ,无锡市运河东路555号时代国际大厦A座21...,4008-659-600,,
美家美户无缝墙布无锡专卖            ,无锡市南长区永和路齐家家居馆4楼美家美户,4008-659-600,,
米家无锡装修公司            ,无锡滨湖区湖滨路728号稻香路与湖滨路交叉...,4008-659-600,,
无锡米乐创意科技有限公司            ,江苏省无锡市滨湖区锦溪路99号江南大学国家...,4008-659-600,,
欧艺世家装饰有限公司            ,无锡市北塘区盛世家园二期1#,4008-659-600,,
无锡光明室内装饰装潢            ,崇安区通江大道广晟苑,4008-659-600,,
无锡品超装饰有限公司            ,无锡惠山区钱桥新兴路93号,4008-659-600,,
东筑空间装饰有限公司            ,江阴红星美凯龙(负一楼),4008-659-600,,
无锡茗轩雅阁装饰工程有限公司            ,哥伦布广场A座1225室,4008-659-600,,
润邦国际高端设计服务机构            ,无锡市国际城市家居创意设计园B座二层（广南...,4008-659-600,,
无锡征城装饰装潢            ,无锡滨湖东顾巷,4008-659-600,,
无锡市千得装饰装潢有限公司            ,宜兴市太湖大道苏宁天氿御城246号店面,4008-659-600,,
无锡同济t6国际设计装饰公司            ,崇安区俱崇安家居创意设计园b座209a(广...,4008-659-600,,
无锡桔子装饰工程有限公司            ,无锡滨湖区高浪东路金泰国际装饰城1栋301...,4008-659-600,,
无锡勇创建筑装饰有限公司            ,无锡市锡沪路199号月星家居国际广场617...,4008-659-600,,
无锡周师傅私家装潢装修            ,上马墩88号,4008-659-600,,
广泛大概youxiany78y67jbbhvb            ,sdfsgfgf,4008-659-600,,
信天装饰公司            ,无锡新区硕放,4008-659-600,,
炫风装饰设计工程有限公司            ,无锡市南长区,4008-659-600,,
无锡喜之家装饰工程有限公司            ,湖滨商业街11#1528,4008-659-600,,
畅想装饰设计工程有限公司            ,江苏省无锡市惠山区惠源路199号,4008-659-600,,
广泛大概youxiany78y67jbbhvb            ,sdfsgfgf,4008-659-600,,
无锡蓝鼎装饰            ,3,4008-659-600,,
无锡坤鹏冷暖设备有限公司            ,无锡市崇安区锡沪东路嘉饰茂负1楼036号,4008-659-600,,
无锡市新视界装饰有限公司            ,无锡市崇安区哥伦布广场2期15号911室,4008-659-600,,
无锡市诚信装修设计有限公司            ,无锡市广益星苑,4008-659-600,,
北京元洲装饰有限责任公司            ,无锡市锡沪路俱崇安创业设计园B座二层（广南...,4008-659-600,,
无锡市千艺百意装饰有限公司            ,无锡市新区旺庄路宝龙城市广场C幢1310,4008-659-600,,
上海唐琪装饰有限公司            ,无锡市惠山西漳天一新街208-102,4008-659-600,,
江苏利德装饰工程有限公司            ,无锡市滨湖区润华大厦15楼,4008-659-600,,
无锡百佳信装饰            ,3,4008-659-600,,
上海泽博装饰设计工程有限公司            ,无锡钱桥镇锡陆路423-32（美林湖西街店...,4008-659-600,,
乐居住建-江苏利德装饰            ,无锡市崇安区摩天360大厦3109室,4008-659-600,,
创美家居设计有限公司            ,无锡市滨湖区,4008-659-600,,
无锡未来建筑装饰工程有限公司            ,无锡市人民中路88号优族联盟大厦1619室,4008-659-600,,
无锡弗洛西勒科技有限公司            ,江苏省无锡市高新区新华路125号,4008-659-600,,
无锡市久峰装饰装潢有限公司            ,,4008-659-600,,
无锡细节人生装饰工程有限公司            ,无锡上马墩路160号靖海公园内,4008-659-600,,
无锡市兴锡装饰设计有限公司            ,无锡市湖滨路月秀东园19号,4008-659-600,,
上海泽博装饰设计工程有限公司            ,无锡钱桥镇锡陆路423-32（美林湖西街店...,4008-659-600,,
无锡喜之家装饰工程有限公司            ,湖滨商业街11#1528,4008-659-600,,
无锡勇创建筑装饰有限公司            ,崇安区广益路291号427室（哥伦布广场3...,4008-659-600,,
无锡未来建筑装饰工程有限公司            ,无锡市人民中路88号优族联盟大厦1619室,4008-659-600,,
无锡家和必美装饰            ,1,4008-659-600,,
无锡瑞鑫装饰            ,无锡前洲崇文路新城苑3号店,4008-659-600,,
江苏利德装饰工程有限公司            ,无锡市滨湖区润华大厦15楼,4008-659-600,,
上海惠祥室内装饰设计有限公司无锡分公司            ,无锡滨湖区周新西路万科商业街88-1,4008-659-600,,
创美家居设计有限公司            ,无锡市滨湖区,4008-659-600,,
无锡百佳信装饰            ,3,4008-659-600,,
上海惠祥室内装饰设计有限公司无锡分公司            ,无锡滨湖区周新西路万科商业街88-1,4008-659-600,,
无锡百佳信装饰            ,3,4008-659-600,,
乐居住建-江苏利德装饰            ,无锡市崇安区摩天360大厦3109室,4008-659-600,,
创美家居设计有限公司            ,无锡市滨湖区,4008-659-600,,
无锡拓者装饰设计中心            ,无锡市新区长江北路19-6号,4008-659-600,,
无锡市西域装饰有限公司            ,崇安区广益路哥伦布广场3号楼1012室,4008-659-600,,
无锡市圣诺装饰工程有限公司            ,锡沪路8号（名品城二期A1-1702）,4008-659-600,,
无锡六一八装饰工程有限公司            ,无锡广益哥伦布广场B塔310室,4008-659-600,,
无锡盛大装饰有限公司            ,无锡市人民西路25号百脑汇科技大厦910室,4008-659-600,,
无锡市升辉建筑装饰有限公司            ,无锡市惠山区清华创业大厦1303室,4008-659-600,,
无锡大弘和装饰工程有限公司            ,无锡新吴区纺城大道288号新世界国际装饰建...,4008-659-600,,
州星建筑装饰设计有限公司            ,滨湖区经贸路美好家园64号201室,4008-659-600,,
无锡市伟复环保科技有限公司            ,无锡市锡山区锡沪中路嘉柏大厦703,4008-659-600,,
无锡凯哥装饰            ,,4008-659-600,,
上海高尚建筑装饰工程有限公司无锡分公司            ,无锡市春合路国信世家57-18,4008-659-600,,
无锡华韵装饰装潢有限公司            ,崇安区广益路391号哥伦布广场408,4008-659-600,,
无锡阔达装饰有限公司            ,广益路291号哥伦布广场3号楼1726室,4008-659-600,,
无锡壁虎电器有限公司            ,无锡市惠山盛岸西路,4008-659-600,,
无锡壁虎电器有限公司            ,盛岸西路688号五洲国际装饰城E区5幢20...,4008-659-600,,
无锡绿赫环保科技有限公司            ,新区宝龙城市广场A幢1536室,4008-659-600,,
苏州云网通信息科技有限公司            ,无锡兴源北路,4008-659-600,,
江苏海舜木业有限公司            ,江苏省无锡市中山路635号,4008-659-600,,
北京阳光无限壁纸            ,北京市朝阳区四惠小武基桥北林达海鱼广场,4008-659-600,,
无锡钲朵整体家装有限公司            ,无锡崇安区东亭春潮路华夏春晓29号,4008-659-600,,
无锡森林木装饰工程有限公司            ,无锡滨湖区金泰国际装饰城1栋301室,4008-659-600,,
浙江尚品居网络科技有限公司            ,杭州江干区五星路198号瑞景国际大701,4008-659-600,,
成都精雕国际广告有限公司            ,四川省成都市武侯区航空路10号紫兰商厦10...,4008-659-600,,
无锡市绿丰装饰装潢有限公司            ,无锡市绿丰装饰装潢有限公司,4008-659-600,,
江苏旭日装饰工程有限公司            ,无锡建筑西路567号(宝通大厦一楼),4008-659-600,,
阿姚装饰团队            ,澄江街道,4008-659-600,,
无锡市豪匠建筑装饰工程有限公司            ,无锡市锡沪路,4008-659-600,,
无锡利德装饰有限公司            ,无锡市崇安区人民中路摩天360,4008-659-600,,
无锡市幸运装饰有限公司            ,贡湖大道242#,4008-659-600,,
无锡红旗装饰            ,1,4008-659-600,,
无锡后十年装饰工程有限公司            ,无锡市太湖西大道849号（标准花园西侧）,4008-659-600,,
无锡市仙居装饰装潢有限公司            ,3,4008-659-600,,
江苏省无锡市创易家装饰工程有限公司            ,1,4008-659-600,,
无锡辉烨装饰设计工程有限公司            ,3,4008-659-600,,
常州鼎创装饰设计工程有限公司            ,1,4008-659-600,,
无锡市布拉格装饰工程有限公司            ,1,4008-659-600,,
无锡华博装饰工程有限公司            ,3,4008-659-600,,
无锡风水装饰有限公司            ,3,4008-659-600,,
无锡爱格派装饰设计有限公司            ,3,4008-659-600,,
无锡久天装饰设计室            ,3,4008-659-600,,
无锡居景天装饰设计工程有限公司            ,1无锡居景天装饰有限公司是一家集工装、家装...,4008-659-600,,
无锡品蓝装饰有限公司            ,3,4008-659-600,,
无锡市哲轩装饰装潢设计            ,3,4008-659-600,,
广州市欧意装饰工程有限公司            ,1,4008-659-600,,
无锡摩丹国际装饰设计工公司            ,3,4008-659-600,,
无锡苏彤装饰设计有限公司            ,3,4008-659-600,,
上海万诺建筑装饰公司无锡分公司            ,333333333333333,4008-659-600,,
无锡福艺装饰设计工程有限公司            ,1,4008-659-600,,
柏泰装饰设计            ,柏泰装饰设计,4008-659-600,,
无锡市锡辉装饰装潢有限公司            ,1,4008-659-600,,
江阴新等式装饰            ,江阴新等式装饰,4008-659-600,,
无锡景水南田装饰装潢有限公司            ,无锡市人民中路97号（佳福大厦）901室,4008-659-600,,
无锡泰达装饰工程有限公司            ,3,4008-659-600,,
无锡索迪亚橱柜装饰            ,3,4008-659-600,,
尚品居装饰            ,宜兴市高塍镇人民东路104号,4008-659-600,,
无锡鑫虹装饰有限公司            ,3,4008-659-600,,
无锡金巢装饰公司            ,3,4008-659-600,,
无锡市品筑装饰装潢有限公司            ,1,4008-659-600,,
茗品轩装饰有限公司            ,无锡市锡山区安镇镇东兴路169号,4008-659-600,,
无锡金美德装饰公司            ,3,4008-659-600,,
无锡一成天装饰工程有限公司            ,1,4008-659-600,,
无锡轩轩室内装饰设计有限公司            ,,4008-659-600,,
江苏中兴一品装饰股份有限公司            ,33333333333,4008-659-600,,
无锡鑫东中锐装饰工程有限公司            ,1,4008-659-600,,
无锡博高装饰材料有限公司            ,1,4008-659-600,,
江苏中兴一品装饰            ,广南路俱崇安负一楼,4008-659-600,,
无锡市豪杰装饰公司            ,3,4008-659-600,,
无锡东方神韵装饰装潢工程有限公司            ,3,4008-659-600,,
无锡市兴锡装饰设计有限公司            ,3,4008-659-600,,
无锡振楠装饰设计有限公司            ,3,4008-659-600,,
无锡安居乐装饰有限公司            ,3,4008-659-600,,
无锡礼邦装饰有限公司            ,1,4008-659-600,,
上海美平建筑装潢无锡分公司            ,11111111111,4008-659-600,,
上海春鹏装饰设计有限公司            ,1,4008-659-600,,
无锡市千秋装饰设计有限公司            ,1,4008-659-600,,
无锡古德装潢有限公司            ,无锡市崇安区上马墩,4008-659-600,,
无锡新起点装饰设计工程有限公司            ,1,4008-659-600,,
无锡市多维空间装饰装潢有限公司            ,3,4008-659-600,,
江阴弘毅装饰            ,江阴弘毅装饰江阴弘毅装饰,4008-659-600,,
无锡威华装饰有限公司            ,1,4008-659-600,,
无锡城市之家装饰设计工程有限公司            ,3,4008-659-600,,
申鼎装饰设计工程有限公司            ,申鼎装饰设计工程有限公司,4008-659-600,,
无锡市仙居装饰装潢有限公司            ,3,4008-659-600,,
北京圣点世纪装饰            ,北京圣点世纪装饰,4008-659-600,,
无锡辉烨装饰设计工程有限公司            ,3,4008-659-600,,
江阴市申典装饰            ,887,4008-659-600,,
上海绿怡装饰无锡公司            ,3,4008-659-600,,
福瑞达碳纤维地暖无锡总代理            ,无锡市北塘区江海西路75号,4008-659-600,,
力丰大理石加工厂            ,江阴市夏港镇西城路128号,4008-659-600,,
纽蒂莱软膜科技有限公司            ,江苏无锡江阴滨江开发区双牌一村21栋203,4008-659-600,,
苏北个人施工队            ,东亭,4008-659-600,,
无锡暖宝宝装            ,1,4008-659-600,,
天澜装饰设计有限公司            ,1,4008-659-600,,
北京元洲装饰无锡分公司            ,3,4008-659-600,,
宜兴三星装饰            ,1,4008-659-600,,
无锡盛宝泰装饰工程公司            ,3,4008-659-600,,
广东三星装饰无锡分公司            ,3,4008-659-600,,
苏州市红蚂蚁装饰设计工程有限公司无锡分公司万达店            ,无锡市滨湖区万达广场蠡溪路179号二楼,4008-659-600,,
庆阳建筑装潢设计            ,庆阳建筑装潢设计,4008-659-600,,
无锡梦雅装饰装潢有限公司            ,3,4008-659-600,,
宜兴市佳艺装饰设计有限公司            ,1,4008-659-600,,
无锡观宇装饰设计公司            ,3,4008-659-600,,
无锡耕牛装饰有限公司            ,3,4008-659-600,,
无锡市鑫秀装饰装潢有限公司            ,1,4008-659-600,,
无锡千棵树装饰装潢公司            ,3,4008-659-600,,
无锡创成装饰装潢            ,1,4008-659-600,,
 ,,4008-659-600,,
无锡创成装饰装潢            ,1,4008-659-600,,
无锡市旺海装饰设计有限公司            ,3,4008-659-600,,
无锡市豪德装饰工程有限公司            ,3,4008-659-600,,
无锡逸品美筑装饰设计有限公司            ,3,4008-659-600,,
无锡世纪龙腾装饰装潢有限公司            ,3,4008-659-600,,
无锡阡陌空间设计有限公司            ,3,4008-659-600,,
上海元新建筑装潢有限公司            ,1111111,4008-659-600,,
无锡善工志装饰装潢设计有限公司            ,3,4008-659-600,,
无锡固家装潢设计有限公司            ,3,4008-659-600,,
上海琢磨建筑装潢公司无锡分公司            ,3,4008-659-600,,
无锡市创佳装饰工程有限公司            ,1,4008-659-600,,
无锡艺峰装饰有限公司            ,3,4008-659-600,,
无锡指北针室内装潢设计有限公司            ,1,4008-659-600,,
北京居安如意装饰无锡分公司            ,3333333333,4008-659-600,,
无锡爱格派装饰            ,1,4008-659-600,,
诚信门窗装潢            ,1,4008-659-600,,
无锡市舜帝生态修复科技有限公司            ,无锡市锡山区锡北镇八士斗山舜帝纪念馆,4008-659-600,,
无锡吉祥鸟装饰有限公司            ,1,4008-659-600,,
常州鼎创装饰设计工程有限公司            ,1,4008-659-600,,
无锡金樽装饰设计有限公司            ,3,4008-659-600,,
无锡市宏旺装饰装潢有限公司            ,2,4008-659-600,,
无锡市丽景装饰装潢工程有限公司            ,3,4008-659-600,,
锡山区锡北镇欧盼铝材厂            ,锡山区八士镇八达路2号,4008-659-600,,
无锡泛东达装饰公司            ,3,4008-659-600,,
无锡远达装饰有限公司            ,3,4008-659-600,,
鸿旭商贸有限公司            ,,4008-659-600,,
无锡华天装饰装潢有限公司            ,3,4008-659-600,,
无锡联谊橱柜装饰有限公司            ,3,4008-659-600,,
上海茶亭装饰有限公司无锡分公司            ,3,4008-659-600,,
无锡指北针室内装潢设计有限公司            ,3,4008-659-600,,
江阴市华艺七间宅装饰            ,江阴市华艺七间宅装饰,4008-659-600,,
宜兴龙源装饰            ,1,4008-659-600,,
无锡爱格派装饰            ,1,4008-659-600,,
无锡精筑装饰设计有限公司            ,1,4008-659-600,,
无锡旭瑞装饰设计有限公司            ,1,4008-659-600,,
无锡欧尚装饰设计有限公司            ,1,4008-659-600,,
无锡邻家装饰设计工程有限工公司            ,3,4008-659-600,,
大为装饰工程有限公司            ,大为装饰工程有限公司,4008-659-600,,
江阴市红太阳装饰            ,江阴市红太阳装饰,4008-659-600,,
江苏锦华建筑装饰设计工程股份有限公司无锡第一分公司            ,无锡运河公园a区28号,4008-659-600,,
无锡杰美装饰有限公司            ,3,4008-659-600,,
无锡城市之家装饰设计工程有限公司            ,1,4008-659-600,,
无锡姚家装潢装饰有限公司            ,3,4008-659-600,,
无锡市绿丰装饰装潢有限公司            ,1,4008-659-600,,
无锡双益品味装饰有限公司            ,3,4008-659-600,,
无锡市新洋溪装饰装潢设计有限公司            ,3,4008-659-600,,
无锡庆鸿装饰有限公司            ,,4008-659-600,,
江苏中财建筑装饰工程有限公司            ,1,4008-659-600,,
无锡龙鼎装饰设计            ,1,4008-659-600,,
无锡市新洋溪装饰装潢设计有限公司            ,3,4008-659-600,,
无锡 金舵装饰            ,1,4008-659-600,,
华康装饰装潢公司            ,1,4008-659-600,,
