广西柳州市中宅建筑装饰工程有限责任公司桂林分公司 ,桂林市象山区中山南路35号经贸大厦万成国际...,18172649679,2328668,
广西品匠家居装饰工程集团有限公司桂林分公司 ,桂林市七星区漓江路19号1幢3层16号,15778019821,3560528,
桂林朗格装饰工程有限责任公司 ,桂林市七星区三里店七星花园牡丹苑H座101...,13978386758,3639773,
南庭艺筑装饰工程设计有限公司桂林分公司 ,桂林市象山区中山南路31号维也纳酒店3楼(...,18260854536,2212302,
广西艺匠建筑装饰工程有限公司 ,桂林市象山区中山南路92号交通大厦3楼(汽...,13677869199,3555656,
广州美星装饰设计有限公司桂林分公司            ,桂林市中山中路大世界智能大厦601室,4008-659-600,,
北京百佳居装饰有限公司桂林分公司            ,桂林市象山区环城西二路4号综合楼1-14号...,4008-659-600,,
桂林市乐艺装饰有限公司            ,桂林市七星区育才路178号,4008-659-600,,
广西名匠装饰工程有限公司桂林分公司            ,桂林市漓江路28号中软现代城写字楼二楼(国...,4008-659-600,,
桂林致和装饰有限责任公司            ,桂林市七星区普陀路12号长城软件3楼(长城...,4008-659-600,,
桂林森美装饰工程有限公司            ,桂林市甲天下广场中软·现代金...,4008-659-600,,
阳朔鸿达装饰设计有限责任公司            ,阳朔城西路68号,4008-659-600,,
桂林鸿鼎装饰工程有限公司            ,桂林秀峰区中山中路45号,4008-659-600,,
桂林灏域装饰工程有限公司            ,桂林市七星区穿山东路22号彰泰.兰乔圣菲2...,4008-659-600,,
桂林市曼维力装饰设计工程有限公司            ,桂林市象山区环城南二路18号幸福家小区12...,4008-659-600,,
广西美伦装饰工程有限公司            ,广西桂林象山区上海路民航大厦三楼,4008-659-600,,
桂林市木和装饰工程有限公司            ,桂林市中山南路35号经贸大厦12-10,4008-659-600,,
桂林四维建筑装饰工程有限公司            ,桂林市临桂区西城北路山水凤凰城天屿临街商铺...,4008-659-600,,
广西美伦装饰工程有限公司            ,象山区上海路18号,4008-659-600,,
北京东易日盛·首铭装饰            ,漓江路19号财富名城1栋3楼（观光酒店对面...,4008-659-600,,
广东星艺装饰集团桂林分公司            ,中山北路35号龙湖大厦二楼,4008-659-600,,
桂林臻品居装饰工程有限公司            ,桂林市秀峰区阳江路好利来大酒店三楼,4008-659-600,,
桂林市美佳丽装饰有限公司            ,桂林市七星公园大门东江二路东江花园202（...,4008-659-600,,
桂林恒达装饰工程有限公司            ,广西桂林金水路金水湾自由自宅301室,4008-659-600,,
桂林市匠星装饰设计有限公司            ,广西桂林市七星区建干路彭家岭路段火烈鸟商务...,4008-659-600,,
桂林兰舍环保科技有限公司            ,,4008-659-600,,
桂林艾佰图装饰工程有限公司            ,广西桂林叠彩佰宫精品酒店506室,4008-659-600,,
桂林吉祥装饰设计工程有限公司            ,桂林市象山区南环路5号桃园大厦二楼,4008-659-600,,
桂林建美装饰            ,桂林市七星区普陀路香山画苑小区15栋1楼8...,4008-659-600,,
桂林吉祥装饰设计工程有限公司            ,桂林市象山区南环路5号桃园大厦二楼,4008-659-600,,
桂林建美装饰            ,桂林市七星区普陀路香山画苑小区15栋1楼8...,4008-659-600,,
桂林市颠锋视界设计装饰有限公司            ,桂林市象山区安新南区江畔御苑7-8号门面,4008-659-600,,
桂林研申装饰工程有限责任公司            ,,4008-659-600,,
桂林艾佰图装饰有限公司            ,桂林市七星区建杆北路火烈鸟商务8楼,4008-659-600,,
桂林市聚美装饰设计有限公司            ,漓江路28号会展中心西侧中软现代城2区4层,4008-659-600,,
老谢家装            ,,4008-659-600,,
苏州苏苏装饰            ,,4008-659-600,,
桂林鸿鼎装饰工程有限公司            ,,4008-659-600,,
瀚杰装饰工艺公司            ,叠彩区乌石街,4008-659-600,,
桂林艾佰图装饰有限公司            ,桂林市七星区建杆北路火烈鸟商务8楼,4008-659-600,,
桂林市聚美装饰设计有限公司            ,漓江路28号会展中心西侧中软现代城2区4层,4008-659-600,,
桂林盛茂装饰工程有限公司            ,,4008-659-600,,
广西南庭艺筑装饰工程设计（桂林）分公司            ,桂林市象山区中山南路维也纳酒店3楼,4008-659-600,,
桂林致和装饰工程有限公司            ,,4008-659-600,,
北京深度空间装饰工程有限公司桂林分公司            ,桂林市七星区甲天下广场鑫海国际1栋9楼,4008-659-600,,
桂林百捷装饰工程有限公司            ,,4008-659-600,,
桂林托美尔装饰工程有限公司            ,七星区环城南一路兴进广场11#301,4008-659-600,,
桂林市逸飞装饰有限公司            ,,4008-659-600,,
百佳居装饰集团桂林分公司            ,广西桂林市环西公路4号（象山政府旁，香江饭...,4008-659-600,,
桂林四维建筑装饰工程有限公司            ,,4008-659-600,,
东莞市春满人间装饰有限公司桂林分公司            ,,4008-659-600,,
桂林华浔品味装饰            ,桂林朝阳路师大北门斜对面彰泰睿城30-2号...,4008-659-600,,
桂林盛茂装饰工程有限公司            ,,4008-659-600,,
广西南庭艺筑装饰工程设计（桂林）分公司            ,桂林市象山区中山南路维也纳酒店3楼,4008-659-600,,
桂林致和装饰工程有限公司            ,,4008-659-600,,
广西美伦装饰工程有限公司            ,桂林市象山区上海路18号民航大厦附楼3、4...,4008-659-600,,
桂林艺田装饰工程有限公司            ,桂林市秀峰区青禾美邦A栋1单元401,4008-659-600,,
桂林大象装饰设计有限公司            ,广西壮族自治区桂林市七星区朝阳路尾信息产业...,4008-659-600,,
广东南国鼎峰装饰桂林分公司            ,桂林市临桂新区花样年花样城二期30栋1-2...,4008-659-600,,
桂林市博宸装饰设计有限公司            ,广西壮族自治区桂林市叠彩区大河乡站前路金河...,4008-659-600,,
桂林鸿鼎装饰工程有限公司            ,桂林市秀峰区中山中路45号华联商厦南一单元...,4008-659-600,,
桂林博望空间装饰有限公司            ,桂林八里街玉柴博望园小区侧门十字路24-2,4008-659-600,,
云南创艺集团桂林分公司            ,桂林市七星区普陀路12号长城花园2楼,4008-659-600,,
桂林巨美装饰工程有限公司            ,桂林市临桂区西城北路山水凤凰城中门,4008-659-600,,
