广西梧州美平方装饰有限公司 ,新兴二路盛业大厦2楼,15278460136,3854398,
梧州中宅建筑装饰工程有限责任公司 ,梧州市西堤三路2号丽港华府第1幢负一层4,...,15877135984,3995589,
梧州品匠家居装饰工程有限公司 ,梧州市长洲区新兴三路102号丰泽·半山华府...,18577442550,3995598,
梧州市正昊装饰工程有限责任公司 ,广西梧州市龙圩区龙圩镇,高冲街163号,13878411321,2727321,
梧州市华浔品味装饰设计工程有限公司 ,梧州市西堤三路28号灏景尚都A区北门,18807741050,2824188,
梧州市众尚装饰设计有限责任公司            ,龙圩镇西南大道277号,4008-659-600,,
业之峰装饰有限公司梧州分公司            , 梧州市长洲区新湖二路40号兴隆佳苑6号楼...,4008-659-600,,
梧州市尚层建筑装饰工程有限公司            ,梧州市长洲区西提三路28号第8幢一层1、2...,4008-659-600,,
 梧州标兵室内设计有限公司            ,三龙大道龙新村村委会旁,4008-659-600,,
城市人家装饰有限公司            ,北京市大兴区亦庄经济开发区4号街区力宝广场...,4008-659-600,,
美星装饰集团            ,南昌,4008-659-600,,
三星装饰设计工程有限公司            ,广西壮族自治区 梧州市 长洲区 新兴三路8...,4008-659-600,,
梧州装饰设计工程有限公司            ,广西梧州市西堤三路28号灏景尚都1号楼一层...,4008-659-600,,
广西梧州卓兴装饰工程有限公司            ,长洲区新兴三路广宇花园（劳动局斜对面,4008-659-600,,
梧州市祥杰装饰设计工程有限公司            ,广西梧州市长洲区新兴二路新苑里一级,4008-659-600,,
梧州市万秀区众宇装饰设计经营部            ,广西梧州市万秀区大学路36-1号第6栋27...,4008-659-600,,
藤县三福匠装饰工程有限公司            ,藤县藤州镇(河东)民安路23号3楼,4008-659-600,,
梧州益家居装饰工程有限公司            ,梧州市龙圩区龙湖三路83号,4008-659-600,,
 ,,4008-659-600,,
南昌市轩仝宇装饰工程有限公司            ,江西省南昌市西湖区子安路89号1602,4008-659-600,,
南昌市轩仝宇装饰工程有限公司            ,江西省南昌市西湖区子安路89号1602,4008-659-600,,
金芒果装饰集团            ,江西省吉安市吉州区广场北路1号(新世界广场...,4008-659-600,,
南昌三帝装饰设计有限公司            ,南昌市青山湖区洪都北道299号高能金域名都...,4008-659-600,,
南庭艺筑装饰梧州分公司            ,,4008-659-600,,
天猫·家装e站            ,,4008-659-600,,
梧州市正昊装饰工程有限责任公司            ,龙圩区高冲街163号,4008-659-600,,
梧州市欧尚装饰有限公司            ,,4008-659-600,,
佛山市南国鼎峰装饰工程有限公司梧州分公司            ,,4008-659-600,,
梧州和敬设计装饰工程有限公司            ,,4008-659-600,,
梧州市水木年华装饰设计工程有限公司            ,长洲区西堤三路28号灏景尚都A区西门旁,4008-659-600,,
北京居兴伟业装饰梧州分公司            ,梧州市西提三路28号(灏景尚都后街3号铺),4008-659-600,,
南庭艺筑装饰梧州分公司            ,,4008-659-600,,
天猫·家装e站            ,,4008-659-600,,
梧州新空间装饰工程有限公司            ,梧州市新兴三路广宇花园交通银行二楼,4008-659-600,,
梧州美嘉园装饰设计有限公司            ,梧州市香城a区10栋19铺、龙圩区龙城路电...,4008-659-600,,
广西南庭艺筑装饰工程设计梧州分公司            ,梧州市新兴珠宝路18号七层,4008-659-600,,
梧州我爱我家装饰设计有限公司            ,梧州西环路中晟建材广场二楼,4008-659-600,,
梧州市天海设计装饰工程有限公司            ,梧州市龙圩区龙圩镇龙湖东三路1号201,4008-659-600,,
梧州豪家居装饰装饰            ,梧州市新兴二路香城B区5号,4008-659-600,,
藤县明日之家装饰设计工程有限公司            ,津北碧水湾,4008-659-600,,
北京居兴伟业装饰设计有限公司梧州分公司            ,梧州市长洲区龙升路30号亨利玫瑰城7号,4008-659-600,,
易尚装饰            ,南昌市青山湖大道333号天香园8号创意园二...,4008-659-600,,
梧州艺创装饰工程有限公司            ,广西壮族自治区 梧州市 苍梧县 梧州市龙圩...,4008-659-600,,
梧州鲁公装饰有限公司            ,梧州新兴三路,4008-659-600,,
阔达建筑装饰工程有限责任公司            ,梧州西环北路87号财经中心c座13层,4008-659-600,,
嘉祺装饰设计工程有限公司            ,苍梧县藤州大道29号,4008-659-600,,
星艺装饰有限公司            ,梧州恒茂国际都会精品商业街二楼,4008-659-600,,
梧州市波涛装饰公司            ,高新区南二环西段财富中心15楼,4008-659-600,,
南国风装饰工程有限工司            ,梧州青山湖南大道墅溪园,4008-659-600,,
广州市华宁装饰工程有限公司南昌分公司            ,江西省南昌市西湖区广润门三区37栋1号,4008-659-600,,
南昌道艺装饰有限公司            ,南昌市红谷滩万达中心写字楼B2-814,4008-659-600,,
梧州匠心装饰            ,梧州东路鹿鼎家居4楼b馆,4008-659-600,,
