点石家装工程有限公司            ,大田县福田大道293号,4008-659-600,,
隆园装饰有限公司            ,三明市梅列区东新四路丁香新村,4008-659-600,,
明达装修公司            ,三明市梅列区东安社区,4008-659-600,,
华浔品味装饰            ,三明市梅列区列东街1143号,4008-659-600,,
三星余工装饰设计工程有限公司            ,三明市梅列区列东街1219号二楼,4008-659-600,,
三明星艺装饰有限公司            ,三明市梅列工商局首层店面(江滨路与东安路交...,4008-659-600,,
圣安居装饰装修工程有限公司            ,三明市大田城关玉山桥头,4008-659-600,,
鼎创装饰有限公司            ,东新一路三明日报社,4008-659-600,,
市三星装饰工程有限公司            ,福建三明梅列区阳光停车场2楼,4008-659-600,,
千年宏祥装饰工程有限公司            ,三明市三元区,4008-659-600,,
江西苹果装饰工程有限公司            ,江西省南昌市洪城路987号丽都广场a栋5楼,4008-659-600,,
香港云裳软装配饰南昌分公司            ,南昌市西湖区省府西二路,4008-659-600,,
力拓装饰工程有限公司            ,三明市三元区荆东路,4008-659-600,,
福建东禾建筑装饰设计工程有限公司分公司            ,,4008-659-600,,
市瑞尊建筑装饰有限公司            ,三明市新市中路294幢105号(下洋汉庭酒...,4008-659-600,,
好易居装饰（）有限公司            ,三明市梅列区六路福清商会大厦9楼,4008-659-600,,
美居装饰            ,,4008-659-600,,
迪赞设计空间            ,南昌市井冈山大道名爵公馆,4008-659-600,,
美居装饰有限公司            ,,4008-659-600,,
市千绘建筑装饰工程有限公司            ,福建省三明市梅列区东新六路工商联大厦二十一...,4008-659-600,,
鼎尚装饰            ,三明市梅列区沪明新村,4008-659-600,,
鲁班装饰设计有限公司            ,南昌,4008-659-600,,
名匠装饰工程有限公司            ,三明市梅列区东安路梅列法院对面,4008-659-600,,
福建道铭装饰工程有限公司            ,三明市梅列区福清商会大厦16楼,4008-659-600,,
美星装饰集团            ,南昌,4008-659-600,,
交换空间装饰有限公司            ,南坪会展中心9玺国际8栋,4008-659-600,,
家豪装饰有限公司            ,三明市梅列区东新四路金牌,4008-659-600,,
实创家居装饰集团有限公司            ,青云谱洪都洪城路6号国贸广场13层,4008-659-600,,
市宁化县铭爵装饰设计有限公司            ,福建省三明市宁化县永利建材城步行街17-6...,4008-659-600,,
中泽装饰有限公司            ,三明市梅列区乾隆新城,4008-659-600,,
