香港美平方国际装饰设计集团有限公司海宁公司 ,联合路75号,13567330713,80776680,
海宁品高装饰设计有限公司 ,海宁市海洲街道钱江西路345号,18969329696,87238585,
海宁众利装饰有限公司 ,海宁市江南大道1604号(上城蝶园),18258363377,87111666,
上海居莉装潢设计有限公司海宁分公司 ,海宁市农肖路东盛路1号,18969309660,87227328,
上海晶意建筑装潢有限公司海宁分公司 ,海昌南路403号,13511363840,87230298,
嘉兴豪企集成家居有限公司 ,海宁市江南大道2438号,17858358371,58358371,
海宁波涛装饰工程有限公司 ,海宁市钱江西路319-321号,18157361617,87373722,
嘉兴鼎乾装饰工程有限公司 ,,18205839977,,
海宁鼎尚装饰            ,浙江省 嘉兴市 海宁市 嘉兴市海宁市文苑南...,4008-659-600,,
广东三星装饰海宁分公司            ,浙江省 嘉兴市 海宁市 海宁市海昌南路鑫泰...,4008-659-600,,
海宁新韵装饰有限公司            ,浙江省 嘉兴市 海宁市 浙江省 嘉兴市 海...,4008-659-600,,
东易日盛装饰集团嘉兴海宁分公司            ,浙江省 嘉兴市 海宁市 嘉兴市中山西路财富...,4008-659-600,,
海宁恒力装饰            ,浙江省 嘉兴市 海宁市 海宁市海昌路272...,4008-659-600,,
美星装饰集团            ,南昌,4008-659-600,,
鲁班装饰设计有限公司            ,南昌,4008-659-600,,
交换空间装饰有限公司            ,南坪会展中心9玺国际8栋,4008-659-600,,
海宁鼎尚装饰            ,嘉兴市海宁市文苑南路100号-102号,4008-659-600,,
上海同济居家装饰海宁分公司            ,浙江省 嘉兴市 海宁市 海宁市文苑路25-...,4008-659-600,,
中冠建筑装饰            ,浙江省 嘉兴市 海宁市 海宁市新苑路190...,4008-659-600,,
海宁鼎力装饰有限公司            ,浙江省 嘉兴市 海宁市 文苑路66-72号,4008-659-600,,
实创家居装饰集团有限公司            ,青云谱洪都洪城路6号国贸广场13层,4008-659-600,,
嘉兴市尚宏装饰工程有限公司            ,嘉兴市昌盛南路现代广场2号楼1005室（元...,4008-659-600,,
海宁市徐氏装饰工程有限公司            ,海宁市农丰路499号鸿运晶座1913,4008-659-600,,
海宁凯汶装饰工程有限公司            ,海宁市海洲街道文宗南路208号,4008-659-600,,
江西苹果装饰公司            ,南昌市抚生丽都广场,4008-659-600,,
北京实创家居装饰集团(江西)有限公司            ,南昌市洪城路6号国贸国贸广场新华都1-3层,4008-659-600,,
江西苹果装饰设计工程有限公司            ,西湖区洪城路987号丽都广场a栋五楼（）,4008-659-600,,
香港云裳软装配饰南昌分公司            ,南昌市西湖区省府西二路,4008-659-600,,
上海同济居家装饰海宁分公司            ,海宁市文苑路25-27号,4008-659-600,,
江西苹果装饰工程有限公司            ,江西省南昌市洪城路987号丽都广场a栋5楼,4008-659-600,,
金芒果装饰集团            ,江西省吉安市吉州区广场北路1号(新世界广场...,4008-659-600,,
广东华浔品味装饰集团公司海宁分公司            ,海宁市海昌南路201号,4008-659-600,,
上海同济居家装饰海宁分公司            ,海宁市文苑路25-27号,4008-659-600,,
江西苹果装饰工程有限公司            ,江西省南昌市洪城路987号丽都广场a栋5楼,4008-659-600,,
佳源装饰            ,,4008-659-600,,
亿嘉利环保装饰海宁店            ,,4008-659-600,,
海宁品高装饰            ,,4008-659-600,,
上海百新建筑装潢设计有限公司            ,,4008-659-600,,
海宁市华浔品味装饰设计工程有限公司            ,海宁市海昌南路548号景华大厦3楼(海宁日...,4008-659-600,,
浙江康源装饰有限公司海宁分公司            ,海宁市海昌南路486号金汇大厦B座裙楼20...,4008-659-600,,
海宁帝豪装饰设计有限公司            ,浙江海宁市海州西路156号,4008-659-600,,
华宁装饰            ,浙江省 嘉兴市 海宁市 海宁市文宗南路12...,4008-659-600,,
阔达建筑装饰工程有限责任公司            ,北京市海淀区西三环北路87号国际财经中心c...,4008-659-600,,
南昌道艺装饰有限公司            ,南昌市红谷滩万达中心写字楼B2-814,4008-659-600,,
嘉兴东源装饰工程有限公司(总部)            ,浙江 嘉兴 嘉兴市 街道：南湖区广益路13...,4008-659-600,,
广州美星装饰（海宁分公司）            ,浙江省 嘉兴市 海宁市 海宁市文苑路9-1...,4008-659-600,,
九鼎装饰股份有限公司海宁分公司            ,浙江省 嘉兴市 海宁市 海宁市海州街道水月...,4008-659-600,,
海宁豪泰装饰有限公司            ,浙江省 嘉兴市 海宁市 海宁市,长安镇修川...,4008-659-600,,
北京龙发建筑装饰工程有限公司海宁分公司            ,浙江省 嘉兴市 海宁市 海昌南路238-2...,4008-659-600,,
