张店实创装饰设计服务部 ,淄博市昌国路与西八路君临天下沿街房28-3,18953355674,8659600,
山东牧马人装饰设计工程有限公司 ,山东省淄博市张店区柳泉路居然之家火炬广场d...,15706437519,3170907,
淄博市鼎亚装饰设计公司            ,山东省淄博市张店区联通路明清街路口北300...,4008-659-600,,
淄博蕴禾装饰公司            ,,4008-659-600,,
济南伊默装饰工程有限公司淄博分公司            ,淄博市华光路58号中房大厦b座701室,4008-659-600,,
山东绿源装饰材料有限公司            ,山东省淄博市张店区,4008-659-600,,
泰景装饰设计工程有限公司            ,淄博市张店区共青团路与西七路交界处,4008-659-600,,
淄博东亿设计装饰有限公司            ,淄博张店华光路149号,4008-659-600,,
淄博东亿设计装饰有限公司            ,淄博张店华光路149号,4008-659-600,,
淄博三信装饰工程有限公司            ,淄博市张店区明清街16-8号,4008-659-600,,
淄博嘉虹装饰设计工程有限公司            ,张店区华光路143号甲7,4008-659-600,,
淄博雅室煌廷装饰公司            ,淄博市张店区名尚国际城市广场,4008-659-600,,
山东怡康居装饰有限公司            ,张店区世纪路与共青团路交叉口东北角,4008-659-600,,
淄博城市人家华杰美居体验馆            ,淄博市张店区共青团路与南京路路口(理工大学...,4008-659-600,,
淄博森勒家居文化发展有限公司            ,山东省淄博市高新区银泰城,4008-659-600,,
淄博徽创空间装饰工程有限公司            ,张店区北京路体育场北-新材料交易中心6楼,4008-659-600,,
淄博名典装饰工程有限公司            ,山东省淄博市张店区西班牙风情街,4008-659-600,,
淄博百佳居装饰【官方】            ,西五路御景国际8楼,4008-659-600,,
淄博弘冠装饰工程有限公司            ,淄博市张店区华光路58号中房大厦c座6楼,4008-659-600,,
齐装网            ,苏州市,4008-659-600,,
淄博汇泽装饰有限责任公司            ,山东省淄博市张店区创业火炬广场D座913室,4008-659-600,,
淄博九创装饰工程有限公司            ,淄博市张店区华光路188号玉龙大厦B座23...,4008-659-600,,
淄博九创装饰            ,张店区柳泉路与新村西路交叉口铂金商务大厦7...,4008-659-600,,
淄博同创装饰有限公司            ,鲁中装饰材料城,4008-659-600,,
山东昕皓装饰设计工程有限公司            ,张店区柳泉路与联通路路口东300米路北18...,4008-659-600,,
南昌新传奇装饰工程有限公司            ,南昌市青山湖区高新大道1755号新传奇装饰...,4008-659-600,,
实创家居装饰集团(江西)有限公司            ,南昌市洪城路6号国贸广场新华都3楼,4008-659-600,,
南昌市鸿基伟业装饰工程有限公司            ,江西省南昌市南京西路555号永溪 大厦11...,4008-659-600,,
山东丰合装饰            ,山东省淄博市张店区新村西路10号,4008-659-600,,
曾洋装饰设计有限公司            ,九江永修县白莲南路1幢1002号,4008-659-600,,
鲁艺家装有限责任公司            ,淄博市张店区西二路154,4008-659-600,,
久盛实木地热地板            ,淄博红星美凯龙家居广场一楼,4008-659-600,,
缘梦购物岛互联网家装            ,沃克家居,4008-659-600,,
鲁班装饰设计有限公司            ,四川南昌,4008-659-600,,
香港嘉祺装饰设计工程有限公司(苏州分公司)            ,,4008-659-600,,
淄博鼎百坚浔装饰工程有限公司            ,淄博市张店区中心路与华光路交叉口云龙大厦B...,4008-659-600,,
鼎百坚浔装饰工程有限公司            ,张店区云龙国际B座6楼,4008-659-600,,
南昌网吧装修-南昌眼镜店装修-写字楼办公室装修-厂房装修            ,怡园路888号,4008-659-600,,
九悦装饰            ,张店新村路与重庆路交叉口往南50米路西（尚...,4008-659-600,,
怀沙设计            ,,4008-659-600,,
正大装饰有限公司            ,赵庄装饰材料城,4008-659-600,,
淄博鼎坚装饰公司            ,淄博市张店区云龙国际B座,4008-659-600,,
九龙装饰            ,,4008-659-600,,
新传奇装饰工程有限公司            ,南昌市高新大道1755号,4008-659-600,,
淄博同福装饰设计工程有限公司            ,,4008-659-600,,
通发多文化传媒            ,淄博市南西五路54号,4008-659-600,,
淄博阿拉丁创意装修            ,金晶大道10号金昌大厦12层,4008-659-600,,
淄博奥美装饰工程有限公司            ,世纪路与中润大道北,4008-659-600,,
南昌市金佳园装饰有限公司            ,南昌市红谷滩新区凤凰北大道景岗佳园店面89...,4008-659-600,,
淄博香港伊亚装饰设计            ,淄博市张店区世纪路新村路交叉口向北50米路...,4008-659-600,,
淄博鼎百坚浔装饰工程有限公司            ,,4008-659-600,,
淄博佰润装饰工程有限公司            ,联通路43号沁园北区五楼,4008-659-600,,
淄博装饰            ,,4008-659-600,,
意家装饰有限公司            ,,4008-659-600,,
南昌宅美装饰            ,南昌抚生路口丽都大厦B座7楼,4008-659-600,,
淄博九创装饰            ,张店区华光路188号B座23楼,4008-659-600,,
南昌至尚装饰工程有限公司            ,解放西路116号1单元602,4008-659-600,,
我爱我家装饰            ,淄博市博山区鼓浪屿装饰城,4008-659-600,,
海珠装饰设计工作室            ,山东省淄博市张店区远景大厦8楼,4008-659-600,,
九悦装饰            ,张店新村路与重庆路交叉口往南50米路西（尚...,4008-659-600,,
怀沙设计            ,,4008-659-600,,
正大装饰有限公司            ,赵庄装饰材料城,4008-659-600,,
淄博鼎坚装饰公司            ,淄博市张店区云龙国际B座,4008-659-600,,
九龙装饰            ,,4008-659-600,,
新传奇装饰工程有限公司            ,南昌市高新大道1755号,4008-659-600,,
淄博同福装饰设计工程有限公司            ,,4008-659-600,,
进贤家装有限公司            ,南昌进贤,4008-659-600,,
淄博佳慧建筑有限公司            ,,4008-659-600,,
南昌至尚装饰工程有限公司            ,解放西路116号1单元602,4008-659-600,,
我爱我家装饰            ,淄博市博山区鼓浪屿装饰城,4008-659-600,,
海珠装饰设计工作室            ,山东省淄博市张店区远景大厦8楼,4008-659-600,,
九悦装饰            ,张店新村路与重庆路交叉口往南50米路西（尚...,4008-659-600,,
怀沙设计            ,,4008-659-600,,
正大装饰有限公司            ,赵庄装饰材料城,4008-659-600,,
淄博鼎坚装饰公司            ,淄博市张店区云龙国际B座,4008-659-600,,
九龙装饰            ,,4008-659-600,,
淄博交换空间装饰有限公司            ,,4008-659-600,,
进贤家装有限公司            ,南昌进贤,4008-659-600,,
淄博佳慧建筑有限公司            ,,4008-659-600,,
南昌至尚装饰工程有限公司            ,解放西路116号1单元602,4008-659-600,,
我爱我家装饰            ,淄博市博山区鼓浪屿装饰城,4008-659-600,,
海珠装饰设计工作室            ,山东省淄博市张店区远景大厦8楼,4008-659-600,,
九悦装饰            ,张店新村路与重庆路交叉口往南50米路西（尚...,4008-659-600,,
怀沙设计            ,,4008-659-600,,
正大装饰有限公司            ,赵庄装饰材料城,4008-659-600,,
淄博鼎坚装饰公司            ,淄博市张店区云龙国际B座,4008-659-600,,
北京索兰影音山东分公司            ,淄博市高新区中润大道59号,4008-659-600,,
淄博鼎坚装饰公司            ,云龙国际B座六楼,4008-659-600,,
山东匠筑装饰            ,,4008-659-600,,
淄博领锋工程设计有限公司            ,,4008-659-600,,
山东匠筑空间装饰设计工程有限公司            ,张店区新村路柳泉路路口乐天马特停车场2楼2...,4008-659-600,,
和程实木装饰公司            ,,4008-659-600,,
淄博迅美装饰工程有限公司            ,世纪路与鲁泰大道交汇处往西300米路北,4008-659-600,,
淄博塞纳春天互联网家居体验馆            ,,4008-659-600,,
淄博吉亚装饰有限公司            ,淄博市张店区齐悦国际一期西北边,4008-659-600,,
淄博乐豪斯高端整装定制            ,山东省淄博张店区南京路与共青团路交叉囗南南...,4008-659-600,,
山东匠筑装饰            ,,4008-659-600,,
淄博我爱我家装饰公司            ,山东省淄博市博山赵庄装饰城,4008-659-600,,
淄博领锋工程设计有限公司            ,,4008-659-600,,
坤鹏圣饰            ,,4008-659-600,,
山东匠筑空间装饰设计工程有限公司            ,张店区新村路柳泉路路口乐天马特停车场2楼2...,4008-659-600,,
淄博迅美装饰工程有限公司            ,世纪路与鲁泰大道交汇处往西300米路北,4008-659-600,,
淄博塞纳春天互联网家居体验馆            ,,4008-659-600,,
灵动智能科技            ,,4008-659-600,,
淄博至美家具有限公司            ,淄博富尔玛家居四楼南厅霍姆雷根美式家居,4008-659-600,,
淄博匠心装饰            ,,4008-659-600,,
淄博塞纳春天装饰工程有限公司            ,,4008-659-600,,
淄博业之峰家园装饰有限公司            ,淄博市张店区世纪路阳光花园商务楼,4008-659-600,,
金辰装饰            ,,4008-659-600,,
淄博博铭装饰工程有限公司            ,,4008-659-600,,
淄博瓷尚陶瓷有限公司            ,,4008-659-600,,
淄博鼎鑫装饰工程有限公司            ,,4008-659-600,,
领尚装饰            ,,4008-659-600,,
淄博迅美装饰工程有限公司            ,张店区鲁泰大道与世纪路交汇处西300米路北...,4008-659-600,,
北京好风景装饰淄博分公司            ,尚美第三城西门,4008-659-600,,
我爱我家装饰公司            ,淄博市张店区世纪路与商场路交叉路口往西20...,4008-659-600,,
扬子智能家居            ,,4008-659-600,,
山东匠筑装饰            ,,4008-659-600,,
淄博速装装饰            ,,4008-659-600,,
淄博鸣杨实木家装            ,,4008-659-600,,
淄博乐豪斯高端整装定制            ,山东省淄博张店区南京路与共青团路交叉囗南南...,4008-659-600,,
淄博我爱我家装饰公司            ,山东省淄博市博山赵庄装饰城,4008-659-600,,
山东匠筑装饰            ,,4008-659-600,,
淄博领锋工程设计有限公司            ,,4008-659-600,,
坤鹏圣饰            ,,4008-659-600,,
好乐家全屋定制--博山店            ,,4008-659-600,,
山东金中瑞装饰设计工程有限公司            ,张店区联通路潘成装饰材料城,4008-659-600,,
山东华杰城市人家装饰工程有限公司            ,山东淄博市张店区共青团西路与南京路路口东北...,4008-659-600,,
淄博鸿韵装饰有限公司            ,淄博市张店区鲁中装饰材料城西侧缘梦购物岛负...,4008-659-600,,
淄博迪森装饰            ,淄博市张店区张南路69号,4008-659-600,,
淄博船说家居装饰            ,淄博义乌小商品城二期,4008-659-600,,
淄博长盛装饰            ,山东省淄博市张店区鲁中材料城D3-5号,4008-659-600,,
淄博市风和筑业装饰            ,淄博市国贸大厦,4008-659-600,,
淄博伊默装饰工程有限公司            ,淄博市华光路58号中房大厦B座701室,4008-659-600,,
北京晨洲装饰工程设计有限公司淄博分公司            ,淄博市高新区银泰时代广场C座2311,4008-659-600,,
淄博国红装饰            ,淄博周村区青年路5号,4008-659-600,,
山东老班长装饰工程有限公司            ,张店区昌国西路红星茶城B4-20,4008-659-600,,
淄博旺宅祈福装饰工程有限公司            ,淄博市张店区鲁中装饰材料城31楼A307,4008-659-600,,
淄博三阳泰和装饰设计有限公司            ,张店区西九路与人民路楼北淄博市不动产登记中...,4008-659-600,,
淄博万泰装饰            ,,4008-659-600,,
淄博汇轩装饰有限公司            ,淄博市张店区共青团路121号,4008-659-600,,
淄博水性科天装饰材料有限公司            ,淄博市昌国西路鑫盛家园南门,4008-659-600,,
淄博一诺千城装饰工程有限公司            ,张店区金达大厦9楼,4008-659-600,,
淄博佰润装饰有限公司            ,,4008-659-600,,
淄博名扬装饰            ,,4008-659-600,,
淄博九创装饰工程有限公司            ,淄博市张店区柳泉路和新村路西北角铂金大厦七...,4008-659-600,,
淄博鼎佰坚浔装饰工程有限公司            ,,4008-659-600,,
城市人家装饰有限公司            ,淄博张店,4008-659-600,,
阔达建筑装饰工程有限责任公司(南昌)分公司            ,北京市海淀区西三环北路87号国际财经中心c...,4008-659-600,,
香港嘉祺装饰设计工程有限公司            ,,4008-659-600,,
美星装饰集团            ,东湖区,4008-659-600,,
鲁班装饰设计有限公司            ,青云谱区,4008-659-600,,
交换空间装饰有限公司            ,,4008-659-600,,
上海波涛装饰公司淄博分公司            ,张店区世贸商务中心,4008-659-600,,
 淄博分公司            ,张店区联通路与张田路十字路口,4008-659-600,,
南国风装饰工程有限工司            ,青山湖南大道墅溪园,4008-659-600,,
广州市华宁装饰工程有限公司淄博分公司            ,张店区联通路60甲6号,8,4008-659-600,,
三星装饰有限公司            ,,4008-659-600,,
名匠装饰有限公司            ,青山湖区,4008-659-600,,
淄博品质空间装饰            ,山东省淄博市 张店区 人民西路176号金石...,4008-659-600,,
淄博尚顿装饰            ,山东淄博上湖御园湖畔临岸,4008-659-600,,
北京龙发装饰集团淄博分公司            , 柳泉路232号,4008-659-600,,
北京业之峰诺华装饰股份有限公司(淄博)分公司            ,,4008-659-600,,
