湖南兴宇成装饰工程有限公司 ,湘潭河东大道48号金桂名城1栋1单元141...,13873234295,52778632,
湖南罗马佳园装饰设计工程有限公司 ,湘潭市岳塘区东泗路宜华湘江名城A9栋(体育...,13257497164,58560059,
湖南爱尚家装饰有限公司 ,湖南省湘潭市岳塘区湖湘北路3号湘银熙城纳帕...,13973260895,58565298,
湘潭麦丰装饰设计有限公司 ,湘潭市岳塘区宝塔街道河东大道46号1栋1单...,15898530786,8530786,
湘潭县易俗河镇极置家建材家居店 ,湘潭县易俗河长通名城D6栋1-15号门面(...,13973282528,57889599,
湖南欧璜装饰设计工程有限公司 ,湖南湘潭雨湖区沙子岭*2栋9楼,18973279065,55881665,
湘潭市名雕装饰            ,湘潭市名雕装饰,4008-659-600,,
湘潭和鼎装饰            ,湖南省 湘潭市 岳塘区 建鑫国际广场,4008-659-600,,
湘潭优品装饰            ,湖南省 湘潭市 雨湖区 雨湖区南岭南路白石...,4008-659-600,,
湘潭知音装饰            ,湘潭市岳塘区建设中路158,4008-659-600,,
湘潭满堂红装饰            ,湘潭市韶山市厦门大道,4008-659-600,,
湘潭大宅尚品装饰            ,湖南省 湘潭市 雨湖区 湘潭潭九路口尊城2...,4008-659-600,,
湘潭市苹果装饰公司            ,湘潭市苹果装饰公司,4008-659-600,,
金煌装饰湘潭分公司            ,南省 湘潭市 岳塘区 湘潭市岳塘区河东大道...,4008-659-600,,
湘潭装饰有限公司            ,湘潭市岳塘区河东大道 ,4008-659-600,,
湘潭金空间装饰            ,湘潭市岳塘区河东大道321附近,4008-659-600,,
湘潭市大唐总成家装工程有限责任公司            ,湖南省 湘潭市 岳塘区 芙蓉路40号帝景国...,4008-659-600,,
苹果装饰            ,岳塘建设南路莲城步行街新街口,4008-659-600,,
实创家居装饰集团有限公司            ,青云谱洪都洪城路6号国贸广场13层,4008-659-600,,
湖南苹果装饰设计工程有限公司            ,湘潭市岳塘区,4008-659-600,,
湘潭金空间装饰公司            ,湘潭岳塘建鑫广场2期3栋4楼,4008-659-600,,
湖南新美装饰工程有限公司            ,湖南湘潭市岳塘区中翰财富广场3楼,4008-659-600,,
湖南艺特家居设计工程有限公司湘潭分公司            ,湘潭市易俗河镇杨柳中路天一家园,4008-659-600,,
格物装饰            ,湘潭市河东大道宝塔路口浦发银行9楼905,4008-659-600,,
北京实创家居装饰集团(江西)有限公司            ,南昌市洪城路6号国贸国贸广场新华都1-3层,4008-659-600,,
一号家居网南昌站            ,江西省南昌市青山湖区上海路699文化创意园,4008-659-600,,
柠檬树装饰工程有限公司            ,岳塘区河东大道交警支队旁，华融湘江银行正对...,4008-659-600,,
绿溢装饰设计工程有限公司            ,九华新都汇写字楼北区2栋7楼,4008-659-600,,
南昌一号家居网            ,南昌市青山湖区上海路699文化创意园,4008-659-600,,
湘潭名雕装饰            ,湘潭名雕,4008-659-600,,
 ,,4008-659-600,,
风水家装设计室            ,湘乡东风路58号,4008-659-600,,
南昌市轩仝宇装饰工程有限公司            ,江西省南昌市西湖区子安路89号1602,4008-659-600,,
湘潭市满堂红            ,湖南省 湘潭市 岳塘区,4008-659-600,,
湖南省知音装饰工程有限公司            ,湖南省湘潭市岳塘区建设中路158号知音装饰...,4008-659-600,,
湘潭精工装饰有限公司            ,湘潭市岳塘区河东大道宝塔路口天瑞新城10楼,4008-659-600,,
一号家居网南昌站            ,江西省南昌市青山湖区上海路699文化创意园,4008-659-600,,
湘潭和信新宜家            ,湘潭和信新宜家,4008-659-600,,
湘潭市满堂红            ,湖南省 湘潭市 岳塘区,4008-659-600,,
湖南省知音装饰工程有限公司            ,湖南省湘潭市岳塘区建设中路158号知音装饰...,4008-659-600,,
湘潭精工装饰有限公司            ,湘潭市岳塘区河东大道宝塔路口天瑞新城10楼,4008-659-600,,
一号家居网南昌站            ,江西省南昌市青山湖区上海路699文化创意园,4008-659-600,,
湘潭和信新宜家            ,湘潭和信新宜家,4008-659-600,,
南昌欧坊装饰            ,洪城路576号天使商务大厦t层,4008-659-600,,
金煌装饰湘潭分公司            ,湘潭岳塘区河东大道88号建鑫城8栋2楼,4008-659-600,,
湖南格物装饰工程有限公司            ,宝塔路口天瑞新城905室(浦发银行楼上),4008-659-600,,
湘潭工匠装饰有限公司            ,湘潭市建设路口莲城步行街大厦A座9楼,4008-659-600,,
湘潭华昌建筑装饰有限公司            ,,4008-659-600,,
湘潭苹果装饰设计工程有限公司            ,湘潭市岳塘区岳塘街道建设南路76号莲城商业...,4008-659-600,,
聚家装饰公司            ,湖南湘潭,4008-659-600,,
金煌装饰湘潭分公司            ,湘潭岳塘区河东大道88号建鑫城8栋2楼,4008-659-600,,
湘潭苹果装饰设计工程有限公司            ,湖南湘潭市建设路口莲城步行街霞光西路口都市...,4008-659-600,,
湘潭市名扬装饰工程有限公司            ,湘潭市岳塘区河东大道煤机厂佳恒综合楼1-3...,4008-659-600,,
湘潭柠檬树装饰设计工程有限公司             ,湘潭市岳塘区河东大道华融湘江银行正对面 交...,4008-659-600,,
湘潭和鼎装饰设计工程有限公司            ,湘潭市岳塘区河东大道88号建鑫国际广场二期...,4008-659-600,,
湘潭鑫源装饰设计有限公司            ,湖南省湘潭市韶山西路125号,4008-659-600,,
湘潭喜居安装饰设计工程有限公司            ,湘潭市岳塘区建鑫国际二期四栋四楼整层,4008-659-600,,
湖南蜗居装饰有限公司            ,湖南省湘潭市万达广场B座写字楼15楼,4008-659-600,,
湘潭和信新宜家装饰有限公司            ,湖南湘潭雨湖九华经开区步步高大道新都汇,4008-659-600,,
湘潭市弘艺装饰            ,湘潭市湘乡市东山北路和梅苑路的交叉口,4008-659-600,,
湘潭华浔品味装饰            ,湘潭市岳塘区湖湘西路纳帕溪谷后湾,4008-659-600,,
湘潭龙发装饰集团            ,地址：湘潭市岳塘区河东大道63号,4008-659-600,,
湘潭名匠装饰有限公司            ,湘潭市岳塘区锦绣新城5楼,4008-659-600,,
湘潭美星装饰集团            ,湘潭美星装饰,4008-659-600,,
鲁班装饰设计有限公司            ,南昌,4008-659-600,,
交换空间装饰有限公司            ,南坪会展中心9玺国际8栋,4008-659-600,,
湘潭泥巴公社装饰设计工程有限公司            ,湘潭市岳塘区建鑫国际社区二期4栋4楼,4008-659-600,,
