广州市华宁装饰工程有限公司溧水分公司 ,南京市溧水区永阳镇秦淮大道301号顾家欧亚...,19941981461,57225828,
南京钜匠装饰设计有限公司 ,南京溧水区顾家商业广场14-816,17512589580,56222731,
南京维宁装饰工程有限公司            ,南京桥北弘阳大厦1724(设计中心:新街口...,4008-659-600,,
南京新爱华装饰有限责任公司            ,南京玄武区北京东路22号和平大厦13楼,4008-659-600,,
广东星艺装饰有限公司            ,南京市鼓楼区山西路金山大厦B座11楼A+G...,4008-659-600,,
南京蓝巢装饰设计有限公司            ,南京市溧水区永阳镇望京街8号名仕阁1栋室(...,4008-659-600,,
南京我乐装饰设计工程有限公司            ,宝塔路14号,4008-659-600,,
北京龙发装饰南京分公司            ,南京市白下区中山南路315号瑞华大厦2楼,4008-659-600,,
南京市汇庭装饰工程有限公司            ,南京市江宁区天元东路228号莱茵铂郡大厦2...,4008-659-600,,
南京龙发装饰有限公司            ,双龙大道829号南方花园瑞阳居4-108,4008-659-600,,
南京树鼎装饰工程有限公司            ,溧水秦淮大道6号,4008-659-600,,
南京颜舍装饰工程有限公司            ,蓝旗街88号紫荆大厦906室,4008-659-600,,
南京蓝巢装饰设计工程有限公司            ,南京市溧水区永阳镇望京街8号名仕阁1栋21...,4008-659-600,,
南京千鼎装饰工程有限公司            ,,4008-659-600,,
南京市汇庭装饰工程有限公司            ,南京市江宁区天元东路228号莱茵铂郡大厦2...,4008-659-600,,
南京龙发装饰有限公司            ,双龙大道829号南方花园瑞阳居4-108,4008-659-600,,
南京东方装饰公司            ,珠江路88号新世界中心A座3515A,4008-659-600,,
南京灿煌装饰工程有限公司            ,南京溧水,4008-659-600,,
南京涛业装饰设计工程有限公司            ,中山南路315号瑞华大厦1304室,4008-659-600,,
苏濠装饰            ,南京市溧水区毓秀路金庭国际花园原售楼部苏濠...,4008-659-600,,
溧水新爱华装饰            ,南京溧水区交通路（五星电器3楼）,4008-659-600,,
溧水华浔            ,溧水区淮源街宏力花苑西门23幢2-3号(皇...,4008-659-600,,
广东名匠装饰集团南京分公司            ,溧水区秦淮大道蓝湖西岸19栋101-102,4008-659-600,,
株洲苹果装饰设计工程有限公司南京分公司            ,溧水区机场路北宸大厦4楼,4008-659-600,,
南京南吉斯装饰工程有限公司            ,南吉斯装饰,4008-659-600,,
