安徽鼎源优品装饰工程有限公司滁州分公司 ,滁州市琅琊区会峰西路72-7号,17755157313,3530066,
滁州忆度装饰工程有限公司 ,恒大名都3栋商业单元102、103室,17705505200,3562830,
滁州市万维装饰工程有限公司 ,滁州市皖东国际车城A区4幢一单元4楼,18805503006,3021969,
明光市福生精工装饰中心 ,琅琊区菱溪路藕塘路交叉口,18355063331,8035353,
滁州岩泉装饰工程有限公司 ,南谯北路泰兴步行街801-104门面房,13905503573,3088066,
华迪装饰工程有限公司滁州分公司            ,安徽省 滁州市 琅琊区 滁州市丰乐大道百合...,4008-659-600,,
滁州苹果装饰(旗舰店)            ,滁州凤阳县尚贤路61号,4008-659-600,,
滁州品尚装饰有限公司            ,滁州-琅琊 全椒路77号,4008-659-600,,
滁州市途中装饰工程有限公司            ,滁州-琅琊 皖东国际车城B区1栋301,4008-659-600,,
鲁班装饰设计有限公司滁州分部            ,滁州南樵区东山头,4008-659-600,,
滁州市居家装饰工程公司            ,滁州-琅琊 国际商城B区,4008-659-600,,
滁州印象宏久装饰工程有限公司            ,滁州-南谯 滁州市南谯中路2329号 开发...,4008-659-600,,
滁州帝豪装饰设计有限公司             ,滁州-南谯 滁州市丰乐大道长江商贸城A区3...,4008-659-600,,
美星装饰集团            ,滁州市来安县建阳路45号,4008-659-600,,
交换空间装饰有限公司            ,凤阳县长春路189号,4008-659-600,,
滁州市恒美装饰工程有限公司            ,安徽省 滁州市 琅琊区 滁州市新城文昌花园...,4008-659-600,,
滁州实创家居装饰集团有限公司            ,光明市人民路雪中飞附近,4008-659-600,,
星艺装饰有限公司            ,滁州凤阳县文昌南街,4008-659-600,,
滁州市顶尖装饰有限公司            ,安徽省 滁州市 琅琊区 南谯中路212号（...,4008-659-600,,
E家装饰工程设计有限公司            ,安徽省 滁州市 琅琊区 皖东国际车城B区5...,4008-659-600,,
滁州龙腾装饰设计有限公司            ,安徽省 滁州市 琅琊区 长江商贸城,4008-659-600,,
世能居装饰设计（滁州）有限公司            ,安徽省 滁州市 南谯区 滁州市南谯区山水人...,4008-659-600,,
滁州华宁装饰工程有限公司            ,滁州来安县塔山东路28号,4008-659-600,,
滁州久米装饰设计有限公司            ,安徽省滁州市丰乐大道长江商贸城B区2栋7层...,4008-659-600,,
滁州匠心之家装饰工程有限公司            ,滁州市南谯区花园东路滁州电子商务产业园1#,4008-659-600,,
滁州轩轩装饰工程有限公司            ,龙蟠大道亚东新城14楼07室,4008-659-600,,
北京佳饰家美装饰有限公司滁州分公司            ,安徽省滁州市南谯中路与花山路交叉口,4008-659-600,,
天长市御庭装饰工程有限公司            ,天长天冶路119红绿灯向南150米南方构件...,4008-659-600,,
南京轩轩设计装饰工程公司            ,滁州市国际车城b区,4008-659-600,,
江西苹果装饰公司滁州分公司            ,滁州市来安县永阳东路,4008-659-600,,
天长市唯佳装饰装潢有限公司            ,安徽省 滁州市石梁东路老天长镇对面,4008-659-600,,
南昌创艺装饰工程有限公司滁州分公司            ,滁州市来安县永阳路,4008-659-600,,
江西鲁公大宅装饰公司滁州分公司            ,滁州市招信镇招信路,4008-659-600,,
滁州弘锦装饰工程有限公司            ,安徽省滁州市丰乐大道百合花园小区大门正对面,4008-659-600,,
滁州丽庭装饰工程有限公司            ,滁州市来安县永阳东路客运站附近,4008-659-600,,
香港云裳软装配饰滁州分公司            ,滁州市南谯区静静幼儿园附近,4008-659-600,,
南昌市轩仝宇装饰工程有限公司滁州分公司            ,滁州市定远县东兴路,4008-659-600,,
合肥华迪装饰工程有限公司滁州分公司            ,安徽省 滁州市 琅琊区 滁州市丰乐大道百合...,4008-659-600,,
迪赞设计空间            ,滁州市琅琊区琅琊西路,4008-659-600,,
滁州市睿德建筑装饰工程有限公司            ,滁州市花山西路482号富春园北门西侧苏果便...,4008-659-600,,
衢州玖佳装饰设计工程有限公司            ,,4008-659-600,,
南昌市轩仝宇装饰工程有限公司滁州分公司            ,滁州市定远县东兴路,4008-659-600,,
合肥华迪装饰工程有限公司滁州分公司            ,安徽省 滁州市 琅琊区 滁州市丰乐大道百合...,4008-659-600,,
迪赞设计空间            ,滁州市琅琊区琅琊西路,4008-659-600,,
滁州市睿德建筑装饰工程有限公司            ,滁州市花山西路482号富春园北门西侧苏果便...,4008-659-600,,
金芒果装饰集团滁州分公司            ,滁州市定远县永康路,4008-659-600,,
枫度装饰            ,,4008-659-600,,
滁州市重剑装饰工程有限公司            ,丰乐北路425号,4008-659-600,,
 ,,4008-659-600,,
南昌三帝装饰设计有限公司滁州分公司            ,滁州市明光市嘉山路北,4008-659-600,,
滁州市睿德建筑装饰工程有限公司            ,滁州市花山西路482号富春园北门西侧苏果便...,4008-659-600,,
金芒果装饰集团滁州分公司            ,滁州市定远县永康路,4008-659-600,,
枫度装饰            ,,4008-659-600,,
滁州市重剑装饰工程有限公司            ,丰乐北路425号,4008-659-600,,
大勇装饰工程有限公司            ,,4008-659-600,,
深圳福韵设计装饰有限公司（滁州）            ,滁州市龙蟠大道188号亚东新城国际804室,4008-659-600,,
滁州天之艺装饰工程有限公司            ,,4008-659-600,,
南京尚成装饰工程有限公司            ,,4008-659-600,,
南京精益求精科技装饰有限公司            ,安徽省滁州市汊河金太阳装饰城A34 栋25...,4008-659-600,,
滁州汇杰装饰工程有限公司            ,南谯区龙蟠大道188号亚东新城国际,4008-659-600,,
南京精益求精科技装饰有限公司            ,安徽省滁州市汊河金太阳装饰城A34 栋25...,4008-659-600,,
滁州汇杰装饰工程有限公司            ,南谯区龙蟠大道188号亚东新城国际,4008-659-600,,
格调装饰            ,,4008-659-600,,
东盛装饰公司            ,滁州市 南谯区 龙蟠大道 亚东新城国际14...,4008-659-600,,
安徽轩雅建筑装饰工程有限公司            ,安徽省滁州市丰乐南路281号(皖东国际车城...,4008-659-600,,
明光市金月亮装饰有限公司            ,明光市招信路333号星光商贸城02幢19号,4008-659-600,,
安徽腾辉装饰工程有限公司            ,安徽省滁州市琅玡区国际商城B区33栋219...,4008-659-600,,
全椒万华装饰工程有限公司            ,全椒盛大装饰城9栋万华装饰,4008-659-600,,
滁州天佑装饰公司            ,龙蟠大道188号亚东新城1519室,4008-659-600,,
安徽华甄建设工程有限公司            ,,4008-659-600,,
滁州市四方艺术装饰有限公司            ,滁州琅琊区凤阳路６号,4008-659-600,,
宏图装饰            ,,4008-659-600,,
易之盛装饰工程有限公司公司            ,滁州市南谯区长江商贸城B区3栋,4008-659-600,,
精工装饰            ,滁州市中央公馆、明光市恒正5-27号,4008-659-600,,
震天装饰工程有限公司            ,滁州市南谯区凤阳路939,4008-659-600,,
滁州圣哲装饰工程有限公司            ,滁州琅琊区,4008-659-600,,
安徽省明光中隆装饰有限公司            ,安徽省明光市万豪建材市场3栋-中隆装饰,4008-659-600,,
南京壹号家信息科技有限公司（滁州分公司）            ,滁州市琅琊区,4008-659-600,,
滁州天地装饰设计有限公司            ,滁州市琅琊区丰乐大道浩然国际商铺1号楼15...,4008-659-600,,
滁州市蓝精灵装饰工程设计有限公司            ,滁州市 琅琊区 滁州市琅琊区菱溪路555号,4008-659-600,,
滁州市恋家建筑装饰有限公司            ,滁州市东坡西路发能国际城南门底商,4008-659-600,,
滁州亚成装饰工程有限公司            ,紫薇中路1970号,4008-659-600,,
滁州合众装饰工程有限公司            ,滁州市亚东国际1702室,4008-659-600,,
