重庆紫微龙德装饰设计工程有限公司 ,潼南凉风亚欧鹏哈佛公馆10-8-9-10,18717008011,44573670,
天古装饰艺术设计有限公司            ,重庆市渝中区中山一路169号和信大厦裙楼三...,4008-659-600,,
天色装饰设计有限公司            ,江北观音桥朗晴广场B幢38楼,4008-659-600,,
视觉色纯简易家装饰            ,重庆市民安大道447号金地豪苑1、2、3楼,4008-659-600,,
鹏泰家好佳装饰工程有限公司            ,江北区观音桥富力海洋广场负2负3层,4008-659-600,,
重庆唐卡装饰工程有限公司            ,重庆市江北区北滨路灯巢406室,4008-659-600,,
美的家装饰工程有限公司            ,主城.区县都有店面(江北.南坪.沙坪坝.渝...,4008-659-600,,
欣然装饰            ,,4008-659-600,,
重庆市潼南区九木堂装饰经营部            ,重庆潼南江北巴渝大道永佳柏林公馆445号,4008-659-600,,
融发之家装饰工程有限公司            ,重庆市江北区大石坝东原D74号写字楼9层,4008-659-600,,
奥诺装饰工程有限公司            ,重庆南岸区南坪大厦b座9楼,4008-659-600,,
三好BRT24天速装中心            ,重庆市渝北区新牌坊新概路山顶道国宾城（轨道...,4008-659-600,,
臻上装饰设计工程有限公司            ,重庆市江北区观音桥郎晴广场A塔9-1,4008-659-600,,
天怡美装饰工程有限公司            ,重庆市渝北区天宫大道华宇北城中央A区,4008-659-600,,
生活家装饰工程有限公司            ,江北区红旗河沟红黄路20号附1号,4008-659-600,,
居之家装饰            ,重庆市九龙坡区华园路13号,4008-659-600,,
一号家居网            ,重庆市江北区五里店渝能城市广场R6负一楼,4008-659-600,,
二十四城家居装饰设计有限公司            ,重庆市九龙坡区杨家坪西郊路19号大洋百货旁,4008-659-600,,
芊墨装饰工程有限公司            ,重庆观音桥朗晴广场A塔18-14,4008-659-600,,
优乐装饰集团-江北整装体验馆            ,重庆市江北区红旗河沟红黄路10号华创大厦3...,4008-659-600,,
德品装饰工程有限公司            ,重庆市江北区红旗河沟东和银都大厦5楼,4008-659-600,,
亿同装饰工程有限公司            ,重庆市沙坪坝区马家岩万煌橱柜城后面,4008-659-600,,
德品装饰工程有限公司            ,重庆市 江北区 红旗河沟  东和银都酒店5...,4008-659-600,,
艾克▪美克室内设计中心            ,南岸区南坪亚太商谷7-17-15(会展中心...,4008-659-600,,
优乐装饰集团            ,重庆市九龙坡区杨家坪动物园对面西城印画小区,4008-659-600,,
北京欧润分公司            ,重庆市江北区五里店转盘，华润万家超市旁,4008-659-600,,
庆凯装饰工程有限公司            ,重庆渝北区新牌坊星湖路1号劲力五星城二期,4008-659-600,,
市晟烨装饰工程有限公司            ,南坪金台大厦7-8,4008-659-600,,
欧也装饰工程有限公司            ,渝北新牌坊转盘附近,4008-659-600,,
鼎轩装饰工程有限公司            ,重庆市江北区 红旗河沟转盘 北部尚座23楼...,4008-659-600,,
美的家装饰工程有限公司            ,重庆市江北区北滨路灯巢TEL:,4008-659-600,,
唐卡装饰工程有限公司            ,重庆市江北区观音桥步行街,4008-659-600,,
市德品装饰工程有限公司            ,重庆市 江北区 红旗河沟 东河银都酒店5楼,4008-659-600,,
