广州名匠装饰玉林分公司 ,广西省玉林市民主南路大润发北面8号商铺,13922909685,0775-2333366,
广西南庭艺筑装饰工程设计玉林分公司 ,玉林市玉州区文体路光大东方一品商住小区1栋...,18178561316,2258882,
中宅建筑装饰工程有限责任公司玉林分公司  ,玉林市玉东新区双拥路39号东盛大厦16楼整...,13669697765,2689299,
盛世豪廷装饰设计工程有限公司玉林分公司            ,玉林市一环北路364号（建材市场对面）,4008-659-600,,
广东三星装饰余工设计师楼玉林分公司            ,人民中路凯旋世纪广场A座14楼,4008-659-600,,
华浔品味装饰            ,广西壮族自治区 玉林市 玉州区 东门商业广...,4008-659-600,,
广西玉林市盛泰装饰有限公司            ,玉林市金港路1号滨江公馆10-19号,4008-659-600,,
玉林市唐艺装饰设计工程有限公司            ,玉林市玉州区建安街34号,4008-659-600,,
广西胜文装饰工程有限公司            ,玉林市玉州区江南路228号香港城A座628...,4008-659-600,,
广西三笙装饰工程有限公司            ,玉林市人民东路11号,4008-659-600,,
广西胜文装饰工程有限公司            ,江南路228号香港城A栋628室,4008-659-600,,
前线装饰工程有限公司            ,人民路1号,4008-659-600,,
玉林一方装饰工程有限公司            ,广西玉林市玉洲区玉城街道广场东路218号,4008-659-600,,
江西苹果装饰公司            ,南昌市抚生丽都广场,4008-659-600,,
北京实创家居装饰集团(江西)有限公司            ,南昌市洪城路6号国贸国贸广场新华都1-3层,4008-659-600,,
江西苹果装饰设计工程有限公司            ,西湖区洪城路987号丽都广场a栋五楼（）,4008-659-600,,
一号家居网南昌站            ,江西省南昌市青山湖区上海路699文化创意园,4008-659-600,,
一号家居网            ,南昌市青山湖区上海路699文化创意园,4008-659-600,,
春满人间装饰玉林分公司            ,广西省玉林市东门商业广场17楼,4008-659-600,,
迪赞设计空间            ,南昌市井冈山大道名爵公馆,4008-659-600,,
南昌实创家居装饰            ,南昌市洪城路6号新华都购物广场3楼,4008-659-600,,
江西翔海装饰工程有限公司            ,,4008-659-600,,
一号家居网南昌站            ,江西省南昌市青山湖区上海路699文化创意园,4008-659-600,,
艺可易装            ,南江街道金港金安路口,4008-659-600,,
美伦装饰            ,城站路6号(协同医院对面2楼),4008-659-600,,
玉林一条龙装饰有限公司            ,广西壮族自治区 玉林市 市辖区 玉林市高级...,4008-659-600,,
九艺.三星装饰玉林分公司            ,玉林市民主南路326号,4008-659-600,,
私人订制装饰            ,广西博白县人民中路365号私人订制家居馆（...,4008-659-600,,
玉林市堡澜装饰工程有限公司            ,,4008-659-600,,
广西胜文装饰工程有限公司            ,广西壮族自治区玉林市玉州区江南路228号香...,4008-659-600,,
艺可易装            ,南江街道金港金安路口,4008-659-600,,
美伦装饰            ,城站路6号(协同医院对面2楼),4008-659-600,,
玉林一条龙装饰有限公司            ,广西壮族自治区 玉林市 市辖区 玉林市高级...,4008-659-600,,
九艺.三星装饰玉林分公司            ,玉林市民主南路326号,4008-659-600,,
私人订制装饰            ,广西博白县人民中路365号私人订制家居馆（...,4008-659-600,,
玉林市堡澜装饰工程有限公司            ,,4008-659-600,,
天美宅装饰材料            ,广西省玉林市人民东路221号,4008-659-600,,
嘉多福装饰工程有限公司            ,民主路551号桂平路口（汽车北站正对面）,4008-659-600,,
玉林市星艺装饰            ,玉林市人民中路1号凯旋世纪广场A座10楼,4008-659-600,,
广西胜文装饰工程有限公司            ,玉林市玉州区江南路228号香港城A幢628...,4008-659-600,,
南庭艺筑装饰工程设计有限公司玉林分公司            ,玉林市九岭路785号光大东方一品商住小区1...,4008-659-600,,
品匠装饰集团玉林分公司            ,玉林市金玉路377号万昌东方巴黎商住小区1...,4008-659-600,,
广东星艺装饰            ,,4008-659-600,,
玉林市绣美装饰工程有限公司            ,玉林市玉州区清淳路146-148号,4008-659-600,,
广东星艺装饰集团广西有限公司玉林分公司            ,,4008-659-600,,
玉林市峻丽装饰有限公司            ,玉林市中环大厦A座622-623,4008-659-600,,
广西靓家装装饰工程有限公司            ,玉林市玉州区玉福路口往博白方向50米,4008-659-600,,
玉林市凯文装饰设计工程有限公司            ,中药港中港路银丰世纪城斜对面,4008-659-600,,
广西品匠装饰工程集团有限公司玉林分公司            ,玉林市金玉路377号万昌东方巴黎商住小区1...,4008-659-600,,
家装e站玉林站            ,广西玉林市玉州区建林路路口、玉州国税对面,4008-659-600,,
广东帝豪装饰工程有限公司玉林分公司            ,玉林市教育东路65号二楼,4008-659-600,,
玉林索美装饰工程有限公司            ,广西玉林市玉州区人民东路279号 ,4008-659-600,,
玉林世匠豪装装饰工程有限公司            ,玉林市,玉州区,江滨路36豪,4008-659-600,,
格姆装饰有限公司            ,广西玉林市望江花园15-11,4008-659-600,,
广东星艺装饰集团广西有限公司玉林分公司            ,人民中路凯旋世纪广场A座10楼,4008-659-600,,
玉林市美邦装饰设计工程有限公司            ,玉林市一环北路413号,4008-659-600,,
嘉祺装饰设计工程有限公司            ,凯旋世纪广场A栋7楼,4008-659-600,,
美星装饰集团            ,南昌,4008-659-600,,
鲁班装饰设计有限公司            ,南昌,4008-659-600,,
交换空间装饰有限公司            ,南坪会展中心9玺国际8栋,4008-659-600,,
明翔装饰设计有限公司            ,广西玉林市一环东路建民街41号（第四加油站...,4008-659-600,,
玉林市华业鸿图装饰设计工程有限公司            ,广西玉林市民主中路96号城市便捷酒店二楼,4008-659-600,,
广西品匠家居装饰工程有限公司玉林分公司            ,玉林市金玉路377号东方巴黎18.19栋0...,4008-659-600,,
名匠装饰有限公司            ,南昌市洪都中大道隆鑫广场a4栋103铺,4008-659-600,,
玉林都市经典装饰工程有限公司            ,玉林市玉州区广场东路295号（市社保局对面...,4008-659-600,,
玉林市简美装饰设计有限公司            ,广场东路31号（老兵饭店旁）,4008-659-600,,
江西苹果装饰-江西苹果装饰(旗舰店)            ,江西省南昌市西湖区洪城路丽都广场a栋苹果装...,4008-659-600,,
实创家居装饰集团有限公司            ,青云谱洪都洪城路6号国贸广场13层,4008-659-600,,
