眉县横鑫装饰 ,宝鸡市眉县眉坞大道江河凯旋城6号,13289392779,9392779,
 市壹凡装饰工程有限公司            ,宝鸡市大庆路凯旋城5号楼1017室,4008-659-600,,
谛景装饰工程有限公司            ,宝鸡市金台区陈仓园市民中心地下广场,4008-659-600,,
陕西交换空间装饰工程有限公司            ,宝鸡市渭滨区高新四路万润国际广场4楼商铺,4008-659-600,,
陕西惟肯装饰设计工程有限公司            ,陕西省宝鸡市高新区高新四路融金国际十楼,4008-659-600,,
园景装饰工程有限公司            ,宝鸡市公园南路仁和公园华府小区2号楼三层商...,4008-659-600,,
市居美装饰设计工程有限公司            ,宝鸡市火炬路28号华夏盛世佳园12#-1-...,4008-659-600,,
陕西爱尚美居装饰工程有限公司分公司            ,宝鸡市高新五路城际酒店南侧,4008-659-600,,
欣龙装潢有限公司            ,宝鸡市陈仓区千渭大明宫建材城A7-34号,4008-659-600,,
居美家装饰设计有限公司            ,宝鸡市陈仓区盛馨苑5号楼一单元1603号,4008-659-600,,
艺轩装饰工程有限公司            ,宝鸡市唐村,4008-659-600,,
柏林装饰工程有限公司            ,宝鸡市金台区,4008-659-600,,
市派晨装饰工程有限公司            ,宝鸡金台区上马营服装城215,4008-659-600,,
市金台区别居一格装饰设计事务所            ,金台区陈仓大道8号红星美凯龙,4008-659-600,,
苏扬名匠装饰            ,宝鸡市蟠龙大道,4008-659-600,,
城市人家装饰公司            ,陕西省宝鸡市渭滨区火炬路东段6号（体育场南...,4008-659-600,,
首姓装饰            ,眉县首善镇,4008-659-600,,
豪庭装饰工程有限公司            ,,4008-659-600,,
波涛装饰设计工程有限公司            ,宝鸡市凤翔县,4008-659-600,,
陕西斑马设计装饰工程有限公司            ,宝鸡市高新区五路财富大厦,4008-659-600,,
市开远艺术装饰有限公司            ,宝鸡市陈仓大道三迪广场186栋B座804室,4008-659-600,,
南昌鲁公大宅装饰工程公司            ,南昌市八一广场丽华购物广场6楼,4008-659-600,,
陕西万和建业建筑装饰工程有限公司            ,宝鸡市眉县万和建业装饰,4008-659-600,,
城市人家装饰有限公司             ,陕西省宝鸡市高新开发区火炬路6号院（中房和...,4008-659-600,,
测试用            ,,4008-659-600,,
东尚大宅装饰工程有限公司            ,陕西省 宝鸡市 渭滨区 高新左岸新城22#...,4008-659-600,,
艺凡装饰装修有限公司            ,陕西省宝鸡市东高新天玺路德福世家底商4F,4008-659-600,,
星艺装饰有限公司            ,宝鸡市金台大道万众家居城南二楼星艺装饰公司,4008-659-600,,
众可装饰工程有限公司            ,金台大道世纪荟萃B座西单元2201室,4008-659-600,,
实创家居装饰集团有限公司            ,青云谱洪都洪城路6号国贸广场13层,4008-659-600,,
市龙凤图装饰工程有限公司            ,宝鸡市金台区金台大道西部阳光建材城509室,4008-659-600,,
