石河子市恒宇装饰商行 ,石河子温州商城C8栋2楼东方邦太全屋定制,13369930818,2657822,
石河子市美艺雅装饰有限公司 ,石河子市开发区东五路58小区46-A号,15009935627,2851111,
石河子开发区鸿扬百盛装饰装修工程有限公司 ,新疆石河子开发区乌伊东路111-C号G栋4...,13899525139,2071977,
嘉禾铭典装饰工程有限公司            ,石河子天津路气象卫星地面站高层1号楼1单元...,4008-659-600,,
立方居装饰设计有限公司            ,石河子美居物流园L座8-1104(美居友好...,4008-659-600,,
糖巢装饰有限责任公司            ,石河子中湾街金坤C区27号楼6单元401室,4008-659-600,,
鲁班装饰设计有限公司            ,南昌,4008-659-600,,
华丽景轩装饰设计有限公司            ,石河子长沙路158号绿苑雅筑小区,4008-659-600,,
嘉鼎盛装饰有限公司            ,石河子美林花源北区直排1-4-1002,4008-659-600,,
交换空间装饰有限公司            ,石河子市开发区,4008-659-600,,
天佑兴业装饰设机构工程有限公司            ,石河子昆明路518号阳光天和综合楼15-1...,4008-659-600,,
创想饰界建筑装饰工程有限公司            ,石河子长春南路美林花源南区1号楼4单元50...,4008-659-600,,
实创家居装饰集团有限公司            ,石河子  开发区,4008-659-600,,
青苹果乐园装饰工程有限公司            ,石河子鲤鱼山路1166号鸿祥雅轩二楼办公区,4008-659-600,,
金乐美居建筑装饰工程有限公司            ,石河子长春中路锦城大厦，锦城丽苑1-3-7...,4008-659-600,,
新疆疆工国际装饰工程有限公司            ,石河子天津南路银苑商务楼18层,4008-659-600,,
万嘉禾装饰有限公司            ,石河子开发区长沙路1号美林阁小区1号楼1单...,4008-659-600,,
新疆硕天装饰股份有限公司            ,温州商城G栋农业银行三楼,4008-659-600,,
新疆铭诚艺鼎装饰有限公司            ,新疆乌鲁木齐市新市区长春南路蓝调一品C区1...,4008-659-600,,
 ,,4008-659-600,,
万嘉宏图装饰工程有限公司            ,乌鲁木齐市市沙依巴克区西山路156队小区1...,4008-659-600,,
新疆继伟彩诗建筑装饰工程有限公司            ,乌市喀什东路五建市场A-16号,4008-659-600,,
新疆六度空间装饰设计有限公司            ,乌鲁木齐市天津路188号银苑商住A座一单元...,4008-659-600,,
新疆精典伟业装饰设计有限公司            ,新疆乌鲁木齐新市区河北东路966号康城果岭...,4008-659-600,,
南昌道艺装饰有限公司            ,南昌市红谷滩万达中心写字楼B2-814,4008-659-600,,
阔达建筑装饰工程有限责任公司            ,北京市海淀区西三环北路87号国际财经中心c...,4008-659-600,,
三维阳光装饰设计工程有限公司            ,乌鲁木齐长春路友好时尚购物B座旁美林花源锦...,4008-659-600,,
嘉祺装饰设计工程有限公司            ,,4008-659-600,,
创艺时代装饰有限公司            ,乌鲁木齐市长沙路158号绿苑雅筑7号楼1单...,4008-659-600,,
惠巢装饰有限公司            ,乌市长沙路美林阁小区1栋1单元803室,4008-659-600,,
新疆快捷龙盟装饰有限公司            ,新疆乌鲁木齐北京路二宫新华联大厦B座13层,4008-659-600,,
新疆黎源建筑装饰设计有限公司            ,小西沟肿瘤医院旁边阳光天和1305和230...,4008-659-600,,
新疆惠盛天祥家装设计有限公司            ,新疆乌鲁木齐市沙依巴克区西虹西路666号绿...,4008-659-600,,
