华庭豪宅装饰工程公司            ,市中区阳光新路与卧龙路交叉口向南500米路...,4008-659-600,,
金尚装饰工程有限公司            ,历城区二环东路嘉恒商务大厦B座一二楼,4008-659-600,,
巨强装饰工程有限公司            ,济南天桥区西泺河路9号,4008-659-600,,
居联峰尚装饰工程有限公司            ,经六路和营市街交叉口往北100米路西独栋5...,4008-659-600,,
山东世宽装饰工程有限公司            ,济南市历下区解放东路中弘广场D座7层,4008-659-600,,
北京新洲装饰            ,济南天桥区无影山北路87号月星家居,4008-659-600,,
九创装饰工程有限公司            ,二环东路东环国际广场A座,4008-659-600,,
美宅装饰工程有限公司            ,济南市历下区舜华路三庆世纪财富中心B2座2...,4008-659-600,,
山东美织巢装饰工程有限公司            ,济南市历城区花园路67号(金马丽晶5楼),4008-659-600,,
山东大本装饰工程有限公司            ,华能路与华阳路交汇处汇隆广场汇阳大厦14楼,4008-659-600,,
森淼装饰设计有限公司            ,历黄路豪鲁电子商厦1329室,4008-659-600,,
罗维装饰工程有限公司            ,济南历下区解放东路东口鲁商国奥城4座5楼,4008-659-600,,
苹果装饰设计工程有限公司            ,济南市历下区趵突泉北路1号开元广场B座5楼...,4008-659-600,,
北京乐上名都装饰工程有限公司分公司            ,历城区华能路汇能大厦27层,4008-659-600,,
山东鲁颂建筑装饰工程有限公司            ,济南市槐荫区绿地中央B-903,4008-659-600,,
山东省装饰集团总公司            ,济南市历下区黄金时代广场E座4层,4008-659-600,,
山东绿橙装饰工程有限公司            ,济南天桥区少年路2号鲁丰纸业院内绿橙装饰,4008-659-600,,
雷鸣装饰工程有限公司            ,济南市历城区舜华南路与龙奥北路东北角，汉峪...,4008-659-600,,
万泰建筑装饰工程有限公司            ,总部设计中心 望岳路1号 ,4008-659-600,,
山东九泰装饰工程有限公司            ,济南市天桥区北园大街欧亚达家居商场3楼,4008-659-600,,
华美家居            ,济南市天桥区北园大街大明家居1楼A-36,4008-659-600,,
博洛尼整体家装            ,泺源大街229号杆石桥金龙大厦,4008-659-600,,
济南坤峰装饰工程有限公司            ,山东济南章丘明珠东街北段路西,4008-659-600,,
济南泽喜缘建筑装饰工程有限公司            ,山东济南章丘区铁道北路与车站街交叉口西北角,4008-659-600,,
比特福装饰工程有限公司            ,济南市银座晶都国际B座3509,4008-659-600,,
威廉装饰工程有限公司            ,济南市槐荫区经十路23899号建邦大厦5楼...,4008-659-600,,
新洲装饰设计有限公司            ,二环东路与华龙路交口嘉恒大厦a座3楼,4008-659-600,,
弘德装饰设计工程有限公司            ,花园路189号历下软件园c座210室,4008-659-600,,
山东国宏装饰工程有限公司            ,高新区舜华南路重汽科技大厦东100米路南,4008-659-600,,
山东浙南大地装饰工程有限公司            ,高新区经十路舜华南路汉峪金谷商务中心,4008-659-600,,
爱宜空间装饰            ,济南槐荫区经一路333号保利中心A座1-1...,4008-659-600,,
正泰装饰设计有限公司            ,经七路汇统大厦A座9层,4008-659-600,,
