自贡市梵舍装饰工程有限公司 ,汇川路林涧美墅19栋1楼2号铺(军分区大门...,18180133208,5200665,
自贡艺佳宜装饰工程有限公司 ,汇东路幸福宾馆旁幸福木业二楼,18227735851,8694468,
自贡鹏飞装饰有限责任公司 ,四川省自贡市自流井区丹阳大道2号普润产业博...,15008103558,8201569,
城市人家装饰有限公司            ,四川省 自贡市 自流井区 汇川路远达都市森...,4008-659-600,,
跃翔设计装饰            ,自贡汇东板仓街道华立装饰城4楼,4008-659-600,,
鲁班装饰设计有限公司            ,南昌,4008-659-600,,
自贡市博雅装饰有限责任公司            ,四川 自贡 荣洲大道一段澳门花园3楼,4008-659-600,,
自贡筑美天成装饰            ,四川省自贡市自流井区汇东路华立装饰城四楼,4008-659-600,,
聚划算装饰工程            ,自流井区汇川路新加坡花园正门(建行楼上),4008-659-600,,
龙发装饰集团            ,汇东板仓阳明东路71号金涛国际a座,4008-659-600,,
自贡市名匠装饰设计工程有限公司            ,汇川路名匠装饰设计公馆(南湖体育馆对面),4008-659-600,,
四川德莱美装饰工程有限公司            ,自贡市高新区华商国际城4号楼4楼,4008-659-600,,
梵舍装饰            ,自贡市汇川路军分区正对面(林涧美墅19-1...,4008-659-600,,
成都名品装饰自贡分公司            ,自贡市自流井区汇东路华英都市尚城4楼(妙观...,4008-659-600,,
美家装饰生活馆            ,创兴城嘻哈乐园,4008-659-600,,
自贡粤派装饰设计高端会所            ,自贡南湖水岸豪庭3号门旁,4008-659-600,,
成都名品装饰自贡分公司            ,四川省自贡市自流井区汇东路妙观寺旁华英都市...,4008-659-600,,
艺品华庭装饰有限公司            ,自贡市汇川路翰林尚都大门中国银行正对面,4008-659-600,,
自贡市鑫诚装饰工程有限公司            ,沿滩新城龙湖郡,4008-659-600,,
自贡名匠装饰设计工程公司            ,自贡南湖体育场旁,4008-659-600,,
自贡市舒安装饰有限公司            ,自贡市龙湖创兴城26-1-22铺,4008-659-600,,
南昌市轩仝宇装饰工程有限公司            ,江西省南昌市西湖区子安路89号1602,4008-659-600,,
金芒果装饰集团            ,江西省吉安市吉州区广场北路1号(新世界广场...,4008-659-600,,
南昌三帝装饰设计有限公司            ,南昌市青山湖区洪都北道299号高能金域名都...,4008-659-600,,
南昌林涵设计            ,林涵设计,4008-659-600,,
 ,,4008-659-600,,
自贡中顺安全技术有限公司            ,,4008-659-600,,
自贡名品装饰豪装工厂店            ,汇川路林涧美墅19栋1楼2号铺,4008-659-600,,
自贡创净环保科技有限公司            ,,4008-659-600,,
自贡嘉美净环保科技有限公司            ,,4008-659-600,,
自贡粤派装饰设计高端会所            ,,4008-659-600,,
自贡市飞鹰装饰责任有限公司            ,自贡市华丽装饰城四楼 飞鹰装饰,4008-659-600,,
粤派装饰设计高端会所            ,,4008-659-600,,
成都名品装饰自贡分公司            ,自贡市汇东路妙观寺旁华英都市尚城4楼,4008-659-600,,
上德名典装饰工程有限公司            ,,4008-659-600,,
时线装饰设计公司            ,南湖国际社区6栋1单元13楼138号,4008-659-600,,
德莱美装饰公司            ,旭水大道南三段388号打电话请打手机座机报...,4008-659-600,,
缅甸银河国际集团            ,昆明市北京路时光俊园,4008-659-600,,
自贡惠尔美装饰工程有限公司            ,自贡市自流井区川普润城A3区1栋3楼,4008-659-600,,
自贡锦华装饰有限公司            ,自流井区丹阳大道普润城A3-3-(2-5),4008-659-600,,
天猫.家装e站.自贡站            ,自流井区普润电商博览城A4区一栋四楼,4008-659-600,,
自贡冠盛装饰            ,自贡市自流井区泰丰大厦8楼10号,4008-659-600,,
华浔品味装饰            ,四川省 自贡市 自流井区 汇川路远达都市森...,4008-659-600,,
梵古装饰工程            ,自贡市自流井区同兴路40号五楼,4008-659-600,,
自贡易尚装饰            ,四川省 自贡市 市辖区 四川省自贡市大安区...,4008-659-600,,
兴元装饰            ,自贡市自流井区新街新世纪广场西南区五楼门牌...,4008-659-600,,
阔达建筑装饰工程有限责任公司            ,北京市海淀区西三环北路87号国际财经中心c...,4008-659-600,,
自贡鲁公大宅装饰            ,自贡市汇西路中国人民银行总行正对面,4008-659-600,,
南昌实创美家装饰            ,南昌市西湖区站前西路289号三星大厦B座1...,4008-659-600,,
嘉祺装饰设计工程有限公司            ,,4008-659-600,,
星艺装饰有限公司            ,南昌市北京东路·恒茂国际都会...,4008-659-600,,
波涛装饰公司            ,高新区南二环西段财富中心,4008-659-600,,
南国风装饰工程有限工司            ,青山湖南大道墅溪园,4008-659-600,,
广州市华宁装饰工程有限公司南昌分公司            ,江西省南昌市西湖区广润门三区37栋1号,4008-659-600,,
自贡思晨装饰            ,四川省 自贡市 自流井区 汇川路316号汇...,4008-659-600,,
 ,,4008-659-600,,
南昌道艺装饰有限公司            ,南昌市红谷滩万达中心写字楼B2-814,4008-659-600,,
华浔品味装饰            ,东路鹿鼎家居4楼b馆,4008-659-600,,
