红叶装饰工程有限公司            ,宿州市中豪国际博览城西区30栋,4008-659-600,,
金叶装饰公司            ,宿州市 埇桥区 中豪北大门20栋,4008-659-600,,
绿森林装饰装饰工程公司            ,宿州市 埇桥区 金茂商城12楼1203室,4008-659-600,,
安徽久盛装饰工程有限公司            ,宿州市中豪国际博览城33栋5-6号,4008-659-600,,
百盛装饰工程有限公司            ,宿州市 西昌北路天鹅湾79幢102室,4008-659-600,,
天猫家装e站            ,安徽省  宿州市 埇桥区  拂晓大道   ...,4008-659-600,,
品冠创意装饰有限公司            ,宿州市中豪建材博览城18栋,4008-659-600,,
市家俊装饰工程有限公司            ,意邦国际家居品牌中心西门1栋108号,4008-659-600,,
名匠装饰萧县分公司            ,,4008-659-600,,
名匠装饰萧县分公司            ,,4008-659-600,,
品冠创意装饰有限公司            ,宿州市中豪建材博览城18栋,4008-659-600,,
市家俊装饰工程有限公司            ,意邦国际家居品牌中心西门1栋108号,4008-659-600,,
名匠装饰萧县分公司            ,,4008-659-600,,
名匠装饰萧县分公司            ,,4008-659-600,,
居然之家装饰工程有限公司            ,,4008-659-600,,
宿州市筑本装饰工程有限公司            ,安徽省 宿州市 埇桥区 安徽省宿州市三八办...,4008-659-600,,
宿州禾木建筑装饰工程有限公司            ,安徽省 宿州市 埇桥区 拂晓大道光彩城西门...,4008-659-600,,
水中月装饰工程有限公司            ,宿州市银河二路港利商业街向东100米,4008-659-600,,
宿州市华浔品味装饰工程有限公司            ,埇桥区汴河路财富广场9栋一单元13层(原老...,4008-659-600,,
鲁班装饰设计有限公司            ,南昌,4008-659-600,,
简居装饰有限公司            ,光彩城B区15#13、14号,4008-659-600,,
九宫阁装饰工程有限公司            ,埇桥区 胜利西路华龙大市场九宫阁装饰,4008-659-600,,
美星装饰集团            ,南昌,4008-659-600,,
宿州尚徽装饰工程有限公司            ,安徽省宿州市埇桥区汴河路财富广场8栋302,4008-659-600,,
泗县唯品建筑装饰工程有限公司            ,安徽省宿州市泗县桃花源北区东门,4008-659-600,,
宿州祥涛装饰工程有限公司            ,安徽省 宿州市 市辖区 中豪国际商业博览城...,4008-659-600,,
宿州水木石建筑装饰工程有限公司            ,埇桥区汴河中路金茂大厦503室,4008-659-600,,
七彩石装饰设计工程有限公司            ,宿州市中豪国际博览城3#327-329,4008-659-600,,
金匠装饰工程有限公司            ,宿州市 埇桥区 中豪国际博览城46栋,4008-659-600,,
品帜装饰工程有限公司            ,两准新城D区1104室,4008-659-600,,
三星装饰有限公司            ,埇桥区汴河路财富广场9栋8层,4008-659-600,,
