湖北建嘉装饰工程有限公司 ,湖北省蕲春县蕲春大道欧亚达建材家居广场5楼...,13317174189,7878988,
易尚国际装饰有限公司            ,新港大道与赤壁大道交汇处东正大厦 ,4008-659-600,,
黄冈嘉禾装饰工程有限公司            ,黄冈市黄州区赤壁大道翡翠一品大门右侧,4008-659-600,,
北京吉诚装饰-分公司            ,黄州大道宇济一号正门左侧,4008-659-600,,
北京海天环艺家居装饰有限公司分公司            ,湖北省黄冈市黄州区西湖三路教育小区,4008-659-600,,
一号家居网站            ,湖北省黄冈市黄州区黄州大道江岸名都,4008-659-600,,
澳华装饰工程有限公司            ,湖北省黄冈市黄州区黄冈宝塔大道43号盐业大...,4008-659-600,,
武汉丽泰装饰设计有限公司黄州分公司            ,黄州区青砖湖路恒富公馆一楼商铺(西湖三路大...,4008-659-600,,
嘉祺装饰设计工程有限公司            ,黄冈新港大道35号,4008-659-600,,
湖北三米装饰工程设计有限公司            ,黄冈市黄州区宝塔大道66号就业大厦605室,4008-659-600,,
三星装饰有限公司            ,南昌市八一大道436号,4008-659-600,,
名匠装饰有限公司            ,黄州区赤壁大道103,4008-659-600,,
湖北楚匠装饰有限公司            ,黄冈市明珠大道(中心三楼),4008-659-600,,
湖北双舟建筑装饰工程公司            ,黄冈市黄州区东坡大道(东坡外滩C-1座三楼,4008-659-600,,
广东星艺装饰集团湖北有限公司分公司            ,青砖湖路12号,4008-659-600,,
团风鸿翔装饰设计有限公司            ,团风县崩坡路26号,4008-659-600,,
黄冈金碧华叶建筑装饰设计工程有限公司，            ,黄州区西湖一路振泰公寓A4门(小蚂蚁超市对...,4008-659-600,,
团风太运装饰有限公司            ,钢材市场c1-1 c15 c16 c17,4008-659-600,,
湖北杰作装饰工程有限公司            ,湖北省黄冈市黄州区西湖一路宝塔大厦二楼,4008-659-600,,
武汉新博装饰工程有限公司分公司            ,黄冈市黄州区体育路26号,4008-659-600,,
鲁公大宅装饰工程公司            ,湖北省蕲春县蕲春大道欧亚达建材家居广场5楼,4008-659-600,,
江西苹果装饰-江西苹果装饰(旗舰店)            ,江西省南昌市西湖区洪城路丽都广场a栋苹果装...,4008-659-600,,
星梦装饰工程有限公司            ,黄州区黄州大道87号,4008-659-600,,
鲁班装饰设计有限公司            ,南昌,4008-659-600,,
美星装饰集团            ,南昌,4008-659-600,,
元和装饰有限公司            ,黄冈市黄州区三清国际华城家具城E区47号二...,4008-659-600,,
实创家居装饰集团有限公司            ,湖北省蕲春县蕲春大道欧亚达建材家居广场5楼,4008-659-600,,
星艺装饰有限公司            ,湖北省蕲春县蕲春大道欧亚达建材家居广场5楼...,4008-659-600,,
波涛装饰设计公司            ,黄冈黄州南二环西段财富中心24楼,4008-659-600,,
泽园装饰工程有限公司            ,蕲春县天际上城A区8-36#,4008-659-600,,
