湖北奥朗装饰设计工程有限公司 ,襄阳市樊城区前进路29号乐居广场一楼门面,18062819911,3595968,
襄阳精工艺匠装饰有限公司 ,襄阳市樊城区团山镇长虹北路66号妞妞大厦1...,15971442477,3322251,
襄阳百宝阁装饰工程有限公司 ,襄阳市邓城大道星鸿天贸城设计之都2号馆4楼...,13797608989,3358009,
湖北百聚装饰设计工程有限公司 ,襄阳襄城区,15587702888,7702888,
上海居奥装饰襄阳分公司 ,湖北省襄阳市樊城区樊魏路红星美凯龙对面民发...,18327521099,7521099,
襄阳艺尚丰装饰工程有限公司 ,襄阳市经开区东津世纪城7区25-103号,18986339984,2535686,
襄阳铭匠装饰 ,樊城区建设西路21号亚奇针织股份有限公司2...,18986365240,6365240,
襄阳兴家建筑装饰工程有限公司 ,襄阳市樊城区前进路前锦公寓703,13387236788,3333978,
武汉江南美装饰设计工程有限公司襄阳分公司 ,襄阳市樊城区中原路华丽世家二楼(客运站对面...,15172406567,3066800,
襄阳自家建筑装饰有限公司            ,湖北省 襄阳市 襄州区 交通路与航空路交界...,4008-659-600,,
襄阳丰艺轩建筑装饰设计有限公司            ,钻石大道与东风汽车大道交叉口车城广场后 锦...,4008-659-600,,
襄阳精诚富华装饰设计工程有限公司            ,车城路口东风汽车大道特1号锦绣东风汽配城1...,4008-659-600,,
襄阳洪亮建筑装饰有限公司            ,湖北省襄阳市襄州区航空路115号经信局二楼,4008-659-600,,
襄阳凯盛建筑装饰设计工程有限公司            ,复兴天贸城2号馆4楼设计之都,4008-659-600,,
枣阳佰怡家装饰工程有限公司            ,新华路69号(三中红绿灯南20米),4008-659-600,,
湖北艺展宏图建筑装饰有限公司            ,邓城大道国际创新产业基地118号门面,4008-659-600,,
襄阳博大同途装饰有限公司            ,襄阳市襄城区檀溪路山水檀溪秀园d-1栋2楼,4008-659-600,,
襄阳明盛装饰有限公司            ,湖北省襄阳市樊城区前进路世纪金源写字楼a7...,4008-659-600,,
襄阳市深度装饰工程有限公司            ,邓城大道49号国际创新产业基地7栋1-13...,4008-659-600,,
湖北美和世家装饰工程有限公司            ,襄州区航空路英伦华府7-104门面(冯营站...,4008-659-600,,
 襄阳曦子装饰设计工程有限公司            ,襄阳市长虹路蓝光大厦5178--5198室...,4008-659-600,,
 襄阳曦子装饰设计工程有限公司            ,襄阳市长虹路蓝光大厦5178--5198室...,4008-659-600,,
襄阳雅美居装饰工程有限公司            ,襄阳市樊城区前进路世纪金源写字楼901室,4008-659-600,,
金陵装饰盛特国际设计            ,民发盛特区A座15层,4008-659-600,,
金丽景装饰工程有限公司            ,湖北 襄阳市襄城区 八一七中路888号金马...,4008-659-600,,
金丽景装饰工程有限公司            ,湖北 襄阳市襄城区 八一七中路888号金马...,4008-659-600,,
广东星艺装饰有限公司            ,天河区体育东路116号财富广场东塔十楼(地...,4008-659-600,,
广东星艺装饰有限公司            ,天河区体育东路116号财富广场东塔十楼(地...,4008-659-600,,
襄阳艺之峰装饰有限公司            ,襄阳市襄州区民发世界城学院派旁,4008-659-600,,
金派美景装饰设计工程有限公司            ,高新区东湖国际花园大门口313,4008-659-600,,
襄阳金派美景装饰设计工程有限公司            ,高新区环城湖北路旺前国际花园一期大门口31...,4008-659-600,,
美和世家室内建筑装饰设计连锁机构            ,襄州区车城南路英伦华府临街商铺7-109,4008-659-600,,
北京海天装饰襄阳分公司            ,万达加油站对面（长虹首府二楼）,4008-659-600,,
襄阳品尚居装饰工程有限公司            ,荆州街,4008-659-600,,
襄阳市生活家装饰工程有限公司            ,襄阳市长虹北路中房七彩阳光115号,4008-659-600,,
金枫叶装饰公司            ,襄樊市樊城区春园路20号,4008-659-600,,
金枫叶装饰公司            ,襄樊市樊城区春园路20号,4008-659-600,,
襄阳丰艺轩建筑装饰设计有限公司            ,襄阳市襄州区钻石大道与东风汽车大道交汇处锦...,4008-659-600,,
襄阳加气块隔墙施工            ,襄阳市襄州区车城南路,4008-659-600,,
襄阳万众城装饰            ,,4008-659-600,,
襄阳明盛装饰有限公司            ,樊城区前进路世纪金源写字楼706室,4008-659-600,,
襄阳恒磊装饰工程有限公司            ,襄阳市樊城区长汉路,4008-659-600,,
襄阳平安居装饰            ,襄阳市樊城区朝阳路10号泰跃朝阳小区,4008-659-600,,
加气块隔墙施工            ,襄阳市,4008-659-600,,
三加智能装饰            ,大庆西路,4008-659-600,,
老河口市新特装饰            ,北京路20号（赞扬办事处斜对面）,4008-659-600,,
老河口市新特装饰            ,北京路20号（赞扬办事处斜对面）,4008-659-600,,
盛世佳博装饰            ,,4008-659-600,,
襄阳万众城装饰            ,,4008-659-600,,
襄阳明盛装饰有限公司            ,樊城区前进路世纪金源写字楼706室,4008-659-600,,
襄阳恒磊装饰工程有限公司            ,襄阳市樊城区长汉路,4008-659-600,,
襄阳平安居装饰            ,襄阳市樊城区朝阳路10号泰跃朝阳小区,4008-659-600,,
加气块隔墙施工            ,襄阳市,4008-659-600,,
三加智能装饰            ,大庆西路,4008-659-600,,
老河口市新特装饰            ,北京路20号（赞扬办事处斜对面）,4008-659-600,,
爱家。装修顾问            ,邓城大道襄阳新城A区,4008-659-600,,
映像设计事务所            ,枣阳市沿河路龙公馆售楼部旁,4008-659-600,,
金派美景装饰设计公司            ,湖北省襄阳市高新区东湖国际花园313,4008-659-600,,
盛世佳博装饰            ,,4008-659-600,,
三米一装饰有限公司            ,樊城,4008-659-600,,
襄阳恒磊装饰工程有限公司            ,襄阳市樊城区长汉路,4008-659-600,,
湖北福汇通建设工程有限公司            ,汉江路与人民路交界处(汉江商务酒店旁),4008-659-600,,
襄阳梦家园装饰            ,,4008-659-600,,
深圳原创装饰公司 襄阳分公司            ,樊城大庆西路37号（二桥头原老火柴厂）,4008-659-600,,
三加智能装饰            ,大庆西路,4008-659-600,,
泰银墙材有限公司            ,樊城区,4008-659-600,,
爱家。装修顾问            ,邓城大道襄阳新城A区,4008-659-600,,
映像设计事务所            ,枣阳市沿河路龙公馆售楼部旁,4008-659-600,,
襄阳精艺特装饰            ,,4008-659-600,,
湖北环宇鼎丰装饰工程有限公司            ,湖北省襄阳市樊城区邓城大道与樊魏路交汇处红...,4008-659-600,,
三米一装饰有限公司            ,樊城,4008-659-600,,
襄阳百姓装饰            ,,4008-659-600,,
湖北诚信源装饰设计工程有限公司            ,襄阳市朝阳路烟厂对面,4008-659-600,,
深圳原创装饰公司 襄阳分公司            ,樊城大庆西路37号（二桥头原老火柴厂）,4008-659-600,,
赤城装饰有线公司            ,襄樊,4008-659-600,,
泰银墙材有限公司            ,樊城区,4008-659-600,,
襄阳印象空间装饰            ,襄阳市襄州区民发世界城旁,4008-659-600,,
襄阳精艺特装饰            ,,4008-659-600,,
老河口市新特装饰            ,北京路20号（赞扬办事处斜对面）,4008-659-600,,
天盛嘉装饰有限公司            ,襄阳老河口北京路中山大市场对面,4008-659-600,,
湖北元英装饰工程有限公司            ,,4008-659-600,,
襄阳嘉禾装饰            ,襄阳市邓城大道翰林世家1号楼3楼,4008-659-600,,
兄弟装饰            ,襄阳=樊城区；高新区；侨峰市场；38栋；9...,4008-659-600,,
湖北皇佳装饰设计工程有限公司            ,湖北省 襄阳市 樊城区 襄阳市高新区长虹北...,4008-659-600,,
襄阳丹图装饰有限公司            ,,4008-659-600,,
襄阳易居大木装饰工程设计有限公司            ,襄阳市高新区钻石大道与东风汽车大道交汇处锦...,4008-659-600,,
湖北元易建筑装饰工程有限公司            ,襄阳市襄州区航空路17号安达客运站正对面,4008-659-600,,
襄阳艺之峰装饰有限公司            ,,4008-659-600,,
天盛嘉室内装饰            ,襄阳老河口市北京路中山大市场对面,4008-659-600,,
湖北乐万涛电子商务有限公司            ,,4008-659-600,,
湖北美和世家装饰工程有限公司            ,襄州区车城南路英伦华府门面,4008-659-600,,
元译装饰            ,,4008-659-600,,
襄阳嘉禾装饰            ,襄阳市邓城大道翰林世家1号楼3楼,4008-659-600,,
天盛嘉装饰有限公司            ,襄阳老河口北京路中山大市场对面,4008-659-600,,
湖北元英装饰工程有限公司            ,,4008-659-600,,
兄弟装饰            ,襄阳=樊城区；高新区；侨峰市场；38栋；9...,4008-659-600,,
元译装饰            ,,4008-659-600,,
武汉绿康园装饰工程有限公司            ,地 址：武汉市江汉区青年路378号万景国际...,4008-659-600,,
武汉绿康园装饰工程有限公司            ,地 址：武汉市江汉区青年路378号万景国际...,4008-659-600,,
新新生活装饰            ,春园西路火炬大厦13层,4008-659-600,,
新新生活装饰            ,春园西路火炬大厦13层,4008-659-600,,
襄阳红蚂蚁装饰            ,,4008-659-600,,
襄阳红蚂蚁装饰            ,,4008-659-600,,
天立装饰设计            ,襄阳市襄城区二桥头交警四大队旁16号,4008-659-600,,
天立装饰设计            ,襄阳市襄城区二桥头交警四大队旁16号,4008-659-600,,
襄阳满庭芳装饰            ,,4008-659-600,,
襄阳卓源装饰            ,襄阳市,4008-659-600,,
襄阳红昌宏装饰            ,,4008-659-600,,
襄阳金亮装饰            ,,4008-659-600,,
湖北好逸装饰            ,,4008-659-600,,
湖北好逸装饰            ,,4008-659-600,,
襄樊志强装饰            ,,4008-659-600,,
华赢宜家装饰公司            ,/红星美凯龙旁红街三楼008,4008-659-600,,
湖北鼎盛峰装饰工程有限公司            ,湖北省襄阳市襄州区航空路清河口百洋欧典1栋...,4008-659-600,,
襄阳灵秀装饰装璜有限公司            ,三元路传染病医院旁南港写字楼3楼318,4008-659-600,,
襄樊曦子装饰设计工程有限公司             ,襄阳市长虹路蓝光大厦5178--5198室...,4008-659-600,,
襄阳海天环艺装饰工程有限公司            ,襄阳市樊城区卧龙大道旁,4008-659-600,,
襄阳聚创装饰设计有限公司            ,襄阳市樊城区前进路世纪金源大厦7-11室,4008-659-600,,
湖北襄阳金陵建筑装饰实业有限公司            ,襄阳市樊城区长虹路36号（再尔广场加油站旁...,4008-659-600,,
襄阳柒柒巴巴装饰有限公司            ,,4008-659-600,,
襄阳红都装饰            ,,4008-659-600,,
襄阳生活家装饰            ,长虹北路与江山北路交界路口中房楼下 ,4008-659-600,,
湖北楚天华艺建筑装饰工程有限公司            ,湖北省襄阳市襄城区檀溪路国际商都正门左侧入...,4008-659-600,,
湖北元易建筑装饰工程有限公司            ,襄阳市襄州区航空路(清水茗居小区1幢101...,4008-659-600,,
襄阳环雅装饰            ,,4008-659-600,,
湖北景恒装饰工程有限公司            ,襄阳市新世纪家居广场6栋201.202门面,4008-659-600,,
湖北百乐居装饰有限公司            ,襄州区汉津路，紫荆花园小区正大门门店,4008-659-600,,
塞纳春天整体家装            ,襄阳市樊城区卧龙大道环球金融城1号楼7楼,4008-659-600,,
襄阳浩佳莉装饰工程有限公司              ,襄阳市高新区二汽万众太阳城南门（东湖国际花...,4008-659-600,,
湖北宽宅装饰设计有限公司            ,人民西路57号御江苑门面三楼(建行楼上),4008-659-600,,
湖北嘉合品筑装饰设计有限公司            ,湖北省襄阳市高新区邓城大道翰林世家嘉筑装饰,4008-659-600,,
襄城区第七视觉装饰设计工作室            ,襄城区檀溪路国际商都B1区0809号,4008-659-600,,
武汉面对面家居有限公司襄阳分公司            ,襄阳汉中,4008-659-600,,
北京博大同途装饰（襄阳）公司            ,襄阳市襄城区檀溪路山水檀溪秀园D-1栋2楼,4008-659-600,,
襄阳榕庭装饰            ,襄城区胜利街218号(原气象学校内),4008-659-600,,
深度装饰            ,襄阳樊城区,4008-659-600,,
襄樊曦子装饰设计工程有限公司            ,襄阳市长虹路蓝光大厦,4008-659-600,,
满天星装饰            ,襄阳邓成大道,4008-659-600,,
精诚装饰            ,襄阳樊城春园东路,4008-659-600,,
