西宁绿色空间装饰设计有限公司 ,西宁市海湖新区金羚大街25号(金座B区),13897462890,6167499,
青海米兰居装饰设计工程有限公司 ,西宁市西大街世贸大厦20楼2002室,13997189280,5206878,
青海名杰装饰工程有限公司 ,西宁市城北区朝阳东路12号家美家具,18797179161,8112261,
北京宜美家园装饰工程有限公司西宁分公司 ,西宁市长江路103号山水国际办公楼14楼,18997482885,8588738,
西宁居立方装饰工程有限公司            ,西宁市城西西关大街 金羚大道,4008-659-600,,
 北京索美装饰西宁分公司	            ,青海省西宁市海湖新区世通国际7号楼1042...,4008-659-600,,
北京轻舟世纪建筑装饰工程（西宁）有限公司            ,西宁市城西区青海西宁城西区月星建材国际广场...,4008-659-600,,
北京鼎盛丽居装饰有限公司西宁分公司            ,青海省 西宁市 城西区 青海省西宁市城西区...,4008-659-600,,
西宁百佳居装饰有限公司            ,西宁-城中-其他 西大街浩运大厦9层,4008-659-600,,
西安都市时空装饰            ,南二环东段80号翔圆大厦3层,4008-659-600,,
宁夏九鼎日盛装饰工程有限公司西宁分公司            ,西宁市海湖新区金座豪庭B区3号楼即金羚大道...,4008-659-600,,
北京宜美家园装饰公司西宁分公司            ,西宁城中 西宁长江路128号创新大夏18楼,4008-659-600,,
青海慕尚装饰工程有限公司            ,西宁市城东区八一路半岛步行街18-176号,4008-659-600,,
陕西波涛装饰工程有限公司            ,西安市高新二路南二环西段财富中心一期c座9...,4008-659-600,,
陕西九朝装饰工程有限公司            ,西安市凤城四路文景十字海璟蓝寓4楼,4008-659-600,,
西安魔方装饰工程有限责任公司            ,西安市南二环西段100号金叶现代之窗4层,4008-659-600,,
陕西谛尚装饰工程有限公司            ,西安市凤城五路东段紫薇风尚5栋楼一单元18...,4008-659-600,,
西安亮剑装饰工程有限公司            ,西安市雁塔区科技路华奥大厦B座7层,4008-659-600,,
西安景图装饰工程有限公司            ,西安市高新区高新四路金桥国际A座5层,4008-659-600,,
陕西巨晖装饰工程有限公司            ,西安市科技路与白沙路十字通达大厦1109室,4008-659-600,,
西安慧之澜装饰工程有限公司            ,西安未央区凤城8路EE康城(新市委对面)2...,4008-659-600,,
 西宁九创装饰工程有限公司            ,西宁市昆仑西路与海湖路交口夏都景苑3F,4008-659-600,,
西安焕彩装饰工程有限公司            ,西安市高新区唐延南路与锦业二路交汇处逸翠尚...,4008-659-600,,
青海柯普装饰工程有限公司            ,青海省城东区昆仑中路7号舒雅家园4号楼1单...,4008-659-600,,
鑫诚装饰            ,,4008-659-600,,
豪迈门业（湟源店）            ,湟源县湟源火车站斜对面,4008-659-600,,
宏远装饰            ,,4008-659-600,,
西宁麻雀装饰设计有限责任公司            ,,4008-659-600,,
西宁金满堂装饰            ,,4008-659-600,,
西宁市格瑞特装饰有限公司            ,,4008-659-600,,
青海绿盛装饰工程有限公司            ,,4008-659-600,,
青海旭腾装饰工程有限公司            ,,4008-659-600,,
好好装饰            ,,4008-659-600,,
水木永盛建筑装饰工程有限公司            ,,4008-659-600,,
青海宏腾装饰有限公司            ,,4008-659-600,,
西宁龙发装饰公司            ,西宁西大街百货,4008-659-600,,
熊孩纸装饰            ,孩纸装饰,4008-659-600,,
 ,,4008-659-600,,
西宁九鼎日盛            ,,4008-659-600,,
青海旭腾装饰工程有限公司            ,青海省西宁市海湖新区文汇路金座晟锦B区 ,4008-659-600,,
西宁博诚装饰有限公司            ,青海省西宁市城西区五四大街交电大楼5楼,4008-659-600,,
西宁麻雀装饰设计有限责任公司            ,海湖新区西川南路46号三榆山水文苑8号楼1...,4008-659-600,,
缔美装饰            ,,4008-659-600,,
青海绿盛装饰工程有限公司            ,,4008-659-600,,
青海旭腾装饰工程有限公司            ,,4008-659-600,,
青海奥陆装饰装潢设计有限公司            ,,4008-659-600,,
青海尚北装饰工程有限公司            ,,4008-659-600,,
西宁实派装饰装潢有限公司            ,西宁市城中区七一路与长江路交汇处青海湖大厦...,4008-659-600,,
西宁奥德赛广告装饰有限公司            ,,4008-659-600,,
青海恩泰装饰工程有限公司            ,,4008-659-600,,
北京嘉和日盛装饰工程有限公司青海分公司            ,,4008-659-600,,
西宁交换空间装饰有限公司            ,海湖新区文成路16号，海湖星城东门3楼。,4008-659-600,,
西宁左间装饰工程有限公司            ,西宁市五四大街40号交通花苑酒店一楼,4008-659-600,,
西宁业之峰装饰            ,海湖新区金座晟景A区6号楼一楼,4008-659-600,,
青海奥陆装饰装潢设计有限公司            ,,4008-659-600,,
青海尚北装饰工程有限公司            ,,4008-659-600,,
西宁实派装饰装潢有限公司            ,西宁市城中区七一路与长江路交汇处青海湖大厦...,4008-659-600,,
西宁奥德赛广告装饰有限公司            ,,4008-659-600,,
西宁绿色空间装饰            ,,4008-659-600,,
青海尚北装饰工程有限公司            ,,4008-659-600,,
西宁实派装饰装潢有限公司            ,西宁市城中区七一路与长江路交汇处青海湖大厦...,4008-659-600,,
西宁奥德赛广告装饰有限公司            ,,4008-659-600,,
西宁绿色空间装饰            ,,4008-659-600,,
水木永盛建筑装饰工程有限公司            ,城中区西大街42号三田写字楼801室,4008-659-600,,
齐家典尚西宁分公司            ,,4008-659-600,,
青海宗峰建筑装饰有限公司            ,城东区滨河路 滨河小区,4008-659-600,,
业之峰装饰公司            ,,4008-659-600,,
西宁业之峰装饰有限公司            ,城西海湖新区金座A区北门业之峰装饰,4008-659-600,,
西宁无限空间装饰有限公司            ,,4008-659-600,,
西宁无限空间装饰有限公司            ,西宁市西大街西门王府井B馆10楼(莫泰酒店...,4008-659-600,,
西宁方舟佳居装饰有限公司            ,青海省西宁市城中区西大街8号世贸大厦10楼,4008-659-600,,
青海名匠装饰工程有限公司            ,青海省西宁市城西区西关大街国芳百货4单元1...,4008-659-600,,
青海好享家装饰工程有限公司            ,青海省西宁市城中区管理站对面山水国际3号楼...,4008-659-600,,
实创家居装饰集团（西宁）有限公司            ,西宁市城西区西川南路46号三榆山水文园底商,4008-659-600,,
西宁振海装饰有限公司            ,城中区长江路93号（西门口）鸿宇宾馆12层,4008-659-600,,
 青海立峰装饰工程有限公司            ,青海省西宁市城北区海湖桥西金座威尼谷3号楼...,4008-659-600,,
青海美平方装饰设计工程有限公司            ,城西区胜利路申宝大厦12楼,4008-659-600,,
西宁德诚精英装饰工程有限公司            ,西宁市海湖新区金座晟锦A区4号楼1单元25...,4008-659-600,,
尚家艺装饰集团青海分公司            ,青海西宁市城中区北大街30号，华侨大厦10...,4008-659-600,,
青海面对面建筑装饰工程有限公司            ,西宁市海湖新区夏都景苑3号楼1单元29楼,4008-659-600,,
青海唯鼎装饰工程有限公司            ,西宁市城西区黄河路1号4幢122号,4008-659-600,,
西宁飞翔装饰建筑有限公司            ,青海省西宁市城北区生物园民族医药,4008-659-600,,
西宁名人堂装饰设计有限公司            ,青海省西宁市城北区海湖大道万佳家博园灯饰城...,4008-659-600,,
西宁佳恒装饰工程有限公司            ,西宁市城北区朝阳国际建材城223-224号...,4008-659-600,,
青海中钦装饰工程设计有限公司            ,南川西路香格里拉大道香格里拉花园四期锦园1...,4008-659-600,,
北京帝豪装饰西宁分公司            ,青海-西宁-西宁市城中区-西宁市西大街40...,4008-659-600,,
实创家居装饰集团（西宁）有限公司            ,西宁城西西川南路46号,4008-659-600,,
西宁业之峰装饰有限公司            ,青海省西宁市城西区五四大街45号乐尚都市广...,4008-659-600,,
北京唯创空间装饰西宁分公司            ,青海西宁城西佳豪国际广场5单元5295室,4008-659-600,,
西宁紫苹果装饰公司            ,西宁市西宁市城西区-西宁市新宁路,4008-659-600,,
江苏品尚建筑品尚工程有限公司西宁分公司            ,西宁市 城西区 西宁市城西区海湖新区金座豪...,4008-659-600,,
西安海派建筑装饰有限公司            ,雁塔区小寨十字国贸大厦24层,4008-659-600,,
西安梓桐装饰工程有限公司            ,陕西省西安市未央区明光路与纬三十街交接处龙...,4008-659-600,,
西安市秦韵装饰工程有限公司            ,西安市雁塔区含光路鹏豪商务区1单元801,4008-659-600,,
北京元洲装饰有限责任公司西宁分公司            ,西宁市城西区海湖新区金羚大街26号,4008-659-600,,
武汉鑫梦园装饰设计工程有限公司西宁分公司            ,青海省西宁市五四大街14号文泰大厦5楼10...,4008-659-600,,
北京阔达装饰公司西宁分公司            ,青海西宁城西区胜利路8号财校东50米,4008-659-600,,
