鼎尚装饰            ,浙江省 嘉兴市 海宁市 嘉兴市海宁市文苑南...,4008-659-600,,
市华浔品味装饰设计工程有限公司            ,海宁市海昌南路201号奥林公寓楼下（华润万...,4008-659-600,,
广东三星装饰分公司            ,浙江省 嘉兴市 海宁市 海宁市海昌南路鑫泰...,4008-659-600,,
杭州康源装饰有限公司分公司            ,海宁市海昌南路486号金汇大厦B座裙楼20...,4008-659-600,,
新韵装饰有限公司            ,浙江省 嘉兴市 海宁市 浙江省 嘉兴市 海...,4008-659-600,,
鲁班装饰设计有限公司            ,南昌,4008-659-600,,
鼎力装饰有限公司            ,浙江省 嘉兴市 海宁市 文苑路66-72号,4008-659-600,,
恒力装饰            ,浙江省 嘉兴市 海宁市 海宁市海昌路272...,4008-659-600,,
美星装饰集团            ,南昌,4008-659-600,,
交换空间装饰有限公司            ,南坪会展中心9玺国际8栋,4008-659-600,,
中冠建筑装饰            ,浙江省 嘉兴市 海宁市 海宁市新苑路190...,4008-659-600,,
东易日盛装饰集团嘉兴分公司            ,浙江省 嘉兴市 海宁市 嘉兴市中山西路财富...,4008-659-600,,
实创家居装饰集团有限公司            ,青云谱洪都洪城路6号国贸广场13层,4008-659-600,,
鼎尚装饰            ,嘉兴市海宁市文苑南路100号-102号,4008-659-600,,
上海同济居家装饰分公司            ,浙江省 嘉兴市 海宁市 海宁市文苑路25-...,4008-659-600,,
江西苹果装饰设计工程有限公司            ,西湖区洪城路987号丽都广场a栋五楼（）,4008-659-600,,
江西苹果装饰公司            ,南昌市抚生丽都广场,4008-659-600,,
江西苹果装饰工程有限公司            ,江西省南昌市洪城路987号丽都广场a栋5楼,4008-659-600,,
北京实创家居装饰集团(江西)有限公司            ,南昌市洪城路6号国贸国贸广场新华都1-3层,4008-659-600,,
香港云裳软装配饰南昌分公司            ,南昌市西湖区省府西二路,4008-659-600,,
迪赞设计空间            ,南昌市井冈山大道名爵公馆,4008-659-600,,
上海同济居家装饰分公司            ,海宁市文苑路25-27号,4008-659-600,,
华宁装饰            ,浙江省 嘉兴市 海宁市 海宁市文宗南路12...,4008-659-600,,
南昌道艺装饰有限公司            ,南昌市红谷滩万达中心写字楼B2-814,4008-659-600,,
阔达建筑装饰工程有限责任公司            ,北京市海淀区西三环北路87号国际财经中心c...,4008-659-600,,
北京龙发建筑装饰工程有限公司分公司            ,浙江省 嘉兴市 海宁市 海昌南路238-2...,4008-659-600,,
嘉兴东源装饰工程有限公司(总部)            ,浙江 嘉兴 嘉兴市 街道：南湖区广益路13...,4008-659-600,,
广州美星装饰（分公司）            ,浙江省 嘉兴市 海宁市 海宁市文苑路9-1...,4008-659-600,,
九鼎装饰股份有限公司分公司            ,浙江省 嘉兴市 海宁市 海宁市海州街道水月...,4008-659-600,,
豪泰装饰有限公司            ,浙江省 嘉兴市 海宁市 海宁市,长安镇修川...,4008-659-600,,
