遂宁一号家创客空间信息科技有限公司 ,遂宁市河东新区东平南路铂金公馆三楼(一号家...,18190151195,2322011,
成都丰立装饰遂宁旗舰店 ,金牛区花牌坊西大国际2楼,13056427229,66505201,
鲁公大宅装饰有限公司遂宁分公司            ,遂宁市船山区嘉禾西路109号,4008-659-600,,
南昌欧坊装饰遂宁分公司            ,遂宁市开善路永逸家居4F,4008-659-600,,
遂宁天盛建筑装饰工程有限公司            ,遂宁市船山区紫竹路274号香林雅郡1栋21...,4008-659-600,,
四川省家鼎装饰工程有限责任公司            ,遂宁市河东新区五彩缤纷路65附8、9号,4008-659-600,,
遂宁市田园装饰有限公司            ,遂宁市嘉禾东路6号（市国土局办公楼）,4008-659-600,,
成都绘盛装饰工程有限公司            ,明月景城商用楼5楼（碧海玉都5楼）,4008-659-600,,
遂宁市博创装饰工程有限公司            ,遂宁市船山区凯旋路191号广福商住楼2层0...,4008-659-600,,
遂宁市森鑫建筑装饰工程有限公司            ,遂宁是公园口家居广场1F-102,4008-659-600,,
遂宁青青建筑装饰工程有限公司            ,遂宁市中国西部现代物流港车配龙汽车百货国际...,4008-659-600,,
四川精妙装饰设计有限公司            ,船山区射洪县太和镇新华中街,4008-659-600,,
广东星艺装饰集团遂宁分公司            ,遂宁船山开善路293号永逸家居商城4楼,4008-659-600,,
遂宁尚峰建筑工程有限公司            ,遂宁物流港健坤车配龙B2栋,4008-659-600,,
遂宁大宅美建筑装饰工程有限公司            ,河东新区五彩缤纷路威尼斯7号,4008-659-600,,
江西苹果装饰公司            ,南昌市抚生丽都广场,4008-659-600,,
北京实创家居装饰集团(江西)有限公司            ,南昌市洪城路6号国贸国贸广场新华都1-3层,4008-659-600,,
江西苹果装饰设计工程有限公司            ,西湖区洪城路987号丽都广场a栋五楼（）,4008-659-600,,
香港云裳软装配饰南昌分公司            ,南昌市西湖区省府西二路,4008-659-600,,
江西苹果装饰工程有限公司            ,江西省南昌市洪城路987号丽都广场a栋5楼,4008-659-600,,
南昌市轩仝宇装饰工程有限公司            ,江西省南昌市西湖区子安路89号1602,4008-659-600,,
迪赞设计空间            ,南昌市井冈山大道名爵公馆,4008-659-600,,
江西龙雕装饰设计有限公司            ,香江家居解放四街37号,4008-659-600,,
南昌实创家居装饰            ,南昌市洪城路6号新华都购物广场3楼,4008-659-600,,
遂宁维度建筑装饰工程有限公司            ,,4008-659-600,,
遂宁市田园装饰有限公司            ,,4008-659-600,,
 遂宁天盛建筑装饰工程有限公司            ,遂宁市河东新区德水北路56号金域国际商业内...,4008-659-600,,
遂宁皇巢建筑装饰工程有限公司            ,遂宁市河东新区五彩缤纷路37号五彩大世界2...,4008-659-600,,
遂宁大宅美建筑装饰工程有限公司            ,鼎盛国际,4008-659-600,,
 遂宁天盛建筑装饰工程有限公司            ,遂宁市河东新区德水北路56号金域国际商业内...,4008-659-600,,
遂宁皇巢建筑装饰工程有限公司            ,遂宁市河东新区五彩缤纷路37号五彩大世界2...,4008-659-600,,
遂宁大宅美建筑装饰工程有限公司            ,鼎盛国际,4008-659-600,,
成都美艺空间装饰工程有限公司大英分公司            ,,4008-659-600,,
四川胡佳装饰工程有限公司            ,四川射洪新华下街92号,4008-659-600,,
遂宁乐家装饰集团            ,,4008-659-600,,
遂宁鸿图装饰工程有限公司            ,,4008-659-600,,
广东九木堂装饰遂宁分公司            ,遂宁市船山区开善中路293号永逸家居四楼,4008-659-600,,
遂宁尚水建筑装饰工程有限公司            ,遂宁市船山区河东新区东平大道国玉金都101...,4008-659-600,,
四川联盛易达建筑装饰工程有限公司            ,四川省遂宁市浅水湾18-7-1号,4008-659-600,,
遂宁正源建筑装饰工程有限公司            ,遂宁市船山区物流港健坤国际五金机电广场A-...,4008-659-600,,
遂宁朗斯建筑装饰工程有限公司            ,遂宁市河东新区正黄中心写字楼11楼整层,4008-659-600,,
遂宁乐享新居建筑装饰工程有限公司            ,遂宁市河东新区东平中路423-425号,4008-659-600,,
遂宁市田园装饰有限公司            ,遂宁市河东新区文华路43号,4008-659-600,,
四川领帝装饰设计有限公司            ,遂宁市 市辖区 喜盈门四楼,4008-659-600,,
遂宁市金匠装饰工程有限公司            ,遂宁市物流港喜盈门建材生活广场B6栋四楼4...,4008-659-600,,
模范装饰工程有限公司            ,河东五彩缤纷路63号附18号(摩天轮旁),4008-659-600,,
嘉祺装饰设计工程有限公司            ,,4008-659-600,,
美星装饰集团            ,南昌,4008-659-600,,
鲁班装饰设计有限公司            ,南昌,4008-659-600,,
交换空间装饰有限公司            ,南坪会展中心9玺国际8栋,4008-659-600,,
北京龙发装饰集团            ,阳明东路71号金涛国际a座,4008-659-600,,
南昌道艺装饰有限公司            ,南昌市红谷滩万达中心写字楼B2-814,4008-659-600,,
遂宁市尚庭建筑有限公司            ,遂宁市船山区河东新区管委会对面,4008-659-600,,
实创家居装饰集团有限公司            ,青云谱洪都洪城路6号国贸广场13层,4008-659-600,,
