铜仁市中拓尚易装饰工程有限公司 ,铜仁市碧江区西外环西城御都五楼,18083223311,5253555,
铜仁市一线装饰工程有限公司            ,贵州省铜仁市碧江区锦江南路301（锦江广场...,4008-659-600,,
贵州饰海人家装饰工程有限公司            ,铜仁市碧江区锦江宾馆附楼11楼（即时代商汇...,4008-659-600,,
贵州扬名东诚装饰有限公司            ,贵州省铜仁市万山区西南国际商贸城二组团12...,4008-659-600,,
馨家园装饰有限公司            ,铜仁市万山区西南商贸城八栋1-8号,4008-659-600,,
铜仁南翔装饰有限公司            ,铜仁市万山区谢桥街道西南国际商贸城20栋2...,4008-659-600,,
贵州省铜仁市顶峰装饰工程有限公司            ,贵州省铜仁市碧江区教育园区安置B区9栋1号...,4008-659-600,,
黔东南蓝宇装饰工程有限责任公司铜仁分公司            ,铜仁市碧江区时代商汇11栋B座二楼,4008-659-600,,
铜仁佳园装饰            ,铜仁市碧江区金滩半岛豪苑,4008-659-600,,
铜仁盛汇装饰            ,,4008-659-600,,
铜仁金伯爵互联网装饰工程有限公司            ,铜仁高速南站出口义乌城3楼伯爵装饰,4008-659-600,,
铜仁安富尊荣建筑装饰有限公司            ,铜仁市碧江区清水大道102号2栋2楼2幢2...,4008-659-600,,
南昌林涵设计            ,林涵设计,4008-659-600,,
 ,,4008-659-600,,
南昌市轩仝宇装饰工程有限公司            ,江西省南昌市西湖区子安路89号1602,4008-659-600,,
金芒果装饰集团            ,江西省吉安市吉州区广场北路1号(新世界广场...,4008-659-600,,
南昌三帝装饰设计有限公司            ,南昌市青山湖区洪都北道299号高能金域名都...,4008-659-600,,
佳园装饰铜仁分公司            ,铜仁市金滩半岛豪苑旁乐巢酒店3楼,4008-659-600,,
贵阳英泰装饰工程有限公司铜仁分公司            ,,4008-659-600,,
贵阳英泰装饰工程有限公司铜仁分公司            ,,4008-659-600,,
铜仁典凡装饰工程有限责任公司            ,铜仁市锦江国际三楼,4008-659-600,,
贵州喜百年装饰工程有限公司铜仁分公司            ,铜仁市碧江区八里岗西城御都4楼,4008-659-600,,
铜仁市创艺装饰工程有限公司            ,时代商汇12栋3楼(湘味不一样楼上),4008-659-600,,
贵州省朗廷装饰工程有限公司            ,贵州省铜仁市万山区西南国际商贸城二组团19...,4008-659-600,,
贵州逸登装饰设计工程有限公司铜仁分公司            ,铜仁茅坪新区农贸市场四号楼二层25.26号...,4008-659-600,,
吉首市美和美家装饰工程有限公司铜仁分公司            ,贵州省铜仁市碧江区南都锦江国际1-18-2...,4008-659-600,,
贵州省铜仁市碧江区睿艺装饰工程有限公司            ,铜仁市碧江区锦江广场,4008-659-600,,
铜仁众点装饰有限公司            ,贵州省铜仁市碧江区贵州省铜仁市碧江区锦江南...,4008-659-600,,
铜仁唯品装饰工程有限公司            ,贵州省铜仁市碧江区民主路阳光大厦二期二楼,4008-659-600,,
阔达建筑装饰工程有限责任公司            ,北京市海淀区西三环北路87号国际财经中心c...,4008-659-600,,
南昌鲁公大宅装饰工程公司            ,南昌市八一广场丽华购物广场6楼,4008-659-600,,
南昌实创美家装饰            ,南昌市西湖区站前西路289号三星大厦B座1...,4008-659-600,,
铜仁众点装饰有限公司            ,西外环书香名苑盘香悦四季一楼,4008-659-600,,
交换空间装饰有限公司            ,南坪会展中心9玺国际8栋,4008-659-600,,
铜仁市乐家装饰工程有限公司            ,铜仁谢桥万山区义乌城三楼,4008-659-600,,
铜仁龙城装饰建筑工程有限公司            ,铜仁市松桃苗族自治县蓼皋街道花鼓大道万桥商...,4008-659-600,,
广州市华宁装饰工程有限公司南昌分公司            ,江西省南昌市西湖区广润门三区37栋1号,4008-659-600,,
南昌道艺装饰有限公司            ,南昌市红谷滩万达中心写字楼B2-814,4008-659-600,,
装饰-江西装饰(旗舰店)            ,江西省南昌市西湖区洪城路丽都广场a栋装饰5...,4008-659-600,,
铜仁鲁班装饰工程有限公司            ,贵州省铜仁市碧江区火车站锦鹏国际4栋3楼,4008-659-600,,
