长治市朝博装饰工程有限公司 ,长治市城区龙盛装饰城3楼E区4号,13835543718,2020101,
长治众创大宅装饰 ,长治市站前路171号众创大厦4,5,6,7...,13008065454,5895588,
北京艺品鼎盛装饰设计有限公司长治分公司 ,长治高新区北二环金都苑底商东5号(庞家庄教...,18636562881,400-865-9600,
长治市信宅装饰工程有限公司 ,长治城区长子门东南区83号,13111001066,8526222,
长治市名创美家装饰工程有限公司 ,长治市捉马西大街日新家园6-7号商铺,17603455200,2160160,
长治市瀚唐装饰有限公司            ,长治市五一路恒超装饰城C区111号,4008-659-600,,
长治元洲装饰有限责任公司            ,长治市城东路中信银行南侧元洲装饰,4008-659-600,,
城市人家装饰有限公司            ,延安中路永盛苑大厦2.3.4号商铺（九州宾...,4008-659-600,,
长治飛凡装饰有限公司            ,山西长治黎城县,4008-659-600,,
长治市和邦装饰工程有限公司            ,山西 长治市 ,4008-659-600,,
山西天成美居装饰有限公司            ,山西省长治市天晚集南路浅水湾楼下1号商铺 ...,4008-659-600,,
襄垣县天中阁设计安装装饰有限公司            ,长治市襄垣县太行路永春电器,4008-659-600,,
 长治欧艺名家装饰公司一部            ,长治-城区 英雄南路266号,4008-659-600,,
江西xx装饰公司            ,南昌市抚生丽都广场,4008-659-600,,
北京实创家居装饰集团(江西)有限公司            ,南昌市洪城路6号国贸国贸广场新华都1-3层,4008-659-600,,
江西xx装饰设计工程有限公司            ,西湖区洪城路987号丽都广场a栋五楼（）,4008-659-600,,
一号家居网南昌站            ,江西省南昌市青山湖区上海路699文化创意园,4008-659-600,,
金玉明家装饰有限公司            ,山西省长治市城区城东路都市名门金玉明家装饰,4008-659-600,,
一号家居网            ,南昌市青山湖区上海路699文化创意园,4008-659-600,,
江西翔海装饰工程有限公司            ,,4008-659-600,,
一号家居网南昌站            ,江西省南昌市青山湖区上海路699文化创意园,4008-659-600,,
迪赞设计空间            ,南昌市井冈山大道名爵公馆,4008-659-600,,
南昌实创家居装饰            ,南昌市洪城路6号新华都购物广场3楼,4008-659-600,,
家天下装饰工程有限公司            ,,4008-659-600,,
元洲装饰            ,长治市英雄北路198号居然之家,4008-659-600,,
金一诺装饰工程公司            ,长治市捉马西大街23号,4008-659-600,,
城市人家乐豪斯装修有限公司            ,府后东街御林家园东200米路南侧,4008-659-600,,
山西扬子亿家装饰有限公司            ,,4008-659-600,,
景苑华府商贸有限公司            ,,4008-659-600,,
山西美通装饰工程有限公司            ,,4008-659-600,,
长治xx装饰            ,长治市金德利摩登时代c座1727室,4008-659-600,,
爱福林集成墙饰            ,,4008-659-600,,
长治市城市人家装饰有限公司            ,长治延安中路永盛苑3号商铺,4008-659-600,,
长治凯旋装饰工程有限公司            ,,4008-659-600,,
xx装饰            ,长治市英雄中路摩登时代,4008-659-600,,
长治一美新城装饰            ,居然之家天昊店,4008-659-600,,
鼎禾装饰            ,,4008-659-600,,
城市人家乐豪斯装饰工程有限公司            ,长治市府后东街御林家园往东200米,4008-659-600,,
壹号名宅            ,,4008-659-600,,
长治城市人家装饰公司            ,,4008-659-600,,
北京阔达装饰长治分公司(南街店)            ,长治市第二人民医院往北200北京阔达装饰,4008-659-600,,
长治城市人家乐豪斯装饰有限公司            ,,4008-659-600,,
山西扬子亿家装饰有限公司            ,长治市城东路龙盛装饰城三楼F区8号,4008-659-600,,
长治市鼎禾平台装饰工程有限公司            ,长治市居然之家斜对面日新家园二期售楼部旁边,4008-659-600,,
山西宜美轩装饰工程有限公司长治分公司            ,长治市保宁门西街世纪嘉园小区商铺A区302,4008-659-600,,
长治楚天装饰工程有限公司            ,长治市五一桥明中明装饰城,4008-659-600,,
北京元洲装饰工程有限公司长治分公司            ,长治市居然之家一楼,4008-659-600,,
长治市超前装饰工程有限公司            ,长治市淮海街8院B-9号商铺,4008-659-600,,
北京龙发装饰集团长治分公司            ,山西省长治市英雄南路80号,4008-659-600,,
长治市深度空间装饰工程有限公司            ,长治市城区清华西街119号,4008-659-600,,
长治阔达装饰工程有限责任公司            ,山西省 长治市 城区 东博源超市北侧帝景苑...,4008-659-600,,
南昌鲁公大宅装饰工程公司            ,长治市城东路仙龙家居广场5号馆,4008-659-600,,
嘉祺装饰设计工程有限公司            ,,4008-659-600,,
美星装饰集团            ,南昌,4008-659-600,,
鲁班装饰设计有限公司            ,南昌,4008-659-600,,
交换空间装饰有限公司            ,南坪会展中心9玺国际8栋,4008-659-600,,
祥和之家装饰工程有限公司            ,长治市英雄北路198号居然之家二层东区,4008-659-600,,
长治市飞马装饰装潢有限公司            ,长治市五一桥宏都装饰城三楼,4008-659-600,,
长治蓝钻装饰工程有限工司            ,长治-城区 长治西环路,4008-659-600,,
尚城装饰            ,山西省长治市安康小区6号楼,4008-659-600,,
山西欣凯德装饰工程有限公司            ,长治北张庄,4008-659-600,,
长治爱尚家装饰装修有限公司            ,长治-城区 山西长治,4008-659-600,,
江西xx装饰-江西xx装饰(旗舰店)            ,江西省南昌市西湖区洪城路丽都广场a栋xx装...,4008-659-600,,
满堂红家居装饰集团有限公司            ,长治市 城区 紫金东街消防支队斜对面满堂红...,4008-659-600,,
装饰设计工程有限公司            ,长治市城区紫金东街346号一单元3号商铺(...,4008-659-600,,
