阜阳宅速美装饰工程有限公司 ,安徽省阜阳市颍州区清河办事处淮河路2066...,15675581530,7132888,
阜阳幸福壹号整体家装有限公司 ,安徽省阜阳市颍州区淮河路正基首府北门，1号...,18654110925,6678888,
浙江九鼎装饰阜阳分公司 ,安徽省阜阳市阜南路怡和庄园西大门南侧50米,18269929502,2346088,
安徽东箭装饰设计工程有限公司阜阳分公司 ,颍州万达斜对面天筑豪生大酒店南5米,13075062059,3977712,
安徽心想事成建筑装饰工程有限公司 ,中南现代城三期1号楼701-702,18325836151,6689566,
阜阳九创装饰工程有限公司 ,颍泉区人民中路,18325886957,7106517,
北京零壹装饰工程有限公司阜阳分公司 ,阜阳市颍州区南京路678号天韵怡城小区9#...,15715685619,2206001,
阜阳熙和装饰有限公司 ,阜阳市颍州区宝龙国际社区3#1804,17355800003,3672799,
阜阳同创装饰 ,安徽省阜阳瑶海大市场对面依水苑11楼,15705586111,2700333,
安徽倾国倾城装饰设计有限公司            ,阜阳市 颍州区 阜阳市颍州区临泉路中央豪景...,4008-659-600,,
星艺装饰有限公司            ,阜王路浙商大厦12f,4008-659-600,,
阜阳市艺龙装饰有限公司            ,阜阳市 颍州区 阜阳市港利金茂广场9栋30...,4008-659-600,,
719原创设计工作室            ,阜阳市 颍州区 万霖花苑东区1号楼六单元1...,4008-659-600,,
北京实创家居装饰集团(江西)有限公司            ,锦城香格里拉东区8号楼A座116号室（中鑫...,4008-659-600,,
南昌欧坊装饰工程有限公司            ,南昌西湖区洪城路576号天使商务广场t层,4008-659-600,,
吾家装饰设计有限公司            ,阜阳市 市辖区 顺昌商城东门,4008-659-600,,
阜阳徽韵装饰有限公司            ,安徽省 阜阳市 阜阳市清河东路150号,4008-659-600,,
嘉祺装饰设计工程有限公司            ,,4008-659-600,,
美星装饰集团            ,南昌,4008-659-600,,
鲁班装饰设计有限公司            ,南昌,4008-659-600,,
交换空间装饰有限公司            ,南坪会展中心9玺国际8栋,4008-659-600,,
阜阳南风装饰工程有限公司            ,安徽省阜阳市颍州区清河办事处阜王路399号...,4008-659-600,,
阜阳1号整体家装有限公司            ,阜阳万达斜对面天筑豪生酒店南5米,4008-659-600,,
安徽华然装饰有限责任公司            ,安徽省 阜阳市 市辖区 市区,4008-659-600,,
阜阳市艺龙装饰有限公司            ,阜阳市 颍州区 阜阳市港利金茂广场9栋30...,4008-659-600,,
江西苹果装饰-江西苹果装饰(旗舰店)            ,江西省南昌市西湖区洪城路丽都广场a栋苹果装...,4008-659-600,,
阜阳面对面装饰设计有限公司            ,阜阳市颍州区万霖花苑西区12#B栋303室...,4008-659-600,,
实创家居装饰集团有限公司            ,青云谱洪都洪城路6号国贸广场13层,4008-659-600,,
幸福家一号家居馆            ,,4008-659-600,,
安徽润佳装饰有限公司            ,颍上县城北新区南苑4期19号楼1单元701,4008-659-600,,
阜阳绿森林装饰公司            ,港丽上城国际,4008-659-600,,
安徽交换空间装饰有限公司            ,阜阳颍上城北新区中山派出所对面向西200米,4008-659-600,,
安徽皖匠装饰公司            ,阜阳市颍州区万达华府商铺,4008-659-600,,
北京实创家居装饰集团(江西)有限公司            ,南昌市洪城路6号国贸国贸广场新华都1-3层,4008-659-600,,
一号家居网南昌站            ,江西省南昌市青山湖区上海路699文化创意园,4008-659-600,,
南昌一号家居网            ,南昌市青山湖区上海路699文化创意园,4008-659-600,,
阜阳京易装饰工程有限公司            ,界首路599号锦华名郡底商,4008-659-600,,
 ,,4008-659-600,,
好乐居装饰            ,,4008-659-600,,
 ,,4008-659-600,,
好乐居装饰            ,,4008-659-600,,
南昌市轩仝宇装饰工程有限公司            ,江西省南昌市西湖区子安路89号1602,4008-659-600,,
浙江九鼎装饰股份阜阳馆            ,阜阳市阜王路浙商大厦8楼801室,4008-659-600,,
一号家居网南昌站            ,江西省南昌市青山湖区上海路699文化创意园,4008-659-600,,
阜阳京易装饰工程有限公司            ,颍泉区界首路599号,4008-659-600,,
南昌欧坊装饰            ,洪城路576号天使商务大厦t层,4008-659-600,,
阜阳美奇装饰工程有限公司            ,中南现代城3期4号楼2204室,4008-659-600,,
安徽凯达装饰设计有限公司            ,安徽阜阳丽丰一品5栋2901,4008-659-600,,
阜阳宅速美装饰集团            ,,4008-659-600,,
南昌实创家居装饰            ,南昌市洪城路6号新华都购物广场3楼,4008-659-600,,
合肥安胜家装饰公司            ,临泉县好迪市场F座206/207,4008-659-600,,
元洲装饰            ,阜王路666号易景国际花园s4#商业2号,4008-659-600,,
阜阳一号家居有限公司            ,,4008-659-600,,
阜阳市创客汇装饰设计有限责任公司            ,阜阳市颍州南路无线电管理中心楼下，创客空间,4008-659-600,,
阜阳市旭阳装饰工程有限公司            ,,4008-659-600,,
安徽皖匠装饰工程有限公司            ,中清路万达华府商铺,4008-659-600,,
简艺装饰工程有限公司            ,清和办事处淮河路2066号正基首府C2栋2...,4008-659-600,,
阜阳市鼎晨建筑装饰工程有限公司            ,阜阳市颍州区颍西办事处中南大道277号中南...,4008-659-600,,
阜阳松松装饰工程有限公司            ,,4008-659-600,,
安徽山水空间装饰集团            ,,4008-659-600,,
安徽方舟装饰有限公司            ,,4008-659-600,,
阜阳市旭阳装饰工程有限公司            ,,4008-659-600,,
阜阳格调装饰            ,,4008-659-600,,
创设装饰工程有限公司            ,,4008-659-600,,
家装9号馆            ,大润发北100米·晶宫和府底商,4008-659-600,,
阜阳市盛金装璜设计工程有限公司            ,颍州万达华府8号楼A2区1205室,4008-659-600,,
东箭装饰集团阜阳分公司            ,天筑豪生大酒店南5米,4008-659-600,,
叶之秋装饰工程有限公司            ,阜王路356号,4008-659-600,,
安徽山水空间装饰有限责任公司阜阳分公司            ,阜阳市颍州区建设大厦,4008-659-600,,
阜阳家年华装饰有限公司            ,阜阳强颍州北路170号颍泉农商银行10楼,4008-659-600,,
安徽宫艺装饰            ,,4008-659-600,,
界首市铭达装饰有限公司            ,界首市文昌路南段东侧,4008-659-600,,
阜南浩瀚鹏诚装饰有限公司            ,  阜南县中央豪景2栋301,4008-659-600,,
阜阳雅居装饰工程有限公司            ,,4008-659-600,,
阜阳快手装饰            ,,4008-659-600,,
创绿家环保科技有限公司            ,阜阳市颍州区正基首府B4办公楼912,4008-659-600,,
月文装饰            ,,4008-659-600,,
居源建筑装饰设计工程有限公司            ,阜阳市颖东区河东办事处北京东路徽创大厦1#...,4008-659-600,,
安徽倾国倾城装饰设计有限公司            ,,4008-659-600,,
颍上县徽派装饰有限公司            ,安徽省颍上县城北新区,4008-659-600,,
阜阳市苏艺装饰工程有限公司            ,阜阳颍州御景嘉苑3号商住楼,4008-659-600,,
阜阳京易装饰工程有限公司            ,颍州区港利金茂广场9#1108（太平洋酒店...,4008-659-600,,
阜阳市弘高建筑装饰工程有限公司            ,阜阳市颍河西路商厦时代广场1号楼2002室,4008-659-600,,
阜阳精鹰装饰工程有限公司            ,阜阳市颍州南路红堡城商铺118号,4008-659-600,,
阜阳市维度装饰有限公司            ,安徽省阜阳市人民西路与西二环交叉口气象大厦...,4008-659-600,,
阜阳市金牌装饰工程有限公司            ,阜阳市颍州区阜王南路689号鸿港花苑,4008-659-600,,
安徽爱尚家装饰工程有限公司阜阳分公司            ,安徽省阜阳市颍州区清河办事处一道河中路12...,4008-659-600,,
阜阳世筑名家设计装饰有限公司              ,安徽省阜阳市界首路599号 ,4008-659-600,,
安徽倾国倾城装饰设计有限公司            ,安徽省阜阳市颍州区中央豪景东门北侧10米,4008-659-600,,
喵咚家互联网家装阜阳6S体验中心            ,阜阳市天英宝鼎建材城西50米,4008-659-600,,
阜阳市南风装饰工程有限公司            ,安徽省阜阳市颍州区清河办事处阜王路399号...,4008-659-600,,
阜阳市快手装饰工程有限公司            ,阜阳市颍州区颍西办事处南京路1816号文景...,4008-659-600,,
阜阳千秋装饰设计有限公司            ,颍东区高速时代华府西大门南50米,4008-659-600,,
阜阳市颍州区星胜装饰            ,颍州区万达广场A1区6号楼602室,4008-659-600,,
阜阳艺尚装饰工程有限公司            ,阜阳市阜王路与一道河路交叉口海丰世纪广场B...,4008-659-600,,
阜阳明居装饰设计有限公司            , 阜阳市 颍州区 阜阳市体育场附近,4008-659-600,,
浙江九鼎装饰阜阳分公司            , 颍州区 阜阳市阜王路浙商大厦8楼801室,4008-659-600,,
