东营九创装饰工程有限公司 ,黄河路与西二路交汇处宝龙城市广场澳门商业街...,17862103107,8202777,
东营泽园装饰有限公司 ,东营市东营区西城商贸园金五路2号,18254601585,7882899,
东营市水晶石装饰设计有限责任公司            ,东营,4008-659-600,,
东营汇众装饰有限公司            ,黄河路与西二路交汇处宝龙城市广场澳门商业街...,4008-659-600,,
东营市天河装饰工程有限责任公司            ,东营市东城惠州路家乐街26号,4008-659-600,,
东营柏高日盛装饰设计工程有限公司            ,山东-东营-东营市河口区-东营市河口区,4008-659-600,,
东营精锐装饰设计工程有限公司            ,东营,4008-659-600,,
东营鑫达装饰公司            ,山东-东营-东营市河口区-东营市仙河镇仙河...,4008-659-600,,
东营宜居装饰设计有限公司            ,山东-东营-东营市东营区,4008-659-600,,
东营鸿图装饰有限公司            ,黄河路与西二路交汇处,4008-659-600,,
东营市大拇指装修公司            ,东营市东营区-东营市日照路18,4008-659-600,,
东营永凯装饰有限公司            ,黄河路美亿家家居广场一楼,4008-659-600,,
轻舟装饰东营公司            ,东二路与北二路路口东北角汇佳商城一楼,4008-659-600,,
东营精锐装饰设计工程有限公司            ,东营市东营区黄河路487号,4008-659-600,,
东营市盈创装饰设计有限公司            ,东营区黄河路美亿家家居馆西侧,4008-659-600,,
北京实创家居装饰集团(江西)有限公司            ,南昌市洪城路6号国贸国贸广场新华都1-3层,4008-659-600,,
一号家居网南昌站            ,江西省南昌市青山湖区上海路699文化创意园,4008-659-600,,
东营胜强装饰有限公司            ,山东-东营-东营市河口区-东营市仙河镇商城...,4008-659-600,,
加拿大HD家居装饰            ,山东省东营市太行山路87号,4008-659-600,,
南昌一号家居网            ,南昌市青山湖区上海路699文化创意园,4008-659-600,,
***东营悦享装饰工程有限公司            ,蓝海国际大饭店北城市主人五楼,4008-659-600,,
江西翔海装饰工程有限公司            ,,4008-659-600,,
南昌欧坊装饰            ,洪城路576号天使商务大厦t层,4008-659-600,,
南昌高鸿装饰工程有限公司            ,抚生路1199号喜盈门灯饰广场三楼,4008-659-600,,
加拿大HD家居装饰            ,,4008-659-600,,
南昌实创家居装饰            ,南昌市洪城路6号新华都购物广场3楼,4008-659-600,,
北京阔达装饰公司东营分部            ,东赵大厦南行200米太行山路上,4008-659-600,,
一号家居网南昌站            ,江西省南昌市青山湖区上海路699文化创意园,4008-659-600,,
东营市恒悦装饰            ,,4008-659-600,,
东营市静雅装饰工程有限公司            ,广饶义乌装饰城西门南50米,4008-659-600,,
鲁公装饰            ,西湖孺子路1号,4008-659-600,,
今辉装饰            ,,4008-659-600,,
东营市拓璞装饰工程有限公司            ,,4008-659-600,,
东营颜呈装饰            ,,4008-659-600,,
一诺新业装饰公司            ,黄河路与海通路交叉口， 陶然财富港,4008-659-600,,
东营市阔达家居有限公司            ,东营市西城区太行山路与北一路交汇处向南10...,4008-659-600,,
飓风防暴门窗            ,,4008-659-600,,
山东良知装饰工程有限公司            ,东营市太行山路如家宾馆南侧 良知装饰,4008-659-600,,
东营鸿生装饰设计有限公司            ,,4008-659-600,,
饰家装饰            ,银座家居对面东单建材广场2W-15,4008-659-600,,
今辉装饰            ,,4008-659-600,,
东营市拓璞装饰工程有限公司            ,,4008-659-600,,
东营颜呈装饰            ,,4008-659-600,,
一诺新业装饰公司            ,黄河路与海通路交叉口， 陶然财富港,4008-659-600,,
东营市阔达家居有限公司            ,东营市西城区太行山路与北一路交汇处向南10...,4008-659-600,,
飓风防暴门窗            ,,4008-659-600,,
山东良知装饰工程有限公司            ,东营市太行山路如家宾馆南侧 良知装饰,4008-659-600,,
东营鸿生装饰设计有限公司            ,,4008-659-600,,
拜占庭装饰设计有限公司            ,山东省 东营市 东营区 太行山路95号,4008-659-600,,
东营城市人家装饰设计工程有限公司            ,东营区黄河路以北西二路以西30米路北城市人...,4008-659-600,,
东营市尚上装饰工程公司            ,东营市东营区黄河商贸园金四路02号,4008-659-600,,
东营永升装饰工程有限公司            ,东营市东营区西城商贸园金六路15号,4008-659-600,,
安徽中常装饰有限公司            ,山东省东营市东营区北二路天籁华都中常建设,4008-659-600,,
东营紫名都装饰            ,东营市太行山路,4008-659-600,,
东营市颜呈装饰设计            ,东营市东营区万海金地大厦B-1506,4008-659-600,,
东营筑城装饰工程有限公司            ,陶然财富港4号楼A座403,4008-659-600,,
南昌欧坊装饰工程有限公司            ,南昌西湖区洪城路576号天使商务广场t层,4008-659-600,,
攀登装饰工程有限公司            ,山东省 东营市 东营区 东营商贸园金大地路...,4008-659-600,,
卓冠装饰设计工程有限公司            ,山东省 东营市 东营区 北一路与太行山路交...,4008-659-600,,
南昌鲁公大宅装饰工程公司            ,南昌市八一广场丽华购物广场6楼,4008-659-600,,
东营艺卓装饰工程有限公司            ,山东省 东营市 东营区 东城商贸园006号...,4008-659-600,,
美星装饰集团            ,南昌,4008-659-600,,
鲁班装饰设计有限公司            ,南昌,4008-659-600,,
交换空间装饰有限公司            ,南坪会展中心9玺国际8栋,4008-659-600,,
东营天马装饰工程有限公司            ,山东省 东营市 东营区 东营市西城区黄河路...,4008-659-600,,
恒岳装饰装饰工程有限公司            ,山东省 东营市 市辖区 东营市东营商贸园（...,4008-659-600,,
精锐装饰工程有限公司            ,山东省 东营市 东营区 金大地鸿基大厦A座...,4008-659-600,,
恒 锐装饰工程有限公司            ,山东省 东营市 东营区 东营区商贸园金一路...,4008-659-600,,
东营卓冠装饰工程有限公司            ,东营市西城太行山路与北一路交叉口往南50米,4008-659-600,,
金港湾装饰工程有限公司            ,山东省 东营市 东营区 西城北二路607号,4008-659-600,,
北京业之峰东营分公司            ,山东省 东营市 东营区 太行山路231号,4008-659-600,,
良知装饰工程有限公司            ,东营市,4008-659-600,,
江西苹果装饰-江西苹果装饰(旗舰店)            ,江西省南昌市西湖区洪城路丽都广场a栋苹果装...,4008-659-600,,
北京紫名都装饰东营分公司            ,山东省 东营市 东营区 太行山路86号,4008-659-600,,
  苏瀚装饰工程有限公司            ,山东省 东营市 东营区 东营商贸园汇鑫大街...,4008-659-600,,
实创家居装饰集团有限公司            ,青云谱洪都洪城路6号国贸广场13层,4008-659-600,,
