实创（）装饰有限公司            ,唐山市高新区元龙大厦4层,4008-659-600,,
今朝装饰设计有限公司            ,建设北路居然之家六层,4008-659-600,,
指南针装饰            ,唐山市丰润区光华道华龙嘉苑1座507号,4008-659-600,,
金诚装饰有限公司            ,唐山市路北区建华东道19号(广大家居内）,4008-659-600,,
北京御峰轩装饰分公司            ,唐山市路北区长宁道与卫国北路交叉口北行50...,4008-659-600,,
元洲装饰            ,河北 唐山 北新道丽景琴园1-21,4008-659-600,,
唐山市宏鑫装饰公司            ,唐山市丰润区南关十字路口东一百米,4008-659-600,,
北京卡洛斯奇装饰工程有限公司唐山分公司            ,路北区景泰翰林412-3号底商,4008-659-600,,
唐山市众创装饰设计工程有限公司            ,唐山高新技术产业园区龙富南道176号,4008-659-600,,
梵高装饰设计有限公司            ,河北 唐山 唐山市路北区,4008-659-600,,
唐山冠坊装饰            ,卫国路135号,4008-659-600,,
佳林国际装饰有限公司            ,迁安市永顺街金客隆超市南对面,4008-659-600,,
开源装饰工程有限公司            ,君瑞国际商业楼1单元1门516号,4008-659-600,,
卡洛斯奇建筑装饰工程有限公司            ,路北区景泰翰林412楼3号底商,4008-659-600,,
市昊昱装饰工程有限公司            ,河北省唐山市路北区光明路与翔云道交叉口北行...,4008-659-600,,
河北华国建筑装饰设计工程有限公司            ,丰润区光华道39号,4008-659-600,,
唐山市丰润区天翔装饰工程有限公司            ,唐丰路342号(天宫寺塔对面),4008-659-600,,
北京亚光亚装饰唐山分公司            ,路南区新华西道宝升昌,4008-659-600,,
唐山指南针装饰            ,唐山市丰润区光华道华龙嘉苑1座507号,4008-659-600,,
景鑫装饰设计有限公司            ,河北省唐山市路北区钓鱼台装饰城12-17,4008-659-600,,
中洲装饰工程有限公司            ,唐山市路北区光明路与祥云道交叉口北行300...,4008-659-600,,
大正装饰公司            ,开平区东城路133号,4008-659-600,,
实创()装饰工程有限公司            ,唐山市高新区建设北路与龙华道交叉口元龙大厦...,4008-659-600,,
鲁班装饰设计有限公司            ,唐山路北区 军创凯旋城底商3号,4008-659-600,,
北京易豪装饰工程唐山分公司            ,路南区老装饰材料市场81号,4008-659-600,,
唐山兰苑居家装饰设计工程有限公司            ,唐山市丰润区华顺家居建材城,4008-659-600,,
城市人家装饰有限公司            ,唐山市路北区新华西道世博大厦1205室 ,4008-659-600,,
大金建筑装饰工程有限公司            ,路北区光明北路石油家园115楼,4008-659-600,,
市浩元装饰设计工作室            ,唐山市路北区建设路与龙福南道交叉口会展中心...,4008-659-600,,
开源装饰工程有限公司            ,唐山市古治区,4008-659-600,,
星艺装饰有限公司            ,唐山市 路北区北新西道71号（圣典茶楼东3...,4008-659-600,,
波涛装饰公司            ,河北唐山唐山路北区大里北路蓝天家园商品,4008-659-600,,
金典装饰            ,唐山-丰润区-丰润 美景花园底商一号（中铁...,4008-659-600,,
