临沧禾佳晟装饰工程有限责任公司 ,金旭之光小区15栋2单元902,18088372333,2152605,
临沧拓达装饰有限责任公司 ,临沧市临翔区金旭之光商铺1-2-209室,18308832662,2156277,
临沧市吉锦翔装饰工程有限公司 ,临沧市临翔区东阁坝巷106号,13759320581,2150776,
临沧三点水装饰设计有限公司            ,临沧市临翔区南天路988号,4008-659-600,,
临沧徽山装饰有限公司            ,临沧市临翔区京州大道142,4008-659-600,,
美星装饰集团            ,南昌,4008-659-600,,
临沧中杰装饰有限公司            ,临沧会展中心9玺国际8栋,4008-659-600,,
临沧新艺匠装饰有限公司            ,临沧市临翔区玉龙街129号附近,4008-659-600,,
临沧家和装饰有限公司            ,临沧洪都中大道隆鑫广场a4栋103铺,4008-659-600,,
北京业之峰诺华装饰股份有限公司            ,八一大道357号 财富广场b座22层,4008-659-600,,
江西苹果装饰-江西苹果装饰(旗舰店)            ,江西省南昌市西湖区洪城路丽都广场a栋苹果装...,4008-659-600,,
临沧中艺装饰工程设计有限公司            ,临沧市临翔区温泉路上段,4008-659-600,,
临沧市草木人艺术设计有限公司            ,临沧市临翔区临都上城15栋1单元202室,4008-659-600,,
临沧环艺装饰工程有限公司            ,临沧市临翔区金旭之光2-202商铺,4008-659-600,,
金芒果装饰集团            ,江西省吉安市吉州区广场北路1号(新世界广场...,4008-659-600,,
南昌三帝装饰设计有限公司            ,南昌市青山湖区洪都北道299号高能金域名都...,4008-659-600,,
南昌林涵设计            ,林涵设计,4008-659-600,,
 ,,4008-659-600,,
南昌市轩仝宇装饰工程有限公司            ,江西省南昌市西湖区子安路89号1602,4008-659-600,,
临沧市草木人艺术设计有限公司            ,临沧市临翔区闲庭水榭13栋,4008-659-600,,
万丰国际15331626661            ,,4008-659-600,,
临沧市元策装饰工程设计有限责任公司            ,云南省临沧市临翔区东港建材城5-B-108...,4008-659-600,,
临沧大恒装饰工程有限公司            ,临沧市东港商城2栋B106,4008-659-600,,
临沧天一装饰工程有限公司            ,临沧青山湖大道333号天香园8号创意园二楼,4008-659-600,,
临沧清军装饰工程有限公司            ,临沧永德县抚生南路博富大厦二楼,4008-659-600,,
欧坊装饰工程有限公司临沧分公司            ,临沧洪城路576号天使商务广场t层,4008-659-600,,
福康装饰工程有限责任公司            ,临沧市扎路营建材市场8—203、204,4008-659-600,,
临沧阔达建筑装饰工程有限责任公司            ,云南省临沧市临翔区南天路1513号,4008-659-600,,
南昌鲁公大宅装饰工程公司            ,南昌市八一广场丽华购物广场6楼,4008-659-600,,
临沧创然装饰有限公司            ,临沧市临翔区西大街50号附近,4008-659-600,,
临沧徽山装饰有限公司            ,临沧市临翔东港建材商城二期11栋,4008-659-600,,
临沧家装E站装饰有限公司            ,临沧市临翔 东港商城12栋B104,4008-659-600,,
临沧鲁宁装饰建筑装饰工程有限公司            ,临沧-临翔 火炬大厦附近,4008-659-600,,
星艺装饰集团(临沧)分公司            ,云南省临沧市临翔区G214(缅宁大道),4008-659-600,,
广州市华宁装饰工程有限公司南昌分公司            ,江西省南昌市西湖区广润门三区37栋1号,4008-659-600,,
临沧思晨装饰工程有限公司            ,临沧市红谷滩新区万达广场A1-310,4008-659-600,,
南昌道艺装饰有限公司            ,南昌市红谷滩万达中心写字楼B2-814,4008-659-600,,
临沧美星装饰设计有限公司            ,临沧市13号路中上段一心堂旁,4008-659-600,,
