新兴新锐装饰设计中心            ,罗定,4008-659-600,,
罗定中宏装饰设计有限公司            ,云浮市龙华中路195-197号,4008-659-600,,
鼎峰装饰设计有限公司            ,云浮市罗城镇兴华一路78号,4008-659-600,,
云浮市速艺装饰工程有限公司            ,云浮市龙都西路33号,4008-659-600,,
嘉信装饰设计            ,云浮市,4008-659-600,,
锐烨装饰工程有限公司            ,云浮市云安区新和31号,4008-659-600,,
城市人家装饰有限公司            ,北京市大兴区亦庄经济开发区4号街区力宝广场...,4008-659-600,,
美星装饰集团            ,南昌,4008-659-600,,
鲁班装饰设计有限公司            ,南昌,4008-659-600,,
交换空间装饰有限公司            ,南坪会展中心9玺国际8栋,4008-659-600,,
匠森装饰设计有限公司            ,白梅路23号（广场花园旁）,4008-659-600,,
广东华宁装饰云浮分公司            ,云浮市云城区,4008-659-600,,
北京业之峰诺华装饰股份有限公司            ,八一大道357号 财富广场b座22层,4008-659-600,,
北京龙发装饰集团            ,阳明东路71号金涛国际a座,4008-659-600,,
云浮市天匠装饰工程有限公司            ,云浮市,4008-659-600,,
实创家居装饰集团有限公司            ,青云谱洪都洪城路6号国贸广场13层,4008-659-600,,
辉妮装饰            ,广东省云浮市河口街,4008-659-600,,
江西苹果装饰公司            ,南昌市抚生丽都广场,4008-659-600,,
金芒果装饰集团            ,江西省吉安市吉州区广场北路1号(新世界广场...,4008-659-600,,
南昌林涵设计            ,林涵设计,4008-659-600,,
金芒果装饰集团            ,江西省吉安市吉州区广场北路1号(新世界广场...,4008-659-600,,
南昌林涵设计            ,林涵设计,4008-659-600,,
满艺装饰工程有限公司            ,南昌市西湖区朝阳洲云锦路与永富路交界口,4008-659-600,,
 ,,4008-659-600,,
华基石材有限公司            ,,4008-659-600,,
云浮市长业石材            ,,4008-659-600,,
云浮市洋洋石材有限公司            ,云浮市云城区金富工业园,4008-659-600,,
云城区名匠装饰设计中心            ,广东省云浮市云城区城北帝景苑C3栋首层 ,4008-659-600,,
罗佳装饰工程有限公司            ,云浮市海富东路35号,4008-659-600,,
景致装饰设计体验中心            ,云浮市云城区臻汇园十栋商铺（市消防局对面）,4008-659-600,,
速艺装饰工程有限公司            ,云浮市龙都西路33号,4008-659-600,,
阔达建筑装饰工程有限责任公司            ,北京市海淀区西三环北路87号国际财经中心c...,4008-659-600,,
嘉祺装饰设计工程有限公司            ,,4008-659-600,,
云浮豪庭天花装饰            ,云浮云城区,4008-659-600,,
云城区灏竣装饰工程部            ,云浮市云城区富华北路市农业局旁边罗北生房屋...,4008-659-600,,
艺诚装饰设计工作室            ,云浮市,4008-659-600,,
冯氏整体装饰工程有限公司            ,云浮市,4008-659-600,,
中宏装饰设计有限公司            ,广东省云浮市龙华中路195-197号,4008-659-600,,
南昌道艺装饰有限公司            ,南昌市红谷滩万达中心写字楼B2-814,4008-659-600,,
华浔品味装饰            ,东路鹿鼎家居4楼b馆,4008-659-600,,
新锐装饰设计中心            ,云浮市云城区,4008-659-600,,
