新疆美艺雅装饰工程有限公司克拉玛依分公司 ,新疆克拉玛依市克拉玛依区胜利路62-3号,15809902521,6968222,
新疆方园装饰工程有限公司 ,新疆克拉玛依市国际家居建材城8-117,18809909858,7581933,
嘉禾铭典装饰工程有限公司            ,天津路气象卫星地面站高层1号楼1单元140...,4008-659-600,,
立方居装饰设计有限公司            ,乌鲁木齐美居物流园L座8-1104（美居友...,4008-659-600,,
糖巢装饰有限责任公司            ,乌鲁木齐市天山区中湾街金坤C区27号楼6单...,4008-659-600,,
鲁班装饰设计有限公司            ,南昌,4008-659-600,,
华丽景轩装饰设计有限公司            ,乌鲁木齐长沙路158号绿苑雅筑小区,4008-659-600,,
美星装饰集团            ,新疆克拉玛依,4008-659-600,,
交换空间装饰有限公司            ,南坪会展中心9玺国际8栋,4008-659-600,,
天佑兴业装饰设机构工程有限公司            ,乌鲁木齐新市区昆明路518号阳光天和综合楼...,4008-659-600,,
创想饰界建筑装饰工程有限公司            ,乌鲁木齐新市区长春南路美林花源南区1号楼4...,4008-659-600,,
实创家居装饰集团有限公司            ,青云谱洪都洪城路6号国贸广场13层,4008-659-600,,
金乐美居建筑装饰工程有限公司            ,新市区长春中路锦城大厦，锦城丽苑1-3-7...,4008-659-600,,
万嘉禾装饰有限公司            ,新疆乌鲁木齐高新技术产业开发区（新市区）长...,4008-659-600,,
青苹果乐园装饰工程有限公司            ,乌鲁木齐市新市区鲤鱼山路1166号鸿祥雅轩...,4008-659-600,,
轻舟装饰            ,乌鲁木齐市新市区天津南路188号轻舟装饰,4008-659-600,,
克拉玛依金派装饰工程有限公司            ,克拉玛依市国际建材城15-222,4008-659-600,,
北京金艺阁装饰            ,鲤鱼山路山水华庭11号单元1002,4008-659-600,,
克拉玛依波涛装饰设计有限公司            ,新疆克拉玛依市迎宾大道69号,4008-659-600,,
新疆铭诚艺鼎装饰有限公司            ,新疆乌鲁木齐市新市区长春南路蓝调一品C区1...,4008-659-600,,
 ,,4008-659-600,,
万嘉宏图装饰工程有限公司            ,乌鲁木齐市市沙依巴克区西山路156队小区1...,4008-659-600,,
新疆继伟彩诗建筑装饰工程有限公司            ,乌市喀什东路五建市场A-16号,4008-659-600,,
新疆六度空间装饰设计有限公司            ,乌鲁木齐市天津路188号银苑商住A座一单元...,4008-659-600,,
新疆精典伟业装饰设计有限公司            ,新疆乌鲁木齐新市区河北东路966号康城果岭...,4008-659-600,,
南昌道艺装饰有限公司            ,南昌市红谷滩万达中心写字楼B2-814,4008-659-600,,
阔达建筑装饰工程有限责任公司            ,北京市海淀区西三环北路87号国际财经中心c...,4008-659-600,,
三维阳光装饰设计工程有限公司            ,乌鲁木齐长春路友好时尚购物B座旁美林花源锦...,4008-659-600,,
嘉祺装饰设计工程有限公司            ,,4008-659-600,,
创艺时代装饰有限公司            ,乌鲁木齐市长沙路158号绿苑雅筑7号楼1单...,4008-659-600,,
惠巢装饰有限公司            ,乌市长沙路美林阁小区1栋1单元803室,4008-659-600,,
新疆快捷龙盟装饰有限公司            ,新疆乌鲁木齐北京路二宫新华联大厦B座13层,4008-659-600,,
新疆黎源建筑装饰设计有限公司            ,小西沟肿瘤医院旁边阳光天和1305和230...,4008-659-600,,
新疆惠盛天祥家装设计有限公司            ,新疆乌鲁木齐市沙依巴克区西虹西路666号绿...,4008-659-600,,
