贵州灏轩居装饰工程有限公司 ,六盘水六枝特区团结路八栋楼对面新华书店五楼...,15685825151,5837566,
六枝特区安家乐建筑装饰工程有限公司 ,六枝特区文化路路口,15086480992,5506577,
贵州快乐佳园装饰工程有限公司            ,南环路南凤天城二期门面2楼,4008-659-600,,
美之家装饰有限公司            ,六盘水中山区南环路85号,4008-659-600,,
贵州鑫名扬装饰工程有限责任公司            ,六盘水市钟山经济开发区红桥新区金果建材市场...,4008-659-600,,
毅辰装饰设计工程有限公司            ,钟山区 凤凰新区华飞星苑一层206号,4008-659-600,,
钟山区华莲之家装饰工程有限公司            ,六盘水钟山区凤凰新区山海关天下B座1721,4008-659-600,,
贵州快乐佳园装饰工程有限公司            ,钟山区南环路南凤天城二期二楼,4008-659-600,,
易尚装饰工程有限公司            ,六盘水市人民广场天易大厦18楼市法院旁,4008-659-600,,
毅辰装饰有限公司            , 凤凰新区华飞星苑一层206号,4008-659-600,,
贵州审美空间装饰工程有限公司            ,六盘水市麒麟路世纪馨苑一单元505室,4008-659-600,,
筑邦装饰工程有限公司            ,六盘水市红桥新区金果建材城D区3楼,4008-659-600,,
红蚂蚁装饰工程有限公司            ,盘县红果银杏广场正对面,4008-659-600,,
贵州左右空间装饰工程有限公司            ,六盘水市钟山区-德馨园财富中心3楼3-14...,4008-659-600,,
贵州云想装饰工程有限责任公司            ,六盘水钟山区钟山大道风池路9号,4008-659-600,,
钟山开发区华堂装饰经营部             ,钟山区麒麟路闽南家居斜对面,4008-659-600,,
贵州快乐佳园装饰工程有限公司分公司            ,南环路南凤天城二期北盘江酒店二楼(市一中斜...,4008-659-600,,
雄业装饰建筑工程有限公司            ,六盘水市钟山区豹业大厦九楼永辉超市旁城市方...,4008-659-600,,
青禾装饰工作室            ,德坞德宏路口金兰新港B栋404,4008-659-600,,
南国金鼎装饰有限公司            ,六盘水市凉都大道市一中对面南凤天城二期门面...,4008-659-600,,
桐徕装饰有限公司             ,六盘水市钟山区麒麟路搬迁一街,4008-659-600,,
宏业装潢工程有限公司            ,贵州省六盘水市钟山区花渔洞菜场巷 ,4008-659-600,,
贵州三星余工装饰设计有限公司分公司            ,钟山中路德远美美家居五楼,4008-659-600,,
柏雅居装饰有限公司            ,六盘水市钟山区德乌四季花城门面111号,4008-659-600,,
南昌道艺装饰有限公司            ,南昌市红谷滩万达中心写字楼B2-814,4008-659-600,,
贵州择美居装饰工程有限公司            ,贵州省六盘水市钟山区碧云路与大连路交汇处东...,4008-659-600,,
筑邦装饰工程有限公司             ,六盘水市红桥新区金果建材城D区3楼331-...,4008-659-600,,
南国风装饰工程有限工司            ,青山湖南大道墅溪园,4008-659-600,,
