十堰博天装饰设计工程有限公司 ,六堰人商旁汉江精品酒店10楼,15571986432,8666691,
十堰堂皇建筑装饰有限公司 ,十堰市茅箭区上海路60号书香嘉苑写字楼15...,13907281313,8665470,
湖北皇朝饰家环保装饰材料有限公司 ,十堰市茅箭区天津路48号欣玺来酒店二层(天...,18618313456,8452555,
十堰红明装饰设计工程有限公司 ,十堰市茅箭区苏州路南北世纪城,13593761839,8611492,
十堰家装e站装饰 ,,13886806661,,
十堰红明装饰设计工程有限公司            ,湖北省 十堰市 茅箭区 地址：十堰市武当广...,4008-659-600,,
星梦想装饰公司            ,湖北省 十堰市 茅箭区 十堰市武当国际园兴...,4008-659-600,,
十堰大运装饰            ,三堰万秀城1号楼1单元20楼,4008-659-600,,
十堰艺彩装饰工程有限公司            ,十堰市茅箭区五堰街办公园路6号金色领地1幢...,4008-659-600,,
北京海天环艺装饰工程公司十堰欧伦达分公司            ,人民中路11号维也纳商业广场1706室,4008-659-600,,
嘉祺装饰设计工程有限公司            ,,4008-659-600,,
十堰艺彩装饰工程有限公司            ,湖北省 十堰市 市辖区 十堰市茅箭区五堰街...,4008-659-600,,
大运装饰工程有限公司            ,湖北省 十堰市 茅箭区 十堰市人民中路93...,4008-659-600,,
十堰宏伦环保装饰材料有限公司            ,湖北省 十堰市 茅箭区 十堰市车站路16号...,4008-659-600,,
十堰锦秀建筑装饰工程公司            ,十堰市 市辖区 十堰市白浪经济开发区白浪中...,4008-659-600,,
十堰星梦想装饰工程有限公司            ,湖北省 十堰市 茅箭区 朝阳路武当国际园兴...,4008-659-600,,
江西装饰-江西装饰(旗舰店)            ,江西省南昌市西湖区洪城路丽都广场a栋苹果装...,4008-659-600,,
十堰九歌装饰设计工程有限公司            ,十堰市人民中路11号军分区对面维也纳商业广...,4008-659-600,,
宜惠装家居馆十堰分公司            ,三堰上海路金座2号厅1楼,4008-659-600,,
北京海天装饰十堰分公司            ,朝阳中路武当国际园B栋11楼,4008-659-600,,
湖北上舍建筑装饰工程有限公司            ,十堰市北京路万达商业广场A座2046,4008-659-600,,
十堰星梦想装饰公司            ,十堰市茅箭区朝阳路武当国际中央商务区1单元...,4008-659-600,,
十堰博天装饰设计工程有限公司            ,湖北省十堰市人民北路6号（六堰人商旁边）汉...,4008-659-600,,
北京实创家居装饰集团(江西)有限公司            ,南昌市洪城路6号国贸国贸广场新华都1-3层,4008-659-600,,
北京吉诚装饰有限公司十堰分公司            ,十堰市人民中路93号万秀城1栋21楼,4008-659-600,,
南昌站            ,江西省南昌市青山湖区上海路699文化创意园,4008-659-600,,
东易日盛·第四维空间            ,北京路京华写字楼7楼,4008-659-600,,
南昌网            ,南昌市青山湖区上海路699文化创意园,4008-659-600,,
南昌实创家居装饰            ,南昌市洪城路6号新华都购物广场3楼,4008-659-600,,
南昌站            ,江西省南昌市青山湖区上海路699文化创意园,4008-659-600,,
南昌高鸿装饰工程有限公司            ,抚生路1199号喜盈门灯饰广场三楼,4008-659-600,,
十堰            ,湖北十堰市上海路大学新城时代广场二楼,4008-659-600,,
江西翔海装饰工程有限公司            ,,4008-659-600,,
南昌实创家居装饰            ,南昌市洪城路6号新华都购物广场3楼,4008-659-600,,
南昌站            ,江西省南昌市青山湖区上海路699文化创意园,4008-659-600,,
十堰江水平装修队            ,茅箭区浙江路,4008-659-600,,
云天装饰            ,,4008-659-600,,
十堰海木源装饰            ,十堰市万秀城写字楼7楼,4008-659-600,,
十堰市阔达装饰设计工程有限公司            ,湖北省十堰市茅箭区朝阳中路武当国际中央商务...,4008-659-600,,
十堰泰诺装饰工程有限公司            ,,4008-659-600,,
十堰云天装饰工程有限公司            ,湖北省十堰市北京北路阳光栖谷天街220-2...,4008-659-600,,
十堰祥龙装饰            ,,4008-659-600,,
亿达装饰            ,,4008-659-600,,
欧伦达装饰            ,人民中路11好维也纳商业广场1706室,4008-659-600,,
十堰市茅箭区三堰四明室内设计工作室            ,十堰市茅箭区人民中路66号8栋801室,4008-659-600,,
盛康装修公司            ,,4008-659-600,,
星梦想装饰            ,,4008-659-600,,
十堰聚品阁建筑装饰设计工程有限公司            ,,4008-659-600,,
十堰工匠装饰工程有限公司            ,,4008-659-600,,
十堰市圣雅皇装饰            ,北京南路7号奥特莱斯国际广场11号楼100...,4008-659-600,,
盛康装修公司            ,,4008-659-600,,
星梦想装饰            ,,4008-659-600,,
十堰聚品阁建筑装饰设计工程有限公司            ,,4008-659-600,,
十堰工匠装饰工程有限公司            ,,4008-659-600,,
十堰市圣雅皇装饰            ,北京南路7号奥特莱斯国际广场11号楼100...,4008-659-600,,
十堰万源建筑装饰            ,,4008-659-600,,
十堰紫名都装饰工程有限公司            ,五堰街办人民中路1号,4008-659-600,,
十堰尚嘉室内装饰设计工程有限公司            ,十堰市五堰街办柳林路30号（移民局旁）,4008-659-600,,
十堰欧伦达设计馆            ,湖北省 十堰市 茅箭区 十堰市维也纳商业广...,4008-659-600,,
十堰市达观装饰设计工程有限公司            ,十堰市五堰人和晶座17-01号,4008-659-600,,
北京海天环艺家居装饰十堰分公司            ,朝阳路武当国际园11楼,4008-659-600,,
十堰分公司            ,十堰市上海路66号大学星城时代广场2楼,4008-659-600,,
十堰欧伦达装饰            ,十堰市张湾区万达广场B座*,4008-659-600,,
十堰泰诺装饰工程有限公司            ,十堰市人民中路66号三堰澳门街工商所旁2楼,4008-659-600,,
十堰梓杰装饰设计工程有限公司            ,张湾区昌升国际商贸城5-7-11号,4008-659-600,,
十堰恒丰装饰有限公司            ,十堰市朝阳中路5号（六堰科器公司对面用新人...,4008-659-600,,
十堰九州装饰工程有限公司            ,五堰维也纳商业广场1606,4008-659-600,,
十堰乐福装饰设计有限公司            ,十堰市茅箭区朝阳中路73号(人民保险旁),4008-659-600,,
北京吉诚装饰十堰分公司            ,湖北省 十堰市 茅箭区 人民中路万秀城１栋...,4008-659-600,,
南昌鲁公大宅装饰工程公司            ,南昌市八一广场丽华购物广场6楼,4008-659-600,,
博天装饰设计工程有限公司            ,湖北省 十堰市 茅箭区 人民北路6号汉江宾...,4008-659-600,,
美星装饰集团            ,南昌,4008-659-600,,
鲁班装饰设计有限公司            ,南昌,4008-659-600,,
交换空间装饰有限公司            ,南坪会展中心9玺国际8栋,4008-659-600,,
湖北大夫第建筑装饰工程有限公司            ,湖北省 十堰市 茅箭区 湖北省十堰市茅箭区...,4008-659-600,,
十堰市达观装饰设计工程有限公司            ,湖北省 十堰市 茅箭区 人民北路62号人和...,4008-659-600,,
十堰盛逸装饰公司            ,湖北省 十堰市 茅箭区 湖北省十堰市茅箭区...,4008-659-600,,
实创家居装饰集团有限公司            ,青云谱洪都洪城路6号国贸广场13层,4008-659-600,,
十堰市阔达装饰设计工程有限公司            ,湖北省 十堰市 茅箭区 朝阳中路武当国际中...,4008-659-600,,
