南京瑞林达装饰有限公司 ,新街口沈举人19号长发华辰大厦1805室,17702508973,58719477,
南京凯典装饰工程有限公司 ,南京市雨花台区德盈国际广场3栋27楼,13611586377,89616076,
南京古兰装饰工程有限公司 ,建邺区凤栖苑130号,13913885909,86669658,
南京创品装饰工程有限公司 ,江苏省南京市江宁区岔路口宏运大道山水方舟门...,13770631218,84964393,
南京典居圣装饰工程有限公司 ,南京市栖霞区晓庄国际广场1-923,13951867609,86607833,
南京瑞林达装饰有限公司 ,新街口沈举人19号长发华辰大厦1805室,17702508973,58719477,
南京凯典装饰工程有限公司 ,南京市雨花台区德盈国际广场3栋27楼,13611586377,89616076,
南京古兰装饰工程有限公司 ,建邺区凤栖苑130号,13913885909,86669658,
南京创品装饰工程有限公司 ,江苏省南京市江宁区岔路口宏运大道山水方舟门...,13770631218,84964393,
南京典居圣装饰工程有限公司 ,南京市栖霞区晓庄国际广场1-923,13951867609,86607833,
南京青松装饰工程有限公司 ,天元东路228号莱茵量子国际大厦14楼,13605155113,84121685,
速美集家装饰有限责任公司南京分公司 ,江苏省南京市江宁区高新园天元东路547号天...,15251822418,400-156-1885,
南京六都装饰工程有限公司 ,南京市江宁区上元大街238号四楼,18502516336,52695936,
南京锦华装饰            ,汉中路180号星汉大厦23楼 ,4008-659-600,,
南京港中装饰设计工程有限公司            ,南京中山东路218号长安国际中心1502室,4008-659-600,,
南京瑞林达装饰有限公司 ,新街口沈举人19号长发华辰大厦1805室,17702508973,58719477,
南京凯典装饰工程有限公司 ,南京市雨花台区德盈国际广场3栋27楼,13611586377,89616076,
南京古兰装饰工程有限公司 ,建邺区凤栖苑130号,13913885909,86669658,
南京创品装饰工程有限公司 ,江苏省南京市江宁区岔路口宏运大道山水方舟门...,13770631218,84964393,
南京典居圣装饰工程有限公司 ,南京市栖霞区晓庄国际广场1-923,13951867609,86607833,
南京青松装饰工程有限公司 ,天元东路228号莱茵量子国际大厦14楼,13605155113,84121685,
速美集家装饰有限责任公司南京分公司 ,江苏省南京市江宁区高新园天元东路547号天...,15251822418,400-156-1885,
南京六都装饰工程有限公司 ,南京市江宁区上元大街238号四楼,18502516336,52695936,
南京锦华装饰            ,汉中路180号星汉大厦23楼 ,4008-659-600,,
南京港中装饰设计工程有限公司            ,南京中山东路218号长安国际中心1502室,4008-659-600,,
南京恒安装饰设计工程有限公司            ,南京市洪武路267号洪武大厦1006室(户...,4008-659-600,,
南京九旗建筑装饰工程有限公司            ,南京市桥北弘阳大厦1812~1814室,4008-659-600,,
南京瑞晶装饰工程有限公司            ,南京市江宁区金箔路624号（工商局向东20...,4008-659-600,,
南京华标·金月亮装饰工程有限公司            ,南京市(1)山西路世贸中心大厦a1座231...,4008-659-600,,
南京集庭装饰工程有限公司            ,南京市白下区大光路188号锦江丽舍920室,4008-659-600,,
南京梵池装饰工程有限公司            ,南京市建邺区江东中路186号宏普捷座512,4008-659-600,,
南京千禧龙装饰有限公司            ,王府大街63号中泰南楼4楼412,4008-659-600,,
南京禾地建筑装饰工程有限公司            ,南京市江东中路76号五洲装饰城三楼,4008-659-600,,
江苏亚伟装饰工程有限公司            ,南京市中山南路89号江苏文化大厦15楼c座,4008-659-600,,
南京蒙塔尼装饰工程有限公司            ,南京市江宁区万达广场A座1405室,4008-659-600,,
南京飞奥装饰公司            ,南京中山南路现代大厦317号2003,4008-659-600,,
南京乾佑御璜建筑装饰工程有限公司            ,江苏省南京市白下区中山东路300号长发cf...,4008-659-600,,
南京秀米装修公司            ,南京市玄武区中央北路230,4008-659-600,,
南京元洲●品界大宅设计            ,河西万达B座,4008-659-600,,
南京天作装饰工程有限公司            ,南京大桥北路9号弘阳大厦909室,4008-659-600,,
南京居联峰尚装饰有限公司            ,江宁区天印大道880号,4008-659-600,,
江苏钟凯丽装饰工程有限公司            ,1,4008-659-600,,
南京矶米装饰设计            ,南京市鼓楼区阅江楼街道江边路30-3室,4008-659-600,,
木桃盒子室内设计有限公司            ,南京市江宁区百家湖湖滨路77号,4008-659-600,,
南京焦点装饰设计工程有限公司            ,南京市白下区光华路2号鑫园12幢106门面...,4008-659-600,,
高度国际装饰设计集团南京分公司            ,鼓楼区集庆门大街268号苏宁慧谷E07-1...,4008-659-600,,
广东星艺装饰有限公司            ,南京市鼓楼区山西路金山大厦B座11楼A+G...,4008-659-600,,
南京艺仟装饰工程有限公司            ,南京市鼓楼区中山北路188号,4008-659-600,,
斯勃克舒适家居            ,卡子门大街88号石林家乐家,4008-659-600,,
南京摩宇装饰工程有限公司            ,南京市和燕路251号金港大厦B座2102室,4008-659-600,,
南京品界大宅            ,南京河西万达B座,4008-659-600,,
金蜗牛装饰工程有限公司            ,浦口区迎江路59号海德北岸广场商铺02号(...,4008-659-600,,
雅士居装饰工程公司            ,,4008-659-600,,
南京伟石装饰工程有限公司            ,岔路口鑫泰国际广场1幢1003室,4008-659-600,,
南京龙耀装饰工程有限公司            ,雨花台区长虹路德盈国际广场,4008-659-600,,
居居装饰工程有限公司            ,南京市鼓楼区江东北路清江苏宁广场1913,4008-659-600,,
南京紫凌轩装饰工程有限公司            ,南京市江宁区天元东路228号莱茵铂郡614,4008-659-600,,
幻居装饰设计工程有限公司            ,南京雨花台雨花西路258号明门公寓1栋80...,4008-659-600,,
南京楚居装饰有限公司            ,南京浦口区苏宁环球天润广场北侧50米,4008-659-600,,
南京品界大宅设计            ,建邺区河西万达B座,4008-659-600,,
南京欧鹰装饰设计工程有限公司            ,南京市户部街33号天之都大厦1112室,4008-659-600,,
南京全鑫装饰工程有限责任公司            ,南京市雨花台区德盈国际广场虹悦城2栋(12...,4008-659-600,,
南京红庭装饰工程有限公司            ,南京市鼓楼区中央路417号先锋广场1325...,4008-659-600,,
江苏天原工创装饰设计工程有限公司            ,江苏南京建邺河西万达广场E幢3106,4008-659-600,,
沙龙装饰工程（南通）有限公司南京分公司            ,南京市江宁区天印大道1299号7-106室...,4008-659-600,,
南京洪川建筑装饰设计有限公司            ,南京市江宁区湖山路419号,4008-659-600,,
北京龙发装饰南京分公司            ,南京市白下区中山南路315号瑞华大厦2楼,4008-659-600,,
南京锦盈源装饰工程有限公司            ,南京市鼓楼区中央路417号先锋广场514,4008-659-600,,
香港鼎匠国际设计有限公司南京分公司            ,南京市中山东路198号1708室,4008-659-600,,
南京天阁装饰工程有限公司            ,南京市浦口区浦珠北路澳林购物广场国美电器楼...,4008-659-600,,
南京酷客装饰工程有限公司            ,南京市中山南路360号同坤大厦17楼,4008-659-600,,
北京大业美家家居装饰有限公司南京分公司            ,南京市秦淮区太平南路297号江苏饭店9楼,4008-659-600,,
南京鑫亦恒机电设备有限公司            ,南京市鼓楼区虎踞路58号,4008-659-600,,
江苏雅仕居装饰工程有限公司            ,雨花区软件大道9-1宁南汽配城对面,4008-659-600,,
南京一号家居馆            ,玄武区中央路302号,4008-659-600,,
南京居秀装饰工程有限公司            ,建邺区兴隆大街,4008-659-600,,
南京龙宾装饰工程有限公司            ,江苏省南京市白下区常府街85号新大都广场甲...,4008-659-600,,
南京乾佑御璜建筑装饰工程有限公司            ,长发中心A座6楼,4008-659-600,,
明珠装饰有限公司            ,下关区幕府西路15号,4008-659-600,,
倍善信装饰工程有限公司            ,南京市江东北路301号滨江广场1棟6楼A座,4008-659-600,,
南京中陆装饰工程有限公司            ,江苏省南京市雨花台,4008-659-600,,
南京威登装饰工程有限公司            ,中华路50号,4008-659-600,,
南京立坤室内设计事务所            ,南京秦淮区光华路2号石林家居广场6007,4008-659-600,,
乐乐装修施工队            ,迈皋桥,4008-659-600,,
南京康友装饰工程有限公司            ,南京市浦口区大桥北路一号华侨银座A座903...,4008-659-600,,
南京臻典建筑装饰工程有限公司            ,南京市白下区洪武路267号洪武大厦706室,4008-659-600,,
江苏亚伟建筑装饰设计工程有限公司            ,南京新街口中山南路89号江苏文化大厦15楼...,4008-659-600,,
惠百氏装饰工程有限公司            ,南京市集庆门大街台园18幢63号,4008-659-600,,
南京mt设计室            ,达美广场,4008-659-600,,
南京黑蚁装修设计工程有限公司            ,南京市白下区五洲装饰城商务楼107,4008-659-600,,
浩旭装饰工程有限公司            ,金盛国际家居3号厅机器码二楼,4008-659-600,,
南京浩荣装饰设计工程有限公司            ,浦口区弘阳公馆一号,4008-659-600,,
南京君涛装饰工程有限公司            ,南京江宁区双龙大道829号瑞阳居01幢32...,4008-659-600,,
南京美洛美巢建筑设计有限公司            ,弘阳广场A2馆-1F 0059-0080号,4008-659-600,,
南京标杆装饰工程有限公司            ,南京市白下区光华路156号星展大厦A座61...,4008-659-600,,
南京金百易建筑装饰工程设计有限公司            ,鼓楼区  热河路50号,4008-659-600,,
陈工家装有限公司            ,南京市珠江路,4008-659-600,,
刘波原创工作室            ,云锦路58号万达东坊7栋720,4008-659-600,,
专业家装团队            ,浦口区万润家园2-504,4008-659-600,,
江苏八斗才装饰工程有限公司            ,龙蟠中路318号金龙蟠家苑1栋1803室,4008-659-600,,
南京贵美装饰工程有限公司            ,南京市江宁区文心街,4008-659-600,,
南京维宁装饰工程有限公司            ,南京桥北路9号弘阳大厦骏馆1724-172...,4008-659-600,,
南京九头鸟装饰工程公司            ,中山南路321号现代大厦2106室,4008-659-600,,
迪科达装饰工程有限公司            ,南京市中华路166号409室(地铁一号线三...,4008-659-600,,
南京煦融装饰工程有限公司            ,南京市浦口区大桥北路9号弘阳大厦801室,4008-659-600,,
top原创国际设计研究院            ,梦都大街建筑师工社708,4008-659-600,,
南京涛锦装饰工程有限公司            ,南京市秦淮区五洲装饰广场兆仑巷三楼,4008-659-600,,
南京帅创装饰设计工程有限公司            ,南京市太平南路151号魔方城市贵族公馆31...,4008-659-600,,
南京中恩装饰工程有限公司            ,南京市锁金村83号公用金卡大厦3楼309室...,4008-659-600,,
南京品家装饰工程有限公司            ,南京市建邺区南湖沿河街西祠街区（17-30...,4008-659-600,,
园亭居装饰公司            ,,4008-659-600,,
南京中央空调，地暖，和暖            ,南京汉中门大街2号蔚蓝之都家园3栋1楼,4008-659-600,,
南京天原工创装饰设计工程有限公司            ,南京市建邺区万达西地二街区11栋3106,4008-659-600,,
南京好军嫂门窗工程有限公司            ,南京市浦口区大桥北路弘扬骏馆,4008-659-600,,
南京六拓装饰工程有限公司            ,六合区花语馨苑上马石路41号,4008-659-600,,
南京易之轩装饰工程设计有限公司            ,南京市六合区金宁国际大厦19楼,4008-659-600,,
南京九头鸟装饰工程有限公司            ,中山南路321号现代大厦2106室,4008-659-600,,
韩耐家具有限公司            ,南京市秦淮区卡子门大街红星美凯龙,4008-659-600,,
南京砚钫在线科技有限公司            ,南京龙蟠路,4008-659-600,,
南京盘古石材有限公司            ,南京雨花区红太阳装饰城C1-204。C1-...,4008-659-600,,
正大石木装饰公司            ,南京市建邺区万达金街西区10栋252号,4008-659-600,,
南京美沃办公家具设备有限公司            ,南京市浦口区花旗104国道旁,4008-659-600,,
金诚装饰有限公司            ,江苏南京,4008-659-600,,
南京逸年华装饰工程有限公司            ,珠江路688号卓越骇客天街1131-113...,4008-659-600,,
南京逸年华装饰工程有限公司            ,珠江路688号卓越骇客天街1131-113...,4008-659-600,,
南京北贸装饰工程有限公司            ,南京市鼓楼区建宁路30号,4008-659-600,,
家福装饰工程            ,南京江宁上元大街,4008-659-600,,
南京美沃办公家具设备有限公司            ,南京市浦口区花旗104国道旁,4008-659-600,,
金诚装饰有限公司            ,江苏南京,4008-659-600,,
万子红装饰设计工程有限公司            ,鼓楼区华侨路管家桥85号华荣大厦2208,4008-659-600,,
南京康佳装饰工程有限公司            ,南京鼓楼中央门,4008-659-600,,
南京大陆装饰工程有限公司            ,下关区建宁路亚都大厦805室,4008-659-600,,
南京市点缀装饰工程有限公司            ,南京市栖霞区迈皋桥,4008-659-600,,
南京洁雅装饰工程有限公司            ,南京市鼓楼区铁路北街182-8号,4008-659-600,,
南京龙峰装饰工程有限公司            ,南京浦口区威尼斯水城九街区物业旁,4008-659-600,,
南京标杆装饰工程有限公司            ,南京市白下区星海路8 号,4008-659-600,,
南京妙诚装饰工程有限公司            ,天润城十街区商铺25--106,4008-659-600,,
南京金逸庭装饰工程有限公司            ,江苏省南京市中央路417号,4008-659-600,,
南京逸年华装饰工程有限公司            ,珠江路688号卓越骇客天街1131-113...,4008-659-600,,
南京尚观居装饰设计工程有限公司            ,南京市浦口区弘阳广场弘阳壹号A座916,4008-659-600,,
桥北瑞云装饰公司            ,南京大桥北路9号弘扬大厦5F,4008-659-600,,
南京小伙伴装饰工程设计有限公司            ,南京市秦淮区龙蟠中路530-1号,4008-659-600,,
尚层装饰北京有限公司南京分公司            ,江东北路88号清江苏宁广场,4008-659-600,,
南京朝好装饰有限公司            ,南京市龙蟠中路311号达美广场1103室,4008-659-600,,
南京馨品诺装饰工程有限公司            ,南京市浦口弘阳壹号B座1016室,4008-659-600,,
南京银燕装饰工程有限公司            ,南京江宁区双龙大道西侧，铂金水岸1幢416...,4008-659-600,,
撒旦发射范德萨发送            ,as范德萨,4008-659-600,,
南京铭康建筑工程有限公司            ,南京大桥北路48号弘阳壹号1809室,4008-659-600,,
大邑建设装饰工程有限公司            ,南京江宁东山湖东路天元吉第城北门向东50米,4008-659-600,,
北京嘉和日盛装饰南京分公司            ,建邺区集庆门大街33号  ,4008-659-600,,
荃盛装饰工程有限公司            ,,4008-659-600,,
南京美盈装饰工程有限公司            ,江宁区竹山路地铁口434号,4008-659-600,,
南京景升装饰工程有限公司            ,南京市江宁区天元中路126号新城发展中心2...,4008-659-600,,
南京艺爵软装饰设计工程有限公司            ,南京市雨花台区玉兰路19-01号,4008-659-600,,
南京美盈装饰工程有限公司            ,江宁区竹山路地铁口434号,4008-659-600,,
南京昊桐装饰设计工程有限公司            ,南京市江宁区上元大街195号,4008-659-600,,
南京泉平装饰设计工程有限公司            ,南京市浦口区弘阳一号B座1011室,4008-659-600,,
南京九间堂装饰工程有限公司            ,南京市建邺区江东中路215号凤凰文化广场B...,4008-659-600,,
米瑞特装修公司            ,,4008-659-600,,
南京国屏光电科技有限公司            ,南京市玄武区月香路6号,4008-659-600,,
南京创品装饰工程有限公司            ,江苏省南京市江宁区岔路口宏运大道山水方舟门...,4008-659-600,,
南京终结者装饰设计工程有限公司            ,南京市雨花台区雨花西路258号(摩卡庄园酒...,4008-659-600,,
南京仲子路科技有限公司            ,江东北路97号鸿都大厦A座6楼,4008-659-600,,
南京庭之栋文化装饰设计工作室            ,新街口洪武北路,4008-659-600,,
南京寰宇装饰有限公司            ,南京市鼓楼区上海路,4008-659-600,,
南京同坤装饰工程有限公司            ,南京市大光路49号红鹰大厦905,4008-659-600,,
南京市业顺装饰公司            ,江苏南京江宁区东山,4008-659-600,,
龙跃装饰工程有限公司            ,弘阳建材馆a2馆三楼3215-3218,4008-659-600,,
南京全木建筑装饰工程有限公司            ,南京市白下区光华路石门坎115号五洲装饰城...,4008-659-600,,
南京弘宇装饰工程有限公司            ,,4008-659-600,,
南京面对面装饰有限公司            ,南京市玄武区南京建设规划展览馆一楼,4008-659-600,,
江苏齐装网络技术有限公司            ,南京玄武区,4008-659-600,,
南京典维装饰工程有限公司            ,南京市下关区幕府西路33号,4008-659-600,,
南京颂美装饰工程有限公司            ,浦口区天润城7街区东大门 ,4008-659-600,,
齐装网有限公司            ,,4008-659-600,,
南京创腾装饰工程有限公司            ,秦淮区汇景路176号,4008-659-600,,
龙跃装饰工程有限公司            ,弘阳建材馆a2馆三楼3215-3218,4008-659-600,,
江苏八斗才装饰工程有限公司            ,,4008-659-600,,
南京终结者装饰设计公司            ,雨花西路258号,4008-659-600,,
南京索兰装饰有限公司            ,南京秦淮区明匙路杜克soho商务楼215室...,4008-659-600,,
南京汉邦柏森节能门窗            ,南京雨花台区,4008-659-600,,
起发永恒装饰公司            ,,4008-659-600,,
南京市红牛装饰            ,南京市秦淮区龙蟠中路458号 ,4008-659-600,,
南京宏栢建筑工程有限公司            ,南京市建邺区江东中路万达广场11栋22楼（...,4008-659-600,,
倍善信装饰工程有限公司            ,南京市江东北路滨江广场1栋6楼A座,4008-659-600,,
江苏雅仕居装饰工程有限公司            ,南京市雨花区软件大道9-1（花神美境小区南...,4008-659-600,,
南京乾佑御璜建筑装饰工程有限公司            ,大行宫中山东路300号长发CFC商业中心A...,4008-659-600,,
南京金御阁装饰工程有限公司            ,南京市浦口区大桥北路9号弘阳大厦骏馆141...,4008-659-600,,
南京秀锋木业有限公司            ,南京迈皋桥长营村144号,4008-659-600,,
南京卓阁建筑装饰工程有限公司            ,南京市石门坎现代大厦,4008-659-600,,
上海天羽空间设计南京分公司            ,南京河西万达广场四楼,4008-659-600,,
南京龙发装饰公司            ,南京市秦淮区瑞华大厦,4008-659-600,,
南京汉拓空间设计有限公司            ,南京市江宁区百家湖诚基大厦B座605,4008-659-600,,
南京东轩恒泰装饰工程有限公司            ,南京市大厂草芳路505号,4008-659-600,,
南京悦恒装饰            ,新街口国贸大厦20楼,4008-659-600,,
南京风沙渡墙纸有限公司            ,南京市太平南路1号新世纪广场B座,4008-659-600,,
南京金螳王建筑装饰有限公司            ,南京市白下区白下路255号,4008-659-600,,
南京品良美惠装饰工程公司            ,浦口区大桥北路1号华侨广场23楼2307室,4008-659-600,,
南京凯典装饰工程有限公司            ,南京德盈国际广场3栋402室,4008-659-600,,
南京佳诺装饰工程有限公司            ,,4008-659-600,,
南京佳林装饰            ,,4008-659-600,,
南京鑫红彩装饰有限公司            ,南京栖霞区马群科技园,4008-659-600,,
南京隆宸装饰工程有限公司            ,,4008-659-600,,
南京凯旋装饰工程有限公司            ,南京市江宁区天印大道1369号,4008-659-600,,
南京龙之友装饰工程有限公司            ,江苏省南京市建邺区汉中门大街257号爱的居...,4008-659-600,,
南京美嘉装饰工程有限公司            ,南京市沿江开发区长冲新天地8-513,4008-659-600,,
南京棒棒家装有限公司            ,南京市栖霞区迈皋桥老街,4008-659-600,,
南京一线天装饰有限公司            ,江宁秣陵街道龙眠大道618号,4008-659-600,,
为家装饰公司            ,,4008-659-600,,
南京智联装饰工程有限公司            ,南京市江宁区科学园吉印大道3789号,4008-659-600,,
丽华装饰有限公司            ,南京市栖霞区,4008-659-600,,
南京华浔品味装饰公司            ,南京市建邺区云锦路59号(万达金街),4008-659-600,,
南京鼎享实业有限责任公司            ,南京新模范马路92号5楼,4008-659-600,,
南京金殿堂装饰工程有限公司            ,江苏南京雨花区,4008-659-600,,
南京百思乐装饰工程有限公司            ,江苏省•南京市•白下区龙蟠中路317号达美...,4008-659-600,,
南京润圭装饰有限公司            ,南京市白下区海福巷,4008-659-600,,
瑞祥佳艺建筑工程有限公司            ,南京市新街口中山东路9号天时国际商贸中心1...,4008-659-600,,
南京三象冷暖            ,莫愁湖东路16-6,4008-659-600,,
南京梵瑞装饰设计有限公司            ,南京市玄武区龙蟠路155号紫金联合立方5-...,4008-659-600,,
 ,,4008-659-600,,
南京市六合区金玉彩堂装饰公司            ,南京市六合区文博家园朝南门面房,4008-659-600,,
南京龙飞亚装饰工程有限公司            ,竹山路99号,4008-659-600,,
南京福殿装饰公司            ,南京浦口区桥北明发商业街278-212商铺,4008-659-600,,
南京欧栎橱柜            ,,4008-659-600,,
南京隆基装饰工程有限公司            ,珠江路67号1908室,4008-659-600,,
南京锐金不锈钢有限公司            ,南京市雨花台区板桥镇科技路19号,4008-659-600,,
南京卡迪装饰工程有限公司            ,南京市仙林大学城香樟园31栋14074,4008-659-600,,
新月装饰有限公司            ,秣陵,4008-659-600,,
南京全鑫装饰工程有限责任公司            ,南京市雨花区虹悦城2幢1206室,4008-659-600,,
北京佳林装饰工程有限公司            ,南京白下区新街口正洪街东宇大厦23楼F座,4008-659-600,,
尚源易馨装饰责任有限公司            ,南京新街口阳光大厦24楼D3室,4008-659-600,,
南京博语装饰工程有限公司            ,南京市玄武区华银路19号,4008-659-600,,
欧宝装饰工程有限公司            ,南京市建邺区江东中路128号,4008-659-600,,
吉水阁室内设计工作室            ,南京市六合区,4008-659-600,,
南京多兰德家具有限公司            ,南京市江宁区陶吴镇粽糖路18号,4008-659-600,,
南京瑞云装饰工程有限公司            ,南京市浦口区大桥北路9号弘阳大厦,4008-659-600,,
南京实创装饰工程有限公司            ,新街口全民健身中心5楼,4008-659-600,,
齐强装修公司            ,南京市浦口区,4008-659-600,,
南京乾佑御璜建筑装饰工程有限公司            ,大行宫中山东路300号长发CFC商业中心A...,4008-659-600,,
九创装饰有限公司            ,南京市江宁开发区天元西路158号,4008-659-600,,
一号家居网南京站            ,中央路266号,4008-659-600,,
南京彬堃装饰工程有限公司            ,南京市浦口区大桥北路弘阳壹号1714室,4008-659-600,,
南京悦恒装饰            ,新街口国贸大厦20楼,4008-659-600,,
南京中强家具有限公司            ,南京江宁区双龙大道958号水岸明珠,4008-659-600,,
南通宇华装饰有限公司南京分公司            ,建邺区水西门大街135号7单元102室,4008-659-600,,
鸿冰装饰公司            ,南京市玄武区,4008-659-600,,
春豪家居一站式服务中心            ,南京高新区新城七栋五楼,4008-659-600,,
南京品胜装修有限公司            ,江苏省南京市,4008-659-600,,
南京名满装饰            ,南京大厂园西路185号,4008-659-600,,
南京恒乐装饰工程有限公司            ,南京市浦口区柳州东路天润城七街区50懂10...,4008-659-600,,
南京唐风宋韵装饰工程配套有限公司            ,南京市下关区中央北路小市新村451号,4008-659-600,,
南京台协装饰工程有限公司            ,白下大杨村26号B座,4008-659-600,,
南京市科尚智能有限公司            ,南京市卡子门红星美凯龙,4008-659-600,,
南京业干装饰公司            ,南京市六合区经久装饰城,4008-659-600,,
公 私精品装饰            ,,4008-659-600,,
江苏八斗才装饰工程有限公司            ,龙蟠中路318号金龙蟠家苑1栋1803室,4008-659-600,,
南京实创装饰工程有限公司            ,新街口全民健身中心5楼,4008-659-600,,
南吉斯装饰有限公司            ,南京市江宁区,4008-659-600,,
齐装网有限公司            ,2533190332,4008-659-600,,
