南京藤黄建筑装饰设计工程有限公司            ,,4008-659-600,,
南京尚境空间装饰工程有限公司            ,,4008-659-600,,
南京东诚铭装饰设计有限公司            ,南京江宁分公司天元东路228号苹果都市B座...,4008-659-600,,
亿烨装饰安装工程有限公司            ,麒麟门 东方红郡,4008-659-600,,
北京佳林装饰工程有限公司            ,南京白下区新街口正洪街东宇大厦23楼F座,4008-659-600,,
南京中强家具有限公司            ,南京江宁区双龙大道958号水岸明珠,4008-659-600,,
凯尊装饰工程有限公司            ,南京市溧水区三小斜对面，新珍珠路58号,4008-659-600,,
深美装饰涌现公司            ,南京江宁区,4008-659-600,,
南京龙发装饰公司            ,南京市秦淮区瑞华大厦,4008-659-600,,
永盛装饰有限公司            ,南京六合,4008-659-600,,
北京东方华美装饰(南京)有限公司            ,南京鼓楼傅厚岗(近紫峰大厦),4008-659-600,,
宏伟装饰有限公司            ,,4008-659-600,,
齐装网有限公司            ,,4008-659-600,,
南京亚纳装饰有限公司            ,南京市浦口区浦口大道1号总部大厦A座4层,4008-659-600,,
南京乾佑御璜建筑装饰工程有限公司            ,大行宫中山东路300号长发CFC商业中心A...,4008-659-600,,
上海天羽空间设计南京分公司            ,南京河西万达广场四楼,4008-659-600,,
上海欧丽诗装饰工程有限公司            ,南京栖霞区,4008-659-600,,
北京紫名居建筑装饰有限公司南京分公司            ,南京市玄武区中央路258号-28号锦盈大厦...,4008-659-600,,
南京康固建材科技有限公司            ,南京浦口大华3栋,4008-659-600,,
南京千和装饰工程有限公司            ,南京市秦淮区建邺路98号鸿信大厦8楼,4008-659-600,,
南京撩色饰家空间设计工作室            ,南京市中山北路215号中山万豪54楼543...,4008-659-600,,
南京福久装饰有限公司            ,浦口融侨观邸53栋501室,4008-659-600,,
南京金芒果装饰有限公司            ,南京市浦口区明发滨江新城281栋721室,4008-659-600,,
南京隆宸装饰工程有限公司            ,,4008-659-600,,
南京数码彩油漆            ,南京市凤台南路75号军港建材油漆市场C栋2...,4008-659-600,,
自动化装饰有限公司            ,,4008-659-600,,
南京隆赛装饰工程有限公司            ,南京市中山北路95号江苏议事园大厦,4008-659-600,,
南京黑鹰装饰工程有限公司            ,花园路12号,4008-659-600,,
南京标杆装饰            ,光华路156号星展大厦6f,4008-659-600,,
南京南邦装饰工程有限公司            ,大桥北路9号弘阳大厦1919-1922室,4008-659-600,,
南京港艺装饰公司            ,南京白下区水西门大街2号,4008-659-600,,
简约装饰工程有限公司            ,,4008-659-600,,
南京铂寰建筑装饰工程有限公司            ,,4008-659-600,,
苏睿装饰设计            ,南京市秦淮区明匙路108号432室(宜家对...,4008-659-600,,
南京名乐装饰有限公司            ,桥北,4008-659-600,,
南京台协装饰工程有限公司            ,白下大杨村26号B座,4008-659-600,,
南京业干装饰公司            ,南京市六合区经久装饰城,4008-659-600,,
公 私精品装饰            ,,4008-659-600,,
南京万庭建筑环境设计有限公司            ,南京市浦口区大桥北路弘扬大厦1701,4008-659-600,,
江苏八斗才装饰工程有限公司            ,龙蟠中路318号金龙蟠家苑1栋1803室,4008-659-600,,
江苏八斗才装饰工程有限公司            ,江苏省南京市龙蟠中路318号,4008-659-600,,
江宁小陈装修队            ,江宁东山湖路90号,4008-659-600,,
南京品家装饰工程有限公司            ,南京市建邺区茶亭东街79号西祠街区17栋3...,4008-659-600,,
南京美汇美装饰公司            ,南京市集庆路198号江苏通信大厦四楼,4008-659-600,,
南京卡迪装饰工程有限公司            ,南京市仙林大学城香樟园31栋14074,4008-659-600,,
南京鹿琼装饰设计有限公司            ,南京市白下区石鼓路华威大厦A座17楼,4008-659-600,,
北京龙发装饰            ,中山南路315号,4008-659-600,,
南京八点钟装饰设计有限公司            ,南京市白下区长白街332号,4008-659-600,,
达梦居装修工程有限公司            ,迈化路新城尚坐4-11,4008-659-600,,
南京东诚铭装饰设计有限公司            ,南京江宁分公司天元东路228号苹果都市B座...,4008-659-600,,
亿烨装饰安装工程有限公司            ,麒麟门 东方红郡,4008-659-600,,
南京阿里巴巴装饰设计工程有限公司            ,南京市浦口区威尼斯水城十街区56-106商...,4008-659-600,,
南京元创装饰工程有限公司            ,南京江宁万达广场F座2206,4008-659-600,,
南京万紫千红装饰工程有限公司            ,,4008-659-600,,
南京宏语筑装饰工程有限公司            ,南京六合金宁国际大厦19楼,4008-659-600,,
南京智联装饰工程有限公司            ,南京市江宁区科学园吉印大道3789号,4008-659-600,,
上海天羽空间设计南京分公司            ,南京河西万达广场四楼,4008-659-600,,
丽华装饰有限公司            ,南京市栖霞区,4008-659-600,,
江苏雅士居装修工程有限公司            ,软件大道9号,4008-659-600,,
艺洋装饰工程有限公司            ,,4008-659-600,,
南京桑提亚哥装饰工程有限公司            ,南京市江宁区天禄大道1号,4008-659-600,,
南京雅舍装饰工程有限公司            ,南京市白下区中山南路321号现代大厦210...,4008-659-600,,
浦口储师傅装修团队            ,南京，浦口，汤泉,4008-659-600,,
金玉彩堂室内设计装饰            ,南京市六合区雄州西路文博家园向南门面3-0...,4008-659-600,,
南京施兰装饰设计工程有限公司            ,南京市秦淮区信府河11号3楼,4008-659-600,,
一号家居网南京站            ,中央路266号,4008-659-600,,
南京彬堃装饰工程有限公司            ,南京市浦口区大桥北路弘阳壹号1714室,4008-659-600,,
春豪家居一站式服务中心            ,南京高新区新城七栋五楼,4008-659-600,,
南京品胜装修有限公司            ,江苏省南京市,4008-659-600,,
南京恒乐装饰工程有限公司            ,南京市浦口区柳州东路天润城七街区50懂10...,4008-659-600,,
南京企宏装饰工程有限公司            ,南京市建邺区云锦路万达金街（天桥旁）,4008-659-600,,
南京好军嫂门窗工程有限公司            ,南京市浦口区大桥北路9号弘阳大厦1221,4008-659-600,,
南京九居装饰工程有限公司            ,江宁区 中国女人街 B区357号,4008-659-600,,
南京市诚信装饰有限公司            ,南京市中和桥路181号,4008-659-600,,
江苏亚伟建筑装饰设计工程有限公            ,中山南路89号江苏文化大厦,4008-659-600,,
南京龙峰装饰工程有限公司            ,南京桥北威尼斯水城十街区物业旁,4008-659-600,,
南京裕春装饰工程有限公司            ,柳州东路203号 威尼斯水城六街区一号商铺,4008-659-600,,
江苏华佑装饰工程有限公司            ,江东北路400号,4008-659-600,,
南京卡迪装饰工程有限公司            ,南京市仙林大学城香樟园31栋14074,4008-659-600,,
南京鹿琼装饰设计有限公司            ,南京市白下区石鼓路华威大厦A座17楼,4008-659-600,,
南京曼雷装饰工程有限公司            ,南京市六合区新华东路312号,4008-659-600,,
南京天森宜嘉装饰工程有限公司            ,南京大桥北路1号华侨广场812,4008-659-600,,
永盛装饰有限公司            ,南京六合,4008-659-600,,
南京实创工程江苏有限公司            ,南京玄武区中山东路145号全名健身中心5层,4008-659-600,,
南京隆宸装饰工程有限公司            ,,4008-659-600,,
金玉彩堂室内设计装饰            ,南京市六合区雄州西路文博家园向南门面3-0...,4008-659-600,,
景悠-悠悠装饰            ,公司地址:珠江路67号华利国际大厦2102...,4008-659-600,,
南京创始人装饰有限公司            ,白下区光华路五洲家居广场五金厅6区13号,4008-659-600,,
江南快装有限公司            ,,4008-659-600,,
南京市科尚智能有限公司            ,南京市卡子门红星美凯龙,4008-659-600,,
南京龙之友装饰工程有限公司            ,江苏省南京市建邺区汉中门大街257号爱的居...,4008-659-600,,
南京荣泰装饰工程公司            ,南京市栖霞区尧化门尧辰路3号6-101,4008-659-600,,
南京北贸装饰工程有限公司            ,南京鼓楼区建宁路30号,4008-659-600,,
南京品家装饰工程有限公司            ,南京市建邺区茶亭东街79号西祠街区17栋3...,4008-659-600,,
南京尚优家具有限公司            ,江苏省南京市麒麟门镇东流工业园袁家边路口,4008-659-600,,
南京唐风宋韵装饰工程配套有限公司            ,南京市下关区中央北路小市新村451号,4008-659-600,,
南京家和家美建筑装饰设计有限公司            ,南京建邺区江东中路223号,4008-659-600,,
南京美力时装饰工程有限公司            ,,4008-659-600,,
南京罄雅装饰工程有限公司            ,南京白下区大光路188号锦江丽舍1615室,4008-659-600,,
南京锦多装饰设计工程有限公司            ,南京市白下区中山南路360号1201室,4008-659-600,,
南京黄埔装饰公司            ,,4008-659-600,,
北京中奥建            ,,4008-659-600,,
南京千和装饰工程有限公司            ,南京市秦淮区建邺路98号鸿信大厦8楼,4008-659-600,,
南京亚纳装饰有限公司            ,南京市浦口区浦口大道1号总部大厦A座4层,4008-659-600,,
南京南吉斯装饰有限公司            ,,4008-659-600,,
南京实创工程江苏有限公司            ,南京玄武区中山东路145号全名健身中心5层,4008-659-600,,
南京朗风冷暖设备有限公司            ,南京市江宁区玉树路88号文鼎雅苑6栋109,4008-659-600,,
南京猎金装饰工程有限公司            ,南京市江宁区河定桥江宁交通运输局旁,4008-659-600,,
南京金茂中装饰工程有限公司            ,南京市大桥北路48号弘阳壹号A座7楼,4008-659-600,,
南吉斯装饰有限公司            ,南京市江宁区,4008-659-600,,
南京誉涛装饰工程有限公司            ,南京市高淳县经济开发区龙井路18号2栋,4008-659-600,,
齐装网有限公司            ,2533190332,4008-659-600,,
南京阔景装饰工程有限公司            ,南京户部街天之都33号2827室,4008-659-600,,
南京创腾装饰工程有限公司            ,南京秦淮区夹岗汇景路176号,4008-659-600,,
南京汇锦装饰股份有限公司            ,龙蟠路9号兴隆大厦10f,4008-659-600,,
南京鼎享实业有限责任公司            ,南京市鼓楼区新模范马路92号5楼,4008-659-600,,
南京元创装饰工程有限公司            ,,4008-659-600,,
 ,,4008-659-600,,
南京我乐装饰设计工程有限公司            ,南京市汉中路180号星汉大厦5楼,4008-659-600,,
南京欧靓装饰设计商务网            ,南京市节制闸路62,4008-659-600,,
南京鼎享实业有限责任公司            ,南京市鼓楼区新模范马路92号5楼,4008-659-600,,
北京大业美家家居装饰有限公司南京分公司            ,南京市鼓楼区石头城路6号石榴财智中心15栋,4008-659-600,,
大厂创佳门窗制作            ,大厂葛中路537号,4008-659-600,,
南京中强家具有限公司            ,南京江宁区双龙大道958号水岸明珠,4008-659-600,,
南京龙飞亚装饰工程有限公司            ,江宁区东新路蚂蚁工坊A座610,4008-659-600,,
齐装网有限公司            ,,4008-659-600,,
南京荣泰装饰工程公司            ,南京市栖霞区尧化门尧辰路3号6-101,4008-659-600,,
南京北贸装饰工程有限公司            ,南京鼓楼区建宁路30号,4008-659-600,,
南京品家装饰工程有限公司            ,南京市建邺区茶亭东街79号西祠街区17栋3...,4008-659-600,,
南京美汇美装饰公司            ,南京市集庆路198号江苏通信大厦四楼,4008-659-600,,
南京中强家具有限公司            ,南京江宁区双龙大道958号水岸明珠,4008-659-600,,
中艺装饰设计工程有限公司            ,南京建邺区所街29号,4008-659-600,,
南京瑞林达装饰工程有限公司            ,南京市华辰大厦1504-D,4008-659-600,,
好管家装饰工程有限公司            ,龙蟠中路317号达美御园南6楼大中桥加油站...,4008-659-600,,
南京北贸装饰工程有限公司            ,南京鼓楼区建宁路30号,4008-659-600,,
南京品家装饰工程有限公司            ,南京市建邺区茶亭东街79号西祠街区17栋3...,4008-659-600,,
南京美汇美装饰公司            ,南京市集庆路198号江苏通信大厦四楼,4008-659-600,,
南京紫凌轩装饰设计有限公司            ,江宁区天元路228号莱茵铂郡614,4008-659-600,,
南京市面对面装饰公司            ,南京市玄武规划中心,4008-659-600,,
南京界点建筑装饰公司            ,浦口区大桥北路旭日华庭金棕榈11栋1单元2...,4008-659-600,,
兴达门窗有限公司            ,雨花区铁心桥江艺路27-15,4008-659-600,,
南京黑鹰装饰工程有限公司            ,花园路12号,4008-659-600,,
南京标杆装饰            ,光华路156号星展大厦6f,4008-659-600,,
天羽马环境艺术有限公司            ,广州路清凉山公园内,4008-659-600,,
南京美力时装饰工程有限公司            ,,4008-659-600,,
上海欧丽诗装饰工程有限公司            ,南京栖霞区,4008-659-600,,
北京紫名居建筑装饰有限公司南京分公司            ,南京市玄武区中央路258号-28号锦盈大厦...,4008-659-600,,
南京壹对壹装饰工程有限公司            ,南京江宁区宏运大道,4008-659-600,,
老地装饰工程有限公司            ,南京市白下路173号,4008-659-600,,
南京夺目装饰工程有限公司            ,浦口区珍珠南路85号,4008-659-600,,
南京龙百装饰            ,南京市建邺区兴隆地铁3号出口对面,4008-659-600,,
南京顺宏空调工程有限公司            ,江东中路1-2号五洲装饰城对面美的体验馆,4008-659-600,,
南京亚纳装饰有限公司            ,南京市浦口区浦口大道1号总部大厦A座4层,4008-659-600,,
南京我乐装饰设计工程有限公司            ,南京市汉中路180号星汉大厦5楼,4008-659-600,,
南京恒乐装饰工程有限公司            ,南京市浦口区柳州东路天润城七街区50懂10...,4008-659-600,,
南京美汇美装饰设计有限公司            ,南京市集庆路198号江苏通信大厦四楼,4008-659-600,,
艾迪整体装饰            ,仙林。南大和园,4008-659-600,,
 江苏科宁舒适家居系统集成有限责任公司            ,南京市鼓楼区定淮门12号世纪之窗16号楼,4008-659-600,,
南京科特勒斯地坪工程有限公司            ,南京市江宁区胜利路19号,4008-659-600,,
南京荣泰装饰工程公司            ,南京市栖霞区尧化门尧辰路3号6-101,4008-659-600,,
南京北贸装饰工程有限公司            ,南京鼓楼区建宁路30号,4008-659-600,,
南京品家装饰工程有限公司            ,南京市建邺区茶亭东街79号西祠街区17栋3...,4008-659-600,,
南京美汇美装饰公司            ,南京市集庆路198号江苏通信大厦四楼,4008-659-600,,
宝旺斯建筑智能工程            ,水西门大街291号万达金街西区10栋227,4008-659-600,,
南京万庭建筑环境设计有限公司            ,南京市浦口区大桥北路弘扬大厦1701,4008-659-600,,
江苏八斗才装饰工程有限公司            ,江苏省南京市龙蟠中路318号,4008-659-600,,
江宁小陈装修队            ,江宁东山湖路90号,4008-659-600,,
南京安吉利尔装饰工程有限公司            ,南京软件园星火路,4008-659-600,,
DePaid            ,玄武区,4008-659-600,,
美通建设工程有限公司            ,下关区金川门外5-6号2楼,4008-659-600,,
南京市军之威装饰            ,南京市天印大道880号,4008-659-600,,
南京佳诺装饰工程有限公司            ,,4008-659-600,,
南京卡迪装饰工程有限公司            ,南京市栖霞区仙林大学城香樟园酒店式公寓31...,4008-659-600,,
南京涛声装饰            ,南京市建邺区所街29号,4008-659-600,,
南京润圭装饰有限公司            ,南京市白下区海福巷,4008-659-600,,
南京火头军信息技术有限公司            ,江苏省南京市浦口区浦口大道1号新城总部大厦...,4008-659-600,,
尚源易馨装饰责任有限公司            ,南京新街口阳光大厦24楼D3室,4008-659-600,,
南京万隆装饰工程有限公司            ,中山南路369号盈嘉大厦909室,4008-659-600,,
南京博语装饰工程有限公司            ,南京市玄武区华银路19号,4008-659-600,,
欧宝装饰工程有限公司            ,南京市建邺区江东中路128号,4008-659-600,,
南京金芒果装饰有限公司            ,南京市浦口区明发滨江新城281栋721室,4008-659-600,,
南京数码彩油漆            ,南京市凤台南路75号军港建材油漆市场C栋2...,4008-659-600,,
子潇装饰有限公司            ,软件大道景明佳园,4008-659-600,,
南京恒润信装饰工程有限公司            ,南京玄武区长江路九号,4008-659-600,,
南京业干装饰公司            ,南京市六合区经久装饰城,4008-659-600,,
公 私精品装饰            ,,4008-659-600,,
江苏八斗才装饰工程有限公司            ,龙蟠中路318号金龙蟠家苑1栋1803室,4008-659-600,,
南京龙飞亚装饰工程有限公司            ,江宁区文静路,4008-659-600,,
南京前锋线建筑装饰工程有限公司            ,钟灵街50号省农科院内,4008-659-600,,
苏州筑福装饰有限公司            ,,4008-659-600,,
南京龙发装饰公司            ,南京市秦淮区瑞华大厦,4008-659-600,,
江苏华佑装饰工程有限公司            ,江东北路400号,4008-659-600,,
南吉斯装饰有限公司            ,南京市江宁区,4008-659-600,,
齐装网有限公司            ,2533190332,4008-659-600,,
南吉斯装饰有限公司            ,南京市江宁区,4008-659-600,,
齐装网有限公司            ,2533190332,4008-659-600,,
吉水阁室内设计工作室            ,南京市六合区,4008-659-600,,
南京多兰德家具有限公司            ,南京市江宁区陶吴镇粽糖路18号,4008-659-600,,
南京瑞云装饰工程有限公司            ,南京市浦口区大桥北路9号弘阳大厦,4008-659-600,,
南京实创装饰工程有限公司            ,新街口全民健身中心5楼,4008-659-600,,
南京美汇美装饰设计有限公司            ,南京市集庆路198号江苏通信大厦四楼,4008-659-600,,
艾迪整体装饰            ,仙林。南大和园,4008-659-600,,
 江苏科宁舒适家居系统集成有限责任公司            ,南京市鼓楼区定淮门12号世纪之窗16号楼,4008-659-600,,
南京科特勒斯地坪工程有限公司            ,南京市江宁区胜利路19号,4008-659-600,,
南京科特勒斯地坪工程有限公司            ,南京市江宁区胜利路19号,4008-659-600,,
江苏八斗才装饰工程有限公司            ,南京市龙蟠中路318号金龙蟠家苑,4008-659-600,,
南京金手匠建筑装饰工程有限公司            ,南京市大光路188号锦江丽舍1906室,4008-659-600,,
宝旺斯建筑智能工程            ,水西门大街291号万达金街西区10栋227,4008-659-600,,
苏州筑福装饰有限公司            ,,4008-659-600,,
南京鹿琼装饰设计有限公司            ,南京市大桥北路1号华侨广场1708室,4008-659-600,,
达梦居装修工程有限公司            ,迈化路新城尚坐4-11,4008-659-600,,
南京亚纳装饰有限公司            ,南京市浦口区浦口大道1号总部大厦A座4层,4008-659-600,,
南京倩鸿装饰有限公司            ,江苏省 南京市 秦淮区  秦淮小区28号,4008-659-600,,
南通宇华装饰有限公司南京分公司            ,建邺区水西门大街135号7单元102室,4008-659-600,,
南京港艺装饰公司            ,南京白下区水西门大街2号,4008-659-600,,
四季度吊死扶伤            ,南京鼓楼区,4008-659-600,,
南京倩鸿装饰有限公司            ,江苏省 南京市 秦淮区  秦淮小区28号,4008-659-600,,
九创装饰有限公司            ,南京市江宁开发区天元西路158号,4008-659-600,,
永盛装饰有限公司            ,南京六合,4008-659-600,,
南京罄雅装饰工程有限公司            ,南京白下区大光路188号锦江丽舍1615室,4008-659-600,,
南京锦多装饰设计工程有限公司            ,南京市白下区中山南路360号1201室,4008-659-600,,
北京佳林装饰工程有限公司            ,南京白下区新街口正洪街东宇大厦23楼F座,4008-659-600,,
隆翔装饰有限公司            ,,4008-659-600,,
撩色饰家空间设计室            ,江苏省南京市鼓楼区中山北路215号中商万豪...,4008-659-600,,
南京坤艮建筑装饰工程有限公司            ,江宁区黄金海岸二区1栋117室,4008-659-600,,
江苏星汇装饰工程有限公司            ,南京市建邺区虎踞南路49号 银翔商务4楼,4008-659-600,,
南京秀锋环境装饰工程有限公司            ,南京市栖霞区迈皋桥长营村144号,4008-659-600,,
 ,,4008-659-600,,
南京凯旋装饰工程有限公司            ,南京市江宁区天印大道1369号,4008-659-600,,
子潇装饰有限公司            ,软件大道景明佳园,4008-659-600,,
南京企宏装饰工程有限公司            ,南京市建邺区云锦路万达金街（天桥旁）,4008-659-600,,
江苏亚伟建筑装饰设计工程有限公            ,中山南路89号江苏文化大厦,4008-659-600,,
南京火头军信息技术有限公司            ,江苏省南京市浦口区浦口大道1号新城总部大厦...,4008-659-600,,
南京龙峰装饰工程有限公司            ,南京桥北威尼斯水城十街区物业旁,4008-659-600,,
南京裕春装饰工程有限公司            ,柳州东路203号 威尼斯水城六街区一号商铺,4008-659-600,,
南京羽农家装有限公司            ,,4008-659-600,,
南京赛沃装饰有限公司            ,和燕路319号,4008-659-600,,
南京千和装饰工程有限公司            ,南京市秦淮区建邺路98号鸿信大厦8楼,4008-659-600,,
南京易园装饰工程有限公司            ,南京市江宁区秣陵街道天印大道1369号广博...,4008-659-600,,
南京彬睿建筑装饰工程有限公司            ,江苏省南京市江宁区岔路口金盛路,4008-659-600,,
高而雅装饰            ,,4008-659-600,,
南京塞维斯建筑科技有限公司            ,南京市江宁区万安东路115号,4008-659-600,,
南京赛丽雅装饰工程有限公司            ,南京市建邺区奥体丹枫园,4008-659-600,,
南京万庭建筑环境设计有限公司            ,南京市浦口区大桥北路弘扬大厦1701,4008-659-600,,
江苏八斗才装饰工程有限公司            ,江苏省南京市龙蟠中路318号,4008-659-600,,
江宁小陈装修队            ,江宁东山湖路90号,4008-659-600,,
苏州筑福装饰有限公司            ,,4008-659-600,,
子潇装饰有限公司            ,软件大道景明佳园,4008-659-600,,
南京大众装饰            ,,4008-659-600,,
子潇装饰有限公司            ,软件大道景明佳园,4008-659-600,,
南京恒润信装饰工程有限公司            ,南京玄武区长江路九号,4008-659-600,,
江苏烨坤装饰工程有限公司            ,南京市秦淮区大明路105--2号  秦淮创...,4008-659-600,,
江苏君望装饰设计有限公司            ,,4008-659-600,,
南京栖喜装饰设计工程有限公司            ,秦淮区虎踞南路96号三楼(老江苏鞋城),4008-659-600,,
南京豪舒装饰有限公司            ,,4008-659-600,,
南京盛亚谦装饰工程有限公司            ,,4008-659-600,,
南京名工坊装饰工程有限公司            ,,4008-659-600,,
泥巴公社装饰公司            ,,4008-659-600,,
南京柏宇装饰工程有限公司            ,南京市建邺区黄山路12号盛世公馆518室,4008-659-600,,
南京亿达天装饰工程有限公司            ,,4008-659-600,,
南京东锦装饰有限公司            ,南京江宁区麒麟门天赋广场20栋309,4008-659-600,,
南京美界装饰有限公司            ,,4008-659-600,,
藏族自治州            ,,4008-659-600,,
南京置青春装饰公司            ,,4008-659-600,,
南京御尚装饰工程有限公司            ,南京市建邺区万达东坊1栋1518,4008-659-600,,
当家装饰            ,,4008-659-600,,
舒心装饰设计有限公司            ,,4008-659-600,,
南京好军事门窗工程有限公司            ,南京市浦口区大桥北路弘扬骏馆,4008-659-600,,
南京筑肯装饰设计有限公司            ,铁心桥大周路32号软件谷科创城D2南100...,4008-659-600,,
南京栖喜装饰设计工程有限公司            ,秦淮区虎踞南路96号三楼(老江苏鞋城),4008-659-600,,
南京名工坊装饰工程有限公司            ,,4008-659-600,,
江苏东大园装饰安装工程有限公司            ,,4008-659-600,,
南京良天装饰工程有限公司            ,南京市雨花台区凤台南路152号中舜.赛虹桥...,4008-659-600,,
南京美美家装饰工程有限公司            ,,4008-659-600,,
南京元洲品界大宅设计            ,南京河西万达B座,4008-659-600,,
江苏君望装饰设计有限公司            ,,4008-659-600,,
