南京豪舒装饰有限公司            ,,4008-659-600,,
南京盛亚谦装饰工程有限公司            ,,4008-659-600,,
南京齐装网测试号            ,,4008-659-600,,
广州星艺装饰集团南京有限公司            ,,4008-659-600,,
南京黑蚁装饰设计工程有限公司            ,南京市光华路五洲装饰城商务楼107,4008-659-600,,
响当当装饰工程有限公司            ,,4008-659-600,,
南京国海装饰工程有限公司            ,中山南路321号 现代大厦506,4008-659-600,,
南京市江宁区皖发门窗销售中心            ,南京市江宁区宏运大道左邻右里50-104,4008-659-600,,
江苏鲁公大宅装饰            ,,4008-659-600,,
南京翼超装饰工程设计公司            ,,4008-659-600,,
南京金忆嘉装饰工程有限公司            ,南京市浦口区浦口大道37号2栋813室,4008-659-600,,
南京晴天户外用品有限公司            ,鼓楼区中央路224号红星美凯龙三楼晴天花园,4008-659-600,,
广州星艺装饰集团南京有限公司            ,,4008-659-600,,
响当当装饰工程有限公司            ,,4008-659-600,,
南京仲月菊电子商务有限公司            ,南京市江宁区金盛路299号临街商铺1-4层...,4008-659-600,,
徽一帆装饰            ,浦口区高新技术开发区侨康路16-55徽一帆...,4008-659-600,,
南京水手装饰工程有限公司            ,,4008-659-600,,
东旭盛和装饰公司            ,,4008-659-600,,
南京阿普勒新材料科技有限公司            ,江苏南京浦口区万寿路15号工大产业园西区K...,4008-659-600,,
南京豪舒装饰有限公司            ,,4008-659-600,,
南京盛亚谦装饰工程有限公司            ,,4008-659-600,,
南京胜远威工程技术有限公司            ,,4008-659-600,,
泥巴公社装饰公司            ,,4008-659-600,,
南京尚层装饰            ,南京市鼓楼区清江苏宁广场33层,4008-659-600,,
南京名舟建筑装饰工程有限公司            ,,4008-659-600,,
南京超翰数控设备有限公司            ,南京溧水区洪蓝工业园华塘路5号,4008-659-600,,
南京壹品空间装饰工程有限公司            ,,4008-659-600,,
南京名舟建筑装饰工程有限公司            ,,4008-659-600,,
南京超翰数控设备有限公司            ,南京溧水区洪蓝工业园华塘路5号,4008-659-600,,
南京众阁装饰工程有限公司            ,南京秦淮区光华路156号星展大厦1栋601,4008-659-600,,
南京宝来装饰            ,,4008-659-600,,
好手艺精品装饰            ,,4008-659-600,,
南京易安装饰工程有限公司            ,南京市江宁区东山街道滨河街区,4008-659-600,,
南京居联饰家装饰公司            ,,4008-659-600,,
南京时时洁装饰工程有限公司            ,南京市建邺区云锦路万达金街14栋302室,4008-659-600,,
南京悦格装饰工程有限公司            ,南京市浦口区大桥北路20号江畔明珠广场,4008-659-600,,
南京家最美装饰工程有限公司            ,玄武区傅厚岗1号富升大厦1508室,4008-659-600,,
南京锦全装饰工程有限公司            ,南京市中山北路219号宏图大厦801,4008-659-600,,
南京生活家装饰工程有限公司            ,南京市建邺区奥体大街177号奥体南门,4008-659-600,,
南京威登建筑装饰工程有限公司            ,南京市中山南路321号现代大厦1302B,4008-659-600,,
南京意柏年建筑装饰设计工程有限公司            ,南京市建邺区梦都大街130号奥体北门富贵俏...,4008-659-600,,
南京金尚装饰工程有限公司            ,南京市浦口区大桥北路20号江畔明珠广场金尚...,4008-659-600,,
南京新爱华装饰有限责任公司            ,南京玄武区北京东路22号和平大厦13楼,4008-659-600,,
南京冠全装饰工程有限公司            ,南京市玄武区中央路258-27号新立基大厦...,4008-659-600,,
南京壹文装饰工程有限公司            ,南京建邺区万达金街西区10栋212室,4008-659-600,,
南京豪舒装饰有限公司            ,南京市浦口区浦珠南路26号紫晶龙华广场1栋...,4008-659-600,,
南京龙佰装饰工程有限公司            ,南京市中山北路217号龙吟广场A单元280...,4008-659-600,,
南京博强装饰设计工程有限公司            ,南京市广州路随园大厦7楼,4008-659-600,,
南京多百装饰工程有限公司            ,白下区中山南路321号现代大厦1608室,4008-659-600,,
南京京合建志洋装饰工程有限公司            ,南京市建邺区汉中门大街123号知海大厦7层,4008-659-600,,
南京名乐装饰工程有限公司            ,南京市浦口区大桥北路9号弘阳大厦1819室,4008-659-600,,
本木装饰工程有限公司            ,建邺区江东中路118号德盈大厦701室（地...,4008-659-600,,
南京国秀装饰工程有限公司            ,南京市龙蟠中路317号(达美御园北门),4008-659-600,,
南京恒儒信装饰工程有限公司            ,南京市玄武区长江路188号德基大厦7楼C座,4008-659-600,,
南京迈高装饰设计工程有限公司            ,南京市白下区中山南路321号现代大厦300...,4008-659-600,,
南京美全装饰工程有限公司            ,南京中央路323号利奥大厦2305室,4008-659-600,,
南京美汇美装饰设计工程有限公司            ,南京市集庆路198号江苏通信大厦四楼 ,4008-659-600,,
鹿琼装饰公司            ,南京市浦口区大桥北路1号华侨广场1307室,4008-659-600,,
南京嘉泽装饰工程有限公司            ,南京市栖霞区和燕路251号金港大厦B座18...,4008-659-600,,
南京东一阁装饰设计有限公司            ,大桥北路48号弘阳广场A2馆负1层F000...,4008-659-600,,
南京聚馨阁装饰工程有限公司            ,江苏省南京市秦淮区龙蟠中路418-3号,4008-659-600,,
南京置青春网络科技有限公司            ,秦淮区国际贸易中心B座14层B3-B5,4008-659-600,,
南京天合居国际装饰事务所            ,南京市江宁区天元中路128号诚基大厦2幢3...,4008-659-600,,
南京瀚居装饰设计有限公司            ,南京市鼓楼区虎踞北路10-2号3楼312室,4008-659-600,,
南京翔韵装饰设计工程有限公司            ,雨花台区明发商业广场2-53007.(3号...,4008-659-600,,
南京标杰建筑装饰工程有限公司            ,南京市白下区洪武路267号洪武大厦1603...,4008-659-600,,
南京百水合装饰工程有限公司            ,南京市建邺区水西门大街249号千峰彩翠大厦...,4008-659-600,,
南京苏奥装饰工程有限公司            ,南京市中山南路321号现代大厦2605室,4008-659-600,,
南京幻鸣居装饰工程有限公司            ,南京市江宁区天元中路128号诚基名苑2幢6...,4008-659-600,,
南京秀居装饰工程有限公司            ,南京市大桥北路华侨银座505室,4008-659-600,,
CNY空间设计机构            ,南京市建邺区江东中路301号奥体名座F座四...,4008-659-600,,
 南京云居装饰工程有限公司            ,南京市浦口区大桥北路9号弘阳大厦1616—...,4008-659-600,,
南京伊善和装饰工程有限公司            ,南京市建邺区万达金街西区10栋3楼337室,4008-659-600,,
金陵云家居            ,雨花西路9号,4008-659-600,,
