广州美峰精装工程有限公司 ,南沙区滨河路南沙万达广场金街3楼311-3...,18027307368,32033592,
生活家家居工程有限公司            ,天河区黄埔大道中282号生活家健康家居体验...,4008-659-600,,
市番禺名匠装饰设计工程有限公司            ,广州市番禺区市桥街光明南路199号友利创意...,4008-659-600,,
阿马丁装饰设计工程有限公司            ,广州市海珠区新港中路中洲中心南塔b座25层...,4008-659-600,,
实创家居装饰集团()有限公司            ,天河区广州大道中599号泰兴商业大厦9层！,4008-659-600,,
苹果装饰设计有限公司             ,广州市天河区天河北路林和西B出口市长大厦大...,4008-659-600,,
番禺华浔品味设计工程有限公司            ,番禺区市桥清河东路147号,4008-659-600,,
名作装饰设计有限公司             ,　广州番禺厦滘五洲城商务中心C座6009,4008-659-600,,
市名匠装饰设计工程有限公司            ,广州市天河区黄埔大道西76号富力盈隆广场1...,4008-659-600,,
觅糖装饰设计工程有限公司            ,广州市越秀区广州大道北197号新达城广场北...,4008-659-600,,
美峰装饰工程有限公司            ,广州市天河区中山大道中282号东圃商业大厦...,4008-659-600,,
广东铭桦装饰工程有限公司            ,广州市海珠区新港东路琶洲蟠龙新街3号909...,4008-659-600,,
广东泥巴公社装饰工程设计有限公司            ,广东省广州市越秀区广州大道北197号新达城...,4008-659-600,,
国茂装饰设计有限公司            ,广州市天河区燕岭路27号银燕大厦108室,4008-659-600,,
市美漫生活装饰设计工程有限公司            ,广州市番禺区五洲城国际建材中心三楼B323...,4008-659-600,,
市白云华浔品味装饰设计工程有限公司            ,广州市白云区云城东路138号天睿商业中心2...,4008-659-600,,
九创建筑设计有限公司            ,广州市天河区天源路天河新天地C座8楼 ,4008-659-600,,
市六度装饰设计有限公司            ,广州市海珠区赤岗西路288号（杨协成创意园...,4008-659-600,,
装饰工程有限公司            ,广州市海珠区 ,4008-659-600,,
万鲤装饰工程有限公司            ,,4008-659-600,,
宏雕装饰设计有限公司            ,广州市白云区江夏北一路自编168号强盛商贸...,4008-659-600,,
市殿隆装饰工程有限公司            ,广州市天河区五山路137号天立大厦a座8e,4008-659-600,,
名作装饰设计有限公司            ,番禺五洲城商务中心c座6009,4008-659-600,,
广州喜林装饰工程有限公司            ,广州市南沙区裕丽街6号106商铺（创鸿嘉园...,4008-659-600,,
市丽轩装饰工程有限公司            ,广州市天河区沙太路银利街银利茶叶博览中心B...,4008-659-600,,
格派装饰工程有限公司            ,广州市天河区奥体南路12号优托邦建材馆东区...,4008-659-600,,
渤匠装饰设计工程有限公司            , 广州白云区鹤龙街尖彭路38号都成商务中心...,4008-659-600,,
鼎运建筑装饰工程有限公司            ,番禺-大石 105国道号德智创意园7楼7a...,4008-659-600,,
金卓装饰工程有限公司            ,广州市黄浦区康南路海伦堡16号103,4008-659-600,,
市王者之风装饰设计公司            ,白云区广州大道北君华香柏广场C栋2602室,4008-659-600,,
南鸿装饰设计工程有限公司            ,广州市白云区齐富路388号卡尔文二楼,4008-659-600,,
市尚馨装饰工程有限公司            ,海珠区广州大道桃花街159号,4008-659-600,,
