南漳鸿盛万家建筑装饰工程有限公司 ,南漳县城关镇商业街中段,15587770277,5460278,
一号家居网分公司            ,襄阳市樊城区中原西路与汉江北路交汇处瑞城国...,4008-659-600,,
湖北奥朗装饰设计工程有限公司            ,襄阳市樊城区前进路29号乐居广场2-2-7...,4008-659-600,,
精工艺匠装饰有限公司            ,襄阳市樊城区团山镇长虹北路66号妞妞大厦1...,4008-659-600,,
海天环艺装饰工程有限公司            ,襄阳市樊城区中原西路与内环路交汇处 绿地缤...,4008-659-600,,
湖北楚天华艺建筑装饰工程有限公司            ,湖北省襄阳市襄城区檀溪路国际商都正门左侧入...,4008-659-600,,
自家建筑装饰有限公司            ,湖北省 襄阳市 襄州区 交通路与航空路交界...,4008-659-600,,
唯艾装饰            ,樊城区建设西路21号亚奇针织股份有限公司2...,4008-659-600,,
洪亮建筑装饰有限公司            ,湖北省襄阳市襄州区航空路115号经信局二楼,4008-659-600,,
枣阳佰怡家装饰工程有限公司            ,新华路69号(三中红绿灯南20米),4008-659-600,,
湖北艺展宏图建筑装饰有限公司            ,邓城大道国际创新产业基地118号门面,4008-659-600,,
湖北嘉合品筑装饰设计有限公司            ,湖北省襄阳市高新区邓城大道翰林世家嘉筑装饰,4008-659-600,,
明盛装饰有限公司            ,湖北省襄阳市樊城区前进路世纪金源写字楼a7...,4008-659-600,,
博大同途装饰有限公司            ,襄阳市襄城区檀溪路山水檀溪秀园d-1栋2楼,4008-659-600,,
市深度装饰工程有限公司            ,邓城大道49号国际创新产业基地7栋1-13...,4008-659-600,,
元易装饰            ,,4008-659-600,,
新新生活装饰            ,春园西路火炬大厦13层,4008-659-600,,
湖北好逸装饰            ,,4008-659-600,,
金亮装饰            ,,4008-659-600,,
红昌宏装饰            ,,4008-659-600,,
满庭芳装饰            ,,4008-659-600,,
湖北鼎盛峰装饰工程有限公司            ,湖北省襄阳市襄州区航空路清水茗居4-5,4008-659-600,,
灵秀装饰装璜有限公司            ,三元路传染病医院旁南港写字楼3楼318,4008-659-600,,
湖北金陵建筑装饰实业有限公司            ,襄阳市樊城区长虹路36号（再尔广场加油站旁...,4008-659-600,,
红都装饰            ,,4008-659-600,,
环雅装饰            ,,4008-659-600,,
浩佳莉装饰            ,襄阳市高新区二汽万众太阳城南门（东湖国际花...,4008-659-600,,
