苏州天羽星装饰设计工程有限公司 ,苏州吴江市  松陵镇 云创路512号 商会...,18936130020,88981819,
广州市华宁装饰工程有限公司松陵分公司 ,苏州市吴江区流虹西路1027-1029号,18962581856,63929336,
吴江叠加装饰工程设计有限公司 ,吴江区仲英大道91号(吴江公园对面),13912719577,63061739,
苏州市品度装饰设计工程有限公司 ,江苏省苏州市吴江区鲈乡南路693号,18362555225,63496625,
苏州杨阳装饰设计工程有限公司 ,苏州市吴江区长板路988号唐郡110栋10...,13390863291,63429936,
苏州红蝴蝶装饰设计有限公司            ,苏州市吴中区苏蠡路蠡盛大厦406室，官方网...,4008-659-600,,
苏州市伯乐尼装饰工程有限公司            ,苏州市吴中区水香街49号,4008-659-600,,
苏州东迪装饰设计工程有限公司            ,苏州市沧浪区太湖西路572号(东吴塔往西2...,4008-659-600,,
上海波涛装饰集团苏州分公司            ,苏州市吴中区宝带西路153号,4008-659-600,,
蘇州阿卡莫建筑裝飾工程有限公司            ,設計部：蘇州蘇蠡路59號蠡和大廈703-7...,4008-659-600,,
苏州贝冧装饰工程有限公司吴江分公司            ,吴江区松陵镇仲英大道446号(鲈乡小学对面...,4008-659-600,,
苏州豪堂装饰工程有限公司吴江分公司            ,吴江区仲英壹号商业广场308室,4008-659-600,,
江苏旭日装饰工程有限公司            ,桐径北路8号月星家居旁(桐泾路和金门路往北...,4008-659-600,,
广东三星装饰吴江分公司            ,吴江市笠泽路783-789号,4008-659-600,,
吴江华浔品味装饰            ,吴江市松陵镇流虹西路号,4008-659-600,,
上海青苹果建筑装潢工程有限公司吴江分公司            ,吴江市流虹路908号 官网:www.qpg...,4008-659-600,,
香港金柜整体家私            ,吴江市松陵镇笠泽西路779号,4008-659-600,,
广东名匠装饰集团            ,仲英大道与双板桥路交叉口,4008-659-600,,
苏州浩宇钢结构安装有限公司            ,苏州吴江同里镇商业文化广场,4008-659-600,,
吴江徽苑装饰有限公司            ,吴江区松陵镇金域华府70幢一楼,4008-659-600,,
上海青苹果建筑装潢工程有限公司吴江分公司            ,苏州吴江区松陵镇流虹路908号,4008-659-600,,
金龙装饰设计工程有限公司            ,盛泽市场路东方花园27幢38号,4008-659-600,,
卓高美缝剂有限公司            ,上海昆阳路,4008-659-600,,
水电改造和维修            ,,4008-659-600,,
厚工坊整木定制            ,江苏省苏州市吴江区七都环湖路,4008-659-600,,
卓高缝美家瓷砖美缝            ,吴江松陵镇运东大道海悦花园10懂1单元30...,4008-659-600,,
苏州木森装饰有限公司            ,吴江、盛泽镇、盛泽大道1169号,4008-659-600,,
吴江三色轩城有限公司            ,吴江区松陵镇永康路713号3楼,4008-659-600,,
 ,,4008-659-600,,
香港嘉祺装饰            ,吴江市松陵镇鲈乡北路天和人家788号,4008-659-600,,
吴江百度装饰            ,吴江仲英大道,4008-659-600,,
吴江为家装饰            ,,4008-659-600,,
苏州市博家装饰设计工程有限公司            ,松陵镇高新路1000号恒隆国际3楼,4008-659-600,,
吴江市旭凯建筑装饰工程有限公司            ,吴江市中山北路358号,4008-659-600,,
徐先生专业施工队            ,吴江及周边,4008-659-600,,
吴江锐图装饰            ,松陵镇鲈乡北路,4008-659-600,,
