梅州市易佳尚阳装饰工程有限公司 ,梅州市大埔县城内环西路184号易尚国际装饰,18107685515,5555756,
桃源居装饰有限公司            ,梅县区新县城府前大道怡景家园18号,4008-659-600,,
正蓝色实业有限公司            ,文化城新兴路百福豪园售楼部正对面（梅州市正...,4008-659-600,,
 壹品空间装饰设计有限公司            ,梅州市江南沿江西路92号,4008-659-600,,
洛奇装饰设计有限公司            ,梅州市梅江区吉祥路51号,4008-659-600,,
梦家装饰设计工程有限公司            ,江南陶然居正大门右转30米,4008-659-600,,
 金泰装饰工程有限公司            ,新中路19-20号（鸿都小学对面）,4008-659-600,,
鼎立置业有限公司大埔分公司            ,迎宾大道中段佳兴楼正大门左边二卡门店,4008-659-600,,
艺都装饰有限公司            ,新贵街和安现代城B栋3-4号,4008-659-600,,
名匠装饰有限公司大埔分公司            ,大埔丽都西路盛榆花园首层5/6号铺,4008-659-600,,
启艺装饰设计有限公司            ,江南鸿运路49-50号(鸿都花园北门),4008-659-600,,
柒大师装饰设计工程有限公司            ,广东省梅州市平远县宜华金色华府A61,4008-659-600,,
市平米立方设计有限公司            ,梅州市梅江区正兴路,4008-659-600,,
市品信装饰有限公司            ,,4008-659-600,,
鑫盛建材城            ,,4008-659-600,,
暗石装饰设计有限公司            ,梅州蕉岭县蕉城镇溪峰西路248号,4008-659-600,,
鼎立装饰有限公司            ,迎宾大道中段佳兴楼正大门左边二卡门店,4008-659-600,,
鲁班装饰设计有限公司            ,南昌,4008-659-600,,
集一元洲装饰有限公司大埔分公司            ,大埔大东镇大桥西侧集一家居建材城五楼,4008-659-600,,
交换空间装饰有限公司            ,南坪会展中心9玺国际8栋,4008-659-600,,
美福装饰有限公司            ,三角镇 广汽丰田旁,4008-659-600,,
大埔千度装饰有限公司            ,汤坑镇罗湖桥头红绿灯100米,4008-659-600,,
集华装饰设计工程有限公司            ,梅州市梅江区陶然居33栋19-22号店[入...,4008-659-600,,
广东中天空间设计有限公司            ,广东省梅州市江南丽都西路怡雅苑24-11号...,4008-659-600,,
大埔卉乐装饰材料有限公司            ,大埔县沿江中路33-17,4008-659-600,,
