山西今朝英迈装饰设计有限公司 ,太原市五一广场,18735127122,8234606,
山西紫苹果装饰工程有限公司 ,太原市小店区,13643453293,7220807,
太原城市人家装饰 ,千峰北路瓦窑街口西北角城市人家装饰,13453446641,2736618,
太原生活家装饰工程有限公司 ,晋祠路9号(迎泽桥西往南300米),18603477783,8728999,
山西华浔品味装饰有限公司 ,晋源区长风商务区长兴南街阳光城环球金融中心...,18406589133,6855789,
山西华创晋美装饰工程有限公司 ,山西省太原市小店区长风街长风画卷B座505,18334710612,7099309,
独特壹家整装生活馆 ,南内环千峰路口鸿峰商务大厦,13653651075,2167800,
太原天地筑和装饰有限公司            ,太原市平阳路186号飞云国际公寓7层717...,4008-659-600,,
太原业之峰装饰有限公司            ,太原市南中环街与体育路口企联大厦18层,4008-659-600,,
太原星艺装饰有限公司            ,太原市小店区长治南路180号(居然之家斜对...,4008-659-600,,
东易日盛阳光居然装饰有限公司            ,太原市长治路199号华辰大厦一、二、三层(...,4008-659-600,,
上海波涛装饰集团太原公司            ,太原市小店区长风街千禧大厦805,4008-659-600,,
太原城市人家装饰有限公司            ,太原市千峰北路瓦窑街口西北角,4008-659-600,,
太原尚层装饰有限公司            ,男中环街国际大都会七号名车公馆楼上,4008-659-600,,
太原风尚共和装饰有限公司            ,小店区体育路16号(近体育场),4008-659-600,,
太原鲁班装饰有限公司            ,山西省 太原市小店区太原市学府街124号,4008-659-600,,
山西保利绿洲装饰设计有限公司            ,太原市小店区亲贤街佳地花园B座18层210...,4008-659-600,,
山西夏之阳装饰设计工程有限公司            ,小店区亲贤北街58号怡和广场1228室,4008-659-600,,
太原市东唐装饰设计有限公司            ,太原市小店区平阳路万狮京华大酒店北侧,4008-659-600,,
太原业之峰诺华装饰有限公司            ,太原市长风街北方君威财富中心16层,4008-659-600,,
山西星尚装饰工程有限公司            ,太原市晋阳街平阳路口东500米纳达大厦东座...,4008-659-600,,
太原东易日盛            ,太原市晋阳街88号兴业大厦西裙楼1-4层东...,4008-659-600,,
小邦主整装服务平台            ,太原市建设南路亲贤北街口邦荟网线下体验店四...,4008-659-600,,
山西欧美金辉装饰工程有限公司            ,小店区电子街 康馨苑B2座2-1301室,4008-659-600,,
太原金拇指装饰设计工程有限公司            ,小店区电子街恒大绿洲西南角二层,4008-659-600,,
百思图建筑装饰工程有限公司            ,吴家堡D3-2-201,4008-659-600,,
太原品界国际装饰            ,太原市长风街北方君威7层,4008-659-600,,
苏人装饰工程有限公司            ,山西省太原市杏花岭区赛马场,4008-659-600,,
山西汉亚装饰设计工作室            ,山西省太原市小店区太榆路君怡大厦,4008-659-600,,
金山建筑装饰工程有限公司            ,小店区电子街恒大绿洲36幢C座,4008-659-600,,
太原东唐装饰设计有限公司            ,①⑧①零③⑤①⑤⑧⑦⑥,4008-659-600,,
实创装饰太原分公司            ,太原市杏花岭区北大街新建路口173号,4008-659-600,,
北京品界装饰有限公司太原分公司            ,太原市小店区长风街北方君威7层,4008-659-600,,
山西晟坤装饰有限公司            ,小店长治路奥林花园悉尼座5层,4008-659-600,,
北京宜美家园建筑装修工程有限公司            ,迎泽西大街德馨花园A座2单元19A,4008-659-600,,
北京元洲装饰太原直营分公司            ,长风街建设路交叉口往东500米路北(国控大...,4008-659-600,,
山西省太原市C创装饰有限公司            ,,4008-659-600,,
太原布瑞可室内设计有限公司            ,太原市长风西街万国MOMA城2号楼801室,4008-659-600,,
山西格林艾尔环境工程技术有限公司            ,山西省太原市小店区人民北路颐源街中世汇源b...,4008-659-600,,
北京交换空间装饰太原公司            ,太原市长风街长治路口,4008-659-600,,
