宜昌远景装饰工程有限公司 ,宜昌市沿江大道万达广场写字楼,13387257813,6523808,
宜昌大山装饰工程设计有限公司 ,宜昌市伍家岗区东山大道173号,13477121075,6263648,
宜昌品匠装饰工程有限公司 ,城东大道碧水林荫西区品匠装饰(24-7-0...,13872605432,6099349,
武汉江南美装饰设计工程有限公司宜昌分公司 ,宜昌开发区港窑路南都御景家辉超市二楼,15172406567,6982122,
大庭装饰工程有限公司            ,湖北省 宜昌市 猇亭区 宜化山语城一期售楼...,4008-659-600,,
南昌欧坊装饰工程有限公司            ,南昌西湖区洪城路576号天使商务广场t层,4008-659-600,,
宜昌市家悦装饰设计工程有限公司            ,湖北 宜昌 宜昌市夷陵区长江市场,4008-659-600,,
宜昌爱尚家装饰公司            ,湖北省 宜昌市 开发区发展大道69号易陶馆...,4008-659-600,,
北京龙发装饰集团            ,阳明东路71号金涛国际a座,4008-659-600,,
湖北诺守美家建筑装饰工程有限公司            ,湖北省 宜昌市 西陵区 宜昌市西陵区高新技...,4008-659-600,,
交换空间装饰有限公司            ,南坪会展中心9玺国际8栋,4008-659-600,,
宜昌锦尚建筑装饰工程            ,湖北省 宜昌市 夷顺商厦二单元七楼501（...,4008-659-600,,
宜昌阔达装饰工程有限公司            ,沿江大道万达广场a座1单元11层号,4008-659-600,,
 ,,4008-659-600,,
宜昌市水木石装饰设计有限公司            ,宜昌市大连路33号清华科技园英才大厦301,4008-659-600,,
宜昌锦尚建筑装饰工程有限公司            ,湖北省宜昌市夷陵大道401号夷顺商厦2单元...,4008-659-600,,
宜昌首信装饰工程有限公司            ,沿江大道金江银座1003,4008-659-600,,
宜昌天尚金字塔装饰工程有限公司            ,西陵一路现代城市广场b座,4008-659-600,,
宜昌信高装饰工程设计有限公司            ,宜化·山语城,4008-659-600,,
宜昌市三禾装饰工程有限责任公司            ,亚洲广场b座23楼,4008-659-600,,
五峰百纳装饰工程有限公司            ,湖北五峰渔关东泰商城28号,4008-659-600,,
宜昌楚汉风环境工程有限公司            ,体育场北路红星美凯龙建材馆,4008-659-600,,
湖北达隆装饰工程有限公司            ,宜昌市港窑路24号7-006，市三医院往城...,4008-659-600,,
湖北龙剑建筑装饰工程有限公司            ,湖北宜昌金东山家居建材广场综合馆5楼,4008-659-600,,
启航装饰有限公司            ,湖北省秭归县长宁大道163号,4008-659-600,,
佳盛装饰工程有限公司            ,,4008-659-600,,
宜昌炜宸设计有限公司            ,发展大道易中建材城易陶馆D123-26号,4008-659-600,,
专业瓷砖美缝            ,宜昌市西陵区华祥商业中心红星美凯龙二楼,4008-659-600,,
宜昌七奇装饰公司            ,宜昌市发展大道16号金德瑞国际酒店办公楼1...,4008-659-600,,
江西苹果装饰公司            ,南昌市抚生丽都广场,4008-659-600,,
北京实创家居装饰集团(江西)有限公司            ,南昌市洪城路6号国贸国贸广场新华都1-3层,4008-659-600,,
江西苹果装饰设计工程有限公司            ,西湖区洪城路987号丽都广场a栋五楼（）,4008-659-600,,
一号家居网南昌站            ,江西省南昌市青山湖区上海路699文化创意园,4008-659-600,,
一号家居网            ,湖北省 宜昌市 伍家岗区 城东大道兴发广场...,4008-659-600,,
宜昌巨匠装饰设计有限公司            ,宜昌市万达广场c座21楼,4008-659-600,,
宜昌品高装饰工程有限公司            ,,4008-659-600,,
宜昌市三禾装饰工程有限责任公司            ,湖北 宜昌 宜昌市西陵区,4008-659-600,,
一号家居网南昌站            ,江西省南昌市青山湖区上海路699文化创意园,4008-659-600,,
宜昌一诺装饰工程有限公司            ,宜昌市中南路52号,4008-659-600,,
迪赞设计空间            ,南昌市井冈山大道名爵公馆,4008-659-600,,
南昌实创家居装饰            ,南昌市洪城路6号新华都购物广场3楼,4008-659-600,,
江西翔海装饰工程有限公司            ,,4008-659-600,,
元尚装饰            ,,4008-659-600,,
宜昌品高装饰工程有限公司            ,,4008-659-600,,
宜昌市三禾装饰工程有限责任公司            ,湖北 宜昌 宜昌市西陵区,4008-659-600,,
一号家居网南昌站            ,江西省南昌市青山湖区上海路699文化创意园,4008-659-600,,
宜昌一诺装饰工程有限公司            ,宜昌市中南路52号,4008-659-600,,
迪赞设计空间            ,南昌市井冈山大道名爵公馆,4008-659-600,,
宜昌自由空间装饰工程有限公司            ,宜昌市西陵区西陵一路19-1-2-2705,4008-659-600,,
宜昌华美宜居装饰工程设计有限公司            ,宜昌市西陵区体育场路76号,4008-659-600,,
宜昌炜宸装饰设计有限公司            ,宜昌西陵区易中建材城易陶馆D123-126...,4008-659-600,,
湖北涵艺装饰设计有限公司            ,宜昌市伍家岗区沿江大道万达广场C座809,4008-659-600,,
湖北达隆装饰工程有限公司            ,,4008-659-600,,
宜昌启辰装饰工程有限责任公司            ,西陵区康龙国际广场龙吟台1单元13A-01...,4008-659-600,,
宜昌品正装饰设计公司            ,,4008-659-600,,
宜昌梵锦建筑装饰工程有限公司            ,宜昌高新区港窑路24-7-005,015,...,4008-659-600,,
北京吉诚装饰有限公司宜昌分公司            ,,4008-659-600,,
宜昌梵锦建筑装饰有限公司            ,,4008-659-600,,
宜昌市嘉格装饰工程有限公司            ,宜昌市城东大道宜化巴黎香颂1-402,4008-659-600,,
宜昌遇见装饰设计工程有限公司            ,宜昌云计算大厦1005,4008-659-600,,
宜昌市嘉格装饰工程有限公司            ,宜昌市城东大道宜化巴黎香颂1-402,4008-659-600,,
北京海天环艺家居装饰宜昌分公司            ,宜昌市西陵区东山大道95号清江大厦22层,4008-659-600,,
宜昌爱尚家建筑装饰工程有限公司            , 宜昌市 开发区发展大道69号易陶馆E栋三...,4008-659-600,,
北京吉诚装饰有限公司宜昌分公司            ,城东大道60号鸿华SOHO时代吉诚装饰,4008-659-600,,
宜昌自己人装饰工程有限公司            ,宜昌市中南路35号兴发广场4栋4-3门店,4008-659-600,,
宜昌风之翼装饰工程有限公司            ,宜昌市伍家岗区中南路东辰一号峰景内街13-...,4008-659-600,,
宜昌大成致美装饰设计有限公司            ,宜昌市伍家岗区城东大道兴发广场三峡农商银行...,4008-659-600,,
