杭州富阳华浔品味装饰设计工程有限公司 ,杭州富阳香槟路47-49号,18867102919,23280680,
杭州名创艺宅建筑装潢有限公司 ,,15088729231,,
杭州生活家家居装饰            ,杭州市富阳区,4008-659-600,,
杭州大思装饰工程有限公司            ,杭州市富阳区,4008-659-600,,
杭州都都装饰工程设计有限公司            ,杭州市富阳区,4008-659-600,,
杭州典固建筑装饰工程有限公司            ,杭州市富阳区,4008-659-600,,
恒彩高端设计机构工程有限公司            ,杭州富阳区,4008-659-600,,
杭州良匠装饰工程有限公司            ,杭州市富阳区,4008-659-600,,
杭州顺吉装饰设计有限公司            ,古墩路829号欧亚达天亿家居广场,4008-659-600,,
杭州萧诚装饰工程有限公司            ,杭州富阳区,4008-659-600,,
金粤龙装饰工程有限公司            ,杭州市富阳金平路,4008-659-600,,
杭州萧诚装饰工程有限公司            ,杭州富阳区,4008-659-600,,
杭州维利国德装饰有限公司            ,下城区华西路299创意园 ,4008-659-600,,
杭州罗盛装饰工程有限公司            ,杭州市拱墅区莫干山路1165号,4008-659-600,,
杭州富阳建筑装饰工程有限公司            ,富春街道,4008-659-600,,
名匠装饰富阳分公司            ,,4008-659-600,,
杭州富阳小老戴装饰工程有限公司            ,富阳,4008-659-600,,
一凡装修            ,,4008-659-600,,
杭州今牌智能家居技术有限公司            ,,4008-659-600,,
富阳市恒泰装饰有限公司            ,,4008-659-600,,
宾格装饰设计工程有限公司            ,富阳区银湖街道九龙大道398号富春硅谷1号...,4008-659-600,,
浙江纳琦环保科技有限公司            ,,4008-659-600,,
优勒环保装饰工程有限公司            ,,4008-659-600,,
杭州富阳景禾装饰工程有限公司            ,杭州市富阳区公望街1160号(大自然商务楼...,4008-659-600,,
杭州富阳家佳建筑装饰工程有限公司            ,杭州市富阳区文教路202号,4008-659-600,,
杭州富阳罗孚装饰工程有限公司            ,杭州富阳金浦路88号,4008-659-600,,
