广东九木堂装饰分公司            ,四川省乐山市市中区柏杨西路东方家园装饰城 ...,4008-659-600,,
市金利装饰工程有限公司            ,乐山市邦泰中心写字楼B座7-7,4008-659-600,,
铅笔头装饰设计有限公司            ,乐山万和装饰城3栋4区4楼,4008-659-600,,
九鼎天逸装饰公司            ,四川省乐山市市中区翰林路778号,4008-659-600,,
北京龙发装饰集团            ,阳明东路71号金涛国际a座,4008-659-600,,
市波涛装饰工程有限责任公司            ,乐山市市中区嘉祥路与嘉兴路交汇处,4008-659-600,,
成都名尊装饰工程有限公司            ,四川省乐山市市中区龙游路西段595号607...,4008-659-600,,
博胜堂装饰有限公司            ,四川省 乐山市 市中区 竹林路136号（棕...,4008-659-600,,
鸿远空间装饰有限公司            ,四川省 乐山市 市中区 乐山市市中区龙游路...,4008-659-600,,
长河装饰有限公司            ,四川省乐山市市中区柏杨西路868号盘龙银座...,4008-659-600,,
弘艺装饰有限公司            ,乐山柏杨西路398号（东方家园装饰城停车场...,4008-659-600,,
长河建筑装饰工程有限公司            ,.乐山市市中区柏杨西路868号盘龙银座6楼...,4008-659-600,,
南昌欧坊装饰工程有限公司            ,南昌西湖区洪城路576号天使商务广场t层,4008-659-600,,
艾达装饰公司            ,四川省乐山市市中区家园街137号,4008-659-600,,
远峰室内装饰设计            ,四川省 乐山市 市中区 柏杨西路769号（...,4008-659-600,,
南昌道艺装饰有限公司            ,南昌市红谷滩万达中心写字楼B2-814,4008-659-600,,
嘉祺装饰设计工程有限公司            ,,4008-659-600,,
鼎和装饰工程有限公司            ,四川省乐山市市中区百禄路377号,4008-659-600,,
星艺装饰有限公司            ,南昌市北京东路·恒茂国际都会...,4008-659-600,,
波涛装饰公司            ,高新区南二环西段财富中心,4008-659-600,,
南国风装饰工程有限工司            ,青山湖南大道墅溪园,4008-659-600,,
华浔品味装饰            ,四川省 乐山市 市中区 柏杨西路（意凡建材...,4008-659-600,,
南昌实创美家装饰            ,南昌市西湖区站前西路289号三星大厦B座1...,4008-659-600,,
夹江县一品居室内装饰部            ,,4008-659-600,,
