平顶山塞纳春天装饰 ,河南省平顶山市新华区凌云路园林路交汇西侧怡...,18637543000,7675066,
立帆集成装饰 ,园林路三国演义斜对面,15539796565,7032078,
宝丰县华宇装饰工程有限公司            ,宝丰县山河路南段盛世嘉园楼下08号,4008-659-600,,
鲁班装饰设计有限公司            ,南昌,4008-659-600,,
河南冰点装饰工程有限公司            ,河南省平顶山市平宝路西口路南,4008-659-600,,
平顶山市盛亚明煌装饰工程有限公司            ,凌云路北段，名仕国际家居对面风车路向东50...,4008-659-600,,
平顶山鳄鱼装饰工程有限公司            ,河南省平顶山市郏县文化路东段百合春天售楼部...,4008-659-600,,
美星装饰集团            ,平顶山市新华区凌云路北段佳田塞纳城佳苑13...,4008-659-600,,
交换空间装饰有限公司            ,南坪会展中心9玺国际8栋,4008-659-600,,
北京龙发装饰集团            ,阳明东路71号金涛国际a座,4008-659-600,,
实创家居装饰集团有限公司            ,青云谱洪都洪城路6号国贸广场13层,4008-659-600,,
鲁山鑫胜设计装饰工程有限公司            ,鲁山县南环路中天酒店对面,4008-659-600,,
平顶山市金一诺装饰工程有限公司            ,开源路平安大道交叉口览山丽景1号楼2单元1...,4008-659-600,,
江西苹果装饰公司            ,南昌市抚生丽都广场,4008-659-600,,
平顶山顶尖设计            ,平顶山建开岗西北角二楼中信银行附近,4008-659-600,,
南昌满艺装饰工程有限公司            ,江西省南昌市西湖区朝阳洲中大云锦A102商...,4008-659-600,,
南昌市轩仝宇装饰工程有限公司            ,江西省南昌市西湖区子安路89号1602,4008-659-600,,
金芒果装饰集团            ,江西省吉安市吉州区广场北路1号(新世界广场...,4008-659-600,,
小楠家装            ,,4008-659-600,,
平顶山林涵设计装饰有限公司            ,平顶山湛河区,4008-659-600,,
南昌满艺装饰工程有限公司            ,江西省南昌市西湖区朝阳洲中大云锦A102商...,4008-659-600,,
南昌市轩仝宇装饰工程有限公司            ,江西省南昌市西湖区子安路89号1602,4008-659-600,,
平顶山海天环艺装饰工程有限公司            ,新华区建设路西段中央花园北门（生态园对面）,4008-659-600,,
汝州市万美装饰有限公司            ,朝阳路永安街交叉口南300米路东,4008-659-600,,
满堂红装饰公司            ,光明路湛河桥南常绿商务大厦三楼,4008-659-600,,
立帆装饰            ,,4008-659-600,,
丰创装饰工程有限公司            ,,4008-659-600,,
上海宜家装修公司            ,,4008-659-600,,
深圳满堂红美家装饰            ,光明路湛河桥南常绿商务大厦二楼,4008-659-600,,
特普丽壁纸            ,,4008-659-600,,
河南美平方装饰工程有限公司            ,平顶山市新华区平安大道陆顺建材城木门区5栋...,4008-659-600,,
北京海天装饰工程有限公司            ,建宏中央花园北门生态园对面,4008-659-600,,
平顶山蚂蚁装服            ,平顶山新华区长青路中原玉石城611,4008-659-600,,
汝州市壹家宜居家居装饰馆            ,汝州市城垣北路凤凰城售楼部斜对面康盈街向西...,4008-659-600,,
平顶山业之峰装饰            ,平顶山市新华区建设路西段老师专对面,4008-659-600,,
化浔品味装饰有限公司            ,00路,4008-659-600,,
河南紫明珠装饰工程有限公司            ,平顶山市新华区平安大道陆顺建材城,4008-659-600,,
平顶山交换空间装饰工程有限公司            ,平顶山市建设路与凌云路交叉口向南100米（...,4008-659-600,,
平顶山品尚装饰工程有限公司            ,新华区云顶灯饰城D区品尚装饰,4008-659-600,,
阔达建筑装饰工程有限责任公司            ,北京市海淀区西三环北路87号国际财经中心c...,4008-659-600,,
平顶山市名匠装饰工程有限公司            ,平顶山市湛河区湛南路城建学院家属楼16号楼...,4008-659-600,,
平顶山市益仲装饰工程有限公司            ,平顶山市卫东区新华路12号,4008-659-600,,
河南锐度装饰工程有限公司            ,平顶山市中兴路中兴铭座1603室,4008-659-600,,
平顶山市大禹天成装饰公司            ,河南鲁山县花园路南段行政大厅斜对面,4008-659-600,,
德诺克装饰            ,平顶山市中兴路,4008-659-600,,
平顶山集美装饰工程有限公司            ,平顶山市湛河区南环路东段路南(明珠花园南门...,4008-659-600,,
华浔品味装饰            ,东路鹿鼎家居4楼b馆,4008-659-600,,
