广元市旭标工程建设有限公司 ,广元市利州区下西坝国际商贸城713-1A,13018147888,3222488,
四川盛百源装饰工程有限公司 ,广元万达晶座A-14-16,15692992922,3361991,
广元豪川装饰            ,四川省 广元市 市中区 万达广场万达晶座A...,4008-659-600,,
广元壹臣装饰公司            ,四川省 广元市 市中区 东坝御锦湾S3号商...,4008-659-600,,
顺新装饰有限公司            ,广元市利州区雪峰办事处芸香社区3幢-3-1...,4008-659-600,,
广元佳佰利装饰有限责任公司            ,广元市利州区东坝文化路老年公寓门口,4008-659-600,,
广元市未来家装饰装修工程有限公司            ,四川省广元市利州区东坝苴国路655# 御景...,4008-659-600,,
城市人家装饰有限公司            ,北京市大兴区亦庄经济开发区4号街区力宝广场...,4008-659-600,,
广元饰家墙艺装饰            ,四川省 广元市 市中区 南河南环路射击场1...,4008-659-600,,
广元市百诺装饰工程有限公司            ,广元市利州区万源南岸阳光,4008-659-600,,
嘉祺装饰设计工程有限公司            ,,4008-659-600,,
广元可米装饰工程有限公司            ,四川省广元市利州区兴安路二段,4008-659-600,,
诚享装饰设计有限公司            ,四川省广元市朝天区9号,4008-659-600,,
大唐名匠装饰装修工程有限公司            ,广元市利州区东坝文化路373号3楼（文化路...,4008-659-600,,
广元木龙居装饰            ,四川省 广元市 市辖区 滨河北路336号 ...,4008-659-600,,
广元皓远装饰            ,四川省 广元市 市中区 万达晶座B栋21楼...,4008-659-600,,
广元家装e站            ,四川省 广元市 市中区 广元市利州区万源南...,4008-659-600,,
成都百居门装饰工程有限公司广元分公司            ,广元市利州区东坝丽都水岸3楼,4008-659-600,,
广元市深港装饰工程有限公司            ,广元国际商贸城7楼,4008-659-600,,
广东华宁装饰广元分公司            ,广元市中利州区古宴路金域华府正大门,4008-659-600,,
广元大唐名匠装饰            ,四川省 广元市 市辖区 利州区东坝文化路3...,4008-659-600,,
成都名轩装饰有限公司旺苍名轩装饰生活馆            ,旺苍县环城中路330号,4008-659-600,,
广元木龙居装饰设计有限工程公司            ,广元利州区东路三段.巴黎时光3号铺.港湾国...,4008-659-600,,
广元市云鑫装饰有限公司            ,广元市利州区滨河路芸香社区12幢18号（澳...,4008-659-600,,
实创家居装饰集团有限公司            ,青云谱洪都洪城路6号国贸广场13层,4008-659-600,,
广元新双豪装饰            ,广元市万源富源金都3F-4F,4008-659-600,,
广元梦想家装饰公司            ,广元市利州区万达中旁(南郡销售中心)对面二...,4008-659-600,,
金芒果装饰集团            ,江西省吉安市吉州区广场北路1号(新世界广场...,4008-659-600,,
南昌三帝装饰设计有限公司            ,南昌市青山湖区洪都北道299号高能金域名都...,4008-659-600,,
南昌林涵设计            ,林涵设计,4008-659-600,,
 ,,4008-659-600,,
南昌市轩仝宇装饰工程有限公司            ,江西省南昌市西湖区子安路89号1602,4008-659-600,,
四川聚源伟业装饰工程有限公司            ,广元市利州东路二段（太平洋大厦602号）,4008-659-600,,
广元蓝宇装饰工程有限公司            ,,4008-659-600,,
利州区梦华装饰装修工作室            ,,4008-659-600,,
四川聚源伟业装饰工程有限公司            ,,4008-659-600,,
诺诚装饰            ,,4008-659-600,,
塞尚格调            ,,4008-659-600,,
广东欧派家居集团有限公司            ,广元市利州区居然之家负一楼,4008-659-600,,
四川中闳装饰集团苍溪分公司            ,,4008-659-600,,
成都华熙文化广元华熙装饰分公司            ,广元利州区雪峰欧锦城8-301,4008-659-600,,
印象装饰工作室            ,广元市利州区下西坝工贸家世界,4008-659-600,,
遂宁市首尚装修工程有限公司——剑阁分公司            ,剑阁县普安镇紫金名门C栋4楼,4008-659-600,,
四川盛百源装饰工程有限公司            ,广元万达晶座A-25-21,4008-659-600,,
广元映鑫装饰工程有限责任公司            ,,4008-659-600,,
四川聚源伟业装饰工程有限公司            ,广元市利州东路二段（太平洋大厦602号）,4008-659-600,,
广元蓝宇装饰工程有限公司            ,,4008-659-600,,
利州区梦华装饰装修工作室            ,,4008-659-600,,
四川聚源伟业装饰工程有限公司            ,,4008-659-600,,
诺诚装饰            ,,4008-659-600,,
