秦皇岛三优装饰工程有限公司张家口分公司 ,张家口市桥东区钻石中路华耐钻石店底商,15333339010,8022191,
张家口轻舟世纪建筑装饰工程有限公司 ,,,,,,,15030339567,4110303,
张家口金蚂蚁装饰工程有限公司 ,张家口市高新区中兴北路长江时代广场A座9层,13051216444,7095547,
张家口熹匠装饰工程有限公司 ,张家口市桥东区滨河南路悦蓝湾底商1号熹匠家...,18133899916,2225511,
随享拼绿色家居整体装饰体验馆 ,张家口市经开区凤凰城一期北门西行20米14...,15512345674,8170777,
张家口科宝博洛尼装饰工程有限公司            ,张家口市高新区新天地锦程大厦底商,4008-659-600,,
张家口帝文装饰工程有限公司            ,张家口市桥西区西坝岗祭风台街SOHO国际A...,4008-659-600,,
张家口爱家装饰工作室            ,河北省 张家口市 桥东区 水岸丽城,4008-659-600,,
张家口雅庭装饰工程有限公司            ,张家口高新区丰泰亲河苑小区,4008-659-600,,
张家口融发建筑装饰工程有限公司            ,张家口市高新区纬二路新天地文化广场5号,4008-659-600,,
张家口海润家装饰工程有限公司            ,张家口高新区府街庭院南门6号底商,4008-659-600,,
张家口宣化启辰建筑装饰有限公司            ,河北省张家口市宣化区小官沟3号,4008-659-600,,
张家口润达装饰有限公司            ,张家口市新天地小区南门润达装饰,4008-659-600,,
张家口深港建筑装饰工程有限公司            ,张家口市桥东区茶榆路6号奥林星城五期35号...,4008-659-600,,
御峰轩装饰张家口分公司            ,张家口高新区纬三路世纪豪园西侧底商,4008-659-600,,
张家口天佑装饰工程有限公司            ,纬二路新城名座底商2号楼5号底商,4008-659-600,,
美屋定制            ,张家口市怀来县沙城镇二街实验小学北300米,4008-659-600,,
南昌欧坊装饰工程有限公司            ,南昌西湖区洪城路576号天使商务广场t层,4008-659-600,,
江西苹果装饰公司            ,南昌市抚生丽都广场,4008-659-600,,
北京实创家居装饰集团(江西)有限公司            ,南昌市洪城路6号国贸国贸广场新华都1-3层,4008-659-600,,
江西苹果装饰设计工程有限公司            ,西湖区洪城路987号丽都广场a栋五楼（）,4008-659-600,,
一号家居网南昌站            ,江西省南昌市青山湖区上海路699文化创意园,4008-659-600,,
张家口三鼎装饰工程有限公司            ,张家口市桥东区奇丽龙家居建材城负一层三鼎装...,4008-659-600,,
张家口紫香柯装饰工程有限公司            ,河北省张家口市经开区朝阳西大街丰泰亲河苑底...,4008-659-600,,
一号家居网            ,南昌市青山湖区上海路699文化创意园,4008-659-600,,
张家口交换空间装饰有限公司            ,张家口纬二路世纪豪园北门正对面,4008-659-600,,
张家口天佑装饰公司            ,纬三路联通大厦后新城名座2号底商楼5号,4008-659-600,,
张家口三元舍装饰工程有限公司            ,张家口桥东区工业路奇丽龙建材家居广场5层,4008-659-600,,
南昌实创家居装饰            ,南昌市洪城路6号新华都购物广场3楼,4008-659-600,,
江西翔海装饰工程有限公司            ,,4008-659-600,,
南昌实创家居装饰            ,南昌市洪城路6号新华都购物广场3楼,4008-659-600,,
江西翔海装饰工程有限公司            ,,4008-659-600,,
张家口海之峰装饰工程有限公司            ,,4008-659-600,,
张家口市欧尚艺锦装饰工程有限公司            ,张家口市桥东区工业街奇丽龙建材家居广场5楼,4008-659-600,,
北京嘉至豪阁装饰工程有限公司            ,张家口市市府西大街财富中心D座8层78号,4008-659-600,,
一号家居网南昌站            ,江西省南昌市青山湖区上海路699文化创意园,4008-659-600,,
张家口合建装饰工程有限公司            ,凯地广场A座712室,4008-659-600,,
爱家装饰            ,,4008-659-600,,
张家口卓益装饰公司            ,,4008-659-600,,
张家口佐佑建筑装饰工程有限公司            ,高新区盛华东大街上京王府别墅4号底商,4008-659-600,,
北京御峰轩装饰张家口分公司            ,伟三路世纪豪园西门底商19号,4008-659-600,,
河北纵横世界装修            ,,4008-659-600,,
张家口欧尚艺锦装饰工程有限公司            ,,4008-659-600,,
张家口创达装饰中心            ,张家口桥西区西坝岗天宝中苑3号楼底商（新十...,4008-659-600,,
怀来百佳装饰            ,怀来县沙城镇存瑞西大街府街新城,4008-659-600,,
弘高装修有限公司            ,,4008-659-600,,
张家口随享拼建筑装饰工程有限公司            ,,4008-659-600,,
张家口非凡装饰工程有限公司            ,,4008-659-600,,
业之峰印象装饰工程张家口有限公司            ,张家口华耐高新店南区二楼,4008-659-600,,
张家口同工装饰工程有限公司            ,张家口市桥东区红旗楼冠垣广场7-29,4008-659-600,,
业之峰印象装饰工程张家口有限公司            ,张家口华耐高新店南区二楼,4008-659-600,,
张家口同工装饰工程有限公司            ,张家口市桥东区红旗楼冠垣广场7-29,4008-659-600,,
科海装饰工程张家口有限公司            ,,4008-659-600,,
张家口随享拼装饰工程有限公司            ,,4008-659-600,,
新潮装饰            ,,4008-659-600,,
张家口融发建筑工程有限公司            ,河北省张家口市高新区纬二路新天地文化广场5...,4008-659-600,,
张家口九创装饰工程有限公司            ,张家口市桥东区金鑫九克拉公馆底商6-9,4008-659-600,,
淘猫e族装修馆            ,张家口市桥东区北方学院东校区富强路新东亚时...,4008-659-600,,
张家口中业建筑装饰            ,张家口高新区张宣公路28号2层B区15号场...,4008-659-600,,
张家口住在米兰装饰            ,河北省张家口市桥西区赐儿山街美居丽景园1号...,4008-659-600,,
张家口胜美达装饰工程有限公司            , 河北省张家口市经开区纬三路凤凰国际城东门...,4008-659-600,,
北京阔达装饰张家口店            ,张家口高新区纬二路新天地西广场3号底商,4008-659-600,,
张家口瑞禾装饰工程有限公司            ,河北省张家口市高新区纬三路辽海国际大厦11...,4008-659-600,,
张家口豆芽电子商务有限公司            ,张家口高新区府街庭院南门6号底商,4008-659-600,,
张家口怡春装饰工程有限公司            ,张家口市高新区张宣公路28号亿安建材城3楼...,4008-659-600,,
