恩施品匠装饰工程有限公司            ,湖北省 恩施土家族苗族自治州 恩施市 恩施...,4008-659-600,,
恩施苹果装饰工程有限公司            ,湖北省 恩施土家族苗族自治州 恩施市 学院...,4008-659-600,,
恩施尚品装饰工程有限公司            ,恩施红谷中大道699号,4008-659-600,,
欧坊装饰工程有限公司恩施分公司            ,湖北省 恩施土家族苗族自治州 恩施市 学院...,4008-659-600,,
筑巢装饰工程有限公司            ,湖北省恩施市金桂大道花果山小区一楼,4008-659-600,,
恩施壹号家信息科技有限公司            ,湖北省 恩施土家族苗族自治州 恩施市 恩施...,4008-659-600,,
恩施聚品装饰设计工程有限公司            ,湖北省恩施市莲湖花园一期101 102 室...,4008-659-600,,
北京实创家居装饰集团恩施分公司            ,洪城路6号坛子口国贸大厦A座1-3层,4008-659-600,,
美升装饰工程有限公司            ,湖北省 恩施土家族苗族自治州 恩施市 恩施...,4008-659-600,,
登品装饰工程有限公司            ,湖北省恩施市金桂大道花果山小区B303号,4008-659-600,,
恒美装饰有限公司            ,湖北省 恩施土家族苗族自治州 恩施市 湖北...,4008-659-600,,
恩施全佳装饰工程有限公司            ,湖北省恩施市金桂大道武陵国际一期B02栋6...,4008-659-600,,
大众装饰            ,恩施市武陵国际装饰城B239号,4008-659-600,,
恩施州时代易舍装饰有限公司            ,湖北省恩施市金桂大道伍家槽现代家居城C区3...,4008-659-600,,
利川市非凡装饰工程有限公司            ,利川市清源路国梁集团12楼,4008-659-600,,
北京海天环艺家居装饰有限公司恩施分公司            ,,4008-659-600,,
广东帝豪装饰恩施分公司            ,,4008-659-600,,
苏州云网通信息科技有限公司            ,苏州姑苏区枫桥路698号,4008-659-600,,
恩施州新佰佳民族工艺开发有限公司            ,恩施市学院路260号（黄泥坝路口50米）,4008-659-600,,
北京海天环艺家居装饰有限公司恩施分公司            ,施州大道福星城一期5-110,4008-659-600,,
