惠州市大亚湾佰居易装饰工程有限公司            ,惠州市大亚湾西区新寮新村一巷34号,4008-659-600,,
惠州市361家装设计工程有限公司            ,惠州市惠阳区淡水白云二路298号天富大厦5...,4008-659-600,,
惠州华逸装饰设计工程有限公司            ,惠州市惠城区华乐弘城1栋1单元301华逸装...,4008-659-600,,
惠州市鑫泓辉工业装饰厂房装修通风制冷无尘净化工程            ,广东省惠州市仲恺高新区陈江大道南9号,4008-659-600,,
广东艺之居装饰            ,惠州市大亚湾新区石化大道西凯峰雅园110号...,4008-659-600,,
惠州市美信建筑装饰工程有限公司            ,演达一路港惠新天地西区二座704-1705...,4008-659-600,,
惠州市余工三星装饰设计工程有限公司            ,惠城区东湖西路达利商务中心505(西枝江桥...,4008-659-600,,
创越装饰设计有限公司            ,惠阳区淡水镇永康中街三巷一号,4008-659-600,,
深圳天伟装饰设计工程有限公司            ,惠州大亚湾石化大道中太东时尚岛6栋109,4008-659-600,,
惠州道合装饰工程有限公司            ,,4008-659-600,,
工匠装饰(惠州)有限公司            ,,4008-659-600,,
惠州市百利装饰设计工程有限公司            ,中区华府一期4号,4008-659-600,,
惠州市德立装饰工程有限公司            ,惠州市惠州大道小金口段362号,4008-659-600,,
惠州市铭派装饰设计工程有限公司            ,惠州市惠阳区淡水爱民东路49号,4008-659-600,,
惠州市水木居装饰工程有限公司            ,惠州市惠城区麦地路58号风尚国际大厦10Ｈ,4008-659-600,,
惠州市名大师建筑装饰设计工程有限公司            ,惠东县平山黄排河南路金融大厦4楼,4008-659-600,,
惠州天鸿装饰工程有限公司            ,,4008-659-600,,
惠州市名匠装饰设计工程有限公司            ,演达大道万饰城b馆4楼,4008-659-600,,
惠州易百装饰工程有限公司            ,,4008-659-600,,
惠州华逸装饰工程有限公司            ,,4008-659-600,,
惠州艾佰图装饰工程有限公司            ,,4008-659-600,,
惠州喜洋洋装饰工程有限公司            ,,4008-659-600,,
无            ,惠州市演达一 路云天华庭大厦2403F(鲁...,4008-659-600,,
惠州同城装饰装修工程有限公司            ,惠州市惠城区演达大道世纪新天世纪阁,4008-659-600,,
惠州好安居装饰工程有限公司            ,,4008-659-600,,
惠州海庭装饰工程有限公司            ,,4008-659-600,,
深圳紫荆花裝飾有限公司            ,大亞灣石化大道288號愛琴海142號商舖,4008-659-600,,
惠州华宁装饰装饰工程有限公司            ,,4008-659-600,,
惠州名雕装饰工程有限公司            ,,4008-659-600,,
惠州金苹果装饰工程有限公司            ,,4008-659-600,,
惠州力辰装饰工程有限公司            ,,4008-659-600,,
