广州市华宁装饰工程有限公司揭阳分公司 ,东山区黄岐山大道与建阳路交界处,15975212735,15975212735,
汕头市汇轩装饰工程有限公司 ,揭阳市榕城区晓翠路金城峰景1号商铺,18822901160,8639989,
晨木室内装饰工程有限公司            ,广东揭阳揭东中国电信大楼入188米晨木装饰,4008-659-600,,
鼎匠装饰有限公司            ,新河建阳路南一区十四幢102,4008-659-600,,
海纳装饰集团            ,广东省揭阳揭东区揭东国道中段地税局向东10...,4008-659-600,,
榕居装饰            ,广东省 揭阳市 榕城区 榕城区莲花市场，东...,4008-659-600,,
星艺装饰有限公司            ,揭阳市东山区黄岐山大道中信商业城38号,4008-659-600,,
品通家居装饰有限公司            ,揭阳市榕城区新兴南路,4008-659-600,,
揭阳华居装饰有限公司            ,揭阳市榕城区晓翠路以东,环市北路以北创鸿国...,4008-659-600,,
晟世装饰设计有限公司            ,揭阳市揭东区中二街中国邮政路口直入700米,4008-659-600,,
里湖兴居装饰            ,广东普宁市里湖镇横马路31号（手机）,4008-659-600,,
元品装饰设计工程有限公司            ,广东省揭阳市渔湖中路2号,4008-659-600,,
广州市三星装饰有限公司揭阳分公司            ,揭阳市东山区建阳东路新翠苑A4铺面（市保健...,4008-659-600,,
江西苹果装饰公司            ,南昌市抚生丽都广场,4008-659-600,,
北京实创家居装饰集团(江西)有限公司            ,南昌市洪城路6号国贸国贸广场新华都1-3层,4008-659-600,,
一号家居网南昌站            ,江西省南昌市青山湖区上海路699文化创意园,4008-659-600,,
一号家居网            ,南昌市青山湖区上海路699文化创意园,4008-659-600,,
揭阳市宏美装饰有限公司            ,宏美装饰材料总汇,4008-659-600,,
揭阳晟世装饰设计有限公司            ,揭阳市揭东区中二街中国邮政路口直入700米,4008-659-600,,
揭阳枫林装修            ,揭阳市榕城区新兴南路,4008-659-600,,
南昌实创家居装饰            ,南昌市洪城路6号新华都购物广场3楼,4008-659-600,,
江西翔海装饰工程有限公司            ,,4008-659-600,,
天宇装饰设计            ,,4008-659-600,,
揭阳市慕名装饰设计            ,,4008-659-600,,
一号家居网南昌站            ,江西省南昌市青山湖区上海路699文化创意园,4008-659-600,,
迪赞设计空间            ,南昌市井冈山大道名爵公馆,4008-659-600,,
揭阳市慕名装饰设计有限公司            ,,4008-659-600,,
汕头市汇轩装饰工程有限公司揭阳分公司            ,揭阳市榕城区晓翠路金城峰景1号商铺,4008-659-600,,
揭阳普宁佳盛装饰公司            ,,4008-659-600,,
鸿瑞装饰设计            ,,4008-659-600,,
揭阳几米家总部            ,揭阳市榕城区东山11号街麦点大楼4楼,4008-659-600,,
广东众合佳美建筑装饰工程有限公司            ,东山十一号路岐山幼儿园前面和兴楼1401,4008-659-600,,
森集空间装饰设计            ,,4008-659-600,,
揭阳市慕名装饰设计            ,揭阳市黄岐山大道金碧尚都39号商铺（即电信...,4008-659-600,,
宜诚装饰            ,,4008-659-600,,
普宁市裕民室内装修屋            ,普宁市流沙南街道里宅居委楼西侧100米,4008-659-600,,
普宁鼎建装饰            ,,4008-659-600,,
沃槿适装饰工程有限公司            ,揭阳市榕城区新河路东升街道沃槿适装饰,4008-659-600,,
广东索雅装饰有限公司            ,,4008-659-600,,
揭阳市欧尚空间装饰设计（OSKJ）            ,东山泰和家园小区后面,4008-659-600,,
揭阳普宁佳盛装饰公司            ,,4008-659-600,,
鸿瑞装饰设计            ,,4008-659-600,,
揭阳几米家总部            ,揭阳市榕城区东山11号街麦点大楼4楼,4008-659-600,,
广东众合佳美建筑装饰工程有限公司            ,东山十一号路岐山幼儿园前面和兴楼1401,4008-659-600,,
森集空间装饰设计            ,,4008-659-600,,
揭阳市慕名装饰设计            ,揭阳市黄岐山大道金碧尚都39号商铺（即电信...,4008-659-600,,
宜诚装饰            ,,4008-659-600,,
普宁市裕民室内装修屋            ,普宁市流沙南街道里宅居委楼西侧100米,4008-659-600,,
普宁鼎建装饰            ,,4008-659-600,,
沃槿适装饰工程有限公司            ,揭阳市榕城区新河路东升街道沃槿适装饰,4008-659-600,,
揭阳市晨木室内装饰            ,广东揭阳揭东中国电信大楼入188米晨木装饰,4008-659-600,,
揭阳市鹏辉装饰工程有限公司            ,揭阳市榕城区东山五号东路中段东泮东凰围6栋...,4008-659-600,,
广东众合佳美建筑装饰工程有限公司            ,榕城区东山十一号街岐山幼儿园前面和兴楼14...,4008-659-600,,
揭阳市华灵精拓设计工程有限公司            ,东升街沟口学校片区第12幢,4008-659-600,,
揭阳市独创装饰工程有限公司            ,揭阳市榕城区新河路中段岐山幼儿园对面和兴楼...,4008-659-600,,
揭阳市天泫装饰设计有限公司            ,粤东贸易广场A3栋,4008-659-600,,
南昌鲁公大宅装饰工程公司            ,南昌市八一广场丽华购物广场6楼,4008-659-600,,
佳盛装饰有限公司            ,广东省揭阳市普宁市S236,4008-659-600,,
易居空回家装饰工程有限责任公司            ,揭阳西三环北路87号国际财经中心c座13层,4008-659-600,,
美星装饰集团            ,南昌,4008-659-600,,
鲁班装饰设计有限公司            ,南昌,4008-659-600,,
弘泰装饰设计有限公司            ,广东省普宁市流沙镇西陇村,4008-659-600,,
翊雅装饰工程有限工司            ,广东省 揭阳市 榕城区 揭阳市榕城区空港经...,4008-659-600,,
三星装饰有限公司            ,广东省 揭阳市 榕城区 东山区建阳路金城龙...,4008-659-600,,
完美装饰股份有限公司            , 广东省揭阳市榕城区新河路南段,4008-659-600,,
江西苹果装饰-江西苹果装饰(旗舰店)            ,江西省南昌市西湖区洪城路丽都广场a栋苹果装...,4008-659-600,,
华浔品味装饰            ,揭阳市榕城区临江南路江南新城（一期）33号...,4008-659-600,,
揭阳市乐帆装饰有限公司            ,揭阳市榕城区榕东街道钟厝洋社区,4008-659-600,,
