昆山百瑞装饰工程有限公司 ,昆山市玉山镇马鞍山路和鹿城路交叉口,13375156838,57798969,
上海芈悦装饰设计有限公司 ,昆山市花桥镇光明路1501-9号,18301954616,50161902,
上海居上装饰设计有限公司 ,昆山市花桥镇绿地大道231弄9号楼1609...,13761930027,50173039,
苏州辰美创意装饰设计工程有限公司 ,昆山市紫竹路699号九方城写字楼8栋406,13761509158,55135198,
上海朗通建筑装潢工程有限公司昆山分公司 ,昆山柏庐北路64号,13218159077,57171618,
上海吉美建筑装饰工程有限公司 ,花桥镇商详路555号汇金大厦501-3室,13160158518,86890026,
昆山易可居装饰设计有限公司 ,昆山市前进东路世茂广场对面联采中心大厦18...,18368807370,50162689,
上海沃依实业有限公司 ,昆山虹桥路598号3栋104,17751477863,36863401,
苏州大鹿装饰工程有限公司 ,昆山市萧林路汉林路口百澜地商苑2栋2103,13046515791,50333336,
昆山水木南山装饰工程有限公司 ,昆山市玉山镇市后街与花园路路口,18914955188,57867876,
江苏艾氏装饰工程有限公司昆山分公司 ,千灯镇景泾路90号,18014869996,50125322,
昆山市东吴庭院装饰工程有限公司 ,昆山市玉山镇杰座大厦305室,13962643908,55233186,
昆山开发区志豪设计装饰部 ,苏州市昆山市长江路1128号日月星城国际商...,15950915172,36911394,
昆山百创诗艺装饰设计工程有限公司 ,昆山市周市镇长江北路宝成大厦828室,13451691321,50158666,
太仓莱米特装饰工程有限公司 ,绿地大道，易买得对面,18962693393,6048198,
昆山叶惠美建筑装潢有限公司 ,景王路东晶国际花园商铺166号叶惠美装饰,15962602059,50170691,
上海贵明装饰有限公司            ,昆山市千灯镇南浦东路124号,4008-659-600,,
北京亚光亚装饰公司太仓分公司            ,太仓市东仓北路2号东昌大厦106 ,4008-659-600,,
江苏旭日装饰工程有限公司            ,昆山市柏庐中路401号,4008-659-600,,
上海九星装饰昆山有限公司            ,昆山花桥徐公桥路2号,4008-659-600,,
昆山维度装饰设计有限公司            ,世贸蝴蝶湾商业街7-04,4008-659-600,,
昆山愚公装潢工程设计有限公司            ,昆山市柏庐北路91号,4008-659-600,,
昆山留白空间设计装饰有限公司            ,昆山市玉山镇城北市后街315号,4008-659-600,,
苏州东润室内设计有限公司            ,昆山柏庐南路吉田国际大厦1701室,4008-659-600,,
潮州市华浔品味装饰设计工程有限公司            ,广东省潮州市潮州大道南较腾达园18-19号...,4008-659-600,,
昆山悦巢装饰设计工程有限公司            ,昆山城南蝶湖湾商业区6-8号（汽车站对面）,4008-659-600,,
昆山市春豪装饰有限公司            ,昆山市萧林路金威广场11号(易初爱莲对面),4008-659-600,,
1918室内装饰设计            ,前进东路888号,4008-659-600,,
 ,,4008-659-600,,
太仓美星装饰            ,太仓市弇山西路城市华庭商务中心11幢505,4008-659-600,,
昆山鼎之艺装饰有限公司            ,昆山北门路尚城国际17#118室,4008-659-600,,
昆山城市之家装饰            ,,4008-659-600,,
