晋江市南峰装饰工程有限公司 ,福建省晋江市长兴路居然之家五楼013室,15260880801,82153108,
福州紫恒装饰工程设计有限公司晋江分公司 ,晋江市世纪大道君悦湾二期8-10号店面(万...,18359595816,85356969,
厦门正之峰装饰设计工程有限公司晋江分公司 ,晋江市梅岭街道世纪大道万达斜对面梅山新天地...,13225080555,13225080,
三星装饰有限公司 ,迎宾路142号,18770242271,85632551,
广州华宁装饰工程有限公司晋江分公司            ,晋江市,4008-659-600,,
福建省九九装饰工程有限公司            ,福建省石狮市子芳路494号爱都公寓二楼,4008-659-600,,
泉州力合装饰设计工程有限公司            ,丰泽区城东体育街,4008-659-600,,
广州艺恒装饰工程有限公司            ,南安市水头镇电信大厦旁壹加壹快捷酒店对面广...,4008-659-600,,
嘉巢装饰工程有限公司            ,泉州-晋江 梅岭社区锦塘雅苑8栋1304室,4008-659-600,,
泉州伍星装饰工程有限公司            ,泉州市丰泽区祥元路玉源大厦6F,4008-659-600,,
泉州市薪木装饰设计有限公司            ,福建 泉州 泉州市丰泽区 东辅路喜盈门家居...,4008-659-600,,
城市人家装饰有限公司            ,北京市大兴区亦庄经济开发区4号街区力宝广场...,4008-659-600,,
北京龙发装饰集团            ,阳明东路71号金涛国际a座,4008-659-600,,
华浔品味装饰            ,东路鹿鼎家居4楼b馆,4008-659-600,,
晋江华浔品味装饰万达公司            ,晋江世纪大道君悦湾18号店面华浔品味装饰,4008-659-600,,
泉州三星装饰工程有限公司            ,泉州市丰泽区丰泽广场二 楼A78--A82,4008-659-600,,
福建泉州爱美家装饰晋江分公司            ,晋江市池店镇西宅小区6号楼2002室,4008-659-600,,
泉州市尚成装饰有限公司             ,晋江市迎宾路9号煌利大厦202室 ,4008-659-600,,
晋江市鼎元装饰工程有限公司            ,晋江市梅岭街道世纪大道桂香苑2#32号店面,4008-659-600,,
晋江市三星装饰工程有限公司            ,福建省晋江（市标）迎宾路142号（商业银行...,4008-659-600,,
晋江市鑫大城装饰公司            ,晋江市青阳泉安中路赤西,4008-659-600,,
 ,,4008-659-600,,
南昌创艺装饰工程有限公司            ,青云谱区解放西路坛子口明珠广场h座23楼整...,4008-659-600,,
香港云裳软装配饰南昌分公司            ,南昌市西湖区省府西二路,4008-659-600,,
金芒果装饰集团            ,江西省吉安市吉州区广场北路1号(新世界广场...,4008-659-600,,
南昌三帝装饰设计有限公司            ,南昌市青山湖区洪都北道299号高能金域名都...,4008-659-600,,
 ,,4008-659-600,,
业之峰装饰南昌分公司            ,,4008-659-600,,
南昌市轩仝宇装饰工程有限公司            ,江西省南昌市西湖区子安路89号1602,4008-659-600,,
迪赞设计空间            ,南昌市井冈山大道名爵公馆,4008-659-600,,
深圳市居众装饰设计工程有限公司晋江分公司            ,晋江市 世纪大道888号万达广场甲A座23...,4008-659-600,,
厦门福旺居装饰工程有限公司晋江分公司            ,晋江市万达广场写字楼B座201-209,4008-659-600,,
厦门市立邦家具装饰有限公司晋江分公司            ,福建省泉州市晋江市梅岭街道世纪大道668号...,4008-659-600,,
晋江市简美装饰有限公司            ,福建省泉州市晋江市梅岭街道世纪大道锦绣广场...,4008-659-600,,
泉州今典延装饰有限公司            ,福建省晋江市 梅岭街道竹树下社区竹晖路竹晖...,4008-659-600,,
家装e站晋江分公司            ,晋江市世纪大道君悦湾1-2栋商场2楼,4008-659-600,,
广东星艺装饰泉州分公司            ,泉州市安吉路美仙山花苑二期14B5 ,4008-659-600,,
鲁班装饰设计有限公司            ,南昌,4008-659-600,,
福建筑宇巢装饰工程有限公司            ,泉州市洛江区三盛四季公园二期12栋201，...,4008-659-600,,
晋江装饰            ,晋江晋江晋江,4008-659-600,,
实创家居装饰集团有限公司            ,青云谱洪都洪城路6号国贸广场13层,4008-659-600,,
