太原永信装饰工程有限公司 ,居然金地洁具区2-2-22,15634900148,2226808,
朔州市雅居装饰设计有限公司 ,朔州市居然金地3区1排6号,13994945858,5996880,
山西今朝英迈装饰设计有限公司            ,太原市迎泽区并州东街62号,4008-659-600,,
朔州市非凡建筑装饰有限公司            ,朔州市开发区森隆大厦16层,4008-659-600,,
朔州和利装饰            ,朔州市市府街金源泰二楼,4008-659-600,,
瀚翔装饰有限公司            ,山西省 朔州市 朔州市朔城区开发区梁郡路（...,4008-659-600,,
北京深度空间装饰工程有限公司朔州分公司            ,山西省朔州市开发区万事通小区北京深度空间装...,4008-659-600,,
朔州铭图装饰设计工程有限公司            ,居然金地7区二栋18号掌上明珠家具后面,4008-659-600,,
山西绿豆装饰有限公司朔州分公司            ,朔城区豪德对面福泰酒楼旁,4008-659-600,,
专业室内设计公司            ,市府东街岸上之家,4008-659-600,,
朔州家装e站            ,山西省朔州市朔城区居然金地13区2栋10号,4008-659-600,,
朔州越达装饰            ,朔州市居然金地1区1栋16号,4008-659-600,,
 ,,4008-659-600,,
北京实创家居装饰集团(江西)有限公司            ,南昌市洪城路6号国贸国贸广场新华都1-3层,4008-659-600,,
 ,,4008-659-600,,
 ,,4008-659-600,,
朔州東唐装饰设计有限公司            ,朔州市张辽路豪德亿隆电器南50米，福泰酒楼...,4008-659-600,,
 ,,4008-659-600,,
迪赞设计空间            ,南昌市井冈山大道名爵公馆,4008-659-600,,
佰艺日盛装饰设计有限公司            ,居然金地13区,4008-659-600,,
南昌实创家居装饰            ,南昌市洪城路6号新华都购物广场3楼,4008-659-600,,
江西翔海装饰工程有限公司            ,,4008-659-600,,
家装e站朔州站            ,开发区政务大厅西侧森隆写字楼16楼,4008-659-600,,
朔州東唐装饰            ,,4008-659-600,,
 ,,4008-659-600,,
朔州家装e站            ,朔城区居然金地,4008-659-600,,
朔州铭图装饰工程有限公司            ,,4008-659-600,,
山西省朔州市宣意装饰有限公司            ,朔州市建设路银建市场临街商铺1-15号（凯...,4008-659-600,,
铭图装饰有限公司            ,朔州市居然金地7区2栋18号,4008-659-600,,
巨亮包工头            ,,4008-659-600,,
朔州市鲁师天工装饰工程有限公司            ,,4008-659-600,,
朔州市居泰装饰设计工程有限公司            ,山西省朔州市豪德6街121号,4008-659-600,,
朔州宣意装饰有限公司            ,朔州市朔城区银建市场临街商铺1#25号（凯...,4008-659-600,,
朔州市辰丰装饰有限公司            ,朔州市朔城区居然金地5区2栋7,8号,4008-659-600,,
秉运装饰有限公司            ,,4008-659-600,,
哈博大装饰工程有限公司            ,古北西街居然金地8区1-7号,4008-659-600,,
朔州越达装饰工程有限公司            ,朔州市居然金地1区1栋16号,4008-659-600,,
铭图装修设计部            ,,4008-659-600,,
朔州家装e站            ,朔城区居然金地,4008-659-600,,
朔州铭图装饰工程有限公司            ,,4008-659-600,,
