四川豪爵建筑装饰工程有限责任公司 ,四川省武胜县太和街229号,18398599991,6262009,
四川新叶建筑装饰工程有限责任公司 ,武胜县上东街仁和广场旁,18982684706,6681688,
四川美鸿装饰工程有限责任公司分公司            , 四川省广安市广安区城南宏志大道583号（...,4008-659-600,,
馨汇点装饰工程有限公司            ,四川省广安市枣山大道万贯法国风情街5-2-...,4008-659-600,,
市尚艺建筑装饰工程有限公司            ,广安市广安区内塔路114号,4008-659-600,,
四川美家美户装饰设计工程有限公司            ,广安市广安区宏志大道585号[银杏华庭]正...,4008-659-600,,
一品居装饰设计有限公司            ,广安市城南富源街89---93号,4008-659-600,,
四川豪爵建筑装饰工程有限责任公司 ,四川省武胜县太和街229号,18398599991,6262009,
四川新叶建筑装饰工程有限责任公司 ,武胜县上东街仁和广场旁,18982684706,6681688,
四川美鸿装饰工程有限责任公司分公司            , 四川省广安市广安区城南宏志大道583号（...,4008-659-600,,
馨汇点装饰工程有限公司            ,四川省广安市枣山大道万贯法国风情街5-2-...,4008-659-600,,
市尚艺建筑装饰工程有限公司            ,广安市广安区内塔路114号,4008-659-600,,
四川美家美户装饰设计工程有限公司            ,广安市广安区宏志大道585号[银杏华庭]正...,4008-659-600,,
一品居装饰设计有限公司            ,广安市城南富源街89---93号,4008-659-600,,
交换空间装饰有限公司            ,四川省广安市广安区城南宏志大道,4008-659-600,,
大通装饰            ,广安市广安区红色影视城小区12-9号,4008-659-600,,
武胜宏博装饰            ,四川省广安市武胜县香江豪庭3-13号,4008-659-600,,
北京业之峰诺华装饰股份有限公司            ,广安八一大道357号 财富广场b座22层,4008-659-600,,
实创家居装饰集团有限公司            ,广安青云谱洪都洪城路6号国贸广场13层,4008-659-600,,
华丰装饰有限公司            ,广安红星二路畜牧局楼下,4008-659-600,,
尚艺建筑装饰工程有限公司            ,广安城南环溪一巷37-39号(希望小学二校...,4008-659-600,,
思晨装饰工程有限公司            ,广安市红谷滩新区万达广场A1-310,4008-659-600,,
四川鸿耀装饰设计有限公司            ,,4008-659-600,,
南昌欧坊装饰工程有限公司            ,南昌西湖区洪城路576号天使商务广场t层,4008-659-600,,
佳美家装饰集团            ,南昌市八一广场丽华购物广场6楼,4008-659-600,,
市梦想家装饰工程有限公司            ,广安市广安区广武东路88号泰合国际商贸城4...,4008-659-600,,
弈昌装饰集团            ,广安区西湖区抚生南路博富大厦二楼,4008-659-600,,
道艺装饰有限公司            ,四川省广安市清平街28号附近,4008-659-600,,
北京佳林国际建筑装饰工程有限公司公司            ,广安市广安区华美立家45栋3楼318号,4008-659-600,,
嘉祺装饰设计工程有限公司            ,,4008-659-600,,
易尚装饰            ,广安市青山湖大道333号天香园8号创意园二...,4008-659-600,,
致远装饰设计有限公司            ,广安市广安区金安大道二段65号10F(利民...,4008-659-600,,
星艺装饰有限公司            ,南昌市北京东路·恒茂国际都会...,4008-659-600,,
波涛装饰公司            ,高新区南二环西段财富中心,4008-659-600,,
南国风装饰工程有限工司            ,青山湖南大道墅溪园,4008-659-600,,
广州市华宁装饰工程有限公司南昌分公司            ,四川省广安市武胜县上东街169号,4008-659-600,,
