北京元洲装饰沧州分公司            ,河北省 沧州市 运河区 新华西路与开元大道...,4008-659-600,,
沧州道艺装饰有限公司            ,河北省 沧州市 运河区 西客站北侧泰大国际...,4008-659-600,,
沧州欧尚装饰集团            ,河北省 沧州市 运河区 沧州市运河区沧州人...,4008-659-600,,
交换空间装饰有限公司沧州分公司            ,沧州市运河区天城郡府东区商业楼3#,4008-659-600,,
北京业之峰装饰沧州分公司            ,河北省 沧州市 运河区 解放西路或西客站北,4008-659-600,,
沧州城市人家装饰            ,河北省 沧州市 运河区 金鼎大厦B座,4008-659-600,,
阔达建筑装饰工程有限责任公司沧州分公司            ,沧州市朝阳北路颐和家居底商博洛尼厨房旗舰店...,4008-659-600,,
上海波涛装饰沧州分公司            ,河北省 沧州市 宏宇城B区101底商,4008-659-600,,
沧州志诚装饰装修工程有限公司            ,沧州市 运河区 南陈屯乡刘辛庄村,4008-659-600,,
