济南金尚装饰工程有限公司 ,历城区二环东路嘉恒商务大厦B座一二楼,15318819659,98965691,
天津居联峰尚装饰工程有限公司济南分公司 ,经六路和营市街交叉口往北100米路西独栋5...,13011707321,86563880,
济南九创装饰工程有限公司 ,二环东路东环国际广场A座,15910109142,88814010,
天津华庭装饰工程有限公司济南分公司 ,历下区解放路与二环东路交叉口往西200米路...,15063381656,400-070-3990,
山东大本装饰工程有限公司 ,华能路与华阳路交汇处汇隆广场汇阳大厦14楼,15264111123,58187988,
济南梵客装饰工程有限公司 ,济南市槐荫区刘长山延长线国茂建材市场二楼C...,15628839936,58187810,
山东美康装饰有限公司 ,历下区新泺大街与崇华路交叉口铭盛大厦8楼,18595249291,00000000,
山东仁义装饰工程有限公司 ,济南市历城区二环东路金桥国际A座1210,13156161855,82375686,
山东云装装饰有限公司 ,山东省济南市历下区华能路38号汇源大厦15...,13256119997,400-077-0750,
济南巨强装饰工程有限公司            ,济南天桥区西泺河路9号,4008-659-600,,
济南森淼装饰设计有限公司            ,历黄路豪鲁电子商厦1329室,4008-659-600,,
济南万泰建筑装饰工程有限公司            ,总部设计中心 望岳路1号 ,4008-659-600,,
济南华美家居            ,济南市天桥区北园大街大明家居1楼A-36,4008-659-600,,
济南博洛尼整体家装            ,泺源大街229号杆石桥金龙大厦,4008-659-600,,
济南浩瀚装饰设计工程有限公司            ,济南市历下区解放路16-2号,4008-659-600,,
 ,,4008-659-600,,
dhome美居装饰            ,济南市杆石桥路金龙大厦,4008-659-600,,
济南雷亿装饰工程有限公司            ,济南历城区东环国际广场A座902,4008-659-600,,
山东贵恒装饰工程有限公司            ,市中区岔路街2号济南贵恒家装市场A208室,4008-659-600,,
济南鼎新装饰工程有限责任公司            ,佛山街51号望佛楼702室,4008-659-600,,
济南城市人家装饰公司            ,济南市明湖东路12号明湖天地b座,4008-659-600,,
济南梓桐树装饰工程有限公司            ,1,4008-659-600,,
济南合山兄弟装饰有限公司            ,济南市高新区新宇路1号香格里拉北塔13F,4008-659-600,,
济南银进装饰工程有限公司            ,济南市北园大街338号 豪鲁电子商厦8楼,4008-659-600,,
城市人家装饰设计工程有限公司            ,济南市明湖东路12号明湖天地b座,4008-659-600,,
济南永昊装饰工程有限公司            ,济南市天桥区无影山中路48号舜都大厦7楼大...,4008-659-600,,
济南尚海装饰工程有限公司            ,济南市天桥区嘉汇环球广场C829,4008-659-600,,
济南梓桐树装饰设计工程有限公司            ,,4008-659-600,,
济南万家惠装饰            ,济南市市中区,4008-659-600,,
济南九创装饰工程有限公司            ,济南市历城区二环东路东环国际广场A座4楼,4008-659-600,,
济南旭峰装饰工程有限公司            ,济南市历下区和平路诚基中心4-1-919,4008-659-600,,
济南市华庭豪宅装饰工程有限公司            ,阳光新路与卧龙路交叉口西300米路南,4008-659-600,,
