科宝博洛尼装饰工程有限公司            ,张家口市高新区新天地锦程大厦底商,4008-659-600,,
淘猫e族装修馆            ,张家口市桥东区北方学院东校区富强路新东亚时...,4008-659-600,,
帝文装饰工程有限公司            ,张家口市桥西区西坝岗祭风台街SOHO国际A...,4008-659-600,,
中业建筑装饰            ,张家口高新区张宣公路28号2层B区15号场...,4008-659-600,,
北京阔达装饰店            ,张家口高新区纬二路新天地西广场3号底商,4008-659-600,,
爱家装饰工作室            ,河北省 张家口市 桥东区 水岸丽城,4008-659-600,,
雅庭装饰工程有限公司            ,张家口高新区丰泰亲河苑小区,4008-659-600,,
融发建筑装饰工程有限公司            ,张家口市高新区纬二路新天地文化广场5号,4008-659-600,,
海润家装饰工程有限公司            ,张家口高新区府街庭院南门6号底商,4008-659-600,,
宣化启辰建筑装饰有限公司            ,河北省张家口市宣化区小官沟3号,4008-659-600,,
润达装饰有限公司            ,张家口市新天地小区南门润达装饰,4008-659-600,,
深港建筑装饰工程有限公司            ,张家口市桥东区茶榆路6号奥林星城五期35号...,4008-659-600,,
室内装饰、设计、施工、选材一条龙服务            ,,4008-659-600,,
同工装饰工程有限公司            ,张家口市桥东区红旗楼冠垣广场7-29,4008-659-600,,
合建装饰工程有限公司            ,凯地广场A座712室,4008-659-600,,
启艺装饰设计服务部            ,河北省张家口市涿鹿县阳光新城2号楼底商10...,4008-659-600,,
胜美达装饰工程有限公司            , 河北省张家口市经开区纬三路凤凰国际城东门...,4008-659-600,,
江西苹果装饰-江西苹果装饰(旗舰店)            ,江西省南昌市西湖区洪城路丽都广场a栋苹果装...,4008-659-600,,
每立方装饰工程有限公司            ,张家口市桥西区远大盛和苑底商,4008-659-600,,
瑞禾装饰工程有限公司            ,河北省张家口市高新区纬三路辽海国际大厦11...,4008-659-600,,
鲁班装饰设计有限公司            ,南昌,4008-659-600,,
市鑫润装饰有限公司            ,张家口市桥西区金华怡园3号楼底商811室,4008-659-600,,
交换空间装饰有限公司            ,张家口市纬二路新天地小区西门底商（文化广场...,4008-659-600,,
珍艺建筑装饰有限公司            ,张家口高新区纬二路府街庭院24号楼8单元1...,4008-659-600,,
嘉祺装饰设计工程有限公司            ,,4008-659-600,,
美星装饰集团            ,南昌,4008-659-600,,
交换空间装饰有限公司            ,南坪会展中心9玺国际8栋,4008-659-600,,
北京金三优装饰分公司            ,张家口市高新区纬二路新天地文化广场1号底商,4008-659-600,,
实创家居装饰集团有限公司            ,青云谱洪都洪城路6号国贸广场13层,4008-659-600,,
三鼎装饰工程有限公司            ,张家口市桥东区唯一东路正源温馨家园小区1号...,4008-659-600,,
市天绘装饰工程有限责任公司            ,张家口市高新区胜利中路凯地广场A座614（...,4008-659-600,,
