深圳天地和装饰设计有限公司 ,深圳市龙华区大浪街道凯豪达广场3栋,17304478867,27526819,
深圳广田云万家科技有限公司 ,深圳市罗湖区深南东路2098号盛华大厦2楼,18575500518,75500518,
深圳市中恒信装饰设计工程有限公司            ,深圳市吉盛路12号,4008-659-600,,
升磊装饰            ,深圳市宝安区西乡航城大道与107国道交汇处...,4008-659-600,,
深圳市帅华装饰工程            ,广东深圳宝安区新安街道六区资安商务大厦12...,4008-659-600,,
广东鵬洋装饰工程有限公司            ,广东,4008-659-600,,
广东星艺装饰（集团）深圳公司            ,南山区南海大道2003号海王大厦一楼,4008-659-600,,
深圳冠升装饰工程有限公司            ,苏州市姑苏区枫桥路698号雪枫街1号楼3层,4008-659-600,,
深圳泥巴公社            ,深圳市福田区赛格科技园4栋东5楼,4008-659-600,,
广州华浔品味装饰设计工程责任有限公司            ,深圳市宝安区西乡街道新安六路互联网产业基地...,4008-659-600,,
深圳市森鹏装饰设计工程有限公司            ,深圳市南山区南山大道1092号亿利达大夏3...,4008-659-600,,
深圳装饰设计工程有限公司            ,深圳市南山区海德三道海岸城大厦西座27层,4008-659-600,,
深圳名艺源装饰            ,深圳市龙岗区深惠路地铁3号线爱联站创兆广场...,4008-659-600,,
浩天装饰设计工程有限公司            ,南山北环大道10076号浩天装饰誉巢文化创...,4008-659-600,,
深圳华和建筑装饰工程有限公司            ,西乡大道231号富裕达大厦顶层 电话(一五...,4008-659-600,,
深圳市禾思喜聚设计顾问有限公司            ,深圳市龙华区民治沙元埔1970文化产业创意...,4008-659-600,,
深圳好易家装饰工程有限公司            ,深圳宝安区新安街道广深路249号锦江之星3...,4008-659-600,,
深圳臻翰装饰设计工程有限公司            ,深圳市罗湖区中兴路239号外贸集团大厦50...,4008-659-600,,
深圳雍庭装饰设计工程有限公司            ,福田区香蜜湖世纪中心家居广场A区2楼,4008-659-600,,
深圳市誉巢装饰设计工程有限公司            ,深圳市南山区北环大道10076号浩天誉巢文...,4008-659-600,,
深圳市誉巢装饰工程设计有限公司            ,,4008-659-600,,
深圳市华美乐装饰工程有限公司            ,深圳市龙岗区龙岗街道五联社区友谊路33号（...,4008-659-600,,
深圳市广盛装饰工程设计有限公司            ,龙岗区中心城清林路锦绣东方90号商铺,4008-659-600,,
深圳艾伦装饰设计有限公司            ,深圳宝安49区海汇路华创达科技园D308,4008-659-600,,
深圳市开普俊梦室内设计有限公司            ,深圳市宝安区三区龙井一路1号东江大厦28B...,4008-659-600,,
深圳新鸿基装饰设计工程有限公司            ,深圳市龙华新区民治街道,4008-659-600,,
装饰设计            ,装饰设计,4008-659-600,,
深圳市欧贝斯纯天然乳胶床上用品有限公司            ,深圳市龙岗区布吉街道达成工业区研发楼101,4008-659-600,,
深圳市龙皇建筑装饰工程有限公司            ,深圳市坪山新区坪山街道沙坡路3号,4008-659-600,,
深圳梦天装饰工程有限公司            ,,4008-659-600,,
经纬基业装饰建筑工程有限公司            ,东莞市凤岗官井头南门步行街A2/A3,4008-659-600,,
深圳市泓森壹品装饰设计工程有限公司            ,深圳市龙华新区梅陇路862号明珠商务大厦4...,4008-659-600,,
深圳市飞叶林装饰设计有限公司            ,深圳市龙华区,4008-659-600,,
深圳市伊美高装饰工程设计有限公司            ,,4008-659-600,,
深圳市浦仃浠装饰工程有限公司            ,深圳市福田区梅林街道上梅林新村200号60...,4008-659-600,,
深圳华和装饰有限公司            ,深圳市龙岗区布吉南岭村南岭食街1-3号,4008-659-600,,
玉蜂装饰设计有限公司            ,坂田四季花城合欢苑102,4008-659-600,,
深圳市智能优品科技有限公司            ,深圳市龙华新区民治街道沙吓老村82栋,4008-659-600,,
千恩装饰设计工程有限公司            ,深圳市龙岗区龙岗中心城珠江广场A4座110...,4008-659-600,,
深圳南利装饰集团股份公司            ,广东省深圳市福田区深南大道1006号国际创...,4008-659-600,,
深圳市南雅饰工程有限公司            ,,4008-659-600,,
鄂中装修队队            ,,4008-659-600,,
深圳市婉雅装饰设计工程有限公司            ,龙华新区1980文化创意园三期1栋B503,4008-659-600,,
深圳市思慕寝室用品有限公司            ,深圳市龙岗区布吉街道达成工业区办公研发楼1...,4008-659-600,,
深圳泰格装饰有限公司            ,深圳龙华区上塘村,4008-659-600,,
深圳市星佳优装饰设计工程有限公司            ,深圳市宝安区沙井中心路幸福居405,4008-659-600,,
深圳金艺阳光装饰设计有限公司            ,龙华大浪,4008-659-600,,
深圳天一装饰工程有限公司            ,深圳市罗湖区,4008-659-600,,
深圳天一装饰工程有限公司            ,深圳市罗湖区,4008-659-600,,
深圳市开普俊梦室内设计有限公司            ,深圳市宝安区三区龙井一路1号东江大厦28B...,4008-659-600,,
深圳市工格装饰设计工程有限公司            ,深圳市龙岗区吉祥地铁站正中.风临国际中心-...,4008-659-600,,
深圳中壹建设工程有限公司            ,,4008-659-600,,
厦门颂美配饰有限公司            ,盐田颂美总仓库888号,4008-659-600,,
深圳市誉和信息咨询有限公司            ,深圳市龙岗区横岗荷康路尚城大厦312室,4008-659-600,,
深圳觅糖装饰设计工程有限公司            ,,4008-659-600,,
深圳市绿天建筑工程有限公司            ,,4008-659-600,,
深圳装饰公司            ,广东省深圳市南山,4008-659-600,,
深圳市国安居装饰设计工程有限公司            ,深圳市福田区八卦四路西,4008-659-600,,
深圳市启明星装饰设计工程有限公司            ,深圳市宝安区广深路松岗段109号金海大厦2...,4008-659-600,,
深圳雅居装饰装修有限公司            ,,4008-659-600,,
深圳市西林木业有限公司            ,,4008-659-600,,
深圳市美卡斯装饰设计有限公司            ,深圳市龙华新区观澜牛轭新村工业一路,4008-659-600,,
深圳市顺正装饰工程有限公司            ,,4008-659-600,,
深圳荣圣华业装饰设计工程有限公司            ,,4008-659-600,,
深圳市尚美佳装修设计有限公司            ,深圳市福田区福田街道国际文化大厦1618,4008-659-600,,
深圳市御佳煌装饰工程公司            ,,4008-659-600,,
深圳市高标装饰设计工程有限公司            ,深圳市罗湖区深南东路文华大厦西座23楼,4008-659-600,,
深圳远大装饰工程有限公司            ,深圳市龙岗区布吉上水径官坑南13-8号首层,4008-659-600,,
深圳市金富强装饰设计工程有限公司            ,龙华新区观澜街道环观南路大和工业区34号益...,4008-659-600,,
深圳臻唯丝            ,,4008-659-600,,
领航装饰            ,,4008-659-600,,
至善装饰            ,,4008-659-600,,
深圳市欧诺装饰设计工程有限公司            ,深圳市龙岗区南联龙岗路10号硅谷动力大厦1...,4008-659-600,,
深圳市诚顺发装饰设计工程有限公司            ,深圳市龙岗区南联碧新路2095号世宏大厦6...,4008-659-600,,
深圳市美卡斯装饰设计有限公司            ,,4008-659-600,,
蜜蜂组国际设计事务所            ,深圳市福田保税区桃花路6号腾飞大厦A栋61...,4008-659-600,,
深圳华信光普有限公司            ,,4008-659-600,,
深圳市御佳煌装饰工程公司            ,,4008-659-600,,
深圳市巨景装饰工程有限公司            ,深圳市龙岗区布吉上水径老围290号,4008-659-600,,
深圳市高标装饰设计工程有限公司            ,深圳市罗湖区深南东路文华大厦西座23楼,4008-659-600,,
深圳市国伟装饰设计工程有限公司            ,,4008-659-600,,
深圳远大装饰工程有限公司            ,深圳市龙岗区布吉上水径官坑南13-8号首层,4008-659-600,,
至善装饰            ,,4008-659-600,,
深圳市名雕装饰股份有限公司            ,深圳市宝安中心区宝华路与海秀路交汇处龙光世...,4008-659-600,,
深圳市美卡斯装饰设计有限公司            ,,4008-659-600,,
深圳市正鼎装饰有限公司            ,深圳市光明新区 松白路与东隆路交汇处 锦昌...,4008-659-600,,
华聚净化科技            ,深圳市龙华新区港深科技园,4008-659-600,,
海达装饰工程有限公司            ,,4008-659-600,,
深圳市浩天装饰设计工程有限公司            ,,4008-659-600,,
深圳市丽扬装饰设计有限公司            ,光明新区公明镇上村元山路,4008-659-600,,
深圳市海峡装饰工程有限公司            ,,4008-659-600,,
深圳装饰            ,深圳装饰,4008-659-600,,
深圳原创设计工程(深圳)有限公司            ,,4008-659-600,,
深圳市博恒装饰工程有限公司            ,深圳市龙华区环观南路72-1创客大厦605...,4008-659-600,,
深圳市源空间装饰设计工程有限公司            ,深圳市龙华新区大浪华荣路204号海城大厦6...,4008-659-600,,
深研市深研建筑设计有限公司            ,,4008-659-600,,
深圳五号装饰设计            ,深圳市龙华区民治街道北站社区创业花园大厦1...,4008-659-600,,
深圳装饰设计工程有限公司            ,400-604-8198,4008-659-600,,
深圳浩天装饰设计有限公司            ,深圳南山北环大道10022,4008-659-600,,
深圳汇星品装饰设计工程有限公司            ,,4008-659-600,,
深圳市久源装饰设计有限公司            ,深圳市罗湖区红岗西村32栋,4008-659-600,,
蜜蜂组国际设计事务所            ,深圳市福田保税区桃花路6号腾飞大厦A栋61...,4008-659-600,,
深圳市御佳煌装饰工程公司            ,,4008-659-600,,
深圳市绿天建筑工程有限公司            ,,4008-659-600,,
深圳装饰公司            ,广东省深圳市南山,4008-659-600,,
深圳市宜居新源装饰材料有限公司            ,,4008-659-600,,
深研市深研建筑设计有限公司            ,,4008-659-600,,
深圳五号装饰设计            ,深圳市龙华区民治街道北站社区创业花园大厦1...,4008-659-600,,
 ,,4008-659-600,,
深圳众成装饰设计工程有限公司            ,深圳市龙岗区平湖镇街道新厦大道86号山厦大...,4008-659-600,,
深圳汇星品装饰设计工程有限公司            ,,4008-659-600,,
深圳市久源装饰设计有限公司            ,深圳市罗湖区红岗西村32栋,4008-659-600,,
深圳市凤天装饰工程有限公司            ,,4008-659-600,,
深圳市益诚装饰设计工程有限公司            ,,4008-659-600,,
深圳市绿天建筑工程有限公司            ,,4008-659-600,,
深圳装饰            ,深圳装饰,4008-659-600,,
东易日盛深圳分公司            ,深圳是福田区大中华国际交易广场,4008-659-600,,
深圳市意境设计顾问有限公司            ,深圳福田保税区,4008-659-600,,
深圳睿兴装饰设计工程实业有限公司            ,深圳市罗湖区嘉宾路太平洋商贸大厦,4008-659-600,,
深圳市西林木业有限公司            ,,4008-659-600,,
有住网深圳宝安体验中心            ,深圳市宝安区西乡街道银田路招商果岭1栋1单...,4008-659-600,,
深圳市乐政装饰工程有限公司            ,,4008-659-600,,
深圳市创宏景装饰材料有限公司            ,,4008-659-600,,
华聚净化科技            ,深圳市龙华新区港深科技园,4008-659-600,,
深圳市浩天装饰设计工程有限公司            ,,4008-659-600,,
深圳市优家优爱装饰有限公司            ,深圳市宝安区宝安中心区华美居A区4楼460,4008-659-600,,
有住网深圳宝安体验中心            ,深圳市宝安区西乡街道银田路招商果岭1栋1单...,4008-659-600,,
深圳市乐政装饰工程有限公司            ,,4008-659-600,,
深圳市创宏景装饰材料有限公司            ,,4008-659-600,,
天天乐装修有限公司            ,,4008-659-600,,
深圳市欧索尔智能科技有限公司            ,,4008-659-600,,
深圳市誉巢装饰设计工程有限公司            ,,4008-659-600,,
深研市深研建筑设计有限公司            ,,4008-659-600,,
龙发装饰（深圳）            ,,4008-659-600,,
深圳五号装饰设计            ,深圳市龙华区民治街道北站社区创业花园大厦1...,4008-659-600,,
深圳市路易通交通设施有限公司            ,,4008-659-600,,
深圳市川盛装饰设计有限公司            ,罗湖区黄贝岭105号,4008-659-600,,
上乐装饰设计            ,,4008-659-600,,
深圳市金富强装饰设计工程有限公司            ,龙华新区观澜街道环观南路大和工业区34号益...,4008-659-600,,
启明星装饰设计工程有限公司            ,深圳市宝安区广深路松岗段109号金海大厦2...,4008-659-600,,
深圳庞氏电子科技有限公司            ,,4008-659-600,,
深圳誉巢别墅装饰设计工程有限公司            ,深圳市南山区北环大道10076号浩天誉巢文...,4008-659-600,,
深圳市奇艺德设计有限公司            ,深圳市福田区八卦二路二栋602室,4008-659-600,,
深圳市永建建筑装饰有限公司            ,龙岗区坂田街道岗头社区雪岗北路2223号C...,4008-659-600,,
深圳栖喜装饰设计工程有限公司            ,深圳龙华新区梅龙路553号光浩国际中心A座...,4008-659-600,,
深圳市兴扬建筑装饰工程有限公司            ,深圳市宝安区西乡永丰社区八区81-3号商铺,4008-659-600,,
深圳市宏百年装饰工程有限公司            ,宝安大道西部硅谷A座603单元,4008-659-600,,
深圳市鹏森装饰设计工程有限公司            ,深圳市南山区深港文化创意园b栋8楼,4008-659-600,,
深圳星艺装饰有限公司            ,广州市天河区体育东路财富广场东塔10楼,4008-659-600,,
优宅装饰            ,龙岗区中心城清林路锦绣东方君府119商铺,4008-659-600,,
深圳市春天里装饰设计工程有限公司            ,深圳市南山区深南大道9039号博耐家居广场...,4008-659-600,,
广州华浔品味装饰设计工程责任有限公司深圳分公司            ,深圳市宝安区西乡街道新安六路互联网产业基地...,4008-659-600,,
深圳市尚领装饰工程有限公司            ,深圳市龙岗区布吉路吉信大厦吉祥阁1406,4008-659-600,,
深圳冠升装饰工程有限公司            ,苏州市姑苏区枫桥路698号雪枫街1号楼3层,4008-659-600,,
深圳市八点装饰设计工程有限公司            ,深圳龙岗区龙城广场万汇大厦,4008-659-600,,
 深圳市威格斯装饰设计工程有限公司            ,深圳市龙岗爱联股份大厦11楼（爱联地铁A出...,4008-659-600,,
深圳喜糖装饰设计工程有限公司            ,深圳市龙华区民治大道优城商务大厦,4008-659-600,,
