肇庆市贝尔装饰工程有限公司 ,肇庆市华英城北园58卡商铺二楼,13679560580,2206981,
肇庆千艺装饰设计 ,肇庆市端州区西江北路康乐名庭B9卡,18922649289,2287288,
肇庆市宏尚装饰工程有限公司            ,广东 肇庆 肇庆市端州区 锦绣路5号中央艺...,4008-659-600,,
肇庆市名匠装饰有限公司            ,广东 肇庆 肇庆市端州区端州一路集美居装饰...,4008-659-600,,
肇庆市端州区东澳装饰设计工程有限公司            ,肇庆市端州区信安路东侧109区骏景湾豪庭第...,4008-659-600,,
肇庆市琢品设计装饰            ,肇庆市端州区 黄岗一路中源名苑12.13号...,4008-659-600,,
肇庆市端州艺臻诚品装饰设计有限公司            ,肇庆市建设二路3号第一幢301房写字楼,4008-659-600,,
肇庆市中恒装饰设计工程有限公司            ,肇庆市端州区睦岗镇出头村委会出头一村2号之...,4008-659-600,,
北京实创家居装饰集团(江西)有限公司            ,南昌市洪城路6号国贸国贸广场新华都1-3层,4008-659-600,,
江西装饰设计工程有限公司            ,西湖区洪城路987号丽都广场a栋五楼（）,4008-659-600,,
南昌站            ,江西省南昌市青山湖区上海路699文化创意园,4008-659-600,,
网            ,南昌市青山湖区上海路699文化创意园,4008-659-600,,
肇庆龙腾装饰公司            ,肇庆市端州区天河路388号,4008-659-600,,
南昌站            ,江西省南昌市青山湖区上海路699文化创意园,4008-659-600,,
迪赞设计空间            ,南昌市井冈山大道名爵公馆,4008-659-600,,
南昌实创家居装饰            ,南昌市洪城路6号新华都购物广场3楼,4008-659-600,,
江西翔海装饰工程有限公司            ,,4008-659-600,,
天下装饰            ,,4008-659-600,,
肇庆市华星装饰设计工程有限公司            ,肇庆市端州区蓝田路集美居装饰材料市场303...,4008-659-600,,
肇庆天与地装饰设计工程有限公司            ,工业大道二路393号,4008-659-600,,
肇庆天与地装饰设计工程有限公司            ,广东省肇庆市怀集县工业大道二路393号,4008-659-600,,
广州熊达室内装饰有限公司            ,蓝塘北路海伦堡花园28座22号,4008-659-600,,
肇庆市中正装饰设计工程有限公司            ,肇庆市朗晴海岸往东50米,4008-659-600,,
端州区鸿运装饰工程部            ,肇庆市端州区,4008-659-600,,
天下装饰            ,,4008-659-600,,
肇庆市华星装饰设计工程有限公司            ,肇庆市端州区蓝田路集美居装饰材料市场303...,4008-659-600,,
