莆田市美星装饰设计有限公司 ,莆田市东圳东路东胜大厦一楼店面,13860958928,2338601,
莆田市弘扬工装饰工程有限公司 ,莆田市荔城区东平路59号东胜大厦,15105902968,2368599,
莆田市怡美装饰工程有限公司 ,莆田市涵江区公园西路景隆凯旋城555号59...,18030332535,8917098,
莆田市柚色装饰设计工程有限公司            ,福建莆田市涵江区 高林街46号,4008-659-600,,
莆田市星雕装饰设计工程有限公司            ,莆田市荔城区镇海办汉庭路298号A2-40...,4008-659-600,,
广东新居缘装饰设计工程有限公司仙游分公司            ,莆田市仙游县鲤南新车站背后天怡财富城5号楼...,4008-659-600,,
莆田河马装饰工程公司            ,莆田市东圳西路荣华富贵楼首层(市检察院对面...,4008-659-600,,
莆田市一席装饰设计工程有限公司            , 莆田市城厢区 万达广场sohoA座220...,4008-659-600,,
莆田市聚邦装饰工程有限公司            ,福建莆田涵江区 六一东路,4008-659-600,,
莆田汉宸室内装饰有限公司            ,莆田市城厢区法院对面,4008-659-600,,
广州托美尔装饰工程有限公司莆田分公司            ,莆田市城厢区东圳西路635号（市检察院前方...,4008-659-600,,
莆田七维空间装饰有限公司            ,莆田市嘉新建材城昌平路334号（六月兰酒店...,4008-659-600,,
莆田大卫装饰设计有限公司            ,莆田市市检察院旁皇城水岸2#1508室,4008-659-600,,
鲁班装饰设计有限公司            ,莆田市,4008-659-600,,
交换空间装饰有限公司            ,莆田市,4008-659-600,,
厦门尚的装饰设计工程有限公司莆田分公司            ,莆田市,4008-659-600,,
莆田市创意阁装饰工程有限公司             ,莆田市城厢区,4008-659-600,,
莆田市三叶装饰有限公司            ,福建 莆田 莆田市荔城区 街道：拱辰街道辰...,4008-659-600,,
莆田市百佳居装饰设计有限公司            ,莆田市仙游鲤南镇兴仙路359号,4008-659-600,,
莆田市华浔品味装饰设计工程有限公司            ,莆田市凤凰山街道,4008-659-600,,
实创家居装饰集团有限公司            ,莆田市,4008-659-600,,
莆田市三星装饰工程有限公司            ,福建省莆田市,4008-659-600,,
九纬装饰工程有限公司            ,城厢区胜利南路与荔园东路交叉路口{喜盈门建...,4008-659-600,,
天宇装饰设计            ,莆田市涵江区路下林小区广场29号,4008-659-600,,
莆田美家帮互联网透明家装公司            ,莆田市涵江区城涵东大道2668号（国珍建材...,4008-659-600,,
莆田市三叶装饰有限公司            ,莆田市荔城区拱辰街道辰门兜小区,4008-659-600,,
狮子设计事务所            ,,4008-659-600,,
