蒲城县景居建筑装饰部 ,陕西省渭南市蒲城县云麾路南段10-C-1,15191938997,7237342,
荣辉装饰有限公司            ,陕西省渭南市临渭区西二路中段北欧青年城5层,4008-659-600,,
市城市人家装饰工程有限公司            ,临渭区西四路新都荟5楼城市人家装饰,4008-659-600,,
九朝装饰工程有限公司            ,渭南市临渭区北欧青年城光运步行街一楼18号,4008-659-600,,
华宇装饰有限公司            ,陕西省渭南市蒲城县迎宾路北段四季花城北50...,4008-659-600,,
华凯装饰有限公司            ,陕西省渭南市临渭区三贤路与东风大街交叉口西...,4008-659-600,,
东盛装饰有限公司            ,陕西省渭南市韩城市复兴路与西峙南路交叉口东...,4008-659-600,,
精简装饰公司            ,陕西省渭南市华阴市华北路北50米,4008-659-600,,
华林装饰公司            ,陕西省渭南市合阳县城关镇凤凰南路北庄建材城,4008-659-600,,
安兰装饰公司            ,陕西省渭南市韩城市旺园酒店十字200米,4008-659-600,,
东方装饰有限公司            ,陕西省渭南市韩城市烟泉北路与状元中街交叉口...,4008-659-600,,
鑫星装饰有限公司            ,陕西省渭南市临渭区西二路与朝阳大街十字一百...,4008-659-600,,
创新装饰公司            ,陕西省渭南市临渭区新区东路18-14号附近,4008-659-600,,
林枫装饰公司            ,陕西省渭南市韩城市太史大街丰义大厦,4008-659-600,,
业之峰装饰公司            ,陕西省渭南市临渭区贸易广场中天建材城3楼,4008-659-600,,
开元装饰公司            ,陕西省渭南市韩城市太史大街民杨国际(天惠亿...,4008-659-600,,
市雅美居装饰有限公司            ,渭南市临渭区四马路与西三路十字路口向北50...,4008-659-600,,
天然阁装饰工程有限公司            ,陕西省渭南市临渭区前进路137号,4008-659-600,,
设享生活装饰            ,乐天国际大厦A座1208,4008-659-600,,
陕西锦诚装饰设计有限公司            ,四马路与西二路十字路北向西200米,4008-659-600,,
雅美居装饰            ,,4008-659-600,,
美亿佳装饰工程有限公司            ,五马路与前进路丁字路口向东10米,4008-659-600,,
洛可可建筑装饰有限公司            ,渭南市临渭区西三路与三马路十字东北角金域华...,4008-659-600,,
陕西逸象装饰工程有限公司            ,临渭区华山大街38号南塘五路口向东50米路...,4008-659-600,,
江西苹果装饰-江西苹果装饰(旗舰店)            ,江西省南昌市西湖区洪城路丽都广场a栋苹果装...,4008-659-600,,
鲁班装饰设计有限公司            ,南昌,4008-659-600,,
嘉祺装饰设计工程有限公司            ,,4008-659-600,,
美星装饰集团            ,南昌,4008-659-600,,
交换空间装饰有限公司            ,南坪会展中心9玺国际8栋,4008-659-600,,
实创家居装饰集团有限公司            ,青云谱洪都洪城路6号国贸广场13层,4008-659-600,,
开元装饰公司            ,陕西省渭南市韩城市太史大街民杨国际(天惠亿...,4008-659-600,,
