九源装饰工程有限公司            ,河南 商丘 商丘市睢阳区南京路归德路交叉口...,4008-659-600,,
大地装饰有限公司            ,商丘市神火大道与珠江路交叉口往南100米路...,4008-659-600,,
市背景家装饰工程有限公司            ,河南省商丘市城乡一体化示范区香君路中意建材...,4008-659-600,,
九源装饰工程有限公司            ,商丘市睢阳区中州路与文化路交叉口南100米...,4008-659-600,,
市润鸿装饰工程有限公司            ,河南商丘市睢阳区文化路南凯旋路西市动物检疫...,4008-659-600,,
商丘超凡装饰工程有限公司            ,河南省商丘市中州路与香君路交叉口北80米路...,4008-659-600,,
千万间装饰工程有限公司            ,河南省商丘市睢阳区归德路与珠江路交叉口往东...,4008-659-600,,
简则美建筑装修装饰有限公司            ,河南省商丘市开发区宇航路南侧天明第一城38...,4008-659-600,,
美星装饰集团            ,商丘市虞城县虞城县政府附近,4008-659-600,,
交换空间装饰有限公司            ,商丘永城亿丰广场南门,4008-659-600,,
虞城县金木匠装饰有限公司            ,河南商丘市虞城县虞城县豫东商业广场8号楼2...,4008-659-600,,
河南圣都装饰工程有限公司            ,河南省商丘市梁园区新兴路369号门面,4008-659-600,,
瑞凡装饰设计有限公司            ,河南 商丘 商丘市梁园区八一路与凯旋路交叉...,4008-659-600,,
永城市维度装饰设计有限公司            ,河南商丘永城市东城区雪枫路道北路向北100...,4008-659-600,,
润达装饰工程有限公司            ,河南商丘市睢阳区神火大道与香君路交叉口东南...,4008-659-600,,
虞城县龙腾装饰有限公司            ,嵩山路与仓颉大道交汇处一豫东商业广场,4008-659-600,,
铭巢装饰设计有限公司            ,商丘市归德路香君路北200米 路西 铭巢装...,4008-659-600,,
香港云裳软装配饰南昌分公司            ,南昌市西湖区省府西二路,4008-659-600,,
超凡装饰工程有限公司            ,商丘市中州路与香君路交叉口向北100米路西,4008-659-600,,
南昌满艺装饰工程有限公司            ,江西省南昌市西湖区朝阳洲中大云锦A102商...,4008-659-600,,
虞城县龙腾装饰有限公司            ,嵩山路与仓颉大道交汇处一豫东商业广场,4008-659-600,,
南昌欧坊装饰工程有限公司            ,南昌西湖区洪城路576号天使商务广场t层,4008-659-600,,
南昌道艺装饰有限公司            ,南昌市红谷滩万达中心写字楼B2-814,4008-659-600,,
阔达建筑装饰工程有限责任公司            ,北京市海淀区西三环北路87号国际财经中心c...,4008-659-600,,
市圆创建筑装饰工程有限公司            ,河南省商丘市睢阳区华夏路112号东方派出所...,4008-659-600,,
鑫泽装饰工程有限公司            ,河南商丘市睢阳区南京路与归德路交叉口应天国...,4008-659-600,,
奥森建筑装饰工程有限公司            ,商丘市睢阳区中州路与宇航路交叉口西50米路...,4008-659-600,,
夏邑县华锦装饰工程有限公司            ,河南 商丘 夏邑县夏邑县龙湖明珠售楼处西侧...,4008-659-600,,
河南天恒装饰工程有限公司            ,河南 商丘 夏邑县栗城春天西区11—12号,4008-659-600,,
永城市新唐人装饰设计有限公司            ,河南省永城市东城区光明路与文化路交差口向东...,4008-659-600,,
鑫泽装饰工程有限公司            ,商丘市睢阳区南京路归德路交叉口应天国际A座...,4008-659-600,,
