生活家家居有限公司            ,福州市鼓楼区乌山西路129号   倪世建材...,4008-659-600,,
宅居宅修装饰工程有限公司            ,福州群众东路75号（市体育馆正对面）,4008-659-600,,
宅帮帮装饰工程有限公司            ,福州市台江区群众东路75号，市体育馆正对面...,4008-659-600,,
亿盟装饰工程有公司            ,,4008-659-600,,
三色装饰工程有限公司            ,,4008-659-600,,
品泽装饰工程有限公司            ,福州东二环泰禾广场 9#22层,4008-659-600,,
天下一佳装饰工程有限公司            ,福州市省体中心田径馆地下一层欣居软装内,4008-659-600,,
百年祥业装饰工程有限公司            ,福州高新技术产业园中青大厦21层(新西客站...,4008-659-600,,
广东星艺装饰集团分公司            ,晋安区东二环泰禾广场9号楼21层,4008-659-600,,
泥巴公社装饰工程设计有限公司            ,台江区台江路47号华辰远祥大厦10楼,4008-659-600,,
筑福装饰工程有限公司            ,福州市晋安区化工路泰合广场C1座7层,4008-659-600,,
市仓山区饰美装修工程有限公司            ,福州市仓山区橘园创意广场65座513,4008-659-600,,
福建优装家装饰工程有限公司            ,福州市晋安区前横路盛辉国际5楼,4008-659-600,,
福建易雕装饰工程有限公司            ,福州市东二环泰禾广场8号楼三层,4008-659-600,,
福建雅宅铭屋装饰装修有限公司            ,福州市晋安区鼓山镇福兴大道49号大同电商城...,4008-659-600,,
德雕装饰集团            ,福建省福州市台江区达道路68号华兴广场3区...,4008-659-600,,
福建庚泽装饰设计工程有限公司            ,福州市台江区排尾路亿立江滨C1#2301,4008-659-600,,
福建省五福九鼎装饰设计有限公司            ,福州市仓山区建新镇百花洲路16号御景商务中...,4008-659-600,,
万鹏装饰设计工程有限公司            ,福州市晋安区连江北路元成建材市场二层200...,4008-659-600,,
冠盛装饰有限公司            ,福州市仓山区乐都汇斜对面御景商务中心一层(...,4008-659-600,,
万景装饰工程有限公司            ,,4008-659-600,,
海星装饰设计工程有限公司            ,福州市仓山区建新北路161号达内装饰大楼4...,4008-659-600,,
天龙创意装饰工程有限公司            ,,4008-659-600,,
国冠装饰工程有限公司            ,,4008-659-600,,
福建苹果装饰设计工程有限公司            ,福州市台江区江滨中大道86号福泰华庭2楼,4008-659-600,,
福建一棵松装饰工程有限公司            ,台江区鳌峰路20号鳌峰广场2号楼18层,4008-659-600,,
泽邦装饰工程有限公司            ,福州金洲北路13号依强产业园B#501,4008-659-600,,
福建万达亿家装饰工程有限公司            ,晋安区前横路169号盛辉国际大厦8楼,4008-659-600,,
福建宅一生装饰工程有限公司            ,福州市鼓楼区西二环中路98号万商大厦4楼,4008-659-600,,
福建梵亚装饰设计工程有限公司            ,福州（省体育中心）东浦路133号精武特卫大...,4008-659-600,,
