魅力家装饰工程有限公司            ,宣州区昭亭中路盛世百合2栋4号门店,4008-659-600,,
桔子装饰工程有限公司            ,宣城宣州区卜村南路前城上东郡商铺5~6号,4008-659-600,,
南昌欧坊装饰工程有限公司            ,南昌西湖区洪城路576号天使商务广场t层,4008-659-600,,
市逸铭装饰有限公司            ,宣城市星隆国际22幢写字楼2317-232...,4008-659-600,,
鲁班装饰设计有限公司            ,南昌,4008-659-600,,
嘉祺装饰设计工程有限公司            ,,4008-659-600,,
交换空间装饰有限公司            ,南坪会展中心9玺国际8栋,4008-659-600,,
市正邦装饰有限公司            ,安徽省 宣城市 宣州区 梅溪路73号(新汽...,4008-659-600,,
市境森源装饰工程有限公司            ,宣城市宣向大道中瑞第一城1幢8号,4008-659-600,,
实创家居装饰集团有限公司            ,青云谱洪都洪城路6号国贸广场13层,4008-659-600,,
市国邦装饰有限公司            ,宣城市叠嶂路国购广场B座写字楼18楼181...,4008-659-600,,
红叶装饰            ,宣城宣州宣城市鳌峰东路4到6号水文局门面,4008-659-600,,
风雅阁装饰工程有限公司            ,安徽省宣城市柏庄南门A幢36栋7-8号,4008-659-600,,
红叶装饰有限公司            ,宣城市鳌峰桥东100米 水文局门面,4008-659-600,,
市盛大装饰有限公司            ,宣城市康乐山庄1-6号门面,4008-659-600,,
风雅阁装饰工程有限公司            ,宣城市柏庄南门A幢36栋,4008-659-600,,
中超装饰装潢有限公司            ,亳州市谯城区汤王大道西关还原楼d号楼1,4008-659-600,,
中杰装饰有限责任公司            ,亳州市市政府北门香樟大厦b-1703,4008-659-600,,
安徽思家墙艺装饰工程有限公司            ,安徽-合肥-合肥市瑶海区-安徽省,4008-659-600,,
安徽省三点水装饰工程有限公司            ,谯城区希夷大道现代城二期c3号门面,4008-659-600,,
涡阳县佳乐美装饰材料有限公司            ,安徽-亳州-涡阳县-站前路新县委后,4008-659-600,,
新艺匠装饰工程有限公司            ,亳州市新艺匠装饰工程有限公司,4008-659-600,,
亳州市利辛瑞丰装饰设计工程有限公司            ,亳州市利辛县皖北商城,4008-659-600,,
和盛装饰工程有限公司            ,宣城市梅溪路151-153号（敬林水城向东...,4008-659-600,,
精昇装饰工程有限公司            ,香江金郡038号门面（梅园路与景德路交叉口...,4008-659-600,,
市瑞庭装饰有限公司            ,美都新城东大门93-95门面（十二中斜对面...,4008-659-600,,
市海梦林装饰工程有限公司             ,宣城市宣州区国购广场10座2004室,4008-659-600,,
