河南紫苹果钻石装饰工程有限公司  ,郑州市二七区大学路西升龙商业广场B区5号楼...,18837129332,58608993,
河南福满人间装饰工程有限公司 ,来电预约签单抵1000元工程款：建设路桐柏...,15637173564,67551885,
河南凯亚装饰工程有限公司 ,南三环连云路东南橄榄城都市广场c座5层52...,18695867810,86548816,
河南梵米丽装饰工程有限公司 ,河南省郑州市陇海路桐柏路凯旋门 B座150...,15333811930,60740150,
河南龙记万家装饰工程有限公司 ,郑州市中原区桐柏路98号帝湖百货三楼龙记万...,13653930937,55071709,
河南前能商贸有限公司 ,紫荆山路91号城南路东南角郑州一建办公楼1...,13783613839,66332929,
河南同筑空间装饰工程有限公司 ,郑州市中原区电厂南路与西三环大学科技园9号...,18236919577,60200006,
郑州创普电子商务有限公司 ,中原路华山路交叉口(中原万达)西200米路...,15237298031,55296000,
河南天诺装饰工程有限公司 ,陇海路桐柏路升龙金中环财富中心a座23层2...,18530828773,55285657,
河南柚子装饰工程有限公司 ,大学南路鼎盛大道二七绿地中心三区1号楼81...,13526726586,55688586,
天津居联峰尚装饰工程有限公司郑州分公司 ,金水区金水路未来路交叉口君悦汇四楼,18203979131,55901288,
郑州江美装饰工程有限公司 ,郑州市二七区大学路南四环交叉口北1公里绿地...,18137885450,55965957,
郑州香江装饰工程有限公司            ,,4008-659-600,,
郑州帝诺装饰工程有限公司            ,,4008-659-600,,
郑州千禧龙装饰工程有限公司            ,,4008-659-600,,
郑州大铭装饰工程有限公司            ,红专路政七街财源大厦A座19楼,4008-659-600,,
郑州盛晨装饰工程有限公司            ,,4008-659-600,,
郑州江南易家装饰工程有限公司            ,,4008-659-600,,
  河南雅之阁装饰设计工程有限公司            ,花园路国基路建工集团北座1210,4008-659-600,,
郑州雅文装饰            ,文化路与北环路向西200米路北瀚海爱特中心...,4008-659-600,,
郑州丰伟装饰设计有限公司            ,郑州市金水区文化路与北环路交叉口瀚海北金A...,4008-659-600,,
河南龙巢装饰工程有限公司            ,升龙金泰成A区6号楼2单元14层1403市,4008-659-600,,
郑州大业美家装饰公司            ,郑东新区金水东路黄河南路永和国际广场17层,4008-659-600,,
郑州慕辰装饰            ,中州大道航海路美林商务一号楼1506室,4008-659-600,,
郑州唐冠装饰装修工程有限公司            ,中州大道农业路西北角苏荷中心20楼2041...,4008-659-600,,
河南泽轩装饰设计工程有限公司            ,郑州市金水区青年路145号升龙环球大厦C座...,4008-659-600,,
河南万泉建筑工程设计有限公司            ,中州大道航海路美林河畔1号楼2405室,4008-659-600,,
河南铭禾装饰工程有限公司            ,商鼎路与东风南路交叉口（高铁旁）升龙广场3...,4008-659-600,,
河南上荣装饰设计工程有限公司            ,河南省郑州市金水区郑汴路凤台南路凤凰城南城...,4008-659-600,,
郑州九间堂装饰工程有限公司            ,,4008-659-600,,
河南渡德装饰工程有限公司            ,金水万达中心,4008-659-600,,
河南沪上名家装饰工程设计有限公司            ,未来路福元路交叉口,4008-659-600,,
北京东方华然装饰郑州分公司            ,紫荆山路与陇海东路交叉口大润发B座20F北...,4008-659-600,,
酌美装饰公司            ,中原路,4008-659-600,,
郑州大铭装饰设计工程有限公司            ,河南省 郑州市 管城回族区 郑州紫荆山路裕...,4008-659-600,,
河南省卓奥装饰工程有限公司            ,金水区经三路农科路金城国际广场Ｂ座１０楼,4008-659-600,,
河南艺尚建筑装饰工程有限公司            ,北区(总店)地址:丰庆路博颂路西500米明...,4008-659-600,,
宾治装饰            ,郑州市金水东路东风南路绿地新都会2号楼A座...,4008-659-600,,
郑州华郑装饰工程有限公司            ,经三路与北环路鑫苑金融广场银座19层,4008-659-600,,
河南万发天地装饰建材有限公司            ,郑州市金水路与农业南路交叉口美盛中心609...,4008-659-600,,
郑州百变空间装饰            ,未来路航海路启航大厦,4008-659-600,,
郑州九创装饰工程有限公司            ,农业路与东明路交叉口路南,4008-659-600,,
郑州新洲装饰            ,郑州市经三路与农业路交叉财富广场3号楼17...,4008-659-600,,
河南兴唐装饰工程有限公司            ,金水区郑汴路英协路圣龙环球大厦A座1202...,4008-659-600,,
郑州德尚装饰设计工程有限公司            ,河南省郑州市金水区索凌路商务大厦4单元80...,4008-659-600,,
河南天恒装饰工程有限公司            ,河南省郑州市南三环连云路橄榄城都市广场C座...,4008-659-600,,
开封城市人家装饰有限公司            ,开封金明广场北金明裕楼下,4008-659-600,,
河南安邦建筑装饰工程有限公司            ,商都路心怡路交叉口北一百米易元国际B座室,4008-659-600,,
济南九创装饰工程有限公司郑州分公司            ,农业路与东明路交叉口西南角名门国际西塔,4008-659-600,,
河南超凡装饰设计工程有限公司            ,花园路黄河路交叉口向北50米路西,4008-659-600,,
郑州铭嘉智尚装饰工程有限公司            ,郑州市金水区经三路东风路交叉口 金成国际平...,4008-659-600,,
装家兵装修平台            ,商都路中兴南路建正东方中心4层,4008-659-600,,
博润装饰工程有限公司            ,新郑市仓城路新华派出所向东100米路南,4008-659-600,,
郑州中西合装饰工程有限公司            ,郑州市中州大道郑汴路英协大厦B座1723室,4008-659-600,,
河南超凡装饰设计工程有限公司            ,郑汴路东明路交叉口恒泰国际,4008-659-600,,
河南东西汇装饰设计工程有限公司            ,金水区经三路56号3-2-1801,4008-659-600,,
河南仁远装饰工程有限公司            ,河南省郑州市高新区西四环与冬青街交叉口企业...,4008-659-600,,
郑州水蜜桃装饰            ,通泰路化庄社区,4008-659-600,,
河南玖舍装饰设计有限公司            ,航空港区中部国际电子商务产业园10号203...,4008-659-600,,
郑州大业美家装饰            ,郑东新区金水东路黄河南路永和国际广场,4008-659-600,,
菁鹰集成装饰设计有限公司            ,郑州市郑汴路与东明路交叉口,4008-659-600,,
北京新洲装饰设计有限公司郑州分公司            ,郑州市金水区经三路与农业路交叉口财富广场三...,4008-659-600,,
郑州品质装饰设计有限公司            ,龙湖镇祥和路企业总部6楼,4008-659-600,,
河南中跃装饰工程有限公司            ,郑州市郑汴路凤凰城D区6号楼1单元2801,4008-659-600,,
郑州龙筑装饰工程设计有限公司            ,金水路与南阳路交叉口西北角清华园SOHO广...,4008-659-600,,
河南天恒装饰工程有限公司            ,www.thzs360.com,4008-659-600,,
郑州美诺装饰工程有限公司            ,郑州市金水区中州大道1188建业置地广场a...,4008-659-600,,
河南超凡装饰设计工程有限公司            ,郑州市管城区郑汴路东明路恒泰国际A16,4008-659-600,,
