壹号国际设计.居奥装饰            ,淮安市清浦区正大路与天津路交汇处,4008-659-600,,
市金塔装饰有限公司            ,淮安市清河区翔宇中道亿力未来城5幢商铺10...,4008-659-600,,
七彩虹装饰工程有限公司            ,,4008-659-600,,
业之峰装饰工程有限公司            ,,4008-659-600,,
同济装饰工程有限公司            ,,4008-659-600,,
市艺米装饰设计有限公司            ,清河区中鑫上城1303,4008-659-600,,
梨木饰家设计有限公司            ,淮安市红星美凯龙4楼D8810-8811（...,4008-659-600,,
广东名匠装饰分公司            ,清河区万达嘉华酒店东侧50米环宇路3-1号,4008-659-600,,
市柏拉图装饰工程有限公司            ,淮安经济开发区厦门路与南昌路交叉口金禾苑1...,4008-659-600,,
市名典装饰工程有限公司            , 淮安市清河区承德北路222号丹桂苑6幢9...,4008-659-600,,
九千居装饰工程有限公司            ,淮安市水渡口大道28号香格里拉国际花园三期...,4008-659-600,,
市尚锦装饰工程有限公司            ,淮安市清河区河畔花城售楼处南侧50米,4008-659-600,,
都市人家装饰工程有限公司            ,香格里拉c区6橦28-100号南昌路右转支...,4008-659-600,,
北京世纪商筑装饰分公司            ,清河区河畔花城55幢55-58号,4008-659-600,,
圣典装饰工程有限公司            ,淮安市清河区中鑫上城7楼B703,4008-659-600,,
龙天装饰设计有限公司            ,淮安市清河区锦绣装饰城对面,4008-659-600,,
市品盛装饰有限公司            ,淮安市万达广场万达中心楼11楼,4008-659-600,,
金牌慧天装饰工程有限公司            ,淮安市经济技术开发区深圳东路博德五金市场莫...,4008-659-600,,
装饰分公司            ,淮安市清河区万达广场东弘辉首馥北商铺,4008-659-600,,
亿唐装饰工程有限公司            ,淮安市经济开发区深圳东路1号博德五金D7-...,4008-659-600,,
口碑装饰工程有限公司            ,淮安市万达广场公寓2号公寓一单元1703室,4008-659-600,,
汉宇装饰有限公司            ,清河区水渡口大道弘辉首馥北商铺,4008-659-600,,
128建筑装饰工程有限公司            ,淮安国际农贸城西区c5-6,(南昌路与黄河...,4008-659-600,,
凯悦装饰工程有限公司            ,清浦区天津路与延安路交叉口(颐景雅苑西大门...,4008-659-600,,
市古隆装饰工程有限公司            ,新亚国际大厦11层1130室,4008-659-600,,
三星品高装饰公司            ,江苏省淮安市深圳路汇金豪庭102-103号...,4008-659-600,,
艺美雅装饰工程有限公司            ,淮安市承德北路丹桂苑16-17号（加油站斜...,4008-659-600,,
安格装饰工程有限公司            ,淮安市清河开发区福州路26号5-3,4008-659-600,,
口碑装饰工程有限公司            ,万达2号公寓1703室,4008-659-600,,
