铜仁市中拓尚易装饰工程有限公司 ,铜仁市碧江区西外环西城御都五楼,18083223311,5253555,
铜仁市一线装饰工程有限公司            ,贵州省铜仁市碧江区锦江南路301（锦江广场...,4008-659-600,,
贵州饰海人家装饰工程有限公司            ,铜仁市碧江区锦江宾馆附楼11楼（即时代商汇...,4008-659-600,,
贵州扬名东诚装饰有限公司            ,贵州省铜仁市万山区西南国际商贸城二组团12...,4008-659-600,,
馨家园装饰有限公司            ,铜仁市万山区西南商贸城八栋1-8号,4008-659-600,,
铜仁南翔装饰有限公司            ,铜仁市万山区谢桥街道西南国际商贸城20栋2...,4008-659-600,,
贵州省铜仁市顶峰装饰工程有限公司            ,贵州省铜仁市碧江区教育园区安置B区9栋1号...,4008-659-600,,
黔东南蓝宇装饰工程有限责任公司铜仁分公司            ,铜仁市碧江区时代商汇11栋B座二楼,4008-659-600,,
铜仁佳园装饰            ,铜仁市碧江区金滩半岛豪苑,4008-659-600,,
