铜川市新区艺鼎装饰有限责任公司 ,陕西省铜川市新区金鼎路布尔玛国际酒店斜对面...,15114999845,3157910,
铜川百枫林装饰工程有限公司 ,陕西省铜川市新区咸丰路白云佳苑沿街商铺东,13649252573,8161011,
艺辉装饰一站式家装体验馆 ,新区·龙记学府6/9路公交终点站公交调度中...,18220024091,6736360,
城市人家装饰有限公司            ,北京市大兴区亦庄经济开发区4号街区力宝广场...,4008-659-600,,
铜川华阳装修装饰设计公司            ,陕西省铜川市新区华原东道枫林小区北门东30...,4008-659-600,,
陕西家居乐装饰装修工程有限公司            ,陕西省西安市长安中路省体育场东门向北100...,4008-659-600,,
北京业之峰诺华装饰股份有限公司            ,八一大道357号 财富广场b座22层,4008-659-600,,
江西苹果装饰-江西苹果装饰(旗舰店)            ,江西省南昌市西湖区洪城路丽都广场a栋苹果装...,4008-659-600,,
铜川宜家装饰            ,陕西省铜川市耀州区铜川新区华阳小区南门,4008-659-600,,
实创家居装饰集团有限公司            ,青云谱洪都洪城路6号国贸广场13层,4008-659-600,,
 ,,4008-659-600,,
西安暖宅装饰整体家装定制体验馆            ,西安市未央区5号龙首村3000㎡体验馆,4008-659-600,,
陕西盛博装饰设计有限公司            ,延安宝塔区市场沟21号楼下,4008-659-600,,
铜川艺辉装饰一站式家居体验馆            ,铜川新区·龙记学府城6/9路公交终点站公交...,4008-659-600,,
陕西格致建筑装饰工程有限公司            ,铜川市新区鸿基西路国际街区小区东北角,4008-659-600,,
南昌林涵设计            ,林涵设计,4008-659-600,,
 ,,4008-659-600,,
南昌市轩仝宇装饰工程有限公司            ,江西省南昌市西湖区子安路89号1602,4008-659-600,,
金芒果装饰集团            ,江西省吉安市吉州区广场北路1号(新世界广场...,4008-659-600,,
南昌三帝装饰设计有限公司            ,南昌市青山湖区洪都北道299号高能金域名都...,4008-659-600,,
欧亿优品装饰            ,铜川北方城14排10号,4008-659-600,,
铜川艺辉装修DIV家装超市            ,铜川市新区龙记学府城6/9路公交终点站调度...,4008-659-600,,
铜川新区星艺装饰装修建材中心            ,,4008-659-600,,
铜川实创空间装饰工程有限公司            ,铜川市新区枫林小区小东门向北60米,4008-659-600,,
欧亿优品装饰            ,,4008-659-600,,
铜川和成暖通机电销售公司            ,铜川市新区正阳路东段,4008-659-600,,
陕西易尚大宅装饰工程有限公司            ,陕西省铜川市王益区七一路心河湾商铺二层,4008-659-600,,
铜川市德义兄弟工贸有限公司            ,铜川市印台区北关中羿首府,4008-659-600,,
铜川市铭洋设计装饰有限公司            ,,4008-659-600,,
铜川金誉装饰设计            ,,4008-659-600,,
