银川丰正装饰工程设计有限公司 ,宁安大街与黄河路交汇处全聚德向西50米,13619501309,5085690,
常州好乐易装饰设计工程有限公司宁夏分公司 ,新华东街塞上凝聚力商业城7号楼3层大厅,15825309129,7880333,
宁夏山水空间装饰工程有限公司 ,银川大阅城7号公寓1523室,15378957288,8957288,
银川好佳益装饰有限公司 ,银川市金凤区北京中路国贸新天地A座1204,18995062861,6072258,
宁夏福泰精工装饰工程有限公司            ,灵武市嘉园路龙辰华庭营业房5-60号,4008-659-600,,
宁夏巨匠装饰公司            ,银川,4008-659-600,,
宁夏浩涵空间设计公司            ,悦海新天地购物广场A座2403室,4008-659-600,,
嘉德鑫瑞装饰设计有限公司            ,银川市兴庆区民族南街143号康乐家居城2楼...,4008-659-600,,
宁夏金木匠装饰公司            ,银川,4008-659-600,,
佳居装饰材料工程有限公司            ,银川新华东街金茂建材城B22-08,4008-659-600,,
银川实创装饰            ,银川市金凤区北京中路51号瑞银财富中心C座,4008-659-600,,
宁夏凌大装饰工程有限公司            ,正源南街长兴花园A区东门商铺30-18#,4008-659-600,,
宁夏鸿嘉格辉装饰设计工程有限公司            ,宁夏银川市兴庆区鸿嘉格辉装饰设计工程有限公...,4008-659-600,,
城市人家装饰公司            ,民族南街紫薇星座,4008-659-600,,
银川丰正装饰工程设计有限公司            ,黄河路与宁安街交汇处全聚德向西50米,4008-659-600,,
维意美嘉装饰装修工程有限公司            ,德胜东路八号,4008-659-600,,
 ,,4008-659-600,,
北京实创家居装饰集团(江西)有限公司            ,南昌市洪城路6号国贸国贸广场新华都1-3层,4008-659-600,,
 ,,4008-659-600,,
北京龙发建筑装饰工程有限公司银川分公司            ,北京中路大世界商务广场A座8楼,4008-659-600,,
 ,,4008-659-600,,
宁夏铂领装饰设计工程有限公司            ,新华东街金茂建材城B25-04-05,4008-659-600,,
 ,,4008-659-600,,
实创家居装饰集团（银川）有限公司            ,银川市北京中路万达广场南侧,4008-659-600,,
银川瀚泉工贸有限公司            ,银川市兴庆区丽景南街机电批发市场6号楼4号...,4008-659-600,,
银川城市人家装饰            ,兴庆区新一中向南200米  银帝.紫微星座,4008-659-600,,
南昌实创家居装饰            ,南昌市洪城路6号新华都购物广场3楼,4008-659-600,,
宁夏凌大装饰工程有限公司            ,宁夏银川兴庆区新华东街金茂建材城B35-9...,4008-659-600,,
江西翔海装饰工程有限公司            ,,4008-659-600,,
 ,,4008-659-600,,
南昌实创家居装饰            ,南昌市洪城路6号新华都购物广场3楼,4008-659-600,,
宁夏凌大装饰工程有限公司            ,宁夏银川兴庆区新华东街金茂建材城B35-9...,4008-659-600,,
江西翔海装饰工程有限公司            ,,4008-659-600,,
宁夏居联饰家装饰公司            ,,4008-659-600,,
龙发装饰-融筑设计机构            ,银川市金凤区北京中路汽车大世界A座8楼,4008-659-600,,
顾家装饰银川分公司            ,银川市兴庆区丽景街宝湖路口东南角,4008-659-600,,
北京欧亚世纪装饰            ,,4008-659-600,,
宁夏凌大装饰工程有限公司            ,宁夏银川市兴庆区金茂建材城B35-9-10,4008-659-600,,
宁夏佳禾盛世装饰工程有限公司            ,,4008-659-600,,
龙发装饰-融筑设计机构            ,银川市 金凤区 金凤区北京中路汽车大世界A...,4008-659-600,,
龙发装饰-融筑设计机构            ,银川市 金凤区 金凤区北京中路汽车大世界A...,4008-659-600,,
宁夏嘉立信建筑安装工程有限公司            ,,4008-659-600,,
宁夏顶点装饰有限公司            ,,4008-659-600,,
宁夏风彩万家装饰工程有限公司            ,宁夏回族自治区银川市金凤区六盘山路,4008-659-600,,
宁夏汉德森建设工程有限公司装修事业部            ,,4008-659-600,,
银川城市人家装饰公司            ,民族北街与宝湖路交叉口,4008-659-600,,
银川市米维装饰设计工程有限公司            ,,4008-659-600,,
宁夏九鼎日盛装饰工程有限公司            ,,4008-659-600,,
银川九创装饰工程有限公司            ,,4008-659-600,,
宁夏美匠装饰工程有限公司            ,丽景街商贸城7-26,4008-659-600,,
宁夏顶点装饰有限公司            ,,4008-659-600,,
宁夏风彩万家装饰工程有限公司            ,宁夏回族自治区银川市金凤区六盘山路,4008-659-600,,
实创家居装饰集团（银川）有限公司            ,银川市金凤区北京中路51号瑞银财富中心C座,4008-659-600,,
银川九创装饰工程有限公司            ,银川市兴庆区清河南街万品汇二楼,4008-659-600,,
银川紫苹果装饰            ,银川市兴庆区新华东街银川数码城三楼,4008-659-600,,
宁夏维意美嘉装饰有限公司            ,贺兰县德胜东路八号，亘元地产向东100米,4008-659-600,,
宁夏佳运大宅装饰工程有限公司            ,玉皇阁南街银川宾馆3楼,4008-659-600,,
宁夏金木匠装饰工程有限公司            ,西夏建材城六号厅6-19,4008-659-600,,
宁夏顺恒威装饰工程有限公司            ,银川市解放东街立达市场6-A12,4008-659-600,,
龙天世纪装饰公司            ,民族南街240号光耀大厦5层,4008-659-600,,
米维装饰公司            ,银川市西夏区兴州北街263,4008-659-600,,
亿度欣君装饰设计工程有限公司            ,银川,4008-659-600,,
宁夏博里建筑装饰工程有限公司            ,银川湖滨东街丽都花园3-801,4008-659-600,,
嘉祺装饰设计工程有限公司            ,,4008-659-600,,
美星装饰集团            ,南昌,4008-659-600,,
鲁班装饰设计有限公司            ,南昌,4008-659-600,,
交换空间装饰有限公司            ,南坪会展中心9玺国际8栋,4008-659-600,,
兔宝宝装饰工程有限公司            ,银川,4008-659-600,,
宁夏豪骏装饰工程有限公司            ,新华东街金茂建材城B18-3,4008-659-600,,
宁夏安宜装饰工程有限公司            ,银川金凤区尹家渠北街韦司德公寓13层,4008-659-600,,
银川装饰            ,银川装饰,4008-659-600,,
实创家居装饰集团有限公司            ,青云谱洪都洪城路6号国贸广场13层,4008-659-600,,
