麻阳越众建筑装饰设计工程有限公司 ,麻阳农资建材市场8栋13.14号,17374536686,400-604-8198,
美迪建筑装饰设计工程有限公司            ,湖南省 怀化市 鹤城区 新湖天大桥桥头世纪...,4008-659-600,,
永宏精工装饰有限公司            ,怀化学院西校区博雅苑E栋,4008-659-600,,
苹果装饰设计工程有限公司            ,湖南省 怀化市 鹤城区 怀化市迎丰中路26...,4008-659-600,,
鲁班装饰设计有限公司怀化分公司            ,天星路与湖天南路交汇处东侧,4008-659-600,,
华宁装饰工程有限公司怀化分公司            ,湖南省怀化市鹤城区湖天大道100号,4008-659-600,,
市名匠装饰有限公司            ,湖南省 怀化市 鹤城区 怀化市新湖天大桥新...,4008-659-600,,
波涛装饰工程有限公司怀化分公司            ,怀化市红星南路(五中旁),4008-659-600,,
 湖南佐居造室者装饰工程有限公司            , 鹤城区 怀化鹤城区沿河南路201号（,4008-659-600,,
志远建筑装饰有限公司            , 怀化市鹤城区迎丰东路太平洋大厦6楼（石油...,4008-659-600,,
交换空间装饰有限公司            ,麻阳新城路58号,4008-659-600,,
美星装饰集团            ,南昌,4008-659-600,,
业之峰诺华装饰有限公司怀化分公司            ,怀化市鹤城区人民东路(怀化大厦国际名品城2...,4008-659-600,,
怀化格莱美居装饰设计有限公司            ,河西天庆精品装饰城三楼3-01,4008-659-600,,
怀化易尚装饰工程有限公司            ,县电信局对面,4008-659-600,,
市三星装饰有限公司            ,人们南路258号,4008-659-600,,
鸿润装饰            ,湖南省 怀化市 鹤城区 怀化市太平桥迎丰中...,4008-659-600,,
東森·聚众装饰            ,鹤城区河西德善路86号,4008-659-600,,
江西苹果装饰公司            ,南昌市抚生丽都广场,4008-659-600,,
满艺装饰工程有限公司            ,南昌市西湖区朝阳洲云锦路与永富路交界口,4008-659-600,,
金空间设计工程有限公司            ,,4008-659-600,,
麻阳越众装饰            ,,4008-659-600,,
创家装饰工程有限公司            ,,4008-659-600,,
南昌市轩仝宇装饰工程有限公司            ,江西省南昌市西湖区子安路89号1602,4008-659-600,,
怀化市木易装饰设计有限公司            ,怀化市鹤城区红星南路23号福星数码广场9楼...,4008-659-600,,
怀化市年年红装饰设计工程有限公司            ,怀化市鹤城区人民东路(怀化大厦国际名品城2...,4008-659-600,,
芷江县道艺装饰工程有限公司            ,芷江凯旋路荣盛建材城二楼9号门面,4008-659-600,,
怀化市凯鑫瑞装饰有限公司            ,湖南省怀化市鹤城区迎丰东路农贸市场内学府花...,4008-659-600,,
华浔品味装饰            ,东路鹿鼎家居4楼b馆,4008-659-600,,
怀化市艺家格装饰有限公司            ,河西舞水二桥天星西路135号三楼,4008-659-600,,
金煌装饰有限公司            ,怀化市 鹤城区 怀化市新湖天大桥新时代广场...,4008-659-600,,
沅陵县天艺装饰有限公司            ,沅陵县城新城央区御鑫城1栋2楼,4008-659-600,,
